k,name,in_iM,gene_weight,regulator,function,category
19,single_gene_1,False,-0.0323105925,,"baeR, exdb, unknown genes",Noise
11,Unchar-6,False,0.0268553462,,uncharacterized,Uncharacterized
31,Carbon Starvation-1,False,-0.0235496546,,"Carbon starvation response: carbon starvation protein A, acetate utilization; pilin assembly: tadABCZ (homologs), rcpAC (homologs), flp family type IVb pilin",Metabolism
16,Unchar-8,False,-0.0217466047,,"fur, ribosomal proteins (rpsT, rplS, rpmE), ribosomal modulation factor, cold shock proteins, bacterioferritin, bacterioferritin-associated ferredoxin, transposases",Uncharacterized
30,Unchar-3,False,0.0201822915,,"phoP/phoQ two component system, phosphate ABC transporter, pyruvate dehydrogenase, pbpG",Uncharacterized
44,Fe-S/Oxidative Stress,False,-0.0162197215,,"Fe-S cluster assembly, oxidative stress resistance: sodA, fumC, katB, catalase ",Stress Response
24,Protocatechuate,False,0.0156779419,,Benzoate degradation: pcaBCGHK,Metabolism
5,Unchar-4,False,-0.015247024900000001,,"Zinc transporters, cadA, rpme-1, iron transporters and receptors",Uncharacterized
0,Nitrogen,False,-0.015241513200000001,NtrC,"Nitrogen stress response: ntrB/ntrC two component system, glnK, amtB, utilization of alternate nitrogen sources: urea (conversion of urea to ammonia), amino acids (transporters), pyrimidines (rutABCD), allantoin (allantoin permease), GABA (GABA permease)",Metabolism
12,Plasmid,False,0.0145323403,,"Plasmid genes: conjugal transfer proteins, DNA primase, glycoside hydrolase, mobilization proteins, type III effectors, integrase, UV resistance protein A, replication initiation protein; efflux transporters, glycine metabolism, sarcosine oxidase subunits ( likely due to plasmid manipulation)",Genomic
8,Alginate,False,-0.0145259897,,"Alginate biosynthesis, phenol degradation protein, benzaldehyde dehydrogenase, dimethylglycine demethylation, genes involved in amino acid transport and metabolism",Exometabolites
40,Unchar-5,False,-0.013834894700000001,,"several unknown genes, type III effectors, cold shock domain-containing proteins, RNA-directed DNA polymerase, integrase, cysteine synthase familiy proteins",Uncharacterized
43,single_gene_5,False,-0.013798685100000001,,"holin, genes of unknown function",Noise
14,Chaperone,False,0.0136921634,,"Chaperones, heat shock proteins, proteins involved in repair processes other than in response to heat shock, ATP-dependent protease ATPase subunits",Stress Response
3,Sulfur-1,False,-0.0131015213,,"Taurine, alkane sulfonate, cysteine, and methionine transport",Metabolism
1,Unchar-1,False,-0.0126904118,,"colR/colS two component system, pyruvate metabolism, insecticidal toxins, groES, glycerol uptake, etc.",Uncharacterized
42,single_gene_4,False,0.0126692246,,"helix-turn-helix domain-containing protein, genes of unknown function",Noise
21,Fe/Protein Transport,False,-0.0117487719,,"Iron starvation response: PvdS,  FoxR (ortholog), other sigma factors associated with iron starvation response, bacterioferritin, bacterioferritin-associated ferredoxin, energy transduction (exbBD), TonB-dependent siderophore receptors ",Metal Uptake
34,Unchar-7,False,0.0107641366,,"lipid-A-disaccharide synthase, TolC family protein, dihydrolipoyllysine-residue acetyltransferase",Uncharacterized
29,Fatty Acid,False,-0.010408563000000001,PsrA,"psrA, fadAB, etfAB, genes with multiple drug resistance domains",Metabolism
9,Resistance-1,False,0.0102206221,,"MarR transcriptional regulator, efflux transporter subunits (RND, MFS, etc.), sulforaphane/aliphatic isothiocyanate, resistance proteins (saxAF)",Stress Response
38,AlgU,False,0.009270511700000001,AlgU,"algU (rpoE),  hrpR, alginate biosynthesis, stress resistance: oxidative, osmotic, heat, UV, and metal ion stress",Stress Response
36,Translation-1,False,0.0091946664,,"Ribosomal proteins, atpCG, secY, rpoA",Translation
22,Carbon Starvation-2,False,0.0088097628,,Inositol phosphate and galactose metabolism,Metabolism
25,Flagella-2,False,0.0079013273,,"Glycosyltransferase, flagellar biosynthesis and assembly: hook, P-ring, export ATPase, chaperone, type III secretion system; cheZ",Motility
41,single_gene_3,False,0.006912233,,genes of unknown function,Noise
4,Recombination,False,-0.0067233995,,"Recombinases family proteins, several genes of unknown function",Stress Response
33,Pyoverdine,False,0.0066154635,PvdS,"Biosynthesis and transport of pyoverdine, metal transporters",Exometabolites
18,Translation-2,False,0.0058601040000000005,,"Ribosome maturation factor, rho, rpsU, rpiU",Translation
28,Osmotic Stress,False,-0.0047653972,,"Osmotic/water stress resistance: osmoprotectants, compatible solute production; oxidative stress resistance ",Stress Response
7,Unchar-9,False,0.0044798839,PSPTO_3698,"molybdenum cofactor-associated genes: moaA, fdhD, oxidoreductase (molydopterin binding protein); xanyhine dehydrogenase subunits (xdhAB) and xanthine dehydrogenase accessory protein (xdhC)",Uncharacterized
23,Phage,False,0.0042361047,,"prtN, ptrB, prophage genes associated with pyocin production in Pseudomonas aeruginosa",Genomic
6,IS-elements,False,0.0040670643,,"transposases, ptrB",Genomic
32,Folate,False,0.0037496017,,"Tetrahydrofolate production: soxGADB, folD, purU",Metabolism
26,Zur,False,0.0036374523000000003,PSPTO_5267,"Zinc transporters, cadA, rpme-1, iron transporters, and receptors",Metal Uptake
27,Yersiniabactin,False,-0.0035810359,,Biosynthesis and transport of yersiniabactin,Exometabolites
17,Unchar-2,False,0.0034801803,,"oxidative stress response: pqq, kdpf, organic hydroperoxide resistance protein, pirin (ortholog); nusA",Uncharacterized
15,Coronatine,False,-0.0031949408,,Coronatine biosynthesis: coronamic acid and coronafacic acid; alginate biosynthesis; type III effectors,Exometabolites
39,Resistance-2,False,-0.0025135928,CueR,"Syringafactin production and efflux, cueR, copper transport, chemotaxis, uric acid production, virulence factor srfB, virulence effector srfC, bacterioferritin, Flp type IV pilin",Stress Response
20,single_gene_2,False,0.0024421407,,"helix-turn-helix domain-containing protein, IS element, holin, kdpF, genes of unknown function",Noise
35,Flagella-1,False,0.0021143401,,"fleS/fleR two component system, flagellar biosynthesis and assembly: rod; hook; L; M, and P ring; hook and basal body complex; motor switch; flagellar type III secretion system",Motility
37,T3SS,False,-0.0017873624000000002,,"hrpR, hrpS, hrpL, coronatine biosynthesis activation: corP, corR/corS two component system, type III effectors, type III secretion system chaperones, type III secretion system components, type III secretion proteins, type III helper protein, type III restriction system endonuclease,ribosome modulation factor, HPr kinase, pectate lyase, flagellar hook length control protein",Exometabolites
10,Sulfur-2,False,-0.0015061412,,"Sulfur starvation response protein (oscA), alkane sulfonate transporters, sulfate transporters, amino acid transporters",Metabolism
2,Chemotaxis,False,-0.0011486964,,"crp, csrA, flgM, chemotaxis proteins, membrane components, fliC, methyl accepting chemotaxis proteins, glycosyltransferase, several genes involved in signal transduction, flagellar genes: hook-associated proteins, filament capping protein, motor protein, motor stator protein",Motility
13,Transport,False,0.0008517867,,"Transport of inorganic ions, amino acids, carbohydrates, and lipids; membrane proteins; carbon starvation protein A; tryptophan synthesis; syringafactin synthesis",Metabolism
