k,name,in_iM,gene_weight,regulator,function,category
21,Fe/Protein Transport,False,-0.0185549157,,"Iron starvation response: PvdS,  FoxR (ortholog), other sigma factors associated with iron starvation response, bacterioferritin, bacterioferritin-associated ferredoxin, energy transduction (exbBD), TonB-dependent siderophore receptors ",Metal Uptake
24,Protocatechuate,False,-0.0159107191,,Benzoate degradation: pcaBCGHK,Metabolism
0,Nitrogen,False,0.0122243526,NtrC,"Nitrogen stress response: ntrB/ntrC two component system, glnK, amtB, utilization of alternate nitrogen sources: urea (conversion of urea to ammonia), amino acids (transporters), pyrimidines (rutABCD), allantoin (allantoin permease), GABA (GABA permease)",Metabolism
18,Translation-2,False,-0.0115176879,,"Ribosome maturation factor, rho, rpsU, rpiU",Translation
29,Fatty Acid,False,-0.0114674734,PsrA,"psrA, fadAB, etfAB, genes with multiple drug resistance domains",Metabolism
6,IS-elements,False,-0.0113291515,,"transposases, ptrB",Genomic
34,Unchar-7,False,0.0108980445,,"lipid-A-disaccharide synthase, TolC family protein, dihydrolipoyllysine-residue acetyltransferase",Uncharacterized
2,Chemotaxis,False,0.0105645192,,"crp, csrA, flgM, chemotaxis proteins, membrane components, fliC, methyl accepting chemotaxis proteins, glycosyltransferase, several genes involved in signal transduction, flagellar genes: hook-associated proteins, filament capping protein, motor protein, motor stator protein",Motility
11,Unchar-6,False,-0.0104842045,,uncharacterized,Uncharacterized
39,Resistance-2,False,0.0101312413,CueR,"Syringafactin production and efflux, cueR, copper transport, chemotaxis, uric acid production, virulence factor srfB, virulence effector srfC, bacterioferritin, Flp type IV pilin",Stress Response
14,Chaperone,False,-0.0099084635,,"Chaperones, heat shock proteins, proteins involved in repair processes other than in response to heat shock, ATP-dependent protease ATPase subunits",Stress Response
16,Unchar-8,False,-0.0093979677,,"fur, ribosomal proteins (rpsT, rplS, rpmE), ribosomal modulation factor, cold shock proteins, bacterioferritin, bacterioferritin-associated ferredoxin, transposases",Uncharacterized
31,Carbon Starvation-1,False,-0.009196277400000001,,"Carbon starvation response: carbon starvation protein A, acetate utilization; pilin assembly: tadABCZ (homologs), rcpAC (homologs), flp family type IVb pilin",Metabolism
32,Folate,False,0.0089562619,,"Tetrahydrofolate production: soxGADB, folD, purU",Metabolism
20,single_gene_2,False,-0.0083589929,,"helix-turn-helix domain-containing protein, IS element, holin, kdpF, genes of unknown function",Noise
1,Unchar-1,False,0.0078368686,,"colR/colS two component system, pyruvate metabolism, insecticidal toxins, groES, glycerol uptake, etc.",Uncharacterized
25,Flagella-2,False,-0.007801506000000001,,"Glycosyltransferase, flagellar biosynthesis and assembly: hook, P-ring, export ATPase, chaperone, type III secretion system; cheZ",Motility
30,Unchar-3,False,-0.0069173483,,"phoP/phoQ two component system, phosphate ABC transporter, pyruvate dehydrogenase, pbpG",Uncharacterized
27,Yersiniabactin,False,0.006633644,,Biosynthesis and transport of yersiniabactin,Exometabolites
37,T3SS,False,-0.0064206556,,"hrpR, hrpS, hrpL, coronatine biosynthesis activation: corP, corR/corS two component system, type III effectors, type III secretion system chaperones, type III secretion system components, type III secretion proteins, type III helper protein, type III restriction system endonuclease,ribosome modulation factor, HPr kinase, pectate lyase, flagellar hook length control protein",Exometabolites
12,Plasmid,False,0.0062221044,,"Plasmid genes: conjugal transfer proteins, DNA primase, glycoside hydrolase, mobilization proteins, type III effectors, integrase, UV resistance protein A, replication initiation protein; efflux transporters, glycine metabolism, sarcosine oxidase subunits ( likely due to plasmid manipulation)",Genomic
44,Fe-S/Oxidative Stress,False,-0.0058872766000000005,,"Fe-S cluster assembly, oxidative stress resistance: sodA, fumC, katB, catalase ",Stress Response
38,AlgU,False,0.0056585518,AlgU,"algU (rpoE),  hrpR, alginate biosynthesis, stress resistance: oxidative, osmotic, heat, UV, and metal ion stress",Stress Response
23,Phage,False,0.0056474515,,"prtN, ptrB, prophage genes associated with pyocin production in Pseudomonas aeruginosa",Genomic
40,Unchar-5,False,-0.0055174688000000005,,"several unknown genes, type III effectors, cold shock domain-containing proteins, RNA-directed DNA polymerase, integrase, cysteine synthase familiy proteins",Uncharacterized
33,Pyoverdine,False,0.0052192358,PvdS,"Biosynthesis and transport of pyoverdine, metal transporters",Exometabolites
5,Unchar-4,False,-0.0052115686,,"Zinc transporters, cadA, rpme-1, iron transporters and receptors",Uncharacterized
43,single_gene_5,False,-0.0047317738,,"holin, genes of unknown function",Noise
3,Sulfur-1,False,-0.0037695351,,"Taurine, alkane sulfonate, cysteine, and methionine transport",Metabolism
41,single_gene_3,False,0.0036205053,,genes of unknown function,Noise
36,Translation-1,False,0.0035564485,,"Ribosomal proteins, atpCG, secY, rpoA",Translation
7,Unchar-9,False,0.0035231927000000003,PSPTO_3698,"molybdenum cofactor-associated genes: moaA, fdhD, oxidoreductase (molydopterin binding protein); xanyhine dehydrogenase subunits (xdhAB) and xanthine dehydrogenase accessory protein (xdhC)",Uncharacterized
19,single_gene_1,False,-0.0033119744000000002,,"baeR, exdb, unknown genes",Noise
15,Coronatine,False,0.0028409748000000003,,Coronatine biosynthesis: coronamic acid and coronafacic acid; alginate biosynthesis; type III effectors,Exometabolites
4,Recombination,False,0.0026154169,,"Recombinases family proteins, several genes of unknown function",Stress Response
13,Transport,False,0.0024827853,,"Transport of inorganic ions, amino acids, carbohydrates, and lipids; membrane proteins; carbon starvation protein A; tryptophan synthesis; syringafactin synthesis",Metabolism
10,Sulfur-2,False,-0.0024208844,,"Sulfur starvation response protein (oscA), alkane sulfonate transporters, sulfate transporters, amino acid transporters",Metabolism
17,Unchar-2,False,-0.002122109,,"oxidative stress response: pqq, kdpf, organic hydroperoxide resistance protein, pirin (ortholog); nusA",Uncharacterized
28,Osmotic Stress,False,-0.0021113295,,"Osmotic/water stress resistance: osmoprotectants, compatible solute production; oxidative stress resistance ",Stress Response
8,Alginate,False,-0.0020684212,,"Alginate biosynthesis, phenol degradation protein, benzaldehyde dehydrogenase, dimethylglycine demethylation, genes involved in amino acid transport and metabolism",Exometabolites
42,single_gene_4,False,0.0008861728,,"helix-turn-helix domain-containing protein, genes of unknown function",Noise
9,Resistance-1,False,-0.0006191643000000001,,"MarR transcriptional regulator, efflux transporter subunits (RND, MFS, etc.), sulforaphane/aliphatic isothiocyanate, resistance proteins (saxAF)",Stress Response
22,Carbon Starvation-2,False,-0.0005601205000000001,,Inositol phosphate and galactose metabolism,Metabolism
35,Flagella-1,False,-0.00027890200000000003,,"fleS/fleR two component system, flagellar biosynthesis and assembly: rod; hook; L; M, and P ring; hook and basal body complex; motor switch; flagellar type III secretion system",Motility
26,Zur,False,-1.67196e-05,PSPTO_5267,"Zinc transporters, cadA, rpme-1, iron transporters, and receptors",Metal Uptake
