k,name,in_iM,gene_weight,regulator,function,category
10,Sulfur-2,False,-0.023221631000000003,,"Sulfur starvation response protein (oscA), alkane sulfonate transporters, sulfate transporters, amino acid transporters",Metabolism
27,Yersiniabactin,False,0.0208687097,,Biosynthesis and transport of yersiniabactin,Exometabolites
31,Carbon Starvation-1,False,0.0162095155,,"Carbon starvation response: carbon starvation protein A, acetate utilization; pilin assembly: tadABCZ (homologs), rcpAC (homologs), flp family type IVb pilin",Metabolism
18,Translation-2,False,0.015591313,,"Ribosome maturation factor, rho, rpsU, rpiU",Translation
6,IS-elements,False,-0.013461295500000001,,"transposases, ptrB",Genomic
25,Flagella-2,False,0.0133362094,,"Glycosyltransferase, flagellar biosynthesis and assembly: hook, P-ring, export ATPase, chaperone, type III secretion system; cheZ",Motility
1,Unchar-1,False,-0.0119849371,,"colR/colS two component system, pyruvate metabolism, insecticidal toxins, groES, glycerol uptake, etc.",Uncharacterized
4,Recombination,False,-0.011378138000000001,,"Recombinases family proteins, several genes of unknown function",Stress Response
0,Nitrogen,False,0.0113502052,NtrC,"Nitrogen stress response: ntrB/ntrC two component system, glnK, amtB, utilization of alternate nitrogen sources: urea (conversion of urea to ammonia), amino acids (transporters), pyrimidines (rutABCD), allantoin (allantoin permease), GABA (GABA permease)",Metabolism
2,Chemotaxis,False,-0.0111709669,,"crp, csrA, flgM, chemotaxis proteins, membrane components, fliC, methyl accepting chemotaxis proteins, glycosyltransferase, several genes involved in signal transduction, flagellar genes: hook-associated proteins, filament capping protein, motor protein, motor stator protein",Motility
24,Protocatechuate,False,-0.0102146919,,Benzoate degradation: pcaBCGHK,Metabolism
36,Translation-1,False,0.0095381604,,"Ribosomal proteins, atpCG, secY, rpoA",Translation
20,single_gene_2,False,-0.009375931300000001,,"helix-turn-helix domain-containing protein, IS element, holin, kdpF, genes of unknown function",Noise
17,Unchar-2,False,-0.0083333181,,"oxidative stress response: pqq, kdpf, organic hydroperoxide resistance protein, pirin (ortholog); nusA",Uncharacterized
7,Unchar-9,False,0.0073495419,PSPTO_3698,"molybdenum cofactor-associated genes: moaA, fdhD, oxidoreductase (molydopterin binding protein); xanyhine dehydrogenase subunits (xdhAB) and xanthine dehydrogenase accessory protein (xdhC)",Uncharacterized
22,Carbon Starvation-2,False,0.0072684156000000005,,Inositol phosphate and galactose metabolism,Metabolism
34,Unchar-7,False,-0.0071656134000000005,,"lipid-A-disaccharide synthase, TolC family protein, dihydrolipoyllysine-residue acetyltransferase",Uncharacterized
38,AlgU,False,-0.0069359848,AlgU,"algU (rpoE),  hrpR, alginate biosynthesis, stress resistance: oxidative, osmotic, heat, UV, and metal ion stress",Stress Response
3,Sulfur-1,False,0.006691033000000001,,"Taurine, alkane sulfonate, cysteine, and methionine transport",Metabolism
8,Alginate,False,0.0066836442,,"Alginate biosynthesis, phenol degradation protein, benzaldehyde dehydrogenase, dimethylglycine demethylation, genes involved in amino acid transport and metabolism",Exometabolites
28,Osmotic Stress,False,0.0065842629,,"Osmotic/water stress resistance: osmoprotectants, compatible solute production; oxidative stress resistance ",Stress Response
32,Folate,False,-0.0061887784,,"Tetrahydrofolate production: soxGADB, folD, purU",Metabolism
44,Fe-S/Oxidative Stress,False,0.0058651125,,"Fe-S cluster assembly, oxidative stress resistance: sodA, fumC, katB, catalase ",Stress Response
26,Zur,False,-0.0055008844,PSPTO_5267,"Zinc transporters, cadA, rpme-1, iron transporters, and receptors",Metal Uptake
39,Resistance-2,False,-0.0053655011,CueR,"Syringafactin production and efflux, cueR, copper transport, chemotaxis, uric acid production, virulence factor srfB, virulence effector srfC, bacterioferritin, Flp type IV pilin",Stress Response
13,Transport,False,-0.0051248134,,"Transport of inorganic ions, amino acids, carbohydrates, and lipids; membrane proteins; carbon starvation protein A; tryptophan synthesis; syringafactin synthesis",Metabolism
30,Unchar-3,False,-0.0050954305,,"phoP/phoQ two component system, phosphate ABC transporter, pyruvate dehydrogenase, pbpG",Uncharacterized
40,Unchar-5,False,0.0049218612000000005,,"several unknown genes, type III effectors, cold shock domain-containing proteins, RNA-directed DNA polymerase, integrase, cysteine synthase familiy proteins",Uncharacterized
37,T3SS,False,-0.0048983099,,"hrpR, hrpS, hrpL, coronatine biosynthesis activation: corP, corR/corS two component system, type III effectors, type III secretion system chaperones, type III secretion system components, type III secretion proteins, type III helper protein, type III restriction system endonuclease,ribosome modulation factor, HPr kinase, pectate lyase, flagellar hook length control protein",Exometabolites
16,Unchar-8,False,-0.0041750063,,"fur, ribosomal proteins (rpsT, rplS, rpmE), ribosomal modulation factor, cold shock proteins, bacterioferritin, bacterioferritin-associated ferredoxin, transposases",Uncharacterized
43,single_gene_5,False,0.0033644333,,"holin, genes of unknown function",Noise
11,Unchar-6,False,-0.0033188790000000003,,uncharacterized,Uncharacterized
19,single_gene_1,False,-0.0032194733,,"baeR, exdb, unknown genes",Noise
29,Fatty Acid,False,-0.0024704031,PsrA,"psrA, fadAB, etfAB, genes with multiple drug resistance domains",Metabolism
21,Fe/Protein Transport,False,0.0023835713000000002,,"Iron starvation response: PvdS,  FoxR (ortholog), other sigma factors associated with iron starvation response, bacterioferritin, bacterioferritin-associated ferredoxin, energy transduction (exbBD), TonB-dependent siderophore receptors ",Metal Uptake
41,single_gene_3,False,0.0018548899,,genes of unknown function,Noise
42,single_gene_4,False,0.0016712192000000001,,"helix-turn-helix domain-containing protein, genes of unknown function",Noise
14,Chaperone,False,0.0015025986000000002,,"Chaperones, heat shock proteins, proteins involved in repair processes other than in response to heat shock, ATP-dependent protease ATPase subunits",Stress Response
5,Unchar-4,False,-0.0014566214,,"Zinc transporters, cadA, rpme-1, iron transporters and receptors",Uncharacterized
12,Plasmid,False,-0.0014361163,,"Plasmid genes: conjugal transfer proteins, DNA primase, glycoside hydrolase, mobilization proteins, type III effectors, integrase, UV resistance protein A, replication initiation protein; efflux transporters, glycine metabolism, sarcosine oxidase subunits ( likely due to plasmid manipulation)",Genomic
35,Flagella-1,False,0.0011155009,,"fleS/fleR two component system, flagellar biosynthesis and assembly: rod; hook; L; M, and P ring; hook and basal body complex; motor switch; flagellar type III secretion system",Motility
33,Pyoverdine,False,-0.0010776757,PvdS,"Biosynthesis and transport of pyoverdine, metal transporters",Exometabolites
15,Coronatine,False,-0.0008748252,,Coronatine biosynthesis: coronamic acid and coronafacic acid; alginate biosynthesis; type III effectors,Exometabolites
9,Resistance-1,False,0.0007523873000000001,,"MarR transcriptional regulator, efflux transporter subunits (RND, MFS, etc.), sulforaphane/aliphatic isothiocyanate, resistance proteins (saxAF)",Stress Response
23,Phage,False,0.0006705695,,"prtN, ptrB, prophage genes associated with pyocin production in Pseudomonas aeruginosa",Genomic
