k,name,in_iM,gene_weight,regulator,function,category
5,Unchar-4,True,-0.06506873540000001,,"Zinc transporters, cadA, rpme-1, iron transporters and receptors",Uncharacterized
2,Chemotaxis,True,0.0553847034,,"crp, csrA, flgM, chemotaxis proteins, membrane components, fliC, methyl accepting chemotaxis proteins, glycosyltransferase, several genes involved in signal transduction, flagellar genes: hook-associated proteins, filament capping protein, motor protein, motor stator protein",Motility
38,AlgU,True,-0.0370256438,AlgU,"algU (rpoE),  hrpR, alginate biosynthesis, stress resistance: oxidative, osmotic, heat, UV, and metal ion stress",Stress Response
7,Unchar-9,False,-0.0775195415,PSPTO_3698,"molybdenum cofactor-associated genes: moaA, fdhD, oxidoreductase (molydopterin binding protein); xanyhine dehydrogenase subunits (xdhAB) and xanthine dehydrogenase accessory protein (xdhC)",Uncharacterized
39,Resistance-2,False,0.052988559500000004,CueR,"Syringafactin production and efflux, cueR, copper transport, chemotaxis, uric acid production, virulence factor srfB, virulence effector srfC, bacterioferritin, Flp type IV pilin",Stress Response
17,Unchar-2,False,0.0442941886,,"oxidative stress response: pqq, kdpf, organic hydroperoxide resistance protein, pirin (ortholog); nusA",Uncharacterized
30,Unchar-3,False,-0.0305462573,,"phoP/phoQ two component system, phosphate ABC transporter, pyruvate dehydrogenase, pbpG",Uncharacterized
36,Translation-1,False,0.028764673100000002,,"Ribosomal proteins, atpCG, secY, rpoA",Translation
40,Unchar-5,False,-0.0264760344,,"several unknown genes, type III effectors, cold shock domain-containing proteins, RNA-directed DNA polymerase, integrase, cysteine synthase familiy proteins",Uncharacterized
25,Flagella-2,False,0.026109190900000002,,"Glycosyltransferase, flagellar biosynthesis and assembly: hook, P-ring, export ATPase, chaperone, type III secretion system; cheZ",Motility
33,Pyoverdine,False,-0.020205918200000002,PvdS,"Biosynthesis and transport of pyoverdine, metal transporters",Exometabolites
44,Fe-S/Oxidative Stress,False,-0.0201251413,,"Fe-S cluster assembly, oxidative stress resistance: sodA, fumC, katB, catalase ",Stress Response
10,Sulfur-2,False,-0.0157329377,,"Sulfur starvation response protein (oscA), alkane sulfonate transporters, sulfate transporters, amino acid transporters",Metabolism
8,Alginate,False,-0.0146936867,,"Alginate biosynthesis, phenol degradation protein, benzaldehyde dehydrogenase, dimethylglycine demethylation, genes involved in amino acid transport and metabolism",Exometabolites
27,Yersiniabactin,False,0.0139026796,,Biosynthesis and transport of yersiniabactin,Exometabolites
15,Coronatine,False,-0.013859570500000001,,Coronatine biosynthesis: coronamic acid and coronafacic acid; alginate biosynthesis; type III effectors,Exometabolites
1,Unchar-1,False,-0.0136504368,,"colR/colS two component system, pyruvate metabolism, insecticidal toxins, groES, glycerol uptake, etc.",Uncharacterized
18,Translation-2,False,-0.0135204478,,"Ribosome maturation factor, rho, rpsU, rpiU",Translation
14,Chaperone,False,-0.0131847613,,"Chaperones, heat shock proteins, proteins involved in repair processes other than in response to heat shock, ATP-dependent protease ATPase subunits",Stress Response
42,single_gene_4,False,-0.0131631798,,"helix-turn-helix domain-containing protein, genes of unknown function",Noise
19,single_gene_1,False,-0.012647680500000001,,"baeR, exdb, unknown genes",Noise
9,Resistance-1,False,-0.011654404200000001,,"MarR transcriptional regulator, efflux transporter subunits (RND, MFS, etc.), sulforaphane/aliphatic isothiocyanate, resistance proteins (saxAF)",Stress Response
6,IS-elements,False,0.011294142600000001,,"transposases, ptrB",Genomic
31,Carbon Starvation-1,False,0.0111813395,,"Carbon starvation response: carbon starvation protein A, acetate utilization; pilin assembly: tadABCZ (homologs), rcpAC (homologs), flp family type IVb pilin",Metabolism
21,Fe/Protein Transport,False,0.011124285000000001,,"Iron starvation response: PvdS,  FoxR (ortholog), other sigma factors associated with iron starvation response, bacterioferritin, bacterioferritin-associated ferredoxin, energy transduction (exbBD), TonB-dependent siderophore receptors ",Metal Uptake
20,single_gene_2,False,-0.0111155281,,"helix-turn-helix domain-containing protein, IS element, holin, kdpF, genes of unknown function",Noise
35,Flagella-1,False,-0.010595006700000001,,"fleS/fleR two component system, flagellar biosynthesis and assembly: rod; hook; L; M, and P ring; hook and basal body complex; motor switch; flagellar type III secretion system",Motility
43,single_gene_5,False,0.0097184087,,"holin, genes of unknown function",Noise
28,Osmotic Stress,False,0.0090671187,,"Osmotic/water stress resistance: osmoprotectants, compatible solute production; oxidative stress resistance ",Stress Response
11,Unchar-6,False,-0.007760799200000001,,uncharacterized,Uncharacterized
13,Transport,False,0.00679334,,"Transport of inorganic ions, amino acids, carbohydrates, and lipids; membrane proteins; carbon starvation protein A; tryptophan synthesis; syringafactin synthesis",Metabolism
4,Recombination,False,0.0055742785,,"Recombinases family proteins, several genes of unknown function",Stress Response
24,Protocatechuate,False,-0.005333299200000001,,Benzoate degradation: pcaBCGHK,Metabolism
41,single_gene_3,False,-0.0051200952,,genes of unknown function,Noise
23,Phage,False,-0.004122289,,"prtN, ptrB, prophage genes associated with pyocin production in Pseudomonas aeruginosa",Genomic
37,T3SS,False,0.0039800269,,"hrpR, hrpS, hrpL, coronatine biosynthesis activation: corP, corR/corS two component system, type III effectors, type III secretion system chaperones, type III secretion system components, type III secretion proteins, type III helper protein, type III restriction system endonuclease,ribosome modulation factor, HPr kinase, pectate lyase, flagellar hook length control protein",Exometabolites
34,Unchar-7,False,-0.0033157750000000004,,"lipid-A-disaccharide synthase, TolC family protein, dihydrolipoyllysine-residue acetyltransferase",Uncharacterized
29,Fatty Acid,False,0.0032295369,PsrA,"psrA, fadAB, etfAB, genes with multiple drug resistance domains",Metabolism
22,Carbon Starvation-2,False,-0.0029602567000000003,,Inositol phosphate and galactose metabolism,Metabolism
32,Folate,False,-0.0027173443,,"Tetrahydrofolate production: soxGADB, folD, purU",Metabolism
0,Nitrogen,False,-0.0025661732000000002,NtrC,"Nitrogen stress response: ntrB/ntrC two component system, glnK, amtB, utilization of alternate nitrogen sources: urea (conversion of urea to ammonia), amino acids (transporters), pyrimidines (rutABCD), allantoin (allantoin permease), GABA (GABA permease)",Metabolism
26,Zur,False,0.0021999981,PSPTO_5267,"Zinc transporters, cadA, rpme-1, iron transporters, and receptors",Metal Uptake
3,Sulfur-1,False,-0.0014559806000000002,,"Taurine, alkane sulfonate, cysteine, and methionine transport",Metabolism
12,Plasmid,False,0.0012447488,,"Plasmid genes: conjugal transfer proteins, DNA primase, glycoside hydrolase, mobilization proteins, type III effectors, integrase, UV resistance protein A, replication initiation protein; efflux transporters, glycine metabolism, sarcosine oxidase subunits ( likely due to plasmid manipulation)",Genomic
16,Unchar-8,False,-0.0007429583,,"fur, ribosomal proteins (rpsT, rplS, rpmE), ribosomal modulation factor, cold shock proteins, bacterioferritin, bacterioferritin-associated ferredoxin, transposases",Uncharacterized
