k,name,in_iM,gene_weight,regulator,function,category
135,Cysteine-1,True,0.2043664663021522,CysB,"Cysteine biosynthesis, sulfate assimilation",Amino Acid Metabolism
158,Cysteine-2,True,0.1371619463484128,CysB,"Cysteine biosynthesis, sulfate assimilation",Amino Acid Metabolism
167,UC-2,True,0.0804823445685116,,Unknown,Unknown
154,sdh KO,False,-0.0342757344975407,,sdh KO,Carbon Metabolism
56,Sulfate,False,0.0267967560075088,Cbl+CysB,Cysteine transport and biosynthesis; aliphatic sulfonate utilization and homeostatic response to sulfate starvation,Amino Acid Metabolism
196,Glyoxylate,False,0.0257588151796756,Crp+ArcA+ppGpp+Cra+IclR+IHF,Glyxoylate cycle; alternate to TCA cycle,Energy Metabolism
25,Lrp,False,0.023169923197319,Lrp,"Global regulation of amino acid biosynthesis/catabolism, stationary phase, nutrient transport, pili synthesis, 1-carbon metabolism",Amino Acid Metabolism
111,YgeV,False,-0.0206264812645379,YgeV,Nucleoside degradation activated by ethanol treatment,Carbon Metabolism
178,NO Stress,False,0.0198287948764198,NsrR/NarP,"Nitric oxide sensing and detoxification, iron-sulfur cluster repair, anaerobic growth",Redox Stress
114,GlcNAc,False,0.0193648115178064,NagC+Crp,"Amino sugar transport, biosynthesis and catabolism",Carbon Metabolism
104,FHL,False,-0.0185523373922257,RpoN+NsrR+ModE+IHF+FhlA,Formate hydrogenlyase: hydrogen production during glucose fermentation via formate oxidation/proton reduction,Energy Metabolism
68,Cellulose,False,0.0185425267789022,,Cellulose biosynthesis; biofilm formation; membrane/periplasmic proteins,Extracellular Structures
9,ROS TALE Amp,False,-0.0183692367146246,,Amplification of DLP12/IS3,Unknown
171,cyoB/ndh/nuoB KO-1,False,-0.0178463069850338,,NDH-1 (nuoB) KO and compensatory NDH-2 (ndh) up-regulation,Energy Metabolism
76,Potassium,False,-0.0177442358528788,KdpE,Potassium sensing and transport,Metal Homeostasis
60,Nitrate/Nitrite,False,-0.0166541165904608,NarL+Fnr,Nitrate/nitrite transport and reduction,Nitrogen Metabolism
110,SCFA,False,-0.0146732584784846,RpoN+AtoC+IHF,Short-chain fatty acid (acetoacetate) transport and catabolism,Carbon Metabolism
197,CCK-PGI Del,False,-0.0145979211631545,,Unknown,Unknown
168,ydfB,False,0.0141251771576603,,Unknown,Unknown
140,ytiC,False,0.0141106419504956,,Unknown,Unknown
8,yqhI,False,0.0139724354030042,,Unknown,Unknown
42,Biotin,False,0.0136406738444705,BirA,Biotin biosynthesis,Cofactor Metabolism
13,RpoH,False,-0.0134566688303832,RpoH,Global heat shock response during log-phase; response to high temperature and/or misfolded proteins,Temperature Shock
36,cydB/appC KO,False,-0.0134172237057401,,cydB/appC KO and compensatory regulatory changes,Energy Metabolism
139,Capsule,False,-0.012806221847644,RcsAB,Colanic acid capsule synthesis and transport; periplasmic proteins; envelope stress response,Extracellular Structures
180,Tyr/Trp/Phe,False,-0.0125928232001579,TyrR/TrpR/Trp-tRNA,Aromatic amino acid biosynthesis and transport,Amino Acid Metabolism
159,ydfW,False,-0.0125321358087527,,Unknown,Unknown
97,Curli-1,False,-0.0124858094305319,RpoS+FliZ+CpxR+CsgD+BtsR,Curli secretion and assembly,Extracellular Structures
186,Glutarate,False,0.012376098442888,RpoS+H-NS+Crp+Lrp+GlaR+ppGpp,Glutarate/aminobutyrate transport and catabolism,Carbon Metabolism
92,Crp-1,False,-0.0123658594210365,Crp,Miscellaneous carbon source metabolism,Carbon Metabolism
106,BW25113,False,0.012352336543523,,Accounts for genomic differences between BW25113 and MG1655 substrains,Strain Difference
191,Tryptophanase,False,0.0123157776653994,Crp+TorR+Nac+L-tryptophan,Tryptophan import and catabolism via tryptophanase; indole/pyruvate biosynthesis,Amino Acid Metabolism
116,Lysine/T2SS,False,-0.0123033438211029,ArgP,Lysine transport and biosynthesis; type II secretion system,Amino Acid Metabolism
78,cyoB/kdpE/qseB KO,False,0.0118739503813612,,cyoB/kdpE/qseF KO,Energy Metabolism
23,thrA KO,False,0.0117940497257265,,thrA KO and compensatory transcriptional changes,Amino Acid Metabolism
1,Translation,False,0.0117660832715899,DksA,Ribosome biogenesis,Translation
18,Methionine,False,-0.0116741817840142,MetJ,Methionine transport and biosynthesis,Amino Acid Metabolism
2,ygdT,False,-0.0116737670155697,,Unknown,Unknown
65,NRZ,False,0.0112562462392173,OmpR,Nitrate reduction under microaerobic condition; aerobic to anaerobic transition,Energy Metabolism
121,Gluconate,False,-0.0111993241030549,GntR+Crp,Gluconate transport and catabolism (Entner-Doudoroff),Carbon Metabolism
161,PAL Amp,False,-0.0110459289826511,,Unknown,Unknown
150,Nickel/Cobalt,False,-0.0109127265848997,RcnR,Nickel and cobalt resistance via efflux,Metal Homeostasis
146,Glycolate,False,-0.0107496999787841,IHF+ArcA+PdhR+GlcC,Glycolate/glyoxylate tranport and catabolism,Carbon Metabolism
31,Nickel,False,-0.0106777121943015,RpoN+NarL+NikR+Fnr,Nickel sensing and uptake,Metal Homeostasis
188,Oxidoreductase,False,-0.0106294482111747,,Putative oxidoreductase components,Redox Stress
193,cyoB/ndh/nuoB KO-2,False,-0.0098165126067182,,cyoB/ndh/nuoB KOs,Energy Metabolism
5,Osmoprotectant,False,0.0098128479593703,RpoS+ppGpp+IHF+H-NS,Transport of osmoprotectant glycine betaine,Envelope Stress
122,UC-9,False,0.0097161166307191,,Unknown,Unknown
103,Tryptophan,False,0.0096555431724438,TrpR+Trp-tRNA,Tryptophan transport and biosynthesis,Amino Acid Metabolism
53,UC-1,False,-0.0095771094521669,,Unknown,Unknown
90,Leu/Val/Ile,False,-0.0095635207953785,Lrp+IHF+Ile-tRNA+Leu-tRNA+Val-tRNA+ppGpp,Branched-chain amino acid biosynthesis,Amino Acid Metabolism
198,Acetate,False,-0.0094295875151444,,Acetate uptake and catabolism; aldehyde catabolism; acetate/ethanol detoxification at stationary phase,Carbon Metabolism
183,DhaR,False,-0.0091446086874103,DhaR,Dihydroxyacetone transport and catabolism; phosphotransferase activity for DhaM phosphorylation,Carbon Metabolism
156,Fnr-2,False,0.0088499794185062,Fnr,Transition from aerobic to anaerobic growth; global control of anaerobiosis,Energy Metabolism
32,CpxR,False,-0.0086401330757018,CpxR,"Inner membrane damage sensing and repair via protein folding/degradation, chemotaxis, drug efflux, DNA repair, motility",Envelope Stress
185,gcvB,False,-0.0086384637894959,gcvB,Amino acid transport,Amino Acid Metabolism
81,crp KO-1,False,-0.008548609772441,,crp KO and compensatory regulatory changes,Carbon Metabolism
175,Hot TALE 16,False,-0.0084804815610725,,Regulatory changes under high temperature,Unknown
7,Sialic Acid,False,-0.0083623635569465,Crp+NanR,N-acetyl-neuraminic acid (or sialic acid) transport and metabolism,Carbon Metabolism
195,Phage Shock,False,-0.0083402720269314,RpoN+IHF+PspF,Phage shock response; response to filamentous phage infection and/or extracytoplasmic shock,Phage Shock
12,UC-4,False,0.0083164403109329,,Unknown,Unknown
163,CP4-44,False,-0.0082731681526019,,CP4-44 prophage expression variation,Prophage
129,Pyruvate-1,False,0.0082044337991894,BtsR,"Pyruvate sensing, transport, and catabolism under nutrient limitation",Carbon Metabolism
169,NrdR,False,-0.0082008787506826,NrdR,Ribonucleoside reduction,Nucleotide Metabolism
69,Phosphate-1,False,-0.0081401146812385,PhoB,"Inorganic phosphate sensing, transport, and production",Phosphate Metabolism
33,Curli-2,False,0.0080897713708503,RpoS+FliZ+CpxR+CsgD+BtsR,Curli secretion and assembly,Extracellular Structures
190,Efflux Pump,False,0.0080309009343773,,Multidrug/spermidine efflux pump,Resistance
95,Ribose,False,0.0079034192310006,dsrA+Crp+RbsR,Ribose transport and catabolism,Carbon Metabolism
6,Glutamine,False,-0.0078159129909064,NtrC,Glutamine transport and synthesis,Nitrogen Metabolism
50,Sulfoquinovose,False,-0.0077997393497684,CsqR,Sulfoquinovose transport and catabolism,Carbon Metabolism
199,Ile/Val,False,0.0076196290182201,,Isoleucine and valine biosynthesis,Amino Acid Metabolism
10,Nucleotide Stress,False,0.0075571776999957,,DNA repair; stringent response signaling via ppGpp; ribosomal biogenesis and stability,DNA Damage
91,NDH-1,False,0.0074919001817933,NarL+ArcA+IHF+Fnr+Fis+ryhB,"NADH:ubiquinone oxidoreductase I: electron transfer from NADH to quinone pool, proton electrochemical gradient generation for aerobic and anaerobic respiration",Energy Metabolism
152,NtrC-3,False,0.0074126828451682,NtrC+RpoN,"Nitrogen assimilation, pyrimidine transport and catabolism",Nitrogen Metabolism
0,Sugar Diacid,False,0.0070373417203694,CdaR,Transport and catabolism of carbohydrate diacids (galacatarate and glucarate),Carbon Metabolism
24,YjfJ,False,0.006861451175656,YjfJ,Putative heat responsive regulon,Temperature Shock
166,Rhamnose,False,0.0066728550187709,Crp+RhaS,Rhamnose transport and catabolism,Carbon Metabolism
138,Leucine,False,-0.0065064240601784,LeuO+Leu-tRNA+ppGpp,Leucine biosynthesis,Amino Acid Metabolism
119,entC/ubiC KO-1,False,-0.0064759191546945,,entC/ubiC KO and compensatory sad up-regulation,Energy Metabolism
59,Magnesium,False,-0.0063438660185969,PhoP,Magnesium sensing and transport; magnesium-limitation response,Metal Homeostasis
132,rcsB KO,False,0.0062526566473572,,rcsB KO and associated regulatory changes,Envelope Stress
4,FlhDC-2,False,0.0061970500373512,FlhDC,Flagellum biosynthesis and export,Extracellular Structures
173,IS Elements-1,False,0.0061180767449466,,Unknown,Unknown
128,FliA,False,-0.0059280716295557,FliA,"Sigma 28; flagellum biosynthesis and export, motility",Extracellular Structures
94,NtrC-1,False,-0.0059214623936423,RpoN+RpoS+NtrC,"Nitrogen assimilation, ammonium transport",Nitrogen Metabolism
21,Nucleoside,False,0.0058247268003004,Crp+CytR,Transport and utilization of ribonucleosides and deoxyribonucleosides,Nucleotide Metabolism
124,Thr/Ser-2,False,-0.0057492849755124,Fnr+Crp+IHF+TdcA+TdcR,Threonine/serine transport and catabolism,Amino Acid Metabolism
115,YgbI,False,-0.0056175899195768,YgbI,Tartrate transport and catabolism,Carbon Metabolism
3,OxyR,False,0.0055876343830576,OxyR,"Oxidative stress response, especially peroxide",Redox Stress
102,Thr/Ser-1,False,0.0055834229422453,TdcA+TdcR+IHF+Fnr+Crp,Threonine/serine transport and catabolism during anaerobiosis,Amino Acid Metabolism
118,ythA,False,0.0055786846883568,,Unknown,Unknown
55,ykgR,False,-0.0054882935274716,,Unknown,Unknown
105,Glycine,False,0.0054833745887827,PurR+Fnr+ppGpp+Crp+Lrp+GcvA,Glycine cleavage system,Amino Acid Metabolism
58,Fur-2,False,-0.0053745818772367,Fur,"Iron sensing and uptake, enterobactin biosynthesis, iron-sulfur cluster activation, iron sequestration",Metal Homeostasis
77,ROS TALE Del-1,False,-0.00535710283,,Unknown,Unknown
80,Thiamine-2,False,-0.0053450986353361,,Thiamine uptake and biosynthesis,Cofactor Metabolism
73,trxC Del,False,0.0053262622350906,,Unknown,Unknown
52,lsrB KO,False,-0.0052997636831187,,lsrB KO and compensatory regulatory changes,Quorum Sensing
108,PaaX,False,-0.0052540753213223,Crp+IHF+PaaX+SlyA,Phenylacetic acid transport and catabolism,Carbon Metabolism
43,N Reduction,False,0.0052168886454259,FlhDC+ModE+NarP+NarL+Fnr,"Electron transfer via nitrate reductases (periplasmic and A), cytochrome c",Energy Metabolism
127,Cold Shock,False,-0.0052013567533956,,Cold shock proteins,Temperature Shock
37,ymdG,False,0.0051211037222656,,Unknown,Unknown
26,baeR KO,False,0.0049779589861653,,baeR KO,Envelope Stress
192,crp KO-2,False,-0.0049320928852945,,crp KO and associated glycerol-3-phosphate (GlpR) regulatory changes,Carbon Metabolism
164,minicoli KOs,False,-0.0049191788320168,,Deletions from minicoli strain,Genome Reduction
130,ldrD,False,-0.004916064899983,,Unknown,Unknown
15,ldrC,False,-0.0048639909886695,,Unknown,Unknown
187,entC/ubiC KO-2,False,0.0047759761527915,,entC/ubiC KO and compensatory sad up-regulation,Energy Metabolism
189,UC-7,False,0.0047636764478848,,Unknown,Unknown
49,BasR,False,-0.0046939374030263,BasR,Lipid A modification and polymixin resistance in the presence of excess iron,Extracellular Structures
126,Thiamine-1,False,-0.0046737870924743,Thiamine diphosphate,Thiamine uptake and biosynthesis,Cofactor Metabolism
148,LPS,False,0.004663213021104,,Lipopolysaccharide biosynthesis and export,Extracellular Structures
70,Salicylic Acid,False,0.0046481740311239,,Salicylic acid efflux,Redox Stress
75,yceO,False,-0.0046021499902605,,Unknown,Unknown
141,ROS TALE Del-2,False,0.0045297510035506,,Unknown,Unknown
99,yjjZ,False,0.0044930400077744,,Unknown,Unknown
165,GadXW,False,-0.0042302947677597,GadX+GadW,Glutamate-dependent acid resistance system; multidrug efflux,Envelope Stress
46,PAL 10 Del,False,-0.0041948711829696,,Unknown,Unknown
82,SSW SNPs,False,0.0041947445910762,,Unknown,ALE Effects
98,ymiB,False,-0.0041536445028957,,Unknown,Unknown
30,IS Elements-2,False,0.0041362574341601,,Unknown,Unknown
40,IS1,False,0.0040923916042565,,IS1 transcripts,Unknown
35,FucR/ExuR,False,-0.0040216094945083,FucR/ExuR,Fucose/galacturonate/glucuronate transport and catabolism,Carbon Metabolism
66,nquinone ALE 3,False,0.0039416331243898,,ubiC KO and associated adaptive regulatory changes,Energy Metabolism
157,Microaerobic,False,0.0039044050938673,RpoS+Fis+NarP+NarL+AppY+YdeO+ArcA+IscR,Hydrogenase 1 and cytochrome bd-II ubiquinol oxidase: microaerobic respiratory chain between hydrogen and oxygen,Energy Metabolism
83,yafF,False,-0.0039003977109978,,Unknown,Unknown
89,UC-6,False,-0.0037760566837334,,Unknown,Unknown
27,ydaG,False,0.0037677570519499,,Unknown,Unknown
84,NtrC-2,False,-0.0036591331650394,NtrC+RpoN,"Nitrogen assimilation, ammonium transport",Nitrogen Metabolism
176,Suf System,False,0.0036266680007872,NsrR+IHF+IscR+OxyR+Fur+ppGpp,Iron-sulfur cluster biosynthesis and insertion,Metal Homeostasis
61,glrR KO,False,-0.003610713960439,,glrR (aka qseF) KO; xylose transport and catabolism,Envelope Stress
170,Purine,False,-0.0036080062309686,PurR+ppGpp,Purine transport and biosynthesis,Nucleotide Metabolism
71,ymgI,False,-0.0034962589083775,,Unknown,Unknown
16,Ferric Citrate,False,-0.0034954156252761,PdhR+HypT+Nac+Crp+Fur+FecI,Ferric citrate transporter; iron uptake under intracellular limitation,Metal Homeostasis
88,Nitrogen,False,0.0034737035751686,Nac,Nitrogen metabolism under nitrogen limitation,Nitrogen Metabolism
62,Fnr-1,False,-0.0034300834159991,Fnr,Transition from aerobic to anaerobic growth; anaerobic reductase and hydrogenase activity,Energy Metabolism
54,Fur-1,False,0.0034294154222815,Fur,"Iron sensing and uptake, enterobactin biosynthesis, iron-sulfur cluster activation, iron sequestration",Metal Homeostasis
100,Molybdenum,False,-0.0031990083756606,Crp+FliA+ModE,Molybdenum transport and molybdoenzyme synthesis,Metal Homeostasis
72,Galactose,False,-0.0031290074695465,RpoS+GalR+GalS+Crp,Galactose transport and catabolism,Carbon Metabolism
39,Xylose,False,-0.0030784228977174,Crp+XylR,d-Xylose transport and catabolism,Carbon Metabolism
101,e14 Del,False,-0.0030626768597428,,Unknown,Unknown
131,efeU Activation,False,-0.0030515070275748,,efeU re-activation and associated efeU ALE-related expression changes,Metal Homeostasis
120,yoaI,False,0.0029280697631945,,Unknown,Unknown
109,Flagella,False,-0.0029161612223823,,Flagellar biosynthesis,Extracellular Structures
145,ppGpp,False,-0.002886438246983,ppGpp,Stringent response,Global Stress
57,ypaB,False,-0.0028550572137686,,Unknown,Unknown
64,Zinc-2,False,-0.0028501660179733,ZraR,Tolerance to high zinc concentration,Metal Homeostasis
200,UC-8,False,-0.0026932240596969,,Unknown,Unknown
74,ArcA,False,-0.0025525828869716,ArcA,Anaerobiosis; repression of aerobic growth genes during anaerobic growth,Energy Metabolism
142,UC-5,False,0.0025473314507579,,Unknown,Unknown
51,RpoS,False,-0.0024682845794381,RpoS,Master regulator of global stress response,Global Stress
153,arcA/luxS KO,False,-0.0024497281649099,,arcA KO,Energy Metabolism
179,Maltose,False,-0.0024139337187014,MalT,Maltose transport and catabolism,Carbon Metabolism
96,Dipeptide,False,0.0022539200444544,gcvB+IHF+Fnr,Dipeptide transport; flagellar biosynthesis,Amino Acid Metabolism
172,Fimbriae,False,0.0021466723572081,QseB+IHF+Lrp+H-NS,Type 1 (mannose-sensitive) pili/fimbriae biosynthesis and secretion,Extracellular Structures
160,YcjW,False,0.0021300188423849,YcjW,Carbohydrate transport and catabolism,Carbon Metabolism
63,Pyrimidine,False,0.0021290611688925,PurR/UTP,Pyrimidine transport and biosynthesis,Nucleotide Metabolism
117,Fnr-3,False,-0.0020846599943952,Fnr,Anaerobic growth,Energy Metabolism
67,RpoE,False,0.0020787592668674,RpoE,Heat shock response; response to high temperature and/or misfolded membrane/periplasmic proteins,Temperature Shock
143,FlhDC-1,False,-0.0020527248191975,FlhDC,Flagellum biosynthesis and export,Extracellular Structures
28,ldrA,False,-0.0020458940947735,,Unknown,Unknown
133,malE OE,False,0.0020113677833755,,Accounts for malE plasmid overexpression,Carbon Metabolism
87,YieP,False,0.0019637222852224,YieP,"Cellular membrane synthesis and stress response, 3-hydroxypropanoate tolerance",Envelope Stress
38,EvgA,False,-0.0019519203049906,EvgA,"Glutamate-dependent acid response, drug resistance, alkali metals response",Envelope Stress
85,DNA Damage,False,0.0018884183554317,LexA,SOS response to DNA damage or inhibition of DNA replication,DNA Damage
14,FucR/AllR/AraC,False,-0.0018692006732546,FucR/AllR/AraC,Allantoin/glycolate/glyoxylate/arabinose/fucose transport and catabolism,Nitrogen Metabolism
45,Resistance,False,0.0018608513682317,,Multidrug resistance; stress response to harmful compounds/antibiotics,Envelope Stress
34,Acid Shock RNA,False,-0.0018532471623841,,Very low pH-responsive acid shock polypeptide,Acid Stress
149,Arginine,False,-0.0018512427887215,ArgR,Arginine transport and biosynthesis,Amino Acid Metabolism
181,GadX,False,0.0018329577018464,RpoS+GadX,Glutamate-dependent acid resistance system; multidrug efflux,Envelope Stress
147,PAL 26 Del,False,0.0018107710138288,,Unknown,Unknown
19,Sorbitol,False,0.0017650401684868,SrlR+GutM+Crp+H-NS,Sorbitol transport and catabolism,Carbon Metabolism
20,Glycerol,False,-0.0017633434390267,Crp+GlpR,Glycerol/glycerol-3-phosphate transport and catabolism,Carbon Metabolism
151,IS5,False,0.0016225405388988,,IS5 transcripts,Unknown
162,Propionate,False,-0.0016131168937354,PrpR+RpoN+Cra+Crp,Propionate catabolism; 2-methylcitric acid cycle,Carbon Metabolism
93,yneP,False,0.0015842532192149,,Unknown,Unknown
29,Quorum Sensing,False,-0.0015777754137695,Crp+LsrR,"Quorum sensing via autoinducer 2, biofilm architecture, foreign DNA stress response; lsrR KO",Quorum Sensing
44,FDH-N/NRA,False,-0.001471903122405,NarL+Fnr,Anaerobic growth on nitrate; formate-to-nitrate electron transfer via formate dehydrogenase N and nitrate reductase A,Energy Metabolism
41,pgi KO,False,0.0014478110038299,,pgi KO,Carbon Metabolism
155,YmfT,False,0.0013640451368186,YmfT,e14 prophage regulator activated by DNA damage,DNA Damage
182,Fatty Acid,False,-0.0012914274274155,FadR,Fatty acid degradation and biosynthesis,Carbon Metabolism
136,Pyruvate-2,False,0.0011965821124942,PyrR,Pyruvate sensing and transport,Carbon Metabolism
113,FDH-O,False,-0.0010616149009697,sdhX,Formate dehydrogenase O; formate to carbon dioxide oxidation; formate-nitrate electron transport during aerobic/anerobic shift,Energy Metabolism
184,pts KO,False,-0.0010156544015739,,ptsHI/crr KO and compensatory regulatory changes,Carbon Metabolism
79,Isc System,False,0.000904754295411,ryhB/IscR,Iron-sulfur cluster biogenesis and insertion,Cofactor Metabolism
11,Histidine,False,-0.0008716127903842,His-tRNA+DksA,Histidine biosynthesis,Amino Acid Metabolism
17,Zinc-1,False,0.000853203645696,Zur/ZntR/CueR,Zinc sensing and uptake; copper sensing and export,Metal Homeostasis
194,tpiA KO,False,-0.0008460856957933,,tpiA KO and compensatory evolved regulatory changes,Carbon Metabolism
112,pts ALE,False,0.0007919802579949,,ptsHIcrr KO and associated adaptive regulatory changes,Energy Metabolism
134,Crp-2,False,0.0007090810490327,Crp,Carbohydrate transport and catabolism,Carbon Metabolism
107,ypjJ,False,-0.0006305762725671,,Unknown,Unknown
125,Membrane,False,-0.0004828844821948,,"Membrane-related stress response regulators, transporters, multidrug resistance",Envelope Stress
22,SoxS,False,-0.0004210136165969,SoxS,"Superoxide/nitric oxide sensing and removal, protection from organic solvents and antibiotics",Redox Stress
177,PlaR,False,0.0003161312462897,PlaR+RpoE+Crp+IHF,Plant-derived sugars transport and catabolism,Carbon Metabolism
86,UC-3,False,0.000294182670474,,Unknown,Unknown
174,Cra,False,0.0002361993092301,Cra,Central carbon metabolism; glycolytic flux-dependent regulation via fructose sensing,Carbon Metabolism
48,Cytochrome c,False,0.0002347635441649,FlhDC+IHF+NsrR+NarL+NarP+Fis+Fnr,Cytochrome c-552 and putative cytochrome c-related proteins,Energy Metabolism
137,Phosphate-2,False,0.0002016930133233,PhoB,"Inorganic phosphate sensing, transport, and production",Phosphate Metabolism
47,Biofilm,False,0.0001960753626595,RpoS+ppGpp+BluR+MarA,"Biofilm formation, acid resistance, cold shock response",Extracellular Structures
123,Copper,False,-0.0001440310738972,CusR/CueR/HprR,Copper/silver sensing and export,Metal Homeostasis
144,Putrescine,False,-0.0001274716308183,RpoS+ArcA+PuuR,Putrescine transport and catabolism,Nitrogen Metabolism
