k,name,in_iM,gene_weight,regulator,function,category
0,PchR – Pulcherrimin,False,0.026696423,PchR,Extracellular synthesis and import of pulcherrimin for iron acquisition,Elements
24,Uncharacterized 5,False,-0.021130861,,Contains many poorly characterized RNAs with noisy activity ,Uncharacterized
14,WapA – Intercellular Competition,False,-0.016265886,SigA + YvrHb + DegU + WalR,Activation of WapA and its operon of unknown genes for interspecies toxin delivery,Lifestyles
17,Uncharacterized 1,False,-0.015439705000000001,,"Contains a SigE/SigG inhibitor, spore coat proteins, translational proteins, oxidative stress response, many RNAs",Uncharacterized
1,FadR – Fatty Acids,False,-0.014330355000000001,FadR,Fatty acid degradation,Carbon
37,Noise – Diamide 15,False,0.014055758000000002,,Likely accounting for noise in the diamide after 15 minutes and LBG exponential conditions,Uncharacterized
38,GlpP – Glycerol,False,-0.013945402,GlpP,Glycerol uptake and utilization,Carbon
27,SknR – Skin Element,False,0.013574786,SknR,Prophage element that disrupts the SigK gene but also plays roles in preventing early germination and regulating proliferation. Unknown and toxin resistance genes.,Mobile Genes
55,Noise – LBGexp_1,False,-0.012940645,,Likely accounting for noise in the first sample of LBG_exp. Top few RNAs are 5' UTRs of glucose metabolism genes,Uncharacterized
61,FrlR – Amino Sugars,False,-0.012303153,FrlR,Amino sugar uptake and metabolism,Carbon
71,"TnrA + CodY – Leucine, Methionine, and Threonine",False,-0.011344454,[TnrA + CodY + ThrR] / [TnrA + CodY + T-box + CcpA + SigA],"Synthesis and salvage of leucine, methionine, threonine",Amino Acids
45,Zur – Zinc Limitation,False,-0.011015397000000001,Zur,"Zinc uptake, zinc metallochaperones, alternatives to zinc-containing proteins",Elements
8,Fnr – Nitrate Respiration,False,0.010803763000000001,Fnr + SigA,Nitrate respiration and nitrite extrusion,Oxygen Limitation
18,ImmR – ICEBs1,False,0.010632082000000001,ImmR,Mobile genetic element that participates in horizontal gene transfer,Mobile Genes
78,Empty 3,False,0.010154626,,Contains no genes,Uncharacterized
26,Uncharacterized 6,False,-0.010090286,,5’ ends of tRNAs and independent transcripts,Uncharacterized
51,ComK – Competence,False,-0.009882466000000001,ComK,"DNA transport, pseudopilus, recombination machinery, and regulatory proteins for competence",Lifestyles
50,PyrR – Pyrimidines,False,0.009803029000000001,PyrR,Synthesis of pyrimidines,Other Organics
32,CzrA – Toxic Cation Export,False,0.00968991,CzrA,"Resistance to Zn, Cu, Co, Ni, and Cd",Elements
22,Spβ-1 – SP-β Prophage 1,False,0.009678268,,Temperature-responsive SP-beta prophage. Response to stressors such as cold and ethanol. Subset of  SPbeta Prophage 2.,Mobile Genes
48,SigE – Sporulation 2,False,-0.009668196,SigE,"Spore maturation through core dehydration, nutrient transport and utilization, septum degradation, inner cortex synthesis, and regulator activation",Sporulation
80,LicR – Lichenan,False,0.00964833,LicR,"Uptake, phosphorylation, and utilization of lechenin, a glucan found in soil",Carbon
11,ArsR+ – Diamide Stress,False,-0.009169517,[ArsR] / [YodB] / [SigA + CtsR] / [SigA + CsoR],"Detoxification in response to: oxidative protein damage, arsenic, catechol, copper, toxic quinones",Multi-Purpose
16,Ybc – Uncharacterized Operon,False,-0.008296589,,Contains one subunit of NADH dehydrogenase with several unknown genes. Categorized as prophage. Responds to heat shock.,Stress
42,Noise – Carbon Source Transition 1,False,0.008293228,,Likely accounting for noise in the carbon source transition experiments,Uncharacterized
70,Thi-Box – Thiamine,False,0.007538339000000001,Thi-box,Synthesis and uptake of thiamine,Other Organics
25,SigK-2 – Sporulation 6,False,-0.0073742,SigK,"Production of outermost spore coat and crust proteins, mother cell lysis",Sporulation
77,PhoP-1 – Phosphate Limitation 1,False,-0.007041168,PhoP + SigA,"High-affinity phosphate uptake, teichuronic acid production pseudogene.",Elements
65,Xpf – PBSX Prophage,False,-0.006924214000000001,Xpf,Prophage element that induces production of bacteriocin and cell lysis in response to DNA-damaging agents,Mobile Genes
41,S-Box – Methionine,False,0.006749536,S-box,Methionine salvage and biosynthesis,Amino Acids
4,SigW – Cell Wall Stress,False,0.006290476000000001,SigW,"Adaptation to membrane active agents such as cefuroxime, antimicrobials from B. amyloliquefaciens, sdpC, and nisin. Control of membrane fluidity. Contains many unknown proteins.",Stress
3,AcoR – Acetoin,False,-0.006031537,AcoR,"Utilization of acetoin, extracellular energy storage",Carbon
28,Noise – S415,False,-0.006001238000000001,,Noisy independent transcript S415,Uncharacterized
58,PurR – Purines,False,0.005921317000000001,PurR,"Synthesis of purine, xanthine and guanine uptake and conversion into purines",Other Organics
53,ComA – Surfactants,False,-0.0056230360000000005,[ComA + CcpA + TnrA] / [Abh + SigA + ComA + Spx + PhoP + CodY + PerR],"Activated during transition to stationary phase (quorum sensing), production of surfactant and exoenzymes to improve nutrient delivery in the biofilm, ComS for activation of competence ",Lifestyles
40,NadR / BirA – NAD and Biotin,False,0.00560362,[NadR] / [BirA],"Biosynthesis of NAD and biotin, plus safA & coxA sporulation proteins and repression of manganese uptake",Multi-Purpose
63,Noise – Carbon Source Transition 2,False,-0.005499095000000001,,Likely accounting for noise in carbon source transition and gluconnate experiments,Uncharacterized
43,Uncharacterized 2,False,0.0052026730000000005,,"Contains cold shock, sporulation onset, toxin, amino acid homeostasis, translataional, other proteins, many RNAs",Uncharacterized
56,AhrC – Arginine,False,-0.005124237,AhrC + YlxR,Uptake and biosynthesis of arginine,Amino Acids
19,Empty 1,False,0.005095134,,Contains no genes,Uncharacterized
35,Spo0A – Sporulation 1,False,0.0049938100000000004,[Spo0A] / [DnaA],"Initiation of sporulation through sigma factor, transcription factor, and regulatory protein expression, as well as septum formation and chromosome anchoring",Sporulation
57,Fur – Iron Limitation,False,-0.004911243,Fur,"Production and transport of siderophores for iron chelation, replacement of ferredoxins in the ETC with flavodoxins, RNA chaperones for iron-limited conditions, heme degradation",Elements
7,SigB-1 – General Stress 1,False,-0.00474898,SigB,"Survival of general stressors including ethanol, salt, paraquat, heat, and freeze-thaw",Stress
67,CymR / NsrR – Sulfur and Nitrate Respiration,False,-0.004561871,[SigA + CymR] / [ResD + SigA + NsrR],Import and utilization of sulfonate and cystine for cysteine production. Nitrite reduction,Multi-Purpose
31,Noise – S1210,False,-0.004439496,,Noisy independent transcript S1210,Uncharacterized
12,Yrk – Putative Sulfur Carriers,False,0.004240627,,Putative sulfur carriers. High activity under diamide stress,Elements
60,RocR / PutR – Arginine and Proline Utilization,False,-0.004190046,[SigL + AhrC + RocR] / [Spo0A + SigA + CodY + PutR],"Utilization of arginine, ornithine, citrulline and proline as carbon and energy sources",Amino Acids
75,HutP – Histidine Utilization,False,-0.003929318,HutP,Histidine uptake and utilization,Amino Acids
74,PhoP-2 – Phosphate Limitation 2,False,0.0038520950000000003,PhoP + SigA,"Degradation of wall teichoic acid to salvage phosphate, synthesis of teichuronic acid to replace wall, high-affinity phosphate uptake.",Elements
52,His – Histidine Synthesis,False,-0.003841024,YlxR,Synthesis of histidine,Amino Acids
15,GerE / GerR – Mid-late Spore Coat,False,0.0036885280000000004,[SigK + GerE] / [SigK + GerR],"Production of spore coat and crust proteins. Omitted from sporulation analysis because all genes are contained by SigK1 & 2, and activity levels are very noisy in non-sporulating conditions.",Sporulation
64,Spβ-2 – SP-β Prophage 2,False,-0.003458399,CsoR + SigA + SigK + SigE,"Temperature-responsive SP-beta prophage. Prophage, unknown, and putative metabolic genes. Response to mitomycin.",Mobile Genes
33,Uncharacterized 3,False,0.003418949,,"Contains many poorly characterized RNAs with noisy activity but clear time correlations, especially in sporulation. May be indicative of overall decreased translational activity ",Uncharacterized
72,LevR – Levan and Fructose,False,0.002937559,LevR,"Fuctose uptake and phosphorylation, degradation of the exopolysaccharide levan into fructose",Carbon
20,"IolR / MelR – Inositol, Melibiose, and Acetoin",False,-0.002565275,[IolR] / [MelR] / [AcoR],"Uptake and utilization of inositol, melibiose/raffinose, and acetoin",Multi-Purpose
47,SigM – Membrane Stress,False,-0.0025368870000000003,SigM,"General stress proteins, alarmones, lipid carriers and flippases, DNA repair, inhibition of septation. Contains many UTRs and some unknown proteins.",Stress
73,TnrA / PucR – Nitrogen Limitation,False,0.00237786,[SigA + TnrA] / [SigA + PucR],"Ammonium uptake, utilization of nitrate and xanthine. Suggests nitrate limitation in the BT condition",Multi-Purpose
79,Alb – Antilisterial Bacteriocin,False,-0.0022016410000000003,Rok + ResD + AbrB + SigA,"Produces and exports subtilosin, which kills anaerobic listeria bacteria",Lifestyles
68,SigE / G – Sporulation 3,False,-0.002196988,[SigE] / [SigG],"Spore coat production, transcription factor and regulator expression, spore DNA protection, spore stress resistance",Sporulation
9,ResD – Oxygen Limitation,False,0.002104604,ResD,"Anaerobic nitrate respiration, bacteriocin production, heme, cytochrome, and ATP synthesis, copper homeostasis",Oxygen Limitation
21,StrRes – Translation,False,-0.0019213160000000002,[stringent response] / [RplJ],"Production of ribosomes, translation initiation factors, ADP formation, protein processing and secretory machinery, DNA replication, RNA polymerase",Lifestyles
59,FruR – Fructose,False,-0.001895301,FruR,Fructose uptake and utilization,Carbon
39,MtrB – Tryptophan,False,0.001852881,MtrB,Biosynthesis of tryptophan,Amino Acids
81,"MtlR / AnsR – Mannitol, Asparagine, and Aspartate",False,0.0017798610000000002,[MtlR] / [AnsR + SigA],"Uptake and utilization of mannitol, degradation of asparagine and aspartate",Multi-Purpose
29,Noise – S1235,False,0.00166801,,"Independent transcript S1235, behaves similar to late sporulation I-modulons",Uncharacterized
30,ManR – Mannose,False,0.001660112,ManR,Utilization of mannose for cell wall synthesis. Needed for exponential growth in LB media (absent glucose) or in the presence of fructose,Carbon
23,SigD – Motility,False,-0.001638223,SigD,"Production of flagella components and export machinery, chemotaxis receptors, use of extracellular energy (polyglutamic acid), regulation of swarming, sporulation inhibitors, cell wall turnover",Lifestyles
44,Rex – Overflow Metabolism,False,-0.001585858,Rex,Overflow metabolism (LDH) and cytochrome BD oxidation  for respiration in anaerobic conditions,Oxygen Limitation
6,MalR – Malate,False,-0.001516519,MalR,Malate uptake and utilization,Carbon
10,CcpA-2 – Low Glucose 2,False,0.001405227,[CcpA + SigA] / [CcpN],"Uptake, utilization, and regulation of alternative carbon sources: TCA intermediates, ribose, maltodextrin, galacto-oligosaccharides, acetoin, gluconate, etc. Suppression of glucose pathways. Stationary phase.",Carbon
13,SigK-1 – Sporulation 5,False,-0.0013453170000000002,SigK,"Production of spore coat and crust proteins, L-sulfolactate production, spore coat cross-linking, stress resistance, many unknown proteins",Sporulation
46,SigB-2 – General Stress 2,False,0.0013277170000000002,SigB,Likely accounting for microarray saturation in the ethanol condition of I-modulon SigB 1 by negatively weighting highly expressed ethanol genes,Stress
66,SigG – Sporulation 4,False,-0.0013269050000000002,SigG,"Calcium and nutrient delivery to the spore, endospore cortex maturation, lipoproteins, forespore-specific metabolic proteins, many unknown sporulation proteins, stress resistance, proteins required for germination",Sporulation
34,Uncharacterized 4,False,-0.001162567,,Contains many poorly characterized RNAs with noisy activity ,Uncharacterized
54,DegU – Toxins and Colony Establishment,False,0.001107164,DegU,"Response to arrested flagellar motor. Secretion of yukE, a homolog of virulence factor EsxA. Production of antitoxins and putative toxin y-genes. Production of hydrophobic biofilm layer and lipoproteins for motility. Many unknown proteins.",Lifestyles
62,Noise – S144,False,0.000863427,,"Likely accounting for noisey RNA S144, an independent transcript",Uncharacterized
82,CcpA-1 – Low Glucose 1,False,0.000791087,CcpA + SigA,"Uptake and utilization of alternative carbon sources: ribose, sucrose, salicin, beta-glucosides, lichenan,  glucomannon, trehalose, G3P, etc. High expression in exponential phase on LB media",Carbon
76,Empty 2,False,0.0007550990000000001,,Contains no genes,Uncharacterized
36,AbrB – Transition State,False,0.0005756450000000001,AbrB,"Various transition state roles: spore killing, antibiotic resistance, toxin production, metabolism, protein modification, and unknown proteins.",Lifestyles
2,CodY – BCAA Limitation,False,0.000415723,CodY,"Uptake of di-/oligopeptides, uptake of guanosine, cell wall metabolism",Amino Acids
5,Eps – Exopolymeric Substances,False,0.000402121,SigA + AbrB + RemA + SinR,"Biosynthesis of tasA and extracellular polysaccharides, the major components of the biofilm",Lifestyles
49,LexA – DNA Repair,False,-0.000123515,LexA,SOS response for DNA protection and repair,Stress
69,CymR – Sulfur,False,-3.5e-05,CymR,"Sulfur metabolism in response to oxidative stress. Utilization and detoxification of S-(2-succino)cysteine, methionine-cysteine conversion, siroheme biosynthesis",Elements
