k,name,in_iM,gene_weight,regulator,function,category
91,NDH-1,True,0.0936192929302864,NarL+ArcA+IHF+Fnr+Fis+ryhB,"NADH:ubiquinone oxidoreductase I: electron transfer from NADH to quinone pool, proton electrochemical gradient generation for aerobic and anaerobic respiration",Energy Metabolism
171,cyoB/ndh/nuoB KO-1,False,0.0311775330047438,,NDH-1 (nuoB) KO and compensatory NDH-2 (ndh) up-regulation,Energy Metabolism
36,cydB/appC KO,False,0.0250363293360579,,cydB/appC KO and compensatory regulatory changes,Energy Metabolism
167,UC-2,False,0.0235164791246564,,Unknown,Unknown
195,Phage Shock,False,-0.0218260278939462,RpoN+IHF+PspF,Phage shock response; response to filamentous phage infection and/or extracytoplasmic shock,Phage Shock
132,rcsB KO,False,-0.0212888152852667,,rcsB KO and associated regulatory changes,Envelope Stress
74,ArcA,False,0.0194719296112737,ArcA,Anaerobiosis; repression of aerobic growth genes during anaerobic growth,Energy Metabolism
99,yjjZ,False,-0.0168630851335669,,Unknown,Unknown
192,crp KO-2,False,-0.0165066539810243,,crp KO and associated glycerol-3-phosphate (GlpR) regulatory changes,Carbon Metabolism
100,Molybdenum,False,0.0162674919860803,Crp+FliA+ModE,Molybdenum transport and molybdoenzyme synthesis,Metal Homeostasis
65,NRZ,False,0.0152871381409449,OmpR,Nitrate reduction under microaerobic condition; aerobic to anaerobic transition,Energy Metabolism
181,GadX,False,-0.0152346018982491,RpoS+GadX,Glutamate-dependent acid resistance system; multidrug efflux,Envelope Stress
53,UC-1,False,0.0148044099981569,,Unknown,Unknown
79,Isc System,False,0.0148041756136348,ryhB/IscR,Iron-sulfur cluster biogenesis and insertion,Cofactor Metabolism
83,yafF,False,-0.0144543705156557,,Unknown,Unknown
131,efeU Activation,False,0.0140450122126921,,efeU re-activation and associated efeU ALE-related expression changes,Metal Homeostasis
54,Fur-1,False,-0.0138500947727062,Fur,"Iron sensing and uptake, enterobactin biosynthesis, iron-sulfur cluster activation, iron sequestration",Metal Homeostasis
86,UC-3,False,0.0133238848390874,,Unknown,Unknown
95,Ribose,False,-0.0129020199686642,dsrA+Crp+RbsR,Ribose transport and catabolism,Carbon Metabolism
175,Hot TALE 16,False,-0.0127155211421664,,Regulatory changes under high temperature,Unknown
176,Suf System,False,-0.0121578380346312,NsrR+IHF+IscR+OxyR+Fur+ppGpp,Iron-sulfur cluster biosynthesis and insertion,Metal Homeostasis
62,Fnr-1,False,0.0120928659523428,Fnr,Transition from aerobic to anaerobic growth; anaerobic reductase and hydrogenase activity,Energy Metabolism
76,Potassium,False,0.0119536842782535,KdpE,Potassium sensing and transport,Metal Homeostasis
93,yneP,False,-0.0118781699016069,,Unknown,Unknown
102,Thr/Ser-1,False,-0.0117855448447178,TdcA+TdcR+IHF+Fnr+Crp,Threonine/serine transport and catabolism during anaerobiosis,Amino Acid Metabolism
80,Thiamine-2,False,-0.011593270763045,,Thiamine uptake and biosynthesis,Cofactor Metabolism
34,Acid Shock RNA,False,0.011392769255025,,Very low pH-responsive acid shock polypeptide,Acid Stress
157,Microaerobic,False,0.0113510229758725,RpoS+Fis+NarP+NarL+AppY+YdeO+ArcA+IscR,Hydrogenase 1 and cytochrome bd-II ubiquinol oxidase: microaerobic respiratory chain between hydrogen and oxygen,Energy Metabolism
198,Acetate,False,-0.0112507874579721,,Acetate uptake and catabolism; aldehyde catabolism; acetate/ethanol detoxification at stationary phase,Carbon Metabolism
94,NtrC-1,False,-0.0111321336986779,RpoN+RpoS+NtrC,"Nitrogen assimilation, ammonium transport",Nitrogen Metabolism
188,Oxidoreductase,False,0.0111174177841495,,Putative oxidoreductase components,Redox Stress
138,Leucine,False,0.0109629784177293,LeuO+Leu-tRNA+ppGpp,Leucine biosynthesis,Amino Acid Metabolism
197,CCK-PGI Del,False,-0.0109188375420847,,Unknown,Unknown
136,Pyruvate-2,False,-0.0106423580634778,PyrR,Pyruvate sensing and transport,Carbon Metabolism
120,yoaI,False,-0.0106217126566624,,Unknown,Unknown
56,Sulfate,False,0.0104936721977042,Cbl+CysB,Cysteine transport and biosynthesis; aliphatic sulfonate utilization and homeostatic response to sulfate starvation,Amino Acid Metabolism
73,trxC Del,False,0.0103785076680872,,Unknown,Unknown
194,tpiA KO,False,0.0103055920735785,,tpiA KO and compensatory evolved regulatory changes,Carbon Metabolism
75,yceO,False,0.0101958104805564,,Unknown,Unknown
130,ldrD,False,-0.0101727949374369,,Unknown,Unknown
145,ppGpp,False,-0.0101184335748867,ppGpp,Stringent response,Global Stress
187,entC/ubiC KO-2,False,0.0099653086821334,,entC/ubiC KO and compensatory sad up-regulation,Energy Metabolism
71,ymgI,False,0.0097585973289499,,Unknown,Unknown
105,Glycine,False,-0.0093596814708746,PurR+Fnr+ppGpp+Crp+Lrp+GcvA,Glycine cleavage system,Amino Acid Metabolism
113,FDH-O,False,0.0093244812112997,sdhX,Formate dehydrogenase O; formate to carbon dioxide oxidation; formate-nitrate electron transport during aerobic/anerobic shift,Energy Metabolism
87,YieP,False,-0.0092152451826731,YieP,"Cellular membrane synthesis and stress response, 3-hydroxypropanoate tolerance",Envelope Stress
5,Osmoprotectant,False,-0.0091929449769871,RpoS+ppGpp+IHF+H-NS,Transport of osmoprotectant glycine betaine,Envelope Stress
1,Translation,False,0.0090148991552108,DksA,Ribosome biogenesis,Translation
143,FlhDC-1,False,-0.008792988028825,FlhDC,Flagellum biosynthesis and export,Extracellular Structures
58,Fur-2,False,0.0086082669687181,Fur,"Iron sensing and uptake, enterobactin biosynthesis, iron-sulfur cluster activation, iron sequestration",Metal Homeostasis
18,Methionine,False,-0.0085665415060596,MetJ,Methionine transport and biosynthesis,Amino Acid Metabolism
190,Efflux Pump,False,-0.0084677647528322,,Multidrug/spermidine efflux pump,Resistance
21,Nucleoside,False,0.0084651154892535,Crp+CytR,Transport and utilization of ribonucleosides and deoxyribonucleosides,Nucleotide Metabolism
122,UC-9,False,-0.0081729475883425,,Unknown,Unknown
89,UC-6,False,-0.0081669600529736,,Unknown,Unknown
77,ROS TALE Del-1,False,0.0081167275296868,,Unknown,Unknown
140,ytiC,False,-0.008105342820236,,Unknown,Unknown
70,Salicylic Acid,False,0.0079995644459685,,Salicylic acid efflux,Redox Stress
116,Lysine/T2SS,False,-0.0078588990137958,ArgP,Lysine transport and biosynthesis; type II secretion system,Amino Acid Metabolism
97,Curli-1,False,-0.0078125441707905,RpoS+FliZ+CpxR+CsgD+BtsR,Curli secretion and assembly,Extracellular Structures
40,IS1,False,-0.007634385575641,,IS1 transcripts,Unknown
127,Cold Shock,False,-0.0075390416329396,,Cold shock proteins,Temperature Shock
199,Ile/Val,False,-0.0075146375427828,,Isoleucine and valine biosynthesis,Amino Acid Metabolism
185,gcvB,False,-0.0075045837221069,gcvB,Amino acid transport,Amino Acid Metabolism
67,RpoE,False,0.0074624732599216,RpoE,Heat shock response; response to high temperature and/or misfolded membrane/periplasmic proteins,Temperature Shock
24,YjfJ,False,0.0074395509764002,YjfJ,Putative heat responsive regulon,Temperature Shock
183,DhaR,False,-0.0072720355295006,DhaR,Dihydroxyacetone transport and catabolism; phosphotransferase activity for DhaM phosphorylation,Carbon Metabolism
141,ROS TALE Del-2,False,0.0072335873364633,,Unknown,Unknown
10,Nucleotide Stress,False,-0.0070657578383108,,DNA repair; stringent response signaling via ppGpp; ribosomal biogenesis and stability,DNA Damage
189,UC-7,False,0.0070303767400152,,Unknown,Unknown
59,Magnesium,False,-0.006970244180948,PhoP,Magnesium sensing and transport; magnesium-limitation response,Metal Homeostasis
0,Sugar Diacid,False,-0.0069634223433538,CdaR,Transport and catabolism of carbohydrate diacids (galacatarate and glucarate),Carbon Metabolism
14,FucR/AllR/AraC,False,0.0068976847359231,FucR/AllR/AraC,Allantoin/glycolate/glyoxylate/arabinose/fucose transport and catabolism,Nitrogen Metabolism
33,Curli-2,False,0.006836835402809,RpoS+FliZ+CpxR+CsgD+BtsR,Curli secretion and assembly,Extracellular Structures
48,Cytochrome c,False,-0.006782679305615,FlhDC+IHF+NsrR+NarL+NarP+Fis+Fnr,Cytochrome c-552 and putative cytochrome c-related proteins,Energy Metabolism
153,arcA/luxS KO,False,0.0066052752320258,,arcA KO,Energy Metabolism
8,yqhI,False,-0.0064610573386438,,Unknown,Unknown
151,IS5,False,0.0063957445885484,,IS5 transcripts,Unknown
68,Cellulose,False,-0.0061946072194271,,Cellulose biosynthesis; biofilm formation; membrane/periplasmic proteins,Extracellular Structures
160,YcjW,False,0.0061693317657064,YcjW,Carbohydrate transport and catabolism,Carbon Metabolism
149,Arginine,False,-0.0061432593437715,ArgR,Arginine transport and biosynthesis,Amino Acid Metabolism
112,pts ALE,False,0.0060825817173571,,ptsHIcrr KO and associated adaptive regulatory changes,Energy Metabolism
101,e14 Del,False,-0.0060443414247773,,Unknown,Unknown
166,Rhamnose,False,-0.0060312839486345,Crp+RhaS,Rhamnose transport and catabolism,Carbon Metabolism
61,glrR KO,False,-0.0056081207532629,,glrR (aka qseF) KO; xylose transport and catabolism,Envelope Stress
125,Membrane,False,0.0055772435160147,,"Membrane-related stress response regulators, transporters, multidrug resistance",Envelope Stress
144,Putrescine,False,0.0054537219740385,RpoS+ArcA+PuuR,Putrescine transport and catabolism,Nitrogen Metabolism
156,Fnr-2,False,0.0054138960777485,Fnr,Transition from aerobic to anaerobic growth; global control of anaerobiosis,Energy Metabolism
164,minicoli KOs,False,-0.0053819281069116,,Deletions from minicoli strain,Genome Reduction
142,UC-5,False,0.005320652035941,,Unknown,Unknown
41,pgi KO,False,0.0052589490181112,,pgi KO,Carbon Metabolism
169,NrdR,False,-0.0052214421476173,NrdR,Ribonucleoside reduction,Nucleotide Metabolism
111,YgeV,False,-0.0051764766242618,YgeV,Nucleoside degradation activated by ethanol treatment,Carbon Metabolism
172,Fimbriae,False,-0.0051347665398448,QseB+IHF+Lrp+H-NS,Type 1 (mannose-sensitive) pili/fimbriae biosynthesis and secretion,Extracellular Structures
57,ypaB,False,0.0050902768573073,,Unknown,Unknown
103,Tryptophan,False,0.0050673525942831,TrpR+Trp-tRNA,Tryptophan transport and biosynthesis,Amino Acid Metabolism
109,Flagella,False,-0.0049946793017464,,Flagellar biosynthesis,Extracellular Structures
117,Fnr-3,False,0.0049493616271306,Fnr,Anaerobic growth,Energy Metabolism
28,ldrA,False,-0.0049388545014266,,Unknown,Unknown
63,Pyrimidine,False,-0.0049221256272268,PurR/UTP,Pyrimidine transport and biosynthesis,Nucleotide Metabolism
78,cyoB/kdpE/qseB KO,False,0.0048871437631623,,cyoB/kdpE/qseF KO,Energy Metabolism
170,Purine,False,0.0048062319068268,PurR+ppGpp,Purine transport and biosynthesis,Nucleotide Metabolism
50,Sulfoquinovose,False,-0.0047904839656573,CsqR,Sulfoquinovose transport and catabolism,Carbon Metabolism
60,Nitrate/Nitrite,False,-0.0047560624421214,NarL+Fnr,Nitrate/nitrite transport and reduction,Nitrogen Metabolism
3,OxyR,False,-0.0047413253582826,OxyR,"Oxidative stress response, especially peroxide",Redox Stress
17,Zinc-1,False,-0.0045267632998878,Zur/ZntR/CueR,Zinc sensing and uptake; copper sensing and export,Metal Homeostasis
44,FDH-N/NRA,False,0.004460022584803,NarL+Fnr,Anaerobic growth on nitrate; formate-to-nitrate electron transfer via formate dehydrogenase N and nitrate reductase A,Energy Metabolism
42,Biotin,False,-0.0043974904134059,BirA,Biotin biosynthesis,Cofactor Metabolism
163,CP4-44,False,0.0043331987977032,,CP4-44 prophage expression variation,Prophage
178,NO Stress,False,-0.0042944770148789,NsrR/NarP,"Nitric oxide sensing and detoxification, iron-sulfur cluster repair, anaerobic growth",Redox Stress
106,BW25113,False,-0.0042731154958546,,Accounts for genomic differences between BW25113 and MG1655 substrains,Strain Difference
55,ykgR,False,-0.0042597916731531,,Unknown,Unknown
104,FHL,False,-0.0042576358315679,RpoN+NsrR+ModE+IHF+FhlA,Formate hydrogenlyase: hydrogen production during glucose fermentation via formate oxidation/proton reduction,Energy Metabolism
19,Sorbitol,False,-0.0041902397011399,SrlR+GutM+Crp+H-NS,Sorbitol transport and catabolism,Carbon Metabolism
32,CpxR,False,-0.0041706373500514,CpxR,"Inner membrane damage sensing and repair via protein folding/degradation, chemotaxis, drug efflux, DNA repair, motility",Envelope Stress
121,Gluconate,False,-0.0040818351094678,GntR+Crp,Gluconate transport and catabolism (Entner-Doudoroff),Carbon Metabolism
96,Dipeptide,False,0.0038919862192929,gcvB+IHF+Fnr,Dipeptide transport; flagellar biosynthesis,Amino Acid Metabolism
110,SCFA,False,0.0038737391725669,RpoN+AtoC+IHF,Short-chain fatty acid (acetoacetate) transport and catabolism,Carbon Metabolism
182,Fatty Acid,False,-0.0038306278696802,FadR,Fatty acid degradation and biosynthesis,Carbon Metabolism
191,Tryptophanase,False,-0.0038158205617773,Crp+TorR+Nac+L-tryptophan,Tryptophan import and catabolism via tryptophanase; indole/pyruvate biosynthesis,Amino Acid Metabolism
23,thrA KO,False,-0.0037547460704438,,thrA KO and compensatory transcriptional changes,Amino Acid Metabolism
64,Zinc-2,False,0.0036896038220201,ZraR,Tolerance to high zinc concentration,Metal Homeostasis
126,Thiamine-1,False,0.0035925488285921,Thiamine diphosphate,Thiamine uptake and biosynthesis,Cofactor Metabolism
193,cyoB/ndh/nuoB KO-2,False,0.0035498940414478,,cyoB/ndh/nuoB KOs,Energy Metabolism
135,Cysteine-1,False,-0.0035399064277989,CysB,"Cysteine biosynthesis, sulfate assimilation",Amino Acid Metabolism
25,Lrp,False,0.0034989569821886,Lrp,"Global regulation of amino acid biosynthesis/catabolism, stationary phase, nutrient transport, pili synthesis, 1-carbon metabolism",Amino Acid Metabolism
159,ydfW,False,-0.0034201723289513,,Unknown,Unknown
88,Nitrogen,False,-0.0034088891451846,Nac,Nitrogen metabolism under nitrogen limitation,Nitrogen Metabolism
2,ygdT,False,-0.0033422337724564,,Unknown,Unknown
11,Histidine,False,0.0033305405462585,His-tRNA+DksA,Histidine biosynthesis,Amino Acid Metabolism
139,Capsule,False,-0.0033274861722686,RcsAB,Colanic acid capsule synthesis and transport; periplasmic proteins; envelope stress response,Extracellular Structures
52,lsrB KO,False,0.0032530229433164,,lsrB KO and compensatory regulatory changes,Quorum Sensing
134,Crp-2,False,0.0032210721290384,Crp,Carbohydrate transport and catabolism,Carbon Metabolism
148,LPS,False,0.0031882539862881,,Lipopolysaccharide biosynthesis and export,Extracellular Structures
39,Xylose,False,0.0030948671708226,Crp+XylR,d-Xylose transport and catabolism,Carbon Metabolism
200,UC-8,False,-0.0030101232927028,,Unknown,Unknown
155,YmfT,False,0.0030096295500591,YmfT,e14 prophage regulator activated by DNA damage,DNA Damage
133,malE OE,False,0.0030053395080381,,Accounts for malE plasmid overexpression,Carbon Metabolism
186,Glutarate,False,0.0030004444671735,RpoS+H-NS+Crp+Lrp+GlaR+ppGpp,Glutarate/aminobutyrate transport and catabolism,Carbon Metabolism
92,Crp-1,False,-0.0029637972833062,Crp,Miscellaneous carbon source metabolism,Carbon Metabolism
72,Galactose,False,0.0029608904959687,RpoS+GalR+GalS+Crp,Galactose transport and catabolism,Carbon Metabolism
147,PAL 26 Del,False,0.0029307778708158,,Unknown,Unknown
43,N Reduction,False,0.0029064789950047,FlhDC+ModE+NarP+NarL+Fnr,"Electron transfer via nitrate reductases (periplasmic and A), cytochrome c",Energy Metabolism
119,entC/ubiC KO-1,False,0.0027534429854322,,entC/ubiC KO and compensatory sad up-regulation,Energy Metabolism
98,ymiB,False,0.002687293858363,,Unknown,Unknown
90,Leu/Val/Ile,False,-0.0026449477702591,Lrp+IHF+Ile-tRNA+Leu-tRNA+Val-tRNA+ppGpp,Branched-chain amino acid biosynthesis,Amino Acid Metabolism
123,Copper,False,-0.002637049820128,CusR/CueR/HprR,Copper/silver sensing and export,Metal Homeostasis
6,Glutamine,False,0.0026329279584171,NtrC,Glutamine transport and synthesis,Nitrogen Metabolism
49,BasR,False,0.0025970552814822,BasR,Lipid A modification and polymixin resistance in the presence of excess iron,Extracellular Structures
22,SoxS,False,0.0024032301355219,SoxS,"Superoxide/nitric oxide sensing and removal, protection from organic solvents and antibiotics",Redox Stress
84,NtrC-2,False,0.0022775218069055,NtrC+RpoN,"Nitrogen assimilation, ammonium transport",Nitrogen Metabolism
47,Biofilm,False,0.0022034288532417,RpoS+ppGpp+BluR+MarA,"Biofilm formation, acid resistance, cold shock response",Extracellular Structures
107,ypjJ,False,0.0021806279313367,,Unknown,Unknown
7,Sialic Acid,False,-0.0021140200929308,Crp+NanR,N-acetyl-neuraminic acid (or sialic acid) transport and metabolism,Carbon Metabolism
69,Phosphate-1,False,-0.0021039753525645,PhoB,"Inorganic phosphate sensing, transport, and production",Phosphate Metabolism
115,YgbI,False,0.0020464014466277,YgbI,Tartrate transport and catabolism,Carbon Metabolism
154,sdh KO,False,0.0020352143483769,,sdh KO,Carbon Metabolism
26,baeR KO,False,-0.0020185965383042,,baeR KO,Envelope Stress
173,IS Elements-1,False,0.0019670538983544,,Unknown,Unknown
152,NtrC-3,False,0.0018875206167938,NtrC+RpoN,"Nitrogen assimilation, pyrimidine transport and catabolism",Nitrogen Metabolism
20,Glycerol,False,0.0018417107252284,Crp+GlpR,Glycerol/glycerol-3-phosphate transport and catabolism,Carbon Metabolism
114,GlcNAc,False,-0.0018317464561947,NagC+Crp,"Amino sugar transport, biosynthesis and catabolism",Carbon Metabolism
35,FucR/ExuR,False,-0.0018231226770928,FucR/ExuR,Fucose/galacturonate/glucuronate transport and catabolism,Carbon Metabolism
196,Glyoxylate,False,-0.00181787032556,Crp+ArcA+ppGpp+Cra+IclR+IHF,Glyxoylate cycle; alternate to TCA cycle,Energy Metabolism
66,nquinone ALE 3,False,-0.0017947052298337,,ubiC KO and associated adaptive regulatory changes,Energy Metabolism
118,ythA,False,0.0017830080071492,,Unknown,Unknown
27,ydaG,False,-0.0017714389402728,,Unknown,Unknown
31,Nickel,False,-0.001673595585753,RpoN+NarL+NikR+Fnr,Nickel sensing and uptake,Metal Homeostasis
4,FlhDC-2,False,0.0016525103728454,FlhDC,Flagellum biosynthesis and export,Extracellular Structures
177,PlaR,False,-0.001638976440273,PlaR+RpoE+Crp+IHF,Plant-derived sugars transport and catabolism,Carbon Metabolism
46,PAL 10 Del,False,-0.0015870470829998,,Unknown,Unknown
81,crp KO-1,False,-0.0015725205383234,,crp KO and compensatory regulatory changes,Carbon Metabolism
16,Ferric Citrate,False,-0.0015486199785348,PdhR+HypT+Nac+Crp+Fur+FecI,Ferric citrate transporter; iron uptake under intracellular limitation,Metal Homeostasis
184,pts KO,False,-0.0015235110084873,,ptsHI/crr KO and compensatory regulatory changes,Carbon Metabolism
128,FliA,False,-0.0014048169538988,FliA,"Sigma 28; flagellum biosynthesis and export, motility",Extracellular Structures
82,SSW SNPs,False,0.0013431423182158,,Unknown,ALE Effects
13,RpoH,False,-0.0013152876058247,RpoH,Global heat shock response during log-phase; response to high temperature and/or misfolded proteins,Temperature Shock
15,ldrC,False,0.0012881343990131,,Unknown,Unknown
37,ymdG,False,0.0011737884193124,,Unknown,Unknown
180,Tyr/Trp/Phe,False,-0.0011259349711721,TyrR/TrpR/Trp-tRNA,Aromatic amino acid biosynthesis and transport,Amino Acid Metabolism
174,Cra,False,0.0011196691383023,Cra,Central carbon metabolism; glycolytic flux-dependent regulation via fructose sensing,Carbon Metabolism
150,Nickel/Cobalt,False,-0.0010450481307505,RcnR,Nickel and cobalt resistance via efflux,Metal Homeostasis
161,PAL Amp,False,-0.0010444076811714,,Unknown,Unknown
179,Maltose,False,0.0010431537942879,MalT,Maltose transport and catabolism,Carbon Metabolism
29,Quorum Sensing,False,-0.0010378904267643,Crp+LsrR,"Quorum sensing via autoinducer 2, biofilm architecture, foreign DNA stress response; lsrR KO",Quorum Sensing
45,Resistance,False,0.0009038702283815,,Multidrug resistance; stress response to harmful compounds/antibiotics,Envelope Stress
137,Phosphate-2,False,-0.0008639131438112,PhoB,"Inorganic phosphate sensing, transport, and production",Phosphate Metabolism
85,DNA Damage,False,-0.0008466268162054,LexA,SOS response to DNA damage or inhibition of DNA replication,DNA Damage
146,Glycolate,False,-0.0008413730299851,IHF+ArcA+PdhR+GlcC,Glycolate/glyoxylate tranport and catabolism,Carbon Metabolism
38,EvgA,False,0.0008382225197802,EvgA,"Glutamate-dependent acid response, drug resistance, alkali metals response",Envelope Stress
162,Propionate,False,0.0007796334884999,PrpR+RpoN+Cra+Crp,Propionate catabolism; 2-methylcitric acid cycle,Carbon Metabolism
165,GadXW,False,0.0007017845708401,GadX+GadW,Glutamate-dependent acid resistance system; multidrug efflux,Envelope Stress
124,Thr/Ser-2,False,0.0006977922591613,Fnr+Crp+IHF+TdcA+TdcR,Threonine/serine transport and catabolism,Amino Acid Metabolism
108,PaaX,False,0.0005443807184856,Crp+IHF+PaaX+SlyA,Phenylacetic acid transport and catabolism,Carbon Metabolism
51,RpoS,False,-0.0005424736753911,RpoS,Master regulator of global stress response,Global Stress
12,UC-4,False,0.0003795968774194,,Unknown,Unknown
168,ydfB,False,0.0003489613670357,,Unknown,Unknown
30,IS Elements-2,False,0.0002517715052066,,Unknown,Unknown
129,Pyruvate-1,False,-0.0002212697619006,BtsR,"Pyruvate sensing, transport, and catabolism under nutrient limitation",Carbon Metabolism
158,Cysteine-2,False,-8.31758166854732e-05,CysB,"Cysteine biosynthesis, sulfate assimilation",Amino Acid Metabolism
9,ROS TALE Amp,False,3.0414808626377304e-05,,Amplification of DLP12/IS3,Unknown
