k,name,in_iM,gene_weight,regulator,function,category
1,Unchar-1,False,0.027915307,,"colR/colS two component system, pyruvate metabolism, insecticidal toxins, groES, glycerol uptake, etc.",Uncharacterized
4,Recombination,False,-0.0175388236,,"Recombinases family proteins, several genes of unknown function",Stress Response
24,Protocatechuate,False,-0.0170885446,,Benzoate degradation: pcaBCGHK,Metabolism
23,Phage,False,-0.015369769600000001,,"prtN, ptrB, prophage genes associated with pyocin production in Pseudomonas aeruginosa",Genomic
9,Resistance-1,False,0.0153302935,,"MarR transcriptional regulator, efflux transporter subunits (RND, MFS, etc.), sulforaphane/aliphatic isothiocyanate, resistance proteins (saxAF)",Stress Response
16,Unchar-8,False,-0.0152715518,,"fur, ribosomal proteins (rpsT, rplS, rpmE), ribosomal modulation factor, cold shock proteins, bacterioferritin, bacterioferritin-associated ferredoxin, transposases",Uncharacterized
6,IS-elements,False,0.0139875196,,"transposases, ptrB",Genomic
5,Unchar-4,False,0.013735747500000001,,"Zinc transporters, cadA, rpme-1, iron transporters and receptors",Uncharacterized
44,Fe-S/Oxidative Stress,False,-0.012961182600000001,,"Fe-S cluster assembly, oxidative stress resistance: sodA, fumC, katB, catalase ",Stress Response
35,Flagella-1,False,-0.0127109504,,"fleS/fleR two component system, flagellar biosynthesis and assembly: rod; hook; L; M, and P ring; hook and basal body complex; motor switch; flagellar type III secretion system",Motility
41,single_gene_3,False,-0.0119584279,,genes of unknown function,Noise
43,single_gene_5,False,-0.0108036621,,"holin, genes of unknown function",Noise
33,Pyoverdine,False,-0.0096266196,PvdS,"Biosynthesis and transport of pyoverdine, metal transporters",Exometabolites
32,Folate,False,0.0093579904,,"Tetrahydrofolate production: soxGADB, folD, purU",Metabolism
25,Flagella-2,False,-0.0090698303,,"Glycosyltransferase, flagellar biosynthesis and assembly: hook, P-ring, export ATPase, chaperone, type III secretion system; cheZ",Motility
28,Osmotic Stress,False,-0.0088267528,,"Osmotic/water stress resistance: osmoprotectants, compatible solute production; oxidative stress resistance ",Stress Response
34,Unchar-7,False,-0.0083348378,,"lipid-A-disaccharide synthase, TolC family protein, dihydrolipoyllysine-residue acetyltransferase",Uncharacterized
19,single_gene_1,False,-0.0072178133000000005,,"baeR, exdb, unknown genes",Noise
12,Plasmid,False,-0.0070876107,,"Plasmid genes: conjugal transfer proteins, DNA primase, glycoside hydrolase, mobilization proteins, type III effectors, integrase, UV resistance protein A, replication initiation protein; efflux transporters, glycine metabolism, sarcosine oxidase subunits ( likely due to plasmid manipulation)",Genomic
18,Translation-2,False,-0.0068330560000000005,,"Ribosome maturation factor, rho, rpsU, rpiU",Translation
15,Coronatine,False,-0.0067293658000000004,,Coronatine biosynthesis: coronamic acid and coronafacic acid; alginate biosynthesis; type III effectors,Exometabolites
0,Nitrogen,False,-0.0065956546000000005,NtrC,"Nitrogen stress response: ntrB/ntrC two component system, glnK, amtB, utilization of alternate nitrogen sources: urea (conversion of urea to ammonia), amino acids (transporters), pyrimidines (rutABCD), allantoin (allantoin permease), GABA (GABA permease)",Metabolism
39,Resistance-2,False,0.0060037564,CueR,"Syringafactin production and efflux, cueR, copper transport, chemotaxis, uric acid production, virulence factor srfB, virulence effector srfC, bacterioferritin, Flp type IV pilin",Stress Response
26,Zur,False,-0.0059993188,PSPTO_5267,"Zinc transporters, cadA, rpme-1, iron transporters, and receptors",Metal Uptake
27,Yersiniabactin,False,0.0059122364000000005,,Biosynthesis and transport of yersiniabactin,Exometabolites
31,Carbon Starvation-1,False,0.0052832275,,"Carbon starvation response: carbon starvation protein A, acetate utilization; pilin assembly: tadABCZ (homologs), rcpAC (homologs), flp family type IVb pilin",Metabolism
10,Sulfur-2,False,0.0048817108,,"Sulfur starvation response protein (oscA), alkane sulfonate transporters, sulfate transporters, amino acid transporters",Metabolism
38,AlgU,False,0.0038646335000000003,AlgU,"algU (rpoE),  hrpR, alginate biosynthesis, stress resistance: oxidative, osmotic, heat, UV, and metal ion stress",Stress Response
36,Translation-1,False,0.0036467131000000002,,"Ribosomal proteins, atpCG, secY, rpoA",Translation
40,Unchar-5,False,-0.0030222368,,"several unknown genes, type III effectors, cold shock domain-containing proteins, RNA-directed DNA polymerase, integrase, cysteine synthase familiy proteins",Uncharacterized
11,Unchar-6,False,-0.0029109302,,uncharacterized,Uncharacterized
3,Sulfur-1,False,0.0029031325000000003,,"Taurine, alkane sulfonate, cysteine, and methionine transport",Metabolism
2,Chemotaxis,False,-0.0028604552,,"crp, csrA, flgM, chemotaxis proteins, membrane components, fliC, methyl accepting chemotaxis proteins, glycosyltransferase, several genes involved in signal transduction, flagellar genes: hook-associated proteins, filament capping protein, motor protein, motor stator protein",Motility
7,Unchar-9,False,0.0027187391,PSPTO_3698,"molybdenum cofactor-associated genes: moaA, fdhD, oxidoreductase (molydopterin binding protein); xanyhine dehydrogenase subunits (xdhAB) and xanthine dehydrogenase accessory protein (xdhC)",Uncharacterized
30,Unchar-3,False,0.0027118383,,"phoP/phoQ two component system, phosphate ABC transporter, pyruvate dehydrogenase, pbpG",Uncharacterized
20,single_gene_2,False,-0.0026403768,,"helix-turn-helix domain-containing protein, IS element, holin, kdpF, genes of unknown function",Noise
42,single_gene_4,False,-0.0023826543,,"helix-turn-helix domain-containing protein, genes of unknown function",Noise
22,Carbon Starvation-2,False,0.0023050992,,Inositol phosphate and galactose metabolism,Metabolism
13,Transport,False,-0.0022472496,,"Transport of inorganic ions, amino acids, carbohydrates, and lipids; membrane proteins; carbon starvation protein A; tryptophan synthesis; syringafactin synthesis",Metabolism
8,Alginate,False,0.0018146284000000001,,"Alginate biosynthesis, phenol degradation protein, benzaldehyde dehydrogenase, dimethylglycine demethylation, genes involved in amino acid transport and metabolism",Exometabolites
37,T3SS,False,-0.0012847336000000001,,"hrpR, hrpS, hrpL, coronatine biosynthesis activation: corP, corR/corS two component system, type III effectors, type III secretion system chaperones, type III secretion system components, type III secretion proteins, type III helper protein, type III restriction system endonuclease,ribosome modulation factor, HPr kinase, pectate lyase, flagellar hook length control protein",Exometabolites
29,Fatty Acid,False,0.0011197321,PsrA,"psrA, fadAB, etfAB, genes with multiple drug resistance domains",Metabolism
14,Chaperone,False,-0.000715668,,"Chaperones, heat shock proteins, proteins involved in repair processes other than in response to heat shock, ATP-dependent protease ATPase subunits",Stress Response
17,Unchar-2,False,-0.0003091177,,"oxidative stress response: pqq, kdpf, organic hydroperoxide resistance protein, pirin (ortholog); nusA",Uncharacterized
21,Fe/Protein Transport,False,6.0585400000000004e-05,,"Iron starvation response: PvdS,  FoxR (ortholog), other sigma factors associated with iron starvation response, bacterioferritin, bacterioferritin-associated ferredoxin, energy transduction (exbBD), TonB-dependent siderophore receptors ",Metal Uptake
