k,Name,in_iM,gene_weight,Regulator,Function,Category
5,Eps – Exopolymeric Substances,True,0.138299283,SigA + AbrB + RemA + SinR,"Biosynthesis of tasA and extracellular polysaccharides, the major components of the biofilm",Lifestyles
22,Spβ-1 – SP-β Prophage 1,False,0.01973705,,Temperature-responsive SP-beta prophage. Response to stressors such as cold and ethanol. Subset of  SPbeta Prophage 2.,Mobile Genes
48,SigE – Sporulation 2,False,0.017858535,SigE,"Spore maturation through core dehydration, nutrient transport and utilization, septum degradation, inner cortex synthesis, and regulator activation",Sporulation
61,FrlR – Amino Sugars,False,-0.01725527,FrlR,Amino sugar uptake and metabolism,Carbon
45,Zur – Zinc Limitation,False,0.01456452,Zur,"Zinc uptake, zinc metallochaperones, alternatives to zinc-containing proteins",Elements
31,Noise – S1210,False,-0.014527973000000001,,Noisy independent transcript S1210,Uncharacterized
71,"TnrA + CodY – Leucine, Methionine, and Threonine",False,0.014177259,[TnrA + CodY + ThrR] / [TnrA + CodY + T-box + CcpA + SigA],"Synthesis and salvage of leucine, methionine, threonine",Amino Acids
10,CcpA-2 – Low Glucose 2,False,-0.013625058999999998,[CcpA + SigA] / [CcpN],"Uptake, utilization, and regulation of alternative carbon sources: TCA intermediates, ribose, maltodextrin, galacto-oligosaccharides, acetoin, gluconate, etc. Suppression of glucose pathways. Stationary phase.",Carbon
36,AbrB – Transition State,False,0.013286869,AbrB,"Various transition state roles: spore killing, antibiotic resistance, toxin production, metabolism, protein modification, and unknown proteins.",Lifestyles
20,"IolR / MelR – Inositol, Melibiose, and Acetoin",False,0.012806416999999999,[IolR] / [MelR] / [AcoR],"Uptake and utilization of inositol, melibiose/raffinose, and acetoin",Multi-Purpose
29,Noise – S1235,False,-0.012410766,,"Independent transcript S1235, behaves similar to late sporulation I-modulons",Uncharacterized
54,DegU – Toxins and Colony Establishment,False,-0.012130455,DegU,"Response to arrested flagellar motor. Secretion of yukE, a homolog of virulence factor EsxA. Production of antitoxins and putative toxin y-genes. Production of hydrophobic biofilm layer and lipoproteins for motility. Many unknown proteins.",Lifestyles
18,ImmR – ICEBs1,False,0.011593128000000001,ImmR,Mobile genetic element that participates in horizontal gene transfer,Mobile Genes
67,CymR / NsrR – Sulfur and Nitrate Respiration,False,-0.011183404,[SigA + CymR] / [ResD + SigA + NsrR],Import and utilization of sulfonate and cystine for cysteine production. Nitrite reduction,Multi-Purpose
76,Empty 2,False,-0.011035071,,Contains no genes,Uncharacterized
68,SigE / G – Sporulation 3,False,-0.011013681,[SigE] / [SigG],"Spore coat production, transcription factor and regulator expression, spore DNA protection, spore stress resistance",Sporulation
27,SknR – Skin Element,False,0.010643785,SknR,Prophage element that disrupts the SigK gene but also plays roles in preventing early germination and regulating proliferation. Unknown and toxin resistance genes.,Mobile Genes
3,AcoR – Acetoin,False,-0.010398331,AcoR,"Utilization of acetoin, extracellular energy storage",Carbon
58,PurR – Purines,False,-0.010394123,PurR,"Synthesis of purine, xanthine and guanine uptake and conversion into purines",Other Organics
44,Rex – Overflow Metabolism,False,-0.009570751,Rex,Overflow metabolism (LDH) and cytochrome BD oxidation  for respiration in anaerobic conditions,Oxygen Limitation
23,SigD – Motility,False,-0.009381921,SigD,"Production of flagella components and export machinery, chemotaxis receptors, use of extracellular energy (polyglutamic acid), regulation of swarming, sporulation inhibitors, cell wall turnover",Lifestyles
51,ComK – Competence,False,-0.009315987,ComK,"DNA transport, pseudopilus, recombination machinery, and regulatory proteins for competence",Lifestyles
55,Noise – LBGexp_1,False,-0.008865615,,Likely accounting for noise in the first sample of LBG_exp. Top few RNAs are 5' UTRs of glucose metabolism genes,Uncharacterized
59,FruR – Fructose,False,-0.008697367,FruR,Fructose uptake and utilization,Carbon
35,Spo0A – Sporulation 1,False,0.008692426999999999,[Spo0A] / [DnaA],"Initiation of sporulation through sigma factor, transcription factor, and regulatory protein expression, as well as septum formation and chromosome anchoring",Sporulation
26,Uncharacterized 6,False,0.008622784,,5’ ends of tRNAs and independent transcripts,Uncharacterized
2,CodY – BCAA Limitation,False,-0.008460506,CodY,"Uptake of di-/oligopeptides, uptake of guanosine, cell wall metabolism",Amino Acids
39,MtrB – Tryptophan,False,0.00799724,MtrB,Biosynthesis of tryptophan,Amino Acids
73,TnrA / PucR – Nitrogen Limitation,False,0.007393874,[SigA + TnrA] / [SigA + PucR],"Ammonium uptake, utilization of nitrate and xanthine. Suggests nitrate limitation in the BT condition",Multi-Purpose
37,Noise – Diamide 15,False,-0.0073429359999999996,,Likely accounting for noise in the diamide after 15 minutes and LBG exponential conditions,Uncharacterized
52,His – Histidine Synthesis,False,0.007153058,YlxR,Synthesis of histidine,Amino Acids
65,Xpf – PBSX Prophage,False,-0.00710261,Xpf,Prophage element that induces production of bacteriocin and cell lysis in response to DNA-damaging agents,Mobile Genes
74,PhoP-2 – Phosphate Limitation 2,False,-0.006908984,PhoP + SigA,"Degradation of wall teichoic acid to salvage phosphate, synthesis of teichuronic acid to replace wall, high-affinity phosphate uptake.",Elements
42,Noise – Carbon Source Transition 1,False,0.006700994,,Likely accounting for noise in the carbon source transition experiments,Uncharacterized
1,FadR – Fatty Acids,False,0.00668146,FadR,Fatty acid degradation,Carbon
81,"MtlR / AnsR – Mannitol, Asparagine, and Aspartate",False,-0.006445738,[MtlR] / [AnsR + SigA],"Uptake and utilization of mannitol, degradation of asparagine and aspartate",Multi-Purpose
79,Alb – Antilisterial Bacteriocin,False,0.0062136959999999995,Rok + ResD + AbrB + SigA,"Produces and exports subtilosin, which kills anaerobic listeria bacteria",Lifestyles
32,CzrA – Toxic Cation Export,False,0.006188651999999999,CzrA,"Resistance to Zn, Cu, Co, Ni, and Cd",Elements
82,CcpA-1 – Low Glucose 1,False,0.0060217709999999995,CcpA + SigA,"Uptake and utilization of alternative carbon sources: ribose, sucrose, salicin, beta-glucosides, lichenan,  glucomannon, trehalose, G3P, etc. High expression in exponential phase on LB media",Carbon
46,SigB-2 – General Stress 2,False,0.0053883180000000004,SigB,Likely accounting for microarray saturation in the ethanol condition of I-modulon SigB 1 by negatively weighting highly expressed ethanol genes,Stress
77,PhoP-1 – Phosphate Limitation 1,False,0.005129211,PhoP + SigA,"High-affinity phosphate uptake, teichuronic acid production pseudogene.",Elements
16,Ybc – Uncharacterized Operon,False,-0.004965342,,Contains one subunit of NADH dehydrogenase with several unknown genes. Categorized as prophage. Responds to heat shock.,Stress
50,PyrR – Pyrimidines,False,0.004566700999999999,PyrR,Synthesis of pyrimidines,Other Organics
6,MalR – Malate,False,-0.0044736640000000005,MalR,Malate uptake and utilization,Carbon
21,StrRes – Translation,False,0.004294085,[stringent response] / [RplJ],"Production of ribosomes, translation initiation factors, ADP formation, protein processing and secretory machinery, DNA replication, RNA polymerase",Lifestyles
62,Noise – S144,False,0.004012257,,"Likely accounting for noisey RNA S144, an independent transcript",Uncharacterized
9,ResD – Oxygen Limitation,False,0.004006267,ResD,"Anaerobic nitrate respiration, bacteriocin production, heme, cytochrome, and ATP synthesis, copper homeostasis",Oxygen Limitation
33,Uncharacterized 3,False,-0.003847157,,"Contains many poorly characterized RNAs with noisy activity but clear time correlations, especially in sporulation. May be indicative of overall decreased translational activity ",Uncharacterized
72,LevR – Levan and Fructose,False,0.00376697,LevR,"Fuctose uptake and phosphorylation, degradation of the exopolysaccharide levan into fructose",Carbon
41,S-Box – Methionine,False,0.0037102959999999996,S-box,Methionine salvage and biosynthesis,Amino Acids
17,Uncharacterized 1,False,0.003515576,,"Contains a SigE/SigG inhibitor, spore coat proteins, translational proteins, oxidative stress response, many RNAs",Uncharacterized
34,Uncharacterized 4,False,0.003187184,,Contains many poorly characterized RNAs with noisy activity ,Uncharacterized
15,GerE / GerR – Mid-late Spore Coat,False,0.00312844,[SigK + GerE] / [SigK + GerR],"Production of spore coat and crust proteins. Omitted from sporulation analysis because all genes are contained by SigK1 & 2, and activity levels are very noisy in non-sporulating conditions.",Sporulation
64,Spβ-2 – SP-β Prophage 2,False,-0.003031629,CsoR + SigA + SigK + SigE,"Temperature-responsive SP-beta prophage. Prophage, unknown, and putative metabolic genes. Response to mitomycin.",Mobile Genes
70,Thi-Box – Thiamine,False,-0.002985758,Thi-box,Synthesis and uptake of thiamine,Other Organics
57,Fur – Iron Limitation,False,-0.002853236,Fur,"Production and transport of siderophores for iron chelation, replacement of ferredoxins in the ETC with flavodoxins, RNA chaperones for iron-limited conditions, heme degradation",Elements
0,PchR – Pulcherrimin,False,-0.00268581,PchR,Extracellular synthesis and import of pulcherrimin for iron acquisition,Elements
11,ArsR+ – Diamide Stress,False,0.0025983720000000003,[ArsR] / [YodB] / [SigA + CtsR] / [SigA + CsoR],"Detoxification in response to: oxidative protein damage, arsenic, catechol, copper, toxic quinones",Multi-Purpose
69,CymR – Sulfur,False,-0.001915595,CymR,"Sulfur metabolism in response to oxidative stress. Utilization and detoxification of S-(2-succino)cysteine, methionine-cysteine conversion, siroheme biosynthesis",Elements
30,ManR – Mannose,False,-0.0018307739999999999,ManR,Utilization of mannose for cell wall synthesis. Needed for exponential growth in LB media (absent glucose) or in the presence of fructose,Carbon
19,Empty 1,False,-0.001730768,,Contains no genes,Uncharacterized
38,GlpP – Glycerol,False,0.0016785910000000001,GlpP,Glycerol uptake and utilization,Carbon
25,SigK-2 – Sporulation 6,False,-0.001610098,SigK,"Production of outermost spore coat and crust proteins, mother cell lysis",Sporulation
12,Yrk – Putative Sulfur Carriers,False,-0.00160684,,Putative sulfur carriers. High activity under diamide stress,Elements
47,SigM – Membrane Stress,False,-0.0015733720000000002,SigM,"General stress proteins, alarmones, lipid carriers and flippases, DNA repair, inhibition of septation. Contains many UTRs and some unknown proteins.",Stress
75,HutP – Histidine Utilization,False,-0.001530669,HutP,Histidine uptake and utilization,Amino Acids
28,Noise – S415,False,0.001446856,,Noisy independent transcript S415,Uncharacterized
60,RocR / PutR – Arginine and Proline Utilization,False,-0.0013800529999999998,[SigL + AhrC + RocR] / [Spo0A + SigA + CodY + PutR],"Utilization of arginine, ornithine, citrulline and proline as carbon and energy sources",Amino Acids
4,SigW – Cell Wall Stress,False,-0.001329739,SigW,"Adaptation to membrane active agents such as cefuroxime, antimicrobials from B. amyloliquefaciens, sdpC, and nisin. Control of membrane fluidity. Contains many unknown proteins.",Stress
43,Uncharacterized 2,False,-0.001324549,,"Contains cold shock, sporulation onset, toxin, amino acid homeostasis, translataional, other proteins, many RNAs",Uncharacterized
40,NadR / BirA – NAD and Biotin,False,0.00130075,[NadR] / [BirA],"Biosynthesis of NAD and biotin, plus safA & coxA sporulation proteins and repression of manganese uptake",Multi-Purpose
53,ComA – Surfactants,False,-0.001299318,[ComA + CcpA + TnrA] / [Abh + SigA + ComA + Spx + PhoP + CodY + PerR],"Activated during transition to stationary phase (quorum sensing), production of surfactant and exoenzymes to improve nutrient delivery in the biofilm, ComS for activation of competence ",Lifestyles
78,Empty 3,False,-0.0011190080000000001,,Contains no genes,Uncharacterized
14,WapA – Intercellular Competition,False,0.001040867,SigA + YvrHb + DegU + WalR,Activation of WapA and its operon of unknown genes for interspecies toxin delivery,Lifestyles
80,LicR – Lichenan,False,0.0010081489999999999,LicR,"Uptake, phosphorylation, and utilization of lechenin, a glucan found in soil",Carbon
66,SigG – Sporulation 4,False,0.0009857289999999999,SigG,"Calcium and nutrient delivery to the spore, endospore cortex maturation, lipoproteins, forespore-specific metabolic proteins, many unknown sporulation proteins, stress resistance, proteins required for germination",Sporulation
13,SigK-1 – Sporulation 5,False,0.000972757,SigK,"Production of spore coat and crust proteins, L-sulfolactate production, spore coat cross-linking, stress resistance, many unknown proteins",Sporulation
7,SigB-1 – General Stress 1,False,0.0006805060000000001,SigB,"Survival of general stressors including ethanol, salt, paraquat, heat, and freeze-thaw",Stress
8,Fnr – Nitrate Respiration,False,-0.0006367969999999999,Fnr + SigA,Nitrate respiration and nitrite extrusion,Oxygen Limitation
49,LexA – DNA Repair,False,0.00045046,LexA,SOS response for DNA protection and repair,Stress
24,Uncharacterized 5,False,-0.000415784,,Contains many poorly characterized RNAs with noisy activity ,Uncharacterized
63,Noise – Carbon Source Transition 2,False,-0.00030203799999999997,,Likely accounting for noise in carbon source transition and gluconnate experiments,Uncharacterized
56,AhrC – Arginine,False,-2.4399999999999996e-07,AhrC + YlxR,Uptake and biosynthesis of arginine,Amino Acids
