k,Name,in_iM,gene_weight,Regulator,Function,Category
22,Spβ-1 – SP-β Prophage 1,False,-0.019681902,,Temperature-responsive SP-beta prophage. Response to stressors such as cold and ethanol. Subset of  SPbeta Prophage 2.,Mobile Genes
60,RocR / PutR – Arginine and Proline Utilization,False,-0.014901766,[SigL  and  AhrC  and  RocR]  or  [Spo0A  and  SigA  and  CodY  and  PutR],"Utilization of arginine, ornithine, citrulline and proline as carbon and energy sources",Amino Acids
36,AbrB – Transition State,False,-0.013507643000000001,AbrB,"Various transition state roles: spore killing, antibiotic resistance, toxin production, metabolism, protein modification, and unknown proteins.",Lifestyles
63,Noise – Carbon Source Transition 2,False,-0.012454574000000001,,Likely accounting for noise in carbon source transition and gluconnate experiments,Uncharacterized
55,Noise – LBGexp_1,False,0.012068196000000002,,Likely accounting for noise in the first sample of LBG_exp. Top few RNAs are 5' UTRs of glucose metabolism genes,Uncharacterized
61,FrlR – Amino Sugars,False,-0.011992832,FrlR,Amino sugar uptake and metabolism,Carbon
12,Yrk – Putative Sulfur Carriers,False,-0.011985555,,Putative sulfur carriers. High activity under diamide stress,Elements
24,Uncharacterized 5,False,-0.01096617,,Contains many poorly characterized RNAs with noisy activity ,Uncharacterized
42,Noise – Carbon Source Transition 1,False,-0.009610944,,Likely accounting for noise in the carbon source transition experiments,Uncharacterized
3,AcoR – Acetoin,False,-0.009398416000000001,AcoR,"Utilization of acetoin, extracellular energy storage",Carbon
31,Noise – S1210,False,-0.009367261,,Noisy independent transcript S1210,Uncharacterized
17,Uncharacterized 1,False,-0.009040934,,"Contains a SigE/SigG inhibitor, spore coat proteins, translational proteins, oxidative stress response, many RNAs",Uncharacterized
10,CcpA-2 – Low Glucose 2,False,-0.008403341,[CcpA  and  SigA]  or  [CcpN],"Uptake, utilization, and regulation of alternative carbon sources: TCA intermediates, ribose, maltodextrin, galacto-oligosaccharides, acetoin, gluconate, etc. Suppression of glucose pathways. Stationary phase.",Carbon
52,His – Histidine Synthesis,False,0.008374821000000001,YlxR,Synthesis of histidine,Amino Acids
21,StrRes – Translation,False,-0.007932718,[stringent response]  or  [RplJ],"Production of ribosomes, translation initiation factors, ADP formation, protein processing and secretory machinery, DNA replication, RNA polymerase",Lifestyles
75,HutP – Histidine Utilization,False,-0.007762899,HutP,Histidine uptake and utilization,Amino Acids
29,Noise – S1235,False,-0.00755861,,"Independent transcript S1235, behaves similar to late sporulation I-modulons",Uncharacterized
33,Uncharacterized 3,False,-0.0075220090000000005,,"Contains many poorly characterized RNAs with noisy activity but clear time correlations, especially in sporulation. May be indicative of overall decreased translational activity ",Uncharacterized
82,CcpA-1 – Low Glucose 1,False,0.00751216,CcpA  and  SigA,"Uptake and utilization of alternative carbon sources: ribose, sucrose, salicin, beta-glucosides, lichenan,  glucomannon, trehalose, G3P, etc. High expression in exponential phase on LB media",Carbon
73,TnrA / PucR – Nitrogen Limitation,False,-0.007488964000000001,[SigA  and  TnrA]  or  [SigA  and  PucR],"Ammonium uptake, utilization of nitrate and xanthine. Suggests nitrate limitation in the BT condition",Multi-Purpose
20,"IolR / MelR – Inositol, Melibiose, and Acetoin",False,-0.007447104,[IolR]  or  [MelR]  or  [AcoR],"Uptake and utilization of inositol, melibiose/raffinose, and acetoin",Multi-Purpose
15,GerE / GerR – Mid-late Spore Coat,False,-0.0072756900000000005,[SigK  and  GerE]  or  [SigK  and  GerR],"Production of spore coat and crust proteins. Omitted from sporulation analysis because all genes are contained by SigK1 & 2, and activity levels are very noisy in non-sporulating conditions.",Sporulation
81,"MtlR / AnsR – Mannitol, Asparagine, and Aspartate",False,-0.007223674,[MtlR]  or  [AnsR  and  SigA],"Uptake and utilization of mannitol, degradation of asparagine and aspartate",Multi-Purpose
26,Uncharacterized 6,False,0.007221395,,5’ ends of tRNAs and independent transcripts,Uncharacterized
48,SigE – Sporulation 2,False,-0.006917749000000001,SigE,"Spore maturation through core dehydration, nutrient transport and utilization, septum degradation, inner cortex synthesis, and regulator activation",Sporulation
74,PhoP-2 – Phosphate Limitation 2,False,-0.006407692,PhoP  and  SigA,"Degradation of wall teichoic acid to salvage phosphate, synthesis of teichuronic acid to replace wall, high-affinity phosphate uptake.",Elements
8,Fnr – Nitrate Respiration,False,0.006351529000000001,Fnr  and  SigA,Nitrate respiration and nitrite extrusion,Oxygen Limitation
67,CymR / NsrR – Sulfur and Nitrate Respiration,False,-0.006294271000000001,[SigA  and  CymR]  or  [ResD  and  SigA  and  NsrR],Import and utilization of sulfonate and cystine for cysteine production. Nitrite reduction,Multi-Purpose
18,ImmR – ICEBs1,False,-0.006200635,ImmR,Mobile genetic element that participates in horizontal gene transfer,Mobile Genes
0,PchR – Pulcherrimin,False,-0.005782598000000001,PchR,Extracellular synthesis and import of pulcherrimin for iron acquisition,Elements
58,PurR – Purines,False,-0.005625276,PurR,"Synthesis of purine, xanthine and guanine uptake and conversion into purines",Other Organics
32,CzrA – Toxic Cation Export,False,0.005611274,CzrA,"Resistance to Zn, Cu, Co, Ni, and Cd",Elements
53,ComA – Surfactants,False,-0.005587721,[ComA  and  CcpA  and  TnrA]  or  [Abh  and  SigA  and  ComA  and  Spx  and  PhoP  and  CodY  and  PerR],"Activated during transition to stationary phase (quorum sensing), production of surfactant and exoenzymes to improve nutrient delivery in the biofilm, ComS for activation of competence ",Lifestyles
76,Empty 2,False,0.005495311,,Contains no genes,Uncharacterized
56,AhrC – Arginine,False,0.005453741000000001,AhrC  and  YlxR,Uptake and biosynthesis of arginine,Amino Acids
78,Empty 3,False,-0.005440077000000001,,Contains no genes,Uncharacterized
59,FruR – Fructose,False,0.0053808910000000005,FruR,Fructose uptake and utilization,Carbon
5,Eps – Exopolymeric Substances,False,0.00503788,SigA  and  AbrB  and  RemA  and  SinR,"Biosynthesis of tasA and extracellular polysaccharides, the major components of the biofilm",Lifestyles
44,Rex – Overflow Metabolism,False,-0.0049639820000000005,Rex,Overflow metabolism (LDH) and cytochrome BD oxidation  for respiration in anaerobic conditions,Oxygen Limitation
38,GlpP – Glycerol,False,-0.004933713,GlpP,Glycerol uptake and utilization,Carbon
14,WapA – Intercellular Competition,False,-0.004086319000000001,SigA  and  YvrHb  and  DegU  and  WalR,Activation of WapA and its operon of unknown genes for interspecies toxin delivery,Lifestyles
66,SigG – Sporulation 4,False,0.0040829740000000005,SigG,"Calcium and nutrient delivery to the spore, endospore cortex maturation, lipoproteins, forespore-specific metabolic proteins, many unknown sporulation proteins, stress resistance, proteins required for germination",Sporulation
27,SknR – Skin Element,False,-0.0037885690000000003,SknR,Prophage element that disrupts the SigK gene but also plays roles in preventing early germination and regulating proliferation. Unknown and toxin resistance genes.,Mobile Genes
51,ComK – Competence,False,-0.0037147940000000004,ComK,"DNA transport, pseudopilus, recombination machinery, and regulatory proteins for competence",Lifestyles
39,MtrB – Tryptophan,False,-0.0036373390000000003,MtrB,Biosynthesis of tryptophan,Amino Acids
9,ResD – Oxygen Limitation,False,-0.003629319,ResD,"Anaerobic nitrate respiration, bacteriocin production, heme, cytochrome, and ATP synthesis, copper homeostasis",Oxygen Limitation
2,CodY – BCAA Limitation,False,0.003562102,CodY,"Uptake of di-/oligopeptides, uptake of guanosine, cell wall metabolism",Amino Acids
49,LexA – DNA Repair,False,0.003528353,LexA,SOS response for DNA protection and repair,Stress
16,Ybc – Uncharacterized Operon,False,0.00350612,,Contains one subunit of NADH dehydrogenase with several unknown genes. Categorized as prophage. Responds to heat shock.,Stress
40,NadR / BirA – NAD and Biotin,False,-0.0034645960000000003,[NadR]  or  [BirA],"Biosynthesis of NAD and biotin, plus safA & coxA sporulation proteins and repression of manganese uptake",Multi-Purpose
71,"TnrA + CodY – Leucine, Methionine, and Threonine",False,-0.003389384,[TnrA  and  CodY  and  ThrR]  or  [TnrA  and  CodY  and  T-box  and  CcpA  and  SigA],"Synthesis and salvage of leucine, methionine, threonine",Amino Acids
68,SigE / G – Sporulation 3,False,-0.003312099,[SigE]  or  [SigG],"Spore coat production, transcription factor and regulator expression, spore DNA protection, spore stress resistance",Sporulation
80,LicR – Lichenan,False,-0.00315007,LicR,"Uptake, phosphorylation, and utilization of lechenin, a glucan found in soil",Carbon
46,SigB-2 – General Stress 2,False,0.0030835520000000003,SigB,Likely accounting for microarray saturation in the ethanol condition of I-modulon SigB 1 by negatively weighting highly expressed ethanol genes,Stress
28,Noise – S415,False,-0.002913816,,Noisy independent transcript S415,Uncharacterized
79,Alb – Antilisterial Bacteriocin,False,-0.00290185,Rok  and  ResD  and  AbrB  and  SigA,"Produces and exports subtilosin, which kills anaerobic listeria bacteria",Lifestyles
30,ManR – Mannose,False,-0.0028874770000000003,ManR,Utilization of mannose for cell wall synthesis. Needed for exponential growth in LB media (absent glucose) or in the presence of fructose,Carbon
6,MalR – Malate,False,0.0028733340000000004,MalR,Malate uptake and utilization,Carbon
72,LevR – Levan and Fructose,False,-0.002582374,LevR,"Fuctose uptake and phosphorylation, degradation of the exopolysaccharide levan into fructose",Carbon
41,S-Box – Methionine,False,-0.002342774,S-box,Methionine salvage and biosynthesis,Amino Acids
1,FadR – Fatty Acids,False,-0.002302677,FadR,Fatty acid degradation,Carbon
11,ArsR+ – Diamide Stress,False,-0.002191484,[ArsR]  or  [YodB]  or  [SigA  and  CtsR]  or  [SigA  and  CsoR],"Detoxification in response to: oxidative protein damage, arsenic, catechol, copper, toxic quinones",Multi-Purpose
70,Thi-Box – Thiamine,False,-0.002140054,Thi-box,Synthesis and uptake of thiamine,Other Organics
13,SigK-1 – Sporulation 5,False,-0.002048528,SigK,"Production of spore coat and crust proteins, L-sulfolactate production, spore coat cross-linking, stress resistance, many unknown proteins",Sporulation
37,Noise – Diamide 15,False,0.0018490540000000001,,Likely accounting for noise in the diamide after 15 minutes and LBG exponential conditions,Uncharacterized
35,Spo0A – Sporulation 1,False,-0.001700523,[Spo0A]  or  [DnaA],"Initiation of sporulation through sigma factor, transcription factor, and regulatory protein expression, as well as septum formation and chromosome anchoring",Sporulation
7,SigB-1 – General Stress 1,False,-0.0015948940000000001,SigB,"Survival of general stressors including ethanol, salt, paraquat, heat, and freeze-thaw",Stress
47,SigM – Membrane Stress,False,-0.0015267710000000001,SigM,"General stress proteins, alarmones, lipid carriers and flippases, DNA repair, inhibition of septation. Contains many UTRs and some unknown proteins.",Stress
34,Uncharacterized 4,False,-0.0014833440000000002,,Contains many poorly characterized RNAs with noisy activity ,Uncharacterized
54,DegU – Toxins and Colony Establishment,False,0.0014814020000000002,DegU,"Response to arrested flagellar motor. Secretion of yukE, a homolog of virulence factor EsxA. Production of antitoxins and putative toxin y-genes. Production of hydrophobic biofilm layer and lipoproteins for motility. Many unknown proteins.",Lifestyles
77,PhoP-1 – Phosphate Limitation 1,False,0.001395386,PhoP  and  SigA,"High-affinity phosphate uptake, teichuronic acid production pseudogene.",Elements
25,SigK-2 – Sporulation 6,False,-0.001203204,SigK,"Production of outermost spore coat and crust proteins, mother cell lysis",Sporulation
64,Spβ-2 – SP-β Prophage 2,False,0.0009407720000000001,CsoR  and  SigA  and  SigK  and  SigE,"Temperature-responsive SP-beta prophage. Prophage, unknown, and putative metabolic genes. Response to mitomycin.",Mobile Genes
23,SigD – Motility,False,-0.0008119010000000001,SigD,"Production of flagella components and export machinery, chemotaxis receptors, use of extracellular energy (polyglutamic acid), regulation of swarming, sporulation inhibitors, cell wall turnover",Lifestyles
45,Zur – Zinc Limitation,False,-0.0007690360000000001,Zur,"Zinc uptake, zinc metallochaperones, alternatives to zinc-containing proteins",Elements
57,Fur – Iron Limitation,False,-0.00073953,Fur,"Production and transport of siderophores for iron chelation, replacement of ferredoxins in the ETC with flavodoxins, RNA chaperones for iron-limited conditions, heme degradation",Elements
65,Xpf – PBSX Prophage,False,-0.000574775,Xpf,Prophage element that induces production of bacteriocin and cell lysis in response to DNA-damaging agents,Mobile Genes
50,PyrR – Pyrimidines,False,-0.000483757,PyrR,Synthesis of pyrimidines,Other Organics
19,Empty 1,False,0.00031151700000000003,,Contains no genes,Uncharacterized
43,Uncharacterized 2,False,-0.000219766,,"Contains cold shock, sporulation onset, toxin, amino acid homeostasis, translataional, other proteins, many RNAs",Uncharacterized
69,CymR – Sulfur,False,0.00021937600000000002,CymR,"Sulfur metabolism in response to oxidative stress. Utilization and detoxification of S-(2-succino)cysteine, methionine-cysteine conversion, siroheme biosynthesis",Elements
62,Noise – S144,False,0.00020033500000000003,,"Likely accounting for noisey RNA S144, an independent transcript",Uncharacterized
4,SigW – Cell Wall Stress,False,0.000146782,SigW,"Adaptation to membrane active agents such as cefuroxime, antimicrobials from B. amyloliquefaciens, sdpC, and nisin. Control of membrane fluidity. Contains many unknown proteins.",Stress
