k,name,in_iM,gene_weight,regulator,function,category
1,Unchar-1,True,0.0632490376,,"colR/colS two component system, pyruvate metabolism, insecticidal toxins, groES, glycerol uptake, etc.",Uncharacterized
35,Flagella-1,False,-0.018463090300000002,,"fleS/fleR two component system, flagellar biosynthesis and assembly: rod; hook; L; M, and P ring; hook and basal body complex; motor switch; flagellar type III secretion system",Motility
27,Yersiniabactin,False,0.0142522171,,Biosynthesis and transport of yersiniabactin,Exometabolites
36,Translation-1,False,0.011878642,,"Ribosomal proteins, atpCG, secY, rpoA",Translation
13,Transport,False,0.0118201269,,"Transport of inorganic ions, amino acids, carbohydrates, and lipids; membrane proteins; carbon starvation protein A; tryptophan synthesis; syringafactin synthesis",Metabolism
37,T3SS,False,-0.009720745900000001,,"hrpR, hrpS, hrpL, coronatine biosynthesis activation: corP, corR/corS two component system, type III effectors, type III secretion system chaperones, type III secretion system components, type III secretion proteins, type III helper protein, type III restriction system endonuclease,ribosome modulation factor, HPr kinase, pectate lyase, flagellar hook length control protein",Exometabolites
28,Osmotic Stress,False,-0.0096100244,,"Osmotic/water stress resistance: osmoprotectants, compatible solute production; oxidative stress resistance ",Stress Response
0,Nitrogen,False,0.0089128166,NtrC,"Nitrogen stress response: ntrB/ntrC two component system, glnK, amtB, utilization of alternate nitrogen sources: urea (conversion of urea to ammonia), amino acids (transporters), pyrimidines (rutABCD), allantoin (allantoin permease), GABA (GABA permease)",Metabolism
17,Unchar-2,False,0.0086983858,,"oxidative stress response: pqq, kdpf, organic hydroperoxide resistance protein, pirin (ortholog); nusA",Uncharacterized
8,Alginate,False,0.0084087877,,"Alginate biosynthesis, phenol degradation protein, benzaldehyde dehydrogenase, dimethylglycine demethylation, genes involved in amino acid transport and metabolism",Exometabolites
33,Pyoverdine,False,-0.007493927500000001,PvdS,"Biosynthesis and transport of pyoverdine, metal transporters",Exometabolites
4,Recombination,False,-0.006883429000000001,,"Recombinases family proteins, several genes of unknown function",Stress Response
7,Unchar-9,False,-0.0065012125,PSPTO_3698,"molybdenum cofactor-associated genes: moaA, fdhD, oxidoreductase (molydopterin binding protein); xanyhine dehydrogenase subunits (xdhAB) and xanthine dehydrogenase accessory protein (xdhC)",Uncharacterized
30,Unchar-3,False,-0.0064337761,,"phoP/phoQ two component system, phosphate ABC transporter, pyruvate dehydrogenase, pbpG",Uncharacterized
16,Unchar-8,False,-0.006217105200000001,,"fur, ribosomal proteins (rpsT, rplS, rpmE), ribosomal modulation factor, cold shock proteins, bacterioferritin, bacterioferritin-associated ferredoxin, transposases",Uncharacterized
12,Plasmid,False,-0.0062093421,,"Plasmid genes: conjugal transfer proteins, DNA primase, glycoside hydrolase, mobilization proteins, type III effectors, integrase, UV resistance protein A, replication initiation protein; efflux transporters, glycine metabolism, sarcosine oxidase subunits ( likely due to plasmid manipulation)",Genomic
23,Phage,False,0.0055964441,,"prtN, ptrB, prophage genes associated with pyocin production in Pseudomonas aeruginosa",Genomic
18,Translation-2,False,-0.0055430123000000005,,"Ribosome maturation factor, rho, rpsU, rpiU",Translation
11,Unchar-6,False,0.0052177557,,uncharacterized,Uncharacterized
44,Fe-S/Oxidative Stress,False,-0.005165674800000001,,"Fe-S cluster assembly, oxidative stress resistance: sodA, fumC, katB, catalase ",Stress Response
26,Zur,False,-0.0046302699,PSPTO_5267,"Zinc transporters, cadA, rpme-1, iron transporters, and receptors",Metal Uptake
15,Coronatine,False,-0.0045584733,,Coronatine biosynthesis: coronamic acid and coronafacic acid; alginate biosynthesis; type III effectors,Exometabolites
41,single_gene_3,False,-0.0045469142,,genes of unknown function,Noise
34,Unchar-7,False,0.0045383185,,"lipid-A-disaccharide synthase, TolC family protein, dihydrolipoyllysine-residue acetyltransferase",Uncharacterized
22,Carbon Starvation-2,False,-0.0045205958,,Inositol phosphate and galactose metabolism,Metabolism
9,Resistance-1,False,0.0044208343,,"MarR transcriptional regulator, efflux transporter subunits (RND, MFS, etc.), sulforaphane/aliphatic isothiocyanate, resistance proteins (saxAF)",Stress Response
25,Flagella-2,False,0.0039109900000000005,,"Glycosyltransferase, flagellar biosynthesis and assembly: hook, P-ring, export ATPase, chaperone, type III secretion system; cheZ",Motility
38,AlgU,False,0.0037576741,AlgU,"algU (rpoE),  hrpR, alginate biosynthesis, stress resistance: oxidative, osmotic, heat, UV, and metal ion stress",Stress Response
6,IS-elements,False,-0.0035793532,,"transposases, ptrB",Genomic
10,Sulfur-2,False,0.0032633129000000003,,"Sulfur starvation response protein (oscA), alkane sulfonate transporters, sulfate transporters, amino acid transporters",Metabolism
21,Fe/Protein Transport,False,-0.0028071655,,"Iron starvation response: PvdS,  FoxR (ortholog), other sigma factors associated with iron starvation response, bacterioferritin, bacterioferritin-associated ferredoxin, energy transduction (exbBD), TonB-dependent siderophore receptors ",Metal Uptake
31,Carbon Starvation-1,False,-0.0027641993000000003,,"Carbon starvation response: carbon starvation protein A, acetate utilization; pilin assembly: tadABCZ (homologs), rcpAC (homologs), flp family type IVb pilin",Metabolism
32,Folate,False,0.0025965835,,"Tetrahydrofolate production: soxGADB, folD, purU",Metabolism
3,Sulfur-1,False,-0.0023500317,,"Taurine, alkane sulfonate, cysteine, and methionine transport",Metabolism
2,Chemotaxis,False,0.0022458869,,"crp, csrA, flgM, chemotaxis proteins, membrane components, fliC, methyl accepting chemotaxis proteins, glycosyltransferase, several genes involved in signal transduction, flagellar genes: hook-associated proteins, filament capping protein, motor protein, motor stator protein",Motility
43,single_gene_5,False,-0.0017239144000000001,,"holin, genes of unknown function",Noise
42,single_gene_4,False,0.0017162917,,"helix-turn-helix domain-containing protein, genes of unknown function",Noise
24,Protocatechuate,False,-0.001622205,,Benzoate degradation: pcaBCGHK,Metabolism
29,Fatty Acid,False,-0.0015964552000000002,PsrA,"psrA, fadAB, etfAB, genes with multiple drug resistance domains",Metabolism
20,single_gene_2,False,-0.0013785881,,"helix-turn-helix domain-containing protein, IS element, holin, kdpF, genes of unknown function",Noise
40,Unchar-5,False,-0.0013380974,,"several unknown genes, type III effectors, cold shock domain-containing proteins, RNA-directed DNA polymerase, integrase, cysteine synthase familiy proteins",Uncharacterized
5,Unchar-4,False,-0.0012685606,,"Zinc transporters, cadA, rpme-1, iron transporters and receptors",Uncharacterized
14,Chaperone,False,-0.0010354152,,"Chaperones, heat shock proteins, proteins involved in repair processes other than in response to heat shock, ATP-dependent protease ATPase subunits",Stress Response
39,Resistance-2,False,-0.0009060892000000001,CueR,"Syringafactin production and efflux, cueR, copper transport, chemotaxis, uric acid production, virulence factor srfB, virulence effector srfC, bacterioferritin, Flp type IV pilin",Stress Response
19,single_gene_1,False,0.0007132759000000001,,"baeR, exdb, unknown genes",Noise
