k,name,in_iM,gene_weight,regulator,function,category
163,CP4-44,True,0.3545498945891343,,CP4-44 prophage expression variation,Prophage
119,entC/ubiC KO-1,False,-0.0420202076080893,,entC/ubiC KO and compensatory sad up-regulation,Energy Metabolism
71,ymgI,False,-0.0370236491947114,,Unknown,Unknown
187,entC/ubiC KO-2,False,0.0309178006186717,,entC/ubiC KO and compensatory sad up-regulation,Energy Metabolism
200,UC-8,False,-0.0296980101875102,,Unknown,Unknown
57,ypaB,False,-0.0293177750320529,,Unknown,Unknown
80,Thiamine-2,False,-0.025633297999129,,Thiamine uptake and biosynthesis,Cofactor Metabolism
16,Ferric Citrate,False,0.0250944907529839,PdhR+HypT+Nac+Crp+Fur+FecI,Ferric citrate transporter; iron uptake under intracellular limitation,Metal Homeostasis
55,ykgR,False,-0.024882137277183,,Unknown,Unknown
107,ypjJ,False,-0.0243149813973203,,Unknown,Unknown
97,Curli-1,False,0.0236404167082777,RpoS+FliZ+CpxR+CsgD+BtsR,Curli secretion and assembly,Extracellular Structures
159,ydfW,False,0.0227519898666804,,Unknown,Unknown
40,IS1,False,-0.0217003778410049,,IS1 transcripts,Unknown
93,yneP,False,0.021103311643744,,Unknown,Unknown
192,crp KO-2,False,0.0207305600950931,,crp KO and associated glycerol-3-phosphate (GlpR) regulatory changes,Carbon Metabolism
178,NO Stress,False,0.0206009652574549,NsrR/NarP,"Nitric oxide sensing and detoxification, iron-sulfur cluster repair, anaerobic growth",Redox Stress
108,PaaX,False,-0.0197997097434748,Crp+IHF+PaaX+SlyA,Phenylacetic acid transport and catabolism,Carbon Metabolism
103,Tryptophan,False,0.0194643952664841,TrpR+Trp-tRNA,Tryptophan transport and biosynthesis,Amino Acid Metabolism
37,ymdG,False,0.0179836653194094,,Unknown,Unknown
115,YgbI,False,-0.0175845741526893,YgbI,Tartrate transport and catabolism,Carbon Metabolism
6,Glutamine,False,0.0175820972537024,NtrC,Glutamine transport and synthesis,Nitrogen Metabolism
198,Acetate,False,-0.0175148762609119,,Acetate uptake and catabolism; aldehyde catabolism; acetate/ethanol detoxification at stationary phase,Carbon Metabolism
137,Phosphate-2,False,0.0173693638598912,PhoB,"Inorganic phosphate sensing, transport, and production",Phosphate Metabolism
60,Nitrate/Nitrite,False,0.0172143151065513,NarL+Fnr,Nitrate/nitrite transport and reduction,Nitrogen Metabolism
45,Resistance,False,0.0170240975813258,,Multidrug resistance; stress response to harmful compounds/antibiotics,Envelope Stress
38,EvgA,False,-0.0169063393434975,EvgA,"Glutamate-dependent acid response, drug resistance, alkali metals response",Envelope Stress
184,pts KO,False,0.0165436394108861,,ptsHI/crr KO and compensatory regulatory changes,Carbon Metabolism
121,Gluconate,False,0.0163533394105637,GntR+Crp,Gluconate transport and catabolism (Entner-Doudoroff),Carbon Metabolism
78,cyoB/kdpE/qseB KO,False,0.0162774827977211,,cyoB/kdpE/qseF KO,Energy Metabolism
94,NtrC-1,False,0.0160083024583967,RpoN+RpoS+NtrC,"Nitrogen assimilation, ammonium transport",Nitrogen Metabolism
105,Glycine,False,0.0159767133583578,PurR+Fnr+ppGpp+Crp+Lrp+GcvA,Glycine cleavage system,Amino Acid Metabolism
81,crp KO-1,False,-0.0155500513628856,,crp KO and compensatory regulatory changes,Carbon Metabolism
49,BasR,False,0.0155474016748054,BasR,Lipid A modification and polymixin resistance in the presence of excess iron,Extracellular Structures
144,Putrescine,False,0.0154137912555384,RpoS+ArcA+PuuR,Putrescine transport and catabolism,Nitrogen Metabolism
125,Membrane,False,0.0150344738740677,,"Membrane-related stress response regulators, transporters, multidrug resistance",Envelope Stress
173,IS Elements-1,False,0.0150092746159483,,Unknown,Unknown
50,Sulfoquinovose,False,-0.0146651426337201,CsqR,Sulfoquinovose transport and catabolism,Carbon Metabolism
24,YjfJ,False,0.0145621480513294,YjfJ,Putative heat responsive regulon,Temperature Shock
15,ldrC,False,0.0145009333944545,,Unknown,Unknown
172,Fimbriae,False,-0.0144508005787862,QseB+IHF+Lrp+H-NS,Type 1 (mannose-sensitive) pili/fimbriae biosynthesis and secretion,Extracellular Structures
168,ydfB,False,-0.0143977034836351,,Unknown,Unknown
23,thrA KO,False,-0.0141550544496986,,thrA KO and compensatory transcriptional changes,Amino Acid Metabolism
21,Nucleoside,False,-0.0141369960268491,Crp+CytR,Transport and utilization of ribonucleosides and deoxyribonucleosides,Nucleotide Metabolism
196,Glyoxylate,False,-0.0140275229157913,Crp+ArcA+ppGpp+Cra+IclR+IHF,Glyxoylate cycle; alternate to TCA cycle,Energy Metabolism
162,Propionate,False,0.0138182164684453,PrpR+RpoN+Cra+Crp,Propionate catabolism; 2-methylcitric acid cycle,Carbon Metabolism
152,NtrC-3,False,-0.0136155895410732,NtrC+RpoN,"Nitrogen assimilation, pyrimidine transport and catabolism",Nitrogen Metabolism
195,Phage Shock,False,-0.0129977560574588,RpoN+IHF+PspF,Phage shock response; response to filamentous phage infection and/or extracytoplasmic shock,Phage Shock
124,Thr/Ser-2,False,-0.012622398421981,Fnr+Crp+IHF+TdcA+TdcR,Threonine/serine transport and catabolism,Amino Acid Metabolism
147,PAL 26 Del,False,-0.0118785613111416,,Unknown,Unknown
160,YcjW,False,0.0118377370255074,YcjW,Carbohydrate transport and catabolism,Carbon Metabolism
86,UC-3,False,0.0118358675491763,,Unknown,Unknown
98,ymiB,False,0.0115086859382246,,Unknown,Unknown
14,FucR/AllR/AraC,False,-0.0114525761137373,FucR/AllR/AraC,Allantoin/glycolate/glyoxylate/arabinose/fucose transport and catabolism,Nitrogen Metabolism
199,Ile/Val,False,0.0114329157982431,,Isoleucine and valine biosynthesis,Amino Acid Metabolism
83,yafF,False,0.010981906808937,,Unknown,Unknown
69,Phosphate-1,False,-0.0109713875492833,PhoB,"Inorganic phosphate sensing, transport, and production",Phosphate Metabolism
194,tpiA KO,False,-0.0109360289568776,,tpiA KO and compensatory evolved regulatory changes,Carbon Metabolism
120,yoaI,False,-0.0109198521443507,,Unknown,Unknown
169,NrdR,False,-0.0107120244795083,NrdR,Ribonucleoside reduction,Nucleotide Metabolism
118,ythA,False,-0.0105519839001196,,Unknown,Unknown
53,UC-1,False,-0.0103797421634685,,Unknown,Unknown
63,Pyrimidine,False,-0.0102734523089807,PurR/UTP,Pyrimidine transport and biosynthesis,Nucleotide Metabolism
17,Zinc-1,False,-0.0102400778054325,Zur/ZntR/CueR,Zinc sensing and uptake; copper sensing and export,Metal Homeostasis
114,GlcNAc,False,0.0101679875612606,NagC+Crp,"Amino sugar transport, biosynthesis and catabolism",Carbon Metabolism
11,Histidine,False,-0.009834053543078,His-tRNA+DksA,Histidine biosynthesis,Amino Acid Metabolism
75,yceO,False,0.0097770162112172,,Unknown,Unknown
183,DhaR,False,-0.0095748519971273,DhaR,Dihydroxyacetone transport and catabolism; phosphotransferase activity for DhaM phosphorylation,Carbon Metabolism
167,UC-2,False,-0.0093386661138084,,Unknown,Unknown
70,Salicylic Acid,False,-0.009211703257447,,Salicylic acid efflux,Redox Stress
100,Molybdenum,False,-0.0092039218070112,Crp+FliA+ModE,Molybdenum transport and molybdoenzyme synthesis,Metal Homeostasis
91,NDH-1,False,-0.008935289408896,NarL+ArcA+IHF+Fnr+Fis+ryhB,"NADH:ubiquinone oxidoreductase I: electron transfer from NADH to quinone pool, proton electrochemical gradient generation for aerobic and anaerobic respiration",Energy Metabolism
171,cyoB/ndh/nuoB KO-1,False,-0.0089287638463151,,NDH-1 (nuoB) KO and compensatory NDH-2 (ndh) up-regulation,Energy Metabolism
51,RpoS,False,-0.00849704180592,RpoS,Master regulator of global stress response,Global Stress
19,Sorbitol,False,0.0084548282747353,SrlR+GutM+Crp+H-NS,Sorbitol transport and catabolism,Carbon Metabolism
18,Methionine,False,-0.0083926971540346,MetJ,Methionine transport and biosynthesis,Amino Acid Metabolism
32,CpxR,False,-0.0081555803320613,CpxR,"Inner membrane damage sensing and repair via protein folding/degradation, chemotaxis, drug efflux, DNA repair, motility",Envelope Stress
20,Glycerol,False,-0.0080845769687668,Crp+GlpR,Glycerol/glycerol-3-phosphate transport and catabolism,Carbon Metabolism
41,pgi KO,False,0.0080712352950527,,pgi KO,Carbon Metabolism
96,Dipeptide,False,-0.0080207623811639,gcvB+IHF+Fnr,Dipeptide transport; flagellar biosynthesis,Amino Acid Metabolism
30,IS Elements-2,False,0.0079372870687108,,Unknown,Unknown
74,ArcA,False,-0.0078719959145207,ArcA,Anaerobiosis; repression of aerobic growth genes during anaerobic growth,Energy Metabolism
36,cydB/appC KO,False,-0.0076416450932126,,cydB/appC KO and compensatory regulatory changes,Energy Metabolism
164,minicoli KOs,False,-0.007606998461909,,Deletions from minicoli strain,Genome Reduction
177,PlaR,False,0.0074988823192202,PlaR+RpoE+Crp+IHF,Plant-derived sugars transport and catabolism,Carbon Metabolism
28,ldrA,False,-0.0074795518418264,,Unknown,Unknown
148,LPS,False,-0.0074662926809626,,Lipopolysaccharide biosynthesis and export,Extracellular Structures
1,Translation,False,-0.0074473520843802,DksA,Ribosome biogenesis,Translation
102,Thr/Ser-1,False,-0.0074465127703625,TdcA+TdcR+IHF+Fnr+Crp,Threonine/serine transport and catabolism during anaerobiosis,Amino Acid Metabolism
92,Crp-1,False,-0.0074368023676161,Crp,Miscellaneous carbon source metabolism,Carbon Metabolism
106,BW25113,False,0.0072335715811891,,Accounts for genomic differences between BW25113 and MG1655 substrains,Strain Difference
35,FucR/ExuR,False,0.0072128182896604,FucR/ExuR,Fucose/galacturonate/glucuronate transport and catabolism,Carbon Metabolism
8,yqhI,False,0.0070359583626172,,Unknown,Unknown
47,Biofilm,False,-0.0070160117022243,RpoS+ppGpp+BluR+MarA,"Biofilm formation, acid resistance, cold shock response",Extracellular Structures
174,Cra,False,0.0069171625649917,Cra,Central carbon metabolism; glycolytic flux-dependent regulation via fructose sensing,Carbon Metabolism
33,Curli-2,False,-0.0068205005488775,RpoS+FliZ+CpxR+CsgD+BtsR,Curli secretion and assembly,Extracellular Structures
138,Leucine,False,0.0067883605437387,LeuO+Leu-tRNA+ppGpp,Leucine biosynthesis,Amino Acid Metabolism
62,Fnr-1,False,-0.0066863382483951,Fnr,Transition from aerobic to anaerobic growth; anaerobic reductase and hydrogenase activity,Energy Metabolism
59,Magnesium,False,-0.0064570018535087,PhoP,Magnesium sensing and transport; magnesium-limitation response,Metal Homeostasis
10,Nucleotide Stress,False,0.0064187670676951,,DNA repair; stringent response signaling via ppGpp; ribosomal biogenesis and stability,DNA Damage
149,Arginine,False,-0.0063891918787749,ArgR,Arginine transport and biosynthesis,Amino Acid Metabolism
129,Pyruvate-1,False,-0.0062306369613522,BtsR,"Pyruvate sensing, transport, and catabolism under nutrient limitation",Carbon Metabolism
88,Nitrogen,False,-0.0061708145019006,Nac,Nitrogen metabolism under nitrogen limitation,Nitrogen Metabolism
157,Microaerobic,False,0.0061619143519436,RpoS+Fis+NarP+NarL+AppY+YdeO+ArcA+IscR,Hydrogenase 1 and cytochrome bd-II ubiquinol oxidase: microaerobic respiratory chain between hydrogen and oxygen,Energy Metabolism
43,N Reduction,False,0.0061066664843951,FlhDC+ModE+NarP+NarL+Fnr,"Electron transfer via nitrate reductases (periplasmic and A), cytochrome c",Energy Metabolism
27,ydaG,False,-0.0060489832026919,,Unknown,Unknown
165,GadXW,False,-0.0059849124961774,GadX+GadW,Glutamate-dependent acid resistance system; multidrug efflux,Envelope Stress
64,Zinc-2,False,0.0059165671905408,ZraR,Tolerance to high zinc concentration,Metal Homeostasis
82,SSW SNPs,False,0.0058113596827403,,Unknown,ALE Effects
87,YieP,False,0.0057984581409748,YieP,"Cellular membrane synthesis and stress response, 3-hydroxypropanoate tolerance",Envelope Stress
112,pts ALE,False,-0.0056718244528233,,ptsHIcrr KO and associated adaptive regulatory changes,Energy Metabolism
7,Sialic Acid,False,0.0056372342354727,Crp+NanR,N-acetyl-neuraminic acid (or sialic acid) transport and metabolism,Carbon Metabolism
26,baeR KO,False,-0.0056307310698318,,baeR KO,Envelope Stress
90,Leu/Val/Ile,False,-0.0055487312550284,Lrp+IHF+Ile-tRNA+Leu-tRNA+Val-tRNA+ppGpp,Branched-chain amino acid biosynthesis,Amino Acid Metabolism
140,ytiC,False,-0.0055355582762405,,Unknown,Unknown
191,Tryptophanase,False,0.0054488312345314,Crp+TorR+Nac+L-tryptophan,Tryptophan import and catabolism via tryptophanase; indole/pyruvate biosynthesis,Amino Acid Metabolism
133,malE OE,False,-0.0053650498950819,,Accounts for malE plasmid overexpression,Carbon Metabolism
145,ppGpp,False,0.0053327957097903,ppGpp,Stringent response,Global Stress
39,Xylose,False,-0.0053185403209225,Crp+XylR,d-Xylose transport and catabolism,Carbon Metabolism
52,lsrB KO,False,0.0052606524758376,,lsrB KO and compensatory regulatory changes,Quorum Sensing
180,Tyr/Trp/Phe,False,0.0051367973337652,TyrR/TrpR/Trp-tRNA,Aromatic amino acid biosynthesis and transport,Amino Acid Metabolism
46,PAL 10 Del,False,0.0050890088409469,,Unknown,Unknown
95,Ribose,False,-0.0050669891585977,dsrA+Crp+RbsR,Ribose transport and catabolism,Carbon Metabolism
34,Acid Shock RNA,False,0.0050425057823052,,Very low pH-responsive acid shock polypeptide,Acid Stress
68,Cellulose,False,-0.004796292142945,,Cellulose biosynthesis; biofilm formation; membrane/periplasmic proteins,Extracellular Structures
85,DNA Damage,False,-0.0047464302022168,LexA,SOS response to DNA damage or inhibition of DNA replication,DNA Damage
134,Crp-2,False,-0.0047209970526896,Crp,Carbohydrate transport and catabolism,Carbon Metabolism
29,Quorum Sensing,False,-0.004644953604028,Crp+LsrR,"Quorum sensing via autoinducer 2, biofilm architecture, foreign DNA stress response; lsrR KO",Quorum Sensing
76,Potassium,False,0.004619832052395,KdpE,Potassium sensing and transport,Metal Homeostasis
89,UC-6,False,-0.0045716382263694,,Unknown,Unknown
130,ldrD,False,-0.0043234649201939,,Unknown,Unknown
13,RpoH,False,0.0042919004711317,RpoH,Global heat shock response during log-phase; response to high temperature and/or misfolded proteins,Temperature Shock
84,NtrC-2,False,-0.0042315976574469,NtrC+RpoN,"Nitrogen assimilation, ammonium transport",Nitrogen Metabolism
126,Thiamine-1,False,-0.0042173044097449,Thiamine diphosphate,Thiamine uptake and biosynthesis,Cofactor Metabolism
139,Capsule,False,-0.0042022011522732,RcsAB,Colanic acid capsule synthesis and transport; periplasmic proteins; envelope stress response,Extracellular Structures
12,UC-4,False,0.0039511991886664,,Unknown,Unknown
141,ROS TALE Del-2,False,-0.0039102710319449,,Unknown,Unknown
189,UC-7,False,0.0038400657688796,,Unknown,Unknown
67,RpoE,False,0.0038289854782384,RpoE,Heat shock response; response to high temperature and/or misfolded membrane/periplasmic proteins,Temperature Shock
104,FHL,False,0.0038144278845045,RpoN+NsrR+ModE+IHF+FhlA,Formate hydrogenlyase: hydrogen production during glucose fermentation via formate oxidation/proton reduction,Energy Metabolism
31,Nickel,False,-0.003675306797617,RpoN+NarL+NikR+Fnr,Nickel sensing and uptake,Metal Homeostasis
99,yjjZ,False,-0.0036524457773441,,Unknown,Unknown
9,ROS TALE Amp,False,0.0035343381488279,,Amplification of DLP12/IS3,Unknown
132,rcsB KO,False,-0.0035170520458928,,rcsB KO and associated regulatory changes,Envelope Stress
111,YgeV,False,-0.0034791483958714,YgeV,Nucleoside degradation activated by ethanol treatment,Carbon Metabolism
154,sdh KO,False,0.0033223276994775,,sdh KO,Carbon Metabolism
166,Rhamnose,False,0.0032548413656729,Crp+RhaS,Rhamnose transport and catabolism,Carbon Metabolism
150,Nickel/Cobalt,False,0.0032091501179183,RcnR,Nickel and cobalt resistance via efflux,Metal Homeostasis
65,NRZ,False,-0.0029864123722837,OmpR,Nitrate reduction under microaerobic condition; aerobic to anaerobic transition,Energy Metabolism
109,Flagella,False,-0.0027924782343507,,Flagellar biosynthesis,Extracellular Structures
22,SoxS,False,-0.0027521100619247,SoxS,"Superoxide/nitric oxide sensing and removal, protection from organic solvents and antibiotics",Redox Stress
116,Lysine/T2SS,False,-0.002751657034086,ArgP,Lysine transport and biosynthesis; type II secretion system,Amino Acid Metabolism
190,Efflux Pump,False,-0.0026341865206155,,Multidrug/spermidine efflux pump,Resistance
170,Purine,False,-0.0026052641129809,PurR+ppGpp,Purine transport and biosynthesis,Nucleotide Metabolism
156,Fnr-2,False,-0.0025808196158148,Fnr,Transition from aerobic to anaerobic growth; global control of anaerobiosis,Energy Metabolism
113,FDH-O,False,0.0025723280345083,sdhX,Formate dehydrogenase O; formate to carbon dioxide oxidation; formate-nitrate electron transport during aerobic/anerobic shift,Energy Metabolism
5,Osmoprotectant,False,-0.0024853310088475,RpoS+ppGpp+IHF+H-NS,Transport of osmoprotectant glycine betaine,Envelope Stress
73,trxC Del,False,0.0023381268926843,,Unknown,Unknown
42,Biotin,False,-0.0023202322684778,BirA,Biotin biosynthesis,Cofactor Metabolism
56,Sulfate,False,0.0022452196127475,Cbl+CysB,Cysteine transport and biosynthesis; aliphatic sulfonate utilization and homeostatic response to sulfate starvation,Amino Acid Metabolism
61,glrR KO,False,0.0022328555525678,,glrR (aka qseF) KO; xylose transport and catabolism,Envelope Stress
110,SCFA,False,-0.0021093677994433,RpoN+AtoC+IHF,Short-chain fatty acid (acetoacetate) transport and catabolism,Carbon Metabolism
185,gcvB,False,-0.0021091000442199,gcvB,Amino acid transport,Amino Acid Metabolism
186,Glutarate,False,0.002023122199735,RpoS+H-NS+Crp+Lrp+GlaR+ppGpp,Glutarate/aminobutyrate transport and catabolism,Carbon Metabolism
153,arcA/luxS KO,False,-0.0020120787172738,,arcA KO,Energy Metabolism
3,OxyR,False,-0.0019998392844804,OxyR,"Oxidative stress response, especially peroxide",Redox Stress
79,Isc System,False,-0.0019574056601751,ryhB/IscR,Iron-sulfur cluster biogenesis and insertion,Cofactor Metabolism
72,Galactose,False,-0.0019461970781105,RpoS+GalR+GalS+Crp,Galactose transport and catabolism,Carbon Metabolism
155,YmfT,False,0.0019027970548481,YmfT,e14 prophage regulator activated by DNA damage,DNA Damage
175,Hot TALE 16,False,0.0017891495710058,,Regulatory changes under high temperature,Unknown
2,ygdT,False,0.0017772408714647,,Unknown,Unknown
193,cyoB/ndh/nuoB KO-2,False,-0.0017273551250088,,cyoB/ndh/nuoB KOs,Energy Metabolism
182,Fatty Acid,False,0.0017158642904729,FadR,Fatty acid degradation and biosynthesis,Carbon Metabolism
197,CCK-PGI Del,False,-0.0016199859738436,,Unknown,Unknown
25,Lrp,False,-0.0016177713436191,Lrp,"Global regulation of amino acid biosynthesis/catabolism, stationary phase, nutrient transport, pili synthesis, 1-carbon metabolism",Amino Acid Metabolism
123,Copper,False,0.001562084002005,CusR/CueR/HprR,Copper/silver sensing and export,Metal Homeostasis
77,ROS TALE Del-1,False,-0.0015391853880711,,Unknown,Unknown
161,PAL Amp,False,0.0015182100230546,,Unknown,Unknown
142,UC-5,False,-0.0014389889311147,,Unknown,Unknown
127,Cold Shock,False,-0.0011865976953578,,Cold shock proteins,Temperature Shock
136,Pyruvate-2,False,0.0011065961729419,PyrR,Pyruvate sensing and transport,Carbon Metabolism
128,FliA,False,-0.0009608472958914,FliA,"Sigma 28; flagellum biosynthesis and export, motility",Extracellular Structures
151,IS5,False,0.0009066773875654,,IS5 transcripts,Unknown
122,UC-9,False,-0.0008823697995052,,Unknown,Unknown
179,Maltose,False,-0.0008577173202697,MalT,Maltose transport and catabolism,Carbon Metabolism
181,GadX,False,0.0008566899269361,RpoS+GadX,Glutamate-dependent acid resistance system; multidrug efflux,Envelope Stress
101,e14 Del,False,0.0008488825756515,,Unknown,Unknown
158,Cysteine-2,False,0.0007874604760245,CysB,"Cysteine biosynthesis, sulfate assimilation",Amino Acid Metabolism
188,Oxidoreductase,False,-0.0007767794351944,,Putative oxidoreductase components,Redox Stress
176,Suf System,False,-0.0007450386703673,NsrR+IHF+IscR+OxyR+Fur+ppGpp,Iron-sulfur cluster biosynthesis and insertion,Metal Homeostasis
146,Glycolate,False,-0.0007340132124022,IHF+ArcA+PdhR+GlcC,Glycolate/glyoxylate tranport and catabolism,Carbon Metabolism
44,FDH-N/NRA,False,-0.0006983900639301,NarL+Fnr,Anaerobic growth on nitrate; formate-to-nitrate electron transfer via formate dehydrogenase N and nitrate reductase A,Energy Metabolism
143,FlhDC-1,False,0.0005895425231244,FlhDC,Flagellum biosynthesis and export,Extracellular Structures
135,Cysteine-1,False,-0.000573834278001,CysB,"Cysteine biosynthesis, sulfate assimilation",Amino Acid Metabolism
0,Sugar Diacid,False,-0.0005685136108064,CdaR,Transport and catabolism of carbohydrate diacids (galacatarate and glucarate),Carbon Metabolism
4,FlhDC-2,False,0.000506941012331,FlhDC,Flagellum biosynthesis and export,Extracellular Structures
117,Fnr-3,False,-0.0003461012546282,Fnr,Anaerobic growth,Energy Metabolism
58,Fur-2,False,-0.0003124881513418,Fur,"Iron sensing and uptake, enterobactin biosynthesis, iron-sulfur cluster activation, iron sequestration",Metal Homeostasis
54,Fur-1,False,0.0003044144799421,Fur,"Iron sensing and uptake, enterobactin biosynthesis, iron-sulfur cluster activation, iron sequestration",Metal Homeostasis
131,efeU Activation,False,-0.0002392326380905,,efeU re-activation and associated efeU ALE-related expression changes,Metal Homeostasis
66,nquinone ALE 3,False,0.0002012576034319,,ubiC KO and associated adaptive regulatory changes,Energy Metabolism
48,Cytochrome c,False,-0.000161145370806,FlhDC+IHF+NsrR+NarL+NarP+Fis+Fnr,Cytochrome c-552 and putative cytochrome c-related proteins,Energy Metabolism
