k,name,in_iM,gene_weight,regulator,function,category
24,Protocatechuate,False,0.0396135051,,Benzoate degradation: pcaBCGHK,Metabolism
1,Unchar-1,False,0.0251670027,,"colR/colS two component system, pyruvate metabolism, insecticidal toxins, groES, glycerol uptake, etc.",Uncharacterized
28,Osmotic Stress,False,-0.021924203200000002,,"Osmotic/water stress resistance: osmoprotectants, compatible solute production; oxidative stress resistance ",Stress Response
36,Translation-1,False,-0.0210717775,,"Ribosomal proteins, atpCG, secY, rpoA",Translation
2,Chemotaxis,False,-0.0171117097,,"crp, csrA, flgM, chemotaxis proteins, membrane components, fliC, methyl accepting chemotaxis proteins, glycosyltransferase, several genes involved in signal transduction, flagellar genes: hook-associated proteins, filament capping protein, motor protein, motor stator protein",Motility
13,Transport,False,-0.0166604558,,"Transport of inorganic ions, amino acids, carbohydrates, and lipids; membrane proteins; carbon starvation protein A; tryptophan synthesis; syringafactin synthesis",Metabolism
43,single_gene_5,False,-0.015670969400000002,,"holin, genes of unknown function",Noise
42,single_gene_4,False,-0.015629665100000002,,"helix-turn-helix domain-containing protein, genes of unknown function",Noise
5,Unchar-4,False,-0.0153015962,,"Zinc transporters, cadA, rpme-1, iron transporters and receptors",Uncharacterized
16,Unchar-8,False,-0.0150146436,,"fur, ribosomal proteins (rpsT, rplS, rpmE), ribosomal modulation factor, cold shock proteins, bacterioferritin, bacterioferritin-associated ferredoxin, transposases",Uncharacterized
29,Fatty Acid,False,-0.0140333383,PsrA,"psrA, fadAB, etfAB, genes with multiple drug resistance domains",Metabolism
26,Zur,False,-0.0135567319,PSPTO_5267,"Zinc transporters, cadA, rpme-1, iron transporters, and receptors",Metal Uptake
15,Coronatine,False,-0.013133313,,Coronatine biosynthesis: coronamic acid and coronafacic acid; alginate biosynthesis; type III effectors,Exometabolites
3,Sulfur-1,False,-0.0127075373,,"Taurine, alkane sulfonate, cysteine, and methionine transport",Metabolism
11,Unchar-6,False,-0.0119866938,,uncharacterized,Uncharacterized
17,Unchar-2,False,0.011833576600000001,,"oxidative stress response: pqq, kdpf, organic hydroperoxide resistance protein, pirin (ortholog); nusA",Uncharacterized
6,IS-elements,False,0.011768643,,"transposases, ptrB",Genomic
7,Unchar-9,False,0.011377665300000001,PSPTO_3698,"molybdenum cofactor-associated genes: moaA, fdhD, oxidoreductase (molydopterin binding protein); xanyhine dehydrogenase subunits (xdhAB) and xanthine dehydrogenase accessory protein (xdhC)",Uncharacterized
40,Unchar-5,False,-0.0111270364,,"several unknown genes, type III effectors, cold shock domain-containing proteins, RNA-directed DNA polymerase, integrase, cysteine synthase familiy proteins",Uncharacterized
20,single_gene_2,False,-0.0096989668,,"helix-turn-helix domain-containing protein, IS element, holin, kdpF, genes of unknown function",Noise
0,Nitrogen,False,-0.009243042600000001,NtrC,"Nitrogen stress response: ntrB/ntrC two component system, glnK, amtB, utilization of alternate nitrogen sources: urea (conversion of urea to ammonia), amino acids (transporters), pyrimidines (rutABCD), allantoin (allantoin permease), GABA (GABA permease)",Metabolism
12,Plasmid,False,0.0084010258,,"Plasmid genes: conjugal transfer proteins, DNA primase, glycoside hydrolase, mobilization proteins, type III effectors, integrase, UV resistance protein A, replication initiation protein; efflux transporters, glycine metabolism, sarcosine oxidase subunits ( likely due to plasmid manipulation)",Genomic
10,Sulfur-2,False,-0.0080893492,,"Sulfur starvation response protein (oscA), alkane sulfonate transporters, sulfate transporters, amino acid transporters",Metabolism
32,Folate,False,-0.0080481345,,"Tetrahydrofolate production: soxGADB, folD, purU",Metabolism
14,Chaperone,False,-0.0078494345,,"Chaperones, heat shock proteins, proteins involved in repair processes other than in response to heat shock, ATP-dependent protease ATPase subunits",Stress Response
4,Recombination,False,-0.0077514482,,"Recombinases family proteins, several genes of unknown function",Stress Response
18,Translation-2,False,-0.0076571715000000005,,"Ribosome maturation factor, rho, rpsU, rpiU",Translation
8,Alginate,False,0.0068041044,,"Alginate biosynthesis, phenol degradation protein, benzaldehyde dehydrogenase, dimethylglycine demethylation, genes involved in amino acid transport and metabolism",Exometabolites
23,Phage,False,-0.005854834000000001,,"prtN, ptrB, prophage genes associated with pyocin production in Pseudomonas aeruginosa",Genomic
34,Unchar-7,False,-0.0054757464,,"lipid-A-disaccharide synthase, TolC family protein, dihydrolipoyllysine-residue acetyltransferase",Uncharacterized
22,Carbon Starvation-2,False,-0.0054451816000000005,,Inositol phosphate and galactose metabolism,Metabolism
25,Flagella-2,False,0.0054429327,,"Glycosyltransferase, flagellar biosynthesis and assembly: hook, P-ring, export ATPase, chaperone, type III secretion system; cheZ",Motility
39,Resistance-2,False,0.0054379677,CueR,"Syringafactin production and efflux, cueR, copper transport, chemotaxis, uric acid production, virulence factor srfB, virulence effector srfC, bacterioferritin, Flp type IV pilin",Stress Response
41,single_gene_3,False,-0.0052362338,,genes of unknown function,Noise
21,Fe/Protein Transport,False,-0.005200581100000001,,"Iron starvation response: PvdS,  FoxR (ortholog), other sigma factors associated with iron starvation response, bacterioferritin, bacterioferritin-associated ferredoxin, energy transduction (exbBD), TonB-dependent siderophore receptors ",Metal Uptake
38,AlgU,False,0.0044215882,AlgU,"algU (rpoE),  hrpR, alginate biosynthesis, stress resistance: oxidative, osmotic, heat, UV, and metal ion stress",Stress Response
31,Carbon Starvation-1,False,-0.003026304,,"Carbon starvation response: carbon starvation protein A, acetate utilization; pilin assembly: tadABCZ (homologs), rcpAC (homologs), flp family type IVb pilin",Metabolism
27,Yersiniabactin,False,0.0027915669,,Biosynthesis and transport of yersiniabactin,Exometabolites
33,Pyoverdine,False,-0.0022563333000000002,PvdS,"Biosynthesis and transport of pyoverdine, metal transporters",Exometabolites
19,single_gene_1,False,0.0020541036,,"baeR, exdb, unknown genes",Noise
44,Fe-S/Oxidative Stress,False,-0.0018946107000000002,,"Fe-S cluster assembly, oxidative stress resistance: sodA, fumC, katB, catalase ",Stress Response
35,Flagella-1,False,0.0011931936000000001,,"fleS/fleR two component system, flagellar biosynthesis and assembly: rod; hook; L; M, and P ring; hook and basal body complex; motor switch; flagellar type III secretion system",Motility
30,Unchar-3,False,0.0010017444,,"phoP/phoQ two component system, phosphate ABC transporter, pyruvate dehydrogenase, pbpG",Uncharacterized
9,Resistance-1,False,-0.0006919462,,"MarR transcriptional regulator, efflux transporter subunits (RND, MFS, etc.), sulforaphane/aliphatic isothiocyanate, resistance proteins (saxAF)",Stress Response
37,T3SS,False,-0.00037969370000000003,,"hrpR, hrpS, hrpL, coronatine biosynthesis activation: corP, corR/corS two component system, type III effectors, type III secretion system chaperones, type III secretion system components, type III secretion proteins, type III helper protein, type III restriction system endonuclease,ribosome modulation factor, HPr kinase, pectate lyase, flagellar hook length control protein",Exometabolites
