k,name,in_iM,gene_weight,regulator,function,category
26,Zur,True,0.0627492051,PSPTO_5267,"Zinc transporters, cadA, rpme-1, iron transporters, and receptors",Metal Uptake
38,AlgU,True,0.041287117400000004,AlgU,"algU (rpoE),  hrpR, alginate biosynthesis, stress resistance: oxidative, osmotic, heat, UV, and metal ion stress",Stress Response
13,Transport,False,-0.0426083143,,"Transport of inorganic ions, amino acids, carbohydrates, and lipids; membrane proteins; carbon starvation protein A; tryptophan synthesis; syringafactin synthesis",Metabolism
32,Folate,False,-0.040596643,,"Tetrahydrofolate production: soxGADB, folD, purU",Metabolism
31,Carbon Starvation-1,False,0.0397744967,,"Carbon starvation response: carbon starvation protein A, acetate utilization; pilin assembly: tadABCZ (homologs), rcpAC (homologs), flp family type IVb pilin",Metabolism
25,Flagella-2,False,0.0348794183,,"Glycosyltransferase, flagellar biosynthesis and assembly: hook, P-ring, export ATPase, chaperone, type III secretion system; cheZ",Motility
17,Unchar-2,False,-0.028174939700000002,,"oxidative stress response: pqq, kdpf, organic hydroperoxide resistance protein, pirin (ortholog); nusA",Uncharacterized
9,Resistance-1,False,-0.027296892700000002,,"MarR transcriptional regulator, efflux transporter subunits (RND, MFS, etc.), sulforaphane/aliphatic isothiocyanate, resistance proteins (saxAF)",Stress Response
4,Recombination,False,0.0261496215,,"Recombinases family proteins, several genes of unknown function",Stress Response
20,single_gene_2,False,0.025046134100000002,,"helix-turn-helix domain-containing protein, IS element, holin, kdpF, genes of unknown function",Noise
23,Phage,False,-0.0232067465,,"prtN, ptrB, prophage genes associated with pyocin production in Pseudomonas aeruginosa",Genomic
11,Unchar-6,False,-0.0216335073,,uncharacterized,Uncharacterized
33,Pyoverdine,False,-0.0209699655,PvdS,"Biosynthesis and transport of pyoverdine, metal transporters",Exometabolites
5,Unchar-4,False,-0.0209316379,,"Zinc transporters, cadA, rpme-1, iron transporters and receptors",Uncharacterized
21,Fe/Protein Transport,False,-0.0193664474,,"Iron starvation response: PvdS,  FoxR (ortholog), other sigma factors associated with iron starvation response, bacterioferritin, bacterioferritin-associated ferredoxin, energy transduction (exbBD), TonB-dependent siderophore receptors ",Metal Uptake
43,single_gene_5,False,-0.0168449697,,"holin, genes of unknown function",Noise
39,Resistance-2,False,0.014374018300000001,CueR,"Syringafactin production and efflux, cueR, copper transport, chemotaxis, uric acid production, virulence factor srfB, virulence effector srfC, bacterioferritin, Flp type IV pilin",Stress Response
7,Unchar-9,False,-0.0143273405,PSPTO_3698,"molybdenum cofactor-associated genes: moaA, fdhD, oxidoreductase (molydopterin binding protein); xanyhine dehydrogenase subunits (xdhAB) and xanthine dehydrogenase accessory protein (xdhC)",Uncharacterized
1,Unchar-1,False,0.0132824963,,"colR/colS two component system, pyruvate metabolism, insecticidal toxins, groES, glycerol uptake, etc.",Uncharacterized
0,Nitrogen,False,-0.012958304700000001,NtrC,"Nitrogen stress response: ntrB/ntrC two component system, glnK, amtB, utilization of alternate nitrogen sources: urea (conversion of urea to ammonia), amino acids (transporters), pyrimidines (rutABCD), allantoin (allantoin permease), GABA (GABA permease)",Metabolism
29,Fatty Acid,False,-0.0129178676,PsrA,"psrA, fadAB, etfAB, genes with multiple drug resistance domains",Metabolism
12,Plasmid,False,0.012722870300000001,,"Plasmid genes: conjugal transfer proteins, DNA primase, glycoside hydrolase, mobilization proteins, type III effectors, integrase, UV resistance protein A, replication initiation protein; efflux transporters, glycine metabolism, sarcosine oxidase subunits ( likely due to plasmid manipulation)",Genomic
28,Osmotic Stress,False,-0.0126738921,,"Osmotic/water stress resistance: osmoprotectants, compatible solute production; oxidative stress resistance ",Stress Response
8,Alginate,False,-0.012507985000000001,,"Alginate biosynthesis, phenol degradation protein, benzaldehyde dehydrogenase, dimethylglycine demethylation, genes involved in amino acid transport and metabolism",Exometabolites
41,single_gene_3,False,-0.0119715826,,genes of unknown function,Noise
36,Translation-1,False,-0.0119391676,,"Ribosomal proteins, atpCG, secY, rpoA",Translation
27,Yersiniabactin,False,-0.011566523700000001,,Biosynthesis and transport of yersiniabactin,Exometabolites
34,Unchar-7,False,0.0102519852,,"lipid-A-disaccharide synthase, TolC family protein, dihydrolipoyllysine-residue acetyltransferase",Uncharacterized
44,Fe-S/Oxidative Stress,False,0.009890129000000001,,"Fe-S cluster assembly, oxidative stress resistance: sodA, fumC, katB, catalase ",Stress Response
19,single_gene_1,False,-0.0073646194,,"baeR, exdb, unknown genes",Noise
35,Flagella-1,False,-0.007073566900000001,,"fleS/fleR two component system, flagellar biosynthesis and assembly: rod; hook; L; M, and P ring; hook and basal body complex; motor switch; flagellar type III secretion system",Motility
30,Unchar-3,False,0.007072694500000001,,"phoP/phoQ two component system, phosphate ABC transporter, pyruvate dehydrogenase, pbpG",Uncharacterized
42,single_gene_4,False,0.0065624276,,"helix-turn-helix domain-containing protein, genes of unknown function",Noise
18,Translation-2,False,0.0051545956,,"Ribosome maturation factor, rho, rpsU, rpiU",Translation
2,Chemotaxis,False,-0.0051432721,,"crp, csrA, flgM, chemotaxis proteins, membrane components, fliC, methyl accepting chemotaxis proteins, glycosyltransferase, several genes involved in signal transduction, flagellar genes: hook-associated proteins, filament capping protein, motor protein, motor stator protein",Motility
22,Carbon Starvation-2,False,0.0048951363,,Inositol phosphate and galactose metabolism,Metabolism
3,Sulfur-1,False,-0.0045218245,,"Taurine, alkane sulfonate, cysteine, and methionine transport",Metabolism
37,T3SS,False,-0.0043347913,,"hrpR, hrpS, hrpL, coronatine biosynthesis activation: corP, corR/corS two component system, type III effectors, type III secretion system chaperones, type III secretion system components, type III secretion proteins, type III helper protein, type III restriction system endonuclease,ribosome modulation factor, HPr kinase, pectate lyase, flagellar hook length control protein",Exometabolites
40,Unchar-5,False,-0.0041305286,,"several unknown genes, type III effectors, cold shock domain-containing proteins, RNA-directed DNA polymerase, integrase, cysteine synthase familiy proteins",Uncharacterized
6,IS-elements,False,-0.0037156047,,"transposases, ptrB",Genomic
24,Protocatechuate,False,-0.0020394961,,Benzoate degradation: pcaBCGHK,Metabolism
16,Unchar-8,False,0.0013168283,,"fur, ribosomal proteins (rpsT, rplS, rpmE), ribosomal modulation factor, cold shock proteins, bacterioferritin, bacterioferritin-associated ferredoxin, transposases",Uncharacterized
14,Chaperone,False,0.0008956212,,"Chaperones, heat shock proteins, proteins involved in repair processes other than in response to heat shock, ATP-dependent protease ATPase subunits",Stress Response
15,Coronatine,False,-0.00041422510000000003,,Coronatine biosynthesis: coronamic acid and coronafacic acid; alginate biosynthesis; type III effectors,Exometabolites
10,Sulfur-2,False,0.0001534879,,"Sulfur starvation response protein (oscA), alkane sulfonate transporters, sulfate transporters, amino acid transporters",Metabolism
