k,name,in_iM,gene_weight,regulator,function,category
73,trxC Del,True,0.1928478765524606,,Unknown,Unknown
3,OxyR,True,0.0691066558709824,OxyR,"Oxidative stress response, especially peroxide",Redox Stress
37,ymdG,False,-0.0372550266485004,,Unknown,Unknown
79,Isc System,False,-0.0354347758828379,ryhB/IscR,Iron-sulfur cluster biogenesis and insertion,Cofactor Metabolism
116,Lysine/T2SS,False,0.0301955573703959,ArgP,Lysine transport and biosynthesis; type II secretion system,Amino Acid Metabolism
35,FucR/ExuR,False,0.029938227550925,FucR/ExuR,Fucose/galacturonate/glucuronate transport and catabolism,Carbon Metabolism
194,tpiA KO,False,0.0295784150568326,,tpiA KO and compensatory evolved regulatory changes,Carbon Metabolism
145,ppGpp,False,0.0292133017964421,ppGpp,Stringent response,Global Stress
104,FHL,False,-0.0289926104944097,RpoN+NsrR+ModE+IHF+FhlA,Formate hydrogenlyase: hydrogen production during glucose fermentation via formate oxidation/proton reduction,Energy Metabolism
85,DNA Damage,False,0.0269662819993188,LexA,SOS response to DNA damage or inhibition of DNA replication,DNA Damage
40,IS1,False,0.0261553132027018,,IS1 transcripts,Unknown
67,RpoE,False,0.0252390748272649,RpoE,Heat shock response; response to high temperature and/or misfolded membrane/periplasmic proteins,Temperature Shock
115,YgbI,False,0.0251174990582228,YgbI,Tartrate transport and catabolism,Carbon Metabolism
9,ROS TALE Amp,False,-0.0241068540260241,,Amplification of DLP12/IS3,Unknown
7,Sialic Acid,False,-0.0228520812774517,Crp+NanR,N-acetyl-neuraminic acid (or sialic acid) transport and metabolism,Carbon Metabolism
182,Fatty Acid,False,0.0228245989039904,FadR,Fatty acid degradation and biosynthesis,Carbon Metabolism
183,DhaR,False,-0.0216679082421599,DhaR,Dihydroxyacetone transport and catabolism; phosphotransferase activity for DhaM phosphorylation,Carbon Metabolism
118,ythA,False,-0.0212289871769915,,Unknown,Unknown
80,Thiamine-2,False,-0.0209718201553124,,Thiamine uptake and biosynthesis,Cofactor Metabolism
16,Ferric Citrate,False,-0.0207979848623187,PdhR+HypT+Nac+Crp+Fur+FecI,Ferric citrate transporter; iron uptake under intracellular limitation,Metal Homeostasis
28,ldrA,False,-0.0202633006160345,,Unknown,Unknown
138,Leucine,False,-0.0198615298716107,LeuO+Leu-tRNA+ppGpp,Leucine biosynthesis,Amino Acid Metabolism
52,lsrB KO,False,0.0188883947076742,,lsrB KO and compensatory regulatory changes,Quorum Sensing
99,yjjZ,False,-0.018685234080267,,Unknown,Unknown
200,UC-8,False,-0.0186395200100237,,Unknown,Unknown
87,YieP,False,-0.0183897599173477,YieP,"Cellular membrane synthesis and stress response, 3-hydroxypropanoate tolerance",Envelope Stress
98,ymiB,False,0.0182625759880108,,Unknown,Unknown
161,PAL Amp,False,-0.0181589761924596,,Unknown,Unknown
195,Phage Shock,False,-0.0166833052179963,RpoN+IHF+PspF,Phage shock response; response to filamentous phage infection and/or extracytoplasmic shock,Phage Shock
144,Putrescine,False,0.0162437735476355,RpoS+ArcA+PuuR,Putrescine transport and catabolism,Nitrogen Metabolism
176,Suf System,False,0.0153658204729394,NsrR+IHF+IscR+OxyR+Fur+ppGpp,Iron-sulfur cluster biosynthesis and insertion,Metal Homeostasis
64,Zinc-2,False,-0.0153014294131227,ZraR,Tolerance to high zinc concentration,Metal Homeostasis
56,Sulfate,False,-0.0150584410346436,Cbl+CysB,Cysteine transport and biosynthesis; aliphatic sulfonate utilization and homeostatic response to sulfate starvation,Amino Acid Metabolism
120,yoaI,False,0.0149833021161196,,Unknown,Unknown
43,N Reduction,False,-0.0148339701491236,FlhDC+ModE+NarP+NarL+Fnr,"Electron transfer via nitrate reductases (periplasmic and A), cytochrome c",Energy Metabolism
66,nquinone ALE 3,False,-0.0147992059263503,,ubiC KO and associated adaptive regulatory changes,Energy Metabolism
96,Dipeptide,False,-0.014527123903335,gcvB+IHF+Fnr,Dipeptide transport; flagellar biosynthesis,Amino Acid Metabolism
101,e14 Del,False,-0.0139136260189094,,Unknown,Unknown
140,ytiC,False,0.0138456932074966,,Unknown,Unknown
184,pts KO,False,-0.0135957445849902,,ptsHI/crr KO and compensatory regulatory changes,Carbon Metabolism
187,entC/ubiC KO-2,False,0.0135032259645614,,entC/ubiC KO and compensatory sad up-regulation,Energy Metabolism
53,UC-1,False,-0.0134322694128615,,Unknown,Unknown
34,Acid Shock RNA,False,-0.0133852103290853,,Very low pH-responsive acid shock polypeptide,Acid Stress
156,Fnr-2,False,-0.0131744616535282,Fnr,Transition from aerobic to anaerobic growth; global control of anaerobiosis,Energy Metabolism
131,efeU Activation,False,0.0131443618858611,,efeU re-activation and associated efeU ALE-related expression changes,Metal Homeostasis
130,ldrD,False,0.0129342100165491,,Unknown,Unknown
111,YgeV,False,-0.0126319072457346,YgeV,Nucleoside degradation activated by ethanol treatment,Carbon Metabolism
189,UC-7,False,-0.0125811089753719,,Unknown,Unknown
42,Biotin,False,-0.0123879957348882,BirA,Biotin biosynthesis,Cofactor Metabolism
0,Sugar Diacid,False,-0.0123238780978536,CdaR,Transport and catabolism of carbohydrate diacids (galacatarate and glucarate),Carbon Metabolism
164,minicoli KOs,False,-0.01231053993507,,Deletions from minicoli strain,Genome Reduction
57,ypaB,False,0.0122933083351162,,Unknown,Unknown
91,NDH-1,False,-0.0113257533154293,NarL+ArcA+IHF+Fnr+Fis+ryhB,"NADH:ubiquinone oxidoreductase I: electron transfer from NADH to quinone pool, proton electrochemical gradient generation for aerobic and anaerobic respiration",Energy Metabolism
69,Phosphate-1,False,-0.0112545024037169,PhoB,"Inorganic phosphate sensing, transport, and production",Phosphate Metabolism
77,ROS TALE Del-1,False,-0.0111885405196001,,Unknown,Unknown
162,Propionate,False,0.0109357631277938,PrpR+RpoN+Cra+Crp,Propionate catabolism; 2-methylcitric acid cycle,Carbon Metabolism
70,Salicylic Acid,False,0.0108611294733856,,Salicylic acid efflux,Redox Stress
146,Glycolate,False,-0.0107212860485714,IHF+ArcA+PdhR+GlcC,Glycolate/glyoxylate tranport and catabolism,Carbon Metabolism
113,FDH-O,False,-0.0107068331549049,sdhX,Formate dehydrogenase O; formate to carbon dioxide oxidation; formate-nitrate electron transport during aerobic/anerobic shift,Energy Metabolism
93,yneP,False,-0.0104379166309687,,Unknown,Unknown
110,SCFA,False,0.0101981321189703,RpoN+AtoC+IHF,Short-chain fatty acid (acetoacetate) transport and catabolism,Carbon Metabolism
175,Hot TALE 16,False,-0.0101719530768082,,Regulatory changes under high temperature,Unknown
81,crp KO-1,False,-0.0100699209316136,,crp KO and compensatory regulatory changes,Carbon Metabolism
147,PAL 26 Del,False,-0.0100162664106361,,Unknown,Unknown
196,Glyoxylate,False,0.0099838666699793,Crp+ArcA+ppGpp+Cra+IclR+IHF,Glyxoylate cycle; alternate to TCA cycle,Energy Metabolism
190,Efflux Pump,False,0.0094897463120209,,Multidrug/spermidine efflux pump,Resistance
167,UC-2,False,-0.0094132821197702,,Unknown,Unknown
192,crp KO-2,False,-0.0094010541142107,,crp KO and associated glycerol-3-phosphate (GlpR) regulatory changes,Carbon Metabolism
65,NRZ,False,0.0093976027539019,OmpR,Nitrate reduction under microaerobic condition; aerobic to anaerobic transition,Energy Metabolism
95,Ribose,False,-0.0093549119746035,dsrA+Crp+RbsR,Ribose transport and catabolism,Carbon Metabolism
152,NtrC-3,False,0.0092099234666179,NtrC+RpoN,"Nitrogen assimilation, pyrimidine transport and catabolism",Nitrogen Metabolism
15,ldrC,False,0.0089817037421694,,Unknown,Unknown
36,cydB/appC KO,False,0.0089046026847421,,cydB/appC KO and compensatory regulatory changes,Energy Metabolism
122,UC-9,False,-0.0088326130757852,,Unknown,Unknown
24,YjfJ,False,-0.0086699330396075,YjfJ,Putative heat responsive regulon,Temperature Shock
178,NO Stress,False,0.008662339452256,NsrR/NarP,"Nitric oxide sensing and detoxification, iron-sulfur cluster repair, anaerobic growth",Redox Stress
153,arcA/luxS KO,False,0.0085726141283981,,arcA KO,Energy Metabolism
17,Zinc-1,False,-0.0085592435509541,Zur/ZntR/CueR,Zinc sensing and uptake; copper sensing and export,Metal Homeostasis
5,Osmoprotectant,False,-0.0085067303084355,RpoS+ppGpp+IHF+H-NS,Transport of osmoprotectant glycine betaine,Envelope Stress
78,cyoB/kdpE/qseB KO,False,-0.0084500732190958,,cyoB/kdpE/qseF KO,Energy Metabolism
197,CCK-PGI Del,False,0.0083840952692065,,Unknown,Unknown
88,Nitrogen,False,-0.0083269293263565,Nac,Nitrogen metabolism under nitrogen limitation,Nitrogen Metabolism
137,Phosphate-2,False,0.0082612492457114,PhoB,"Inorganic phosphate sensing, transport, and production",Phosphate Metabolism
151,IS5,False,0.0080981808604357,,IS5 transcripts,Unknown
44,FDH-N/NRA,False,0.0080020134302706,NarL+Fnr,Anaerobic growth on nitrate; formate-to-nitrate electron transfer via formate dehydrogenase N and nitrate reductase A,Energy Metabolism
158,Cysteine-2,False,-0.0079626475180092,CysB,"Cysteine biosynthesis, sulfate assimilation",Amino Acid Metabolism
75,yceO,False,0.0078029569973557,,Unknown,Unknown
193,cyoB/ndh/nuoB KO-2,False,0.0076071305014969,,cyoB/ndh/nuoB KOs,Energy Metabolism
123,Copper,False,-0.0075130324483276,CusR/CueR/HprR,Copper/silver sensing and export,Metal Homeostasis
180,Tyr/Trp/Phe,False,0.007512115828221,TyrR/TrpR/Trp-tRNA,Aromatic amino acid biosynthesis and transport,Amino Acid Metabolism
105,Glycine,False,0.0074937128960284,PurR+Fnr+ppGpp+Crp+Lrp+GcvA,Glycine cleavage system,Amino Acid Metabolism
25,Lrp,False,-0.0074018218813759,Lrp,"Global regulation of amino acid biosynthesis/catabolism, stationary phase, nutrient transport, pili synthesis, 1-carbon metabolism",Amino Acid Metabolism
92,Crp-1,False,-0.007264768432994,Crp,Miscellaneous carbon source metabolism,Carbon Metabolism
157,Microaerobic,False,0.0072319836504002,RpoS+Fis+NarP+NarL+AppY+YdeO+ArcA+IscR,Hydrogenase 1 and cytochrome bd-II ubiquinol oxidase: microaerobic respiratory chain between hydrogen and oxygen,Energy Metabolism
106,BW25113,False,-0.0071777791422494,,Accounts for genomic differences between BW25113 and MG1655 substrains,Strain Difference
94,NtrC-1,False,-0.0071547701918506,RpoN+RpoS+NtrC,"Nitrogen assimilation, ammonium transport",Nitrogen Metabolism
23,thrA KO,False,0.0071018950172476,,thrA KO and compensatory transcriptional changes,Amino Acid Metabolism
63,Pyrimidine,False,-0.0069651474976855,PurR/UTP,Pyrimidine transport and biosynthesis,Nucleotide Metabolism
54,Fur-1,False,-0.0066984618504059,Fur,"Iron sensing and uptake, enterobactin biosynthesis, iron-sulfur cluster activation, iron sequestration",Metal Homeostasis
58,Fur-2,False,0.0065874385621056,Fur,"Iron sensing and uptake, enterobactin biosynthesis, iron-sulfur cluster activation, iron sequestration",Metal Homeostasis
6,Glutamine,False,-0.0064800123544309,NtrC,Glutamine transport and synthesis,Nitrogen Metabolism
49,BasR,False,0.0064615538857849,BasR,Lipid A modification and polymixin resistance in the presence of excess iron,Extracellular Structures
61,glrR KO,False,-0.0063739356942632,,glrR (aka qseF) KO; xylose transport and catabolism,Envelope Stress
20,Glycerol,False,0.0062750064234955,Crp+GlpR,Glycerol/glycerol-3-phosphate transport and catabolism,Carbon Metabolism
117,Fnr-3,False,-0.0062277233424032,Fnr,Anaerobic growth,Energy Metabolism
119,entC/ubiC KO-1,False,0.0062248337192701,,entC/ubiC KO and compensatory sad up-regulation,Energy Metabolism
59,Magnesium,False,-0.0061930165196562,PhoP,Magnesium sensing and transport; magnesium-limitation response,Metal Homeostasis
84,NtrC-2,False,0.0060481788104712,NtrC+RpoN,"Nitrogen assimilation, ammonium transport",Nitrogen Metabolism
86,UC-3,False,-0.0058296799895621,,Unknown,Unknown
125,Membrane,False,-0.005787622686712,,"Membrane-related stress response regulators, transporters, multidrug resistance",Envelope Stress
60,Nitrate/Nitrite,False,-0.0057448641699116,NarL+Fnr,Nitrate/nitrite transport and reduction,Nitrogen Metabolism
109,Flagella,False,-0.0056795544089658,,Flagellar biosynthesis,Extracellular Structures
170,Purine,False,0.0056252531067748,PurR+ppGpp,Purine transport and biosynthesis,Nucleotide Metabolism
143,FlhDC-1,False,0.0055939014093179,FlhDC,Flagellum biosynthesis and export,Extracellular Structures
89,UC-6,False,0.0055507190264424,,Unknown,Unknown
102,Thr/Ser-1,False,-0.0055202347677329,TdcA+TdcR+IHF+Fnr+Crp,Threonine/serine transport and catabolism during anaerobiosis,Amino Acid Metabolism
71,ymgI,False,-0.0054403630924407,,Unknown,Unknown
168,ydfB,False,0.0054361406168933,,Unknown,Unknown
185,gcvB,False,0.0053468530676931,gcvB,Amino acid transport,Amino Acid Metabolism
2,ygdT,False,0.0052190250720033,,Unknown,Unknown
82,SSW SNPs,False,-0.0051892728401741,,Unknown,ALE Effects
165,GadXW,False,-0.0051727914085723,GadX+GadW,Glutamate-dependent acid resistance system; multidrug efflux,Envelope Stress
198,Acetate,False,-0.0050510999876341,,Acetate uptake and catabolism; aldehyde catabolism; acetate/ethanol detoxification at stationary phase,Carbon Metabolism
48,Cytochrome c,False,0.0049815724200019,FlhDC+IHF+NsrR+NarL+NarP+Fis+Fnr,Cytochrome c-552 and putative cytochrome c-related proteins,Energy Metabolism
149,Arginine,False,-0.0049381639868594,ArgR,Arginine transport and biosynthesis,Amino Acid Metabolism
172,Fimbriae,False,0.0049222752747249,QseB+IHF+Lrp+H-NS,Type 1 (mannose-sensitive) pili/fimbriae biosynthesis and secretion,Extracellular Structures
97,Curli-1,False,0.0045610249592975,RpoS+FliZ+CpxR+CsgD+BtsR,Curli secretion and assembly,Extracellular Structures
46,PAL 10 Del,False,-0.0045485013514928,,Unknown,Unknown
129,Pyruvate-1,False,0.0043970170459508,BtsR,"Pyruvate sensing, transport, and catabolism under nutrient limitation",Carbon Metabolism
19,Sorbitol,False,0.0043842223142256,SrlR+GutM+Crp+H-NS,Sorbitol transport and catabolism,Carbon Metabolism
160,YcjW,False,0.0043785816605204,YcjW,Carbohydrate transport and catabolism,Carbon Metabolism
135,Cysteine-1,False,0.0043219514810097,CysB,"Cysteine biosynthesis, sulfate assimilation",Amino Acid Metabolism
181,GadX,False,-0.0042657770349989,RpoS+GadX,Glutamate-dependent acid resistance system; multidrug efflux,Envelope Stress
112,pts ALE,False,0.0042621713443341,,ptsHIcrr KO and associated adaptive regulatory changes,Energy Metabolism
10,Nucleotide Stress,False,-0.0041819690583811,,DNA repair; stringent response signaling via ppGpp; ribosomal biogenesis and stability,DNA Damage
121,Gluconate,False,-0.0040663700011853,GntR+Crp,Gluconate transport and catabolism (Entner-Doudoroff),Carbon Metabolism
132,rcsB KO,False,-0.0040194053714186,,rcsB KO and associated regulatory changes,Envelope Stress
11,Histidine,False,-0.0039686801919339,His-tRNA+DksA,Histidine biosynthesis,Amino Acid Metabolism
27,ydaG,False,-0.0038876279207546,,Unknown,Unknown
173,IS Elements-1,False,-0.0037684259061827,,Unknown,Unknown
45,Resistance,False,0.0036917007095924,,Multidrug resistance; stress response to harmful compounds/antibiotics,Envelope Stress
174,Cra,False,0.0036503608135233,Cra,Central carbon metabolism; glycolytic flux-dependent regulation via fructose sensing,Carbon Metabolism
47,Biofilm,False,-0.0034867608395385,RpoS+ppGpp+BluR+MarA,"Biofilm formation, acid resistance, cold shock response",Extracellular Structures
55,ykgR,False,-0.0034161712227324,,Unknown,Unknown
12,UC-4,False,0.0034063995220691,,Unknown,Unknown
169,NrdR,False,-0.0033701230454352,NrdR,Ribonucleoside reduction,Nucleotide Metabolism
68,Cellulose,False,-0.0032593265335183,,Cellulose biosynthesis; biofilm formation; membrane/periplasmic proteins,Extracellular Structures
8,yqhI,False,0.003245313390193,,Unknown,Unknown
21,Nucleoside,False,-0.0031544683439141,Crp+CytR,Transport and utilization of ribonucleosides and deoxyribonucleosides,Nucleotide Metabolism
103,Tryptophan,False,0.003093258090412,TrpR+Trp-tRNA,Tryptophan transport and biosynthesis,Amino Acid Metabolism
62,Fnr-1,False,-0.0030560659421702,Fnr,Transition from aerobic to anaerobic growth; anaerobic reductase and hydrogenase activity,Energy Metabolism
90,Leu/Val/Ile,False,0.0029617133323429,Lrp+IHF+Ile-tRNA+Leu-tRNA+Val-tRNA+ppGpp,Branched-chain amino acid biosynthesis,Amino Acid Metabolism
13,RpoH,False,-0.0028989277506841,RpoH,Global heat shock response during log-phase; response to high temperature and/or misfolded proteins,Temperature Shock
155,YmfT,False,0.0028816719494542,YmfT,e14 prophage regulator activated by DNA damage,DNA Damage
31,Nickel,False,0.0028787182236543,RpoN+NarL+NikR+Fnr,Nickel sensing and uptake,Metal Homeostasis
32,CpxR,False,-0.0028471990378592,CpxR,"Inner membrane damage sensing and repair via protein folding/degradation, chemotaxis, drug efflux, DNA repair, motility",Envelope Stress
134,Crp-2,False,0.0028177585089203,Crp,Carbohydrate transport and catabolism,Carbon Metabolism
188,Oxidoreductase,False,-0.0027141764815395,,Putative oxidoreductase components,Redox Stress
163,CP4-44,False,0.0026716298270457,,CP4-44 prophage expression variation,Prophage
128,FliA,False,0.0026550953822238,FliA,"Sigma 28; flagellum biosynthesis and export, motility",Extracellular Structures
127,Cold Shock,False,0.0026099110647734,,Cold shock proteins,Temperature Shock
72,Galactose,False,0.0025790272072575,RpoS+GalR+GalS+Crp,Galactose transport and catabolism,Carbon Metabolism
30,IS Elements-2,False,0.0025221319229502,,Unknown,Unknown
4,FlhDC-2,False,-0.0024834337099352,FlhDC,Flagellum biosynthesis and export,Extracellular Structures
26,baeR KO,False,0.0024570926455033,,baeR KO,Envelope Stress
199,Ile/Val,False,-0.0024204336525687,,Isoleucine and valine biosynthesis,Amino Acid Metabolism
22,SoxS,False,-0.0023765057316104,SoxS,"Superoxide/nitric oxide sensing and removal, protection from organic solvents and antibiotics",Redox Stress
154,sdh KO,False,0.0023626191557476,,sdh KO,Carbon Metabolism
142,UC-5,False,0.0023484539109545,,Unknown,Unknown
159,ydfW,False,-0.0023104015274649,,Unknown,Unknown
177,PlaR,False,-0.0021918155627486,PlaR+RpoE+Crp+IHF,Plant-derived sugars transport and catabolism,Carbon Metabolism
41,pgi KO,False,-0.0020961360687891,,pgi KO,Carbon Metabolism
114,GlcNAc,False,-0.0019350425314333,NagC+Crp,"Amino sugar transport, biosynthesis and catabolism",Carbon Metabolism
126,Thiamine-1,False,-0.0018926251156178,Thiamine diphosphate,Thiamine uptake and biosynthesis,Cofactor Metabolism
186,Glutarate,False,0.001785302507405,RpoS+H-NS+Crp+Lrp+GlaR+ppGpp,Glutarate/aminobutyrate transport and catabolism,Carbon Metabolism
29,Quorum Sensing,False,0.0015906094263253,Crp+LsrR,"Quorum sensing via autoinducer 2, biofilm architecture, foreign DNA stress response; lsrR KO",Quorum Sensing
150,Nickel/Cobalt,False,0.0015312592730191,RcnR,Nickel and cobalt resistance via efflux,Metal Homeostasis
50,Sulfoquinovose,False,0.0014736927125964,CsqR,Sulfoquinovose transport and catabolism,Carbon Metabolism
166,Rhamnose,False,0.0014670218522181,Crp+RhaS,Rhamnose transport and catabolism,Carbon Metabolism
51,RpoS,False,-0.0012837851940889,RpoS,Master regulator of global stress response,Global Stress
18,Methionine,False,-0.0012319419838599,MetJ,Methionine transport and biosynthesis,Amino Acid Metabolism
1,Translation,False,-0.001011004556212,DksA,Ribosome biogenesis,Translation
179,Maltose,False,-0.0009701272818063,MalT,Maltose transport and catabolism,Carbon Metabolism
133,malE OE,False,0.0008440292312042,,Accounts for malE plasmid overexpression,Carbon Metabolism
100,Molybdenum,False,0.000831950100841,Crp+FliA+ModE,Molybdenum transport and molybdoenzyme synthesis,Metal Homeostasis
14,FucR/AllR/AraC,False,-0.0008119309756574,FucR/AllR/AraC,Allantoin/glycolate/glyoxylate/arabinose/fucose transport and catabolism,Nitrogen Metabolism
38,EvgA,False,-0.0008048056044172,EvgA,"Glutamate-dependent acid response, drug resistance, alkali metals response",Envelope Stress
39,Xylose,False,0.0007320412400563,Crp+XylR,d-Xylose transport and catabolism,Carbon Metabolism
108,PaaX,False,0.0007267818955633,Crp+IHF+PaaX+SlyA,Phenylacetic acid transport and catabolism,Carbon Metabolism
74,ArcA,False,-0.0007066030271637,ArcA,Anaerobiosis; repression of aerobic growth genes during anaerobic growth,Energy Metabolism
141,ROS TALE Del-2,False,-0.0006702608147175,,Unknown,Unknown
191,Tryptophanase,False,-0.0004469830937505,Crp+TorR+Nac+L-tryptophan,Tryptophan import and catabolism via tryptophanase; indole/pyruvate biosynthesis,Amino Acid Metabolism
33,Curli-2,False,-0.0002967207507165,RpoS+FliZ+CpxR+CsgD+BtsR,Curli secretion and assembly,Extracellular Structures
171,cyoB/ndh/nuoB KO-1,False,0.0002812763354938,,NDH-1 (nuoB) KO and compensatory NDH-2 (ndh) up-regulation,Energy Metabolism
136,Pyruvate-2,False,0.0002558051578173,PyrR,Pyruvate sensing and transport,Carbon Metabolism
139,Capsule,False,0.0002554565733184,RcsAB,Colanic acid capsule synthesis and transport; periplasmic proteins; envelope stress response,Extracellular Structures
124,Thr/Ser-2,False,-0.0002207205156731,Fnr+Crp+IHF+TdcA+TdcR,Threonine/serine transport and catabolism,Amino Acid Metabolism
76,Potassium,False,0.0001478107988152,KdpE,Potassium sensing and transport,Metal Homeostasis
107,ypjJ,False,-0.000146502405301,,Unknown,Unknown
83,yafF,False,0.0001153780509241,,Unknown,Unknown
148,LPS,False,-2.5052681157733005e-06,,Lipopolysaccharide biosynthesis and export,Extracellular Structures
