k,name,in_iM,gene_weight,regulator,function,category
116,Lysine/T2SS,True,0.0818562211357689,ArgP,Lysine transport and biosynthesis; type II secretion system,Amino Acid Metabolism
169,NrdR,False,0.0308883758780328,NrdR,Ribonucleoside reduction,Nucleotide Metabolism
138,Leucine,False,0.0296491730177806,LeuO+Leu-tRNA+ppGpp,Leucine biosynthesis,Amino Acid Metabolism
3,OxyR,False,-0.0248489066954086,OxyR,"Oxidative stress response, especially peroxide",Redox Stress
191,Tryptophanase,False,0.0247290949766542,Crp+TorR+Nac+L-tryptophan,Tryptophan import and catabolism via tryptophanase; indole/pyruvate biosynthesis,Amino Acid Metabolism
196,Glyoxylate,False,0.0246537769218221,Crp+ArcA+ppGpp+Cra+IclR+IHF,Glyxoylate cycle; alternate to TCA cycle,Energy Metabolism
92,Crp-1,False,-0.021697771584263,Crp,Miscellaneous carbon source metabolism,Carbon Metabolism
200,UC-8,False,0.0211649789380486,,Unknown,Unknown
89,UC-6,False,-0.0201341005733712,,Unknown,Unknown
192,crp KO-2,False,0.0185326294093394,,crp KO and associated glycerol-3-phosphate (GlpR) regulatory changes,Carbon Metabolism
188,Oxidoreductase,False,0.0180350037697806,,Putative oxidoreductase components,Redox Stress
171,cyoB/ndh/nuoB KO-1,False,0.018029017311536,,NDH-1 (nuoB) KO and compensatory NDH-2 (ndh) up-regulation,Energy Metabolism
190,Efflux Pump,False,-0.0175945653635347,,Multidrug/spermidine efflux pump,Resistance
177,PlaR,False,0.0165045376673867,PlaR+RpoE+Crp+IHF,Plant-derived sugars transport and catabolism,Carbon Metabolism
164,minicoli KOs,False,-0.0161530108384577,,Deletions from minicoli strain,Genome Reduction
105,Glycine,False,0.0149867476355334,PurR+Fnr+ppGpp+Crp+Lrp+GcvA,Glycine cleavage system,Amino Acid Metabolism
198,Acetate,False,-0.0147335615671887,,Acetate uptake and catabolism; aldehyde catabolism; acetate/ethanol detoxification at stationary phase,Carbon Metabolism
189,UC-7,False,-0.0145778673105088,,Unknown,Unknown
142,UC-5,False,-0.0139195825607627,,Unknown,Unknown
76,Potassium,False,-0.0137547110027631,KdpE,Potassium sensing and transport,Metal Homeostasis
1,Translation,False,-0.0137085695680062,DksA,Ribosome biogenesis,Translation
48,Cytochrome c,False,0.0132605165398973,FlhDC+IHF+NsrR+NarL+NarP+Fis+Fnr,Cytochrome c-552 and putative cytochrome c-related proteins,Energy Metabolism
66,nquinone ALE 3,False,0.0131223818047058,,ubiC KO and associated adaptive regulatory changes,Energy Metabolism
151,IS5,False,-0.0127200796872345,,IS5 transcripts,Unknown
72,Galactose,False,0.0125160509000429,RpoS+GalR+GalS+Crp,Galactose transport and catabolism,Carbon Metabolism
44,FDH-N/NRA,False,-0.0119353717636584,NarL+Fnr,Anaerobic growth on nitrate; formate-to-nitrate electron transfer via formate dehydrogenase N and nitrate reductase A,Energy Metabolism
185,gcvB,False,-0.011550169531885,gcvB,Amino acid transport,Amino Acid Metabolism
60,Nitrate/Nitrite,False,-0.0114674443710401,NarL+Fnr,Nitrate/nitrite transport and reduction,Nitrogen Metabolism
75,yceO,False,-0.0112159597296377,,Unknown,Unknown
6,Glutamine,False,0.010784455131072,NtrC,Glutamine transport and synthesis,Nitrogen Metabolism
127,Cold Shock,False,0.0104306480437594,,Cold shock proteins,Temperature Shock
179,Maltose,False,0.0104080091019732,MalT,Maltose transport and catabolism,Carbon Metabolism
14,FucR/AllR/AraC,False,-0.0103539901477149,FucR/AllR/AraC,Allantoin/glycolate/glyoxylate/arabinose/fucose transport and catabolism,Nitrogen Metabolism
54,Fur-1,False,-0.0102936108475674,Fur,"Iron sensing and uptake, enterobactin biosynthesis, iron-sulfur cluster activation, iron sequestration",Metal Homeostasis
133,malE OE,False,-0.0101702432217314,,Accounts for malE plasmid overexpression,Carbon Metabolism
176,Suf System,False,0.0099025621434108,NsrR+IHF+IscR+OxyR+Fur+ppGpp,Iron-sulfur cluster biosynthesis and insertion,Metal Homeostasis
124,Thr/Ser-2,False,0.00979349286292,Fnr+Crp+IHF+TdcA+TdcR,Threonine/serine transport and catabolism,Amino Acid Metabolism
172,Fimbriae,False,0.0096509959542737,QseB+IHF+Lrp+H-NS,Type 1 (mannose-sensitive) pili/fimbriae biosynthesis and secretion,Extracellular Structures
137,Phosphate-2,False,-0.0094919668208762,PhoB,"Inorganic phosphate sensing, transport, and production",Phosphate Metabolism
64,Zinc-2,False,0.0094457760472429,ZraR,Tolerance to high zinc concentration,Metal Homeostasis
13,RpoH,False,0.0094088057053875,RpoH,Global heat shock response during log-phase; response to high temperature and/or misfolded proteins,Temperature Shock
97,Curli-1,False,-0.0093815575620392,RpoS+FliZ+CpxR+CsgD+BtsR,Curli secretion and assembly,Extracellular Structures
12,UC-4,False,-0.009318256275436,,Unknown,Unknown
24,YjfJ,False,0.0092829526883077,YjfJ,Putative heat responsive regulon,Temperature Shock
62,Fnr-1,False,-0.0090372889313418,Fnr,Transition from aerobic to anaerobic growth; anaerobic reductase and hydrogenase activity,Energy Metabolism
71,ymgI,False,0.008994702503069,,Unknown,Unknown
84,NtrC-2,False,0.0088495858420403,NtrC+RpoN,"Nitrogen assimilation, ammonium transport",Nitrogen Metabolism
155,YmfT,False,-0.0088443088216035,YmfT,e14 prophage regulator activated by DNA damage,DNA Damage
162,Propionate,False,-0.0086750393786422,PrpR+RpoN+Cra+Crp,Propionate catabolism; 2-methylcitric acid cycle,Carbon Metabolism
77,ROS TALE Del-1,False,0.0086241907524767,,Unknown,Unknown
88,Nitrogen,False,-0.0085507793033122,Nac,Nitrogen metabolism under nitrogen limitation,Nitrogen Metabolism
130,ldrD,False,-0.0085049989463296,,Unknown,Unknown
23,thrA KO,False,-0.008414853791141,,thrA KO and compensatory transcriptional changes,Amino Acid Metabolism
16,Ferric Citrate,False,-0.0083207802958806,PdhR+HypT+Nac+Crp+Fur+FecI,Ferric citrate transporter; iron uptake under intracellular limitation,Metal Homeostasis
140,ytiC,False,-0.0082600236255448,,Unknown,Unknown
90,Leu/Val/Ile,False,-0.0081689025568628,Lrp+IHF+Ile-tRNA+Leu-tRNA+Val-tRNA+ppGpp,Branched-chain amino acid biosynthesis,Amino Acid Metabolism
46,PAL 10 Del,False,-0.0081393423255403,,Unknown,Unknown
132,rcsB KO,False,0.0079737924598298,,rcsB KO and associated regulatory changes,Envelope Stress
45,Resistance,False,0.0078098687279854,,Multidrug resistance; stress response to harmful compounds/antibiotics,Envelope Stress
58,Fur-2,False,-0.0075822608092675,Fur,"Iron sensing and uptake, enterobactin biosynthesis, iron-sulfur cluster activation, iron sequestration",Metal Homeostasis
0,Sugar Diacid,False,0.0075043284651233,CdaR,Transport and catabolism of carbohydrate diacids (galacatarate and glucarate),Carbon Metabolism
109,Flagella,False,-0.0073751437015616,,Flagellar biosynthesis,Extracellular Structures
108,PaaX,False,0.007322385242161,Crp+IHF+PaaX+SlyA,Phenylacetic acid transport and catabolism,Carbon Metabolism
178,NO Stress,False,-0.0072327548068328,NsrR/NarP,"Nitric oxide sensing and detoxification, iron-sulfur cluster repair, anaerobic growth",Redox Stress
79,Isc System,False,0.0072050282486886,ryhB/IscR,Iron-sulfur cluster biogenesis and insertion,Cofactor Metabolism
113,FDH-O,False,0.0071187200020694,sdhX,Formate dehydrogenase O; formate to carbon dioxide oxidation; formate-nitrate electron transport during aerobic/anerobic shift,Energy Metabolism
194,tpiA KO,False,0.0071176179172151,,tpiA KO and compensatory evolved regulatory changes,Carbon Metabolism
100,Molybdenum,False,0.0069029952110614,Crp+FliA+ModE,Molybdenum transport and molybdoenzyme synthesis,Metal Homeostasis
119,entC/ubiC KO-1,False,0.0068744229236153,,entC/ubiC KO and compensatory sad up-regulation,Energy Metabolism
149,Arginine,False,0.0068504706044675,ArgR,Arginine transport and biosynthesis,Amino Acid Metabolism
183,DhaR,False,-0.0067077156180546,DhaR,Dihydroxyacetone transport and catabolism; phosphotransferase activity for DhaM phosphorylation,Carbon Metabolism
37,ymdG,False,-0.0066048475000566,,Unknown,Unknown
15,ldrC,False,-0.0065837591355867,,Unknown,Unknown
83,yafF,False,0.006559274607761,,Unknown,Unknown
56,Sulfate,False,0.0064976666420188,Cbl+CysB,Cysteine transport and biosynthesis; aliphatic sulfonate utilization and homeostatic response to sulfate starvation,Amino Acid Metabolism
34,Acid Shock RNA,False,-0.0064785093687117,,Very low pH-responsive acid shock polypeptide,Acid Stress
85,DNA Damage,False,-0.0064729873561893,LexA,SOS response to DNA damage or inhibition of DNA replication,DNA Damage
144,Putrescine,False,-0.0064076897707202,RpoS+ArcA+PuuR,Putrescine transport and catabolism,Nitrogen Metabolism
20,Glycerol,False,0.0063698830131234,Crp+GlpR,Glycerol/glycerol-3-phosphate transport and catabolism,Carbon Metabolism
197,CCK-PGI Del,False,0.0063607285174953,,Unknown,Unknown
182,Fatty Acid,False,0.0063568805693353,FadR,Fatty acid degradation and biosynthesis,Carbon Metabolism
80,Thiamine-2,False,-0.0063381903810868,,Thiamine uptake and biosynthesis,Cofactor Metabolism
143,FlhDC-1,False,-0.0063231166938601,FlhDC,Flagellum biosynthesis and export,Extracellular Structures
168,ydfB,False,-0.0063211536357892,,Unknown,Unknown
78,cyoB/kdpE/qseB KO,False,-0.0062882581760392,,cyoB/kdpE/qseF KO,Energy Metabolism
129,Pyruvate-1,False,0.0061172781692424,BtsR,"Pyruvate sensing, transport, and catabolism under nutrient limitation",Carbon Metabolism
134,Crp-2,False,0.0061026747911408,Crp,Carbohydrate transport and catabolism,Carbon Metabolism
112,pts ALE,False,-0.006049379774067,,ptsHIcrr KO and associated adaptive regulatory changes,Energy Metabolism
43,N Reduction,False,0.0059879478456457,FlhDC+ModE+NarP+NarL+Fnr,"Electron transfer via nitrate reductases (periplasmic and A), cytochrome c",Energy Metabolism
160,YcjW,False,-0.0059622293328582,YcjW,Carbohydrate transport and catabolism,Carbon Metabolism
147,PAL 26 Del,False,0.0059464058819317,,Unknown,Unknown
195,Phage Shock,False,0.0058056264319762,RpoN+IHF+PspF,Phage shock response; response to filamentous phage infection and/or extracytoplasmic shock,Phage Shock
141,ROS TALE Del-2,False,0.0056288058461559,,Unknown,Unknown
41,pgi KO,False,0.0055933016228339,,pgi KO,Carbon Metabolism
159,ydfW,False,-0.0055929118290185,,Unknown,Unknown
31,Nickel,False,-0.0055778731120575,RpoN+NarL+NikR+Fnr,Nickel sensing and uptake,Metal Homeostasis
21,Nucleoside,False,-0.0055332891802181,Crp+CytR,Transport and utilization of ribonucleosides and deoxyribonucleosides,Nucleotide Metabolism
111,YgeV,False,0.0055245430982438,YgeV,Nucleoside degradation activated by ethanol treatment,Carbon Metabolism
146,Glycolate,False,0.0055071469047112,IHF+ArcA+PdhR+GlcC,Glycolate/glyoxylate tranport and catabolism,Carbon Metabolism
61,glrR KO,False,0.0054897594463262,,glrR (aka qseF) KO; xylose transport and catabolism,Envelope Stress
152,NtrC-3,False,-0.0054874919489571,NtrC+RpoN,"Nitrogen assimilation, pyrimidine transport and catabolism",Nitrogen Metabolism
53,UC-1,False,0.005472640778557,,Unknown,Unknown
35,FucR/ExuR,False,0.005091236747135,FucR/ExuR,Fucose/galacturonate/glucuronate transport and catabolism,Carbon Metabolism
93,yneP,False,-0.0050456893197985,,Unknown,Unknown
166,Rhamnose,False,0.0048913343756235,Crp+RhaS,Rhamnose transport and catabolism,Carbon Metabolism
36,cydB/appC KO,False,-0.0048872870199695,,cydB/appC KO and compensatory regulatory changes,Energy Metabolism
59,Magnesium,False,0.0045985114880727,PhoP,Magnesium sensing and transport; magnesium-limitation response,Metal Homeostasis
91,NDH-1,False,-0.0045949434256115,NarL+ArcA+IHF+Fnr+Fis+ryhB,"NADH:ubiquinone oxidoreductase I: electron transfer from NADH to quinone pool, proton electrochemical gradient generation for aerobic and anaerobic respiration",Energy Metabolism
87,YieP,False,-0.004484434033513,YieP,"Cellular membrane synthesis and stress response, 3-hydroxypropanoate tolerance",Envelope Stress
180,Tyr/Trp/Phe,False,-0.0044717434695774,TyrR/TrpR/Trp-tRNA,Aromatic amino acid biosynthesis and transport,Amino Acid Metabolism
120,yoaI,False,-0.0043209633998527,,Unknown,Unknown
184,pts KO,False,-0.0041995445303615,,ptsHI/crr KO and compensatory regulatory changes,Carbon Metabolism
135,Cysteine-1,False,0.0041774469028443,CysB,"Cysteine biosynthesis, sulfate assimilation",Amino Acid Metabolism
173,IS Elements-1,False,0.0041077541610422,,Unknown,Unknown
49,BasR,False,-0.0040049649992274,BasR,Lipid A modification and polymixin resistance in the presence of excess iron,Extracellular Structures
68,Cellulose,False,-0.0039800298749175,,Cellulose biosynthesis; biofilm formation; membrane/periplasmic proteins,Extracellular Structures
2,ygdT,False,0.00396387188786,,Unknown,Unknown
40,IS1,False,-0.0038623514702194,,IS1 transcripts,Unknown
117,Fnr-3,False,0.0037913291945242,Fnr,Anaerobic growth,Energy Metabolism
199,Ile/Val,False,-0.0035754671161536,,Isoleucine and valine biosynthesis,Amino Acid Metabolism
103,Tryptophan,False,0.0035629073207519,TrpR+Trp-tRNA,Tryptophan transport and biosynthesis,Amino Acid Metabolism
163,CP4-44,False,0.0034621246758507,,CP4-44 prophage expression variation,Prophage
57,ypaB,False,0.0034195597299042,,Unknown,Unknown
121,Gluconate,False,-0.0033327559870969,GntR+Crp,Gluconate transport and catabolism (Entner-Doudoroff),Carbon Metabolism
42,Biotin,False,-0.0032985055994167,BirA,Biotin biosynthesis,Cofactor Metabolism
81,crp KO-1,False,-0.003272282311295,,crp KO and compensatory regulatory changes,Carbon Metabolism
156,Fnr-2,False,0.0032235389107738,Fnr,Transition from aerobic to anaerobic growth; global control of anaerobiosis,Energy Metabolism
145,ppGpp,False,-0.0032189957691553,ppGpp,Stringent response,Global Stress
4,FlhDC-2,False,-0.0032091856882297,FlhDC,Flagellum biosynthesis and export,Extracellular Structures
22,SoxS,False,-0.0031702165182555,SoxS,"Superoxide/nitric oxide sensing and removal, protection from organic solvents and antibiotics",Redox Stress
33,Curli-2,False,0.0031528548862356,RpoS+FliZ+CpxR+CsgD+BtsR,Curli secretion and assembly,Extracellular Structures
55,ykgR,False,-0.0031342808118771,,Unknown,Unknown
25,Lrp,False,-0.0031009802660797,Lrp,"Global regulation of amino acid biosynthesis/catabolism, stationary phase, nutrient transport, pili synthesis, 1-carbon metabolism",Amino Acid Metabolism
32,CpxR,False,-0.0030964463743482,CpxR,"Inner membrane damage sensing and repair via protein folding/degradation, chemotaxis, drug efflux, DNA repair, motility",Envelope Stress
157,Microaerobic,False,0.0030889410227168,RpoS+Fis+NarP+NarL+AppY+YdeO+ArcA+IscR,Hydrogenase 1 and cytochrome bd-II ubiquinol oxidase: microaerobic respiratory chain between hydrogen and oxygen,Energy Metabolism
18,Methionine,False,-0.0030879414754402,MetJ,Methionine transport and biosynthesis,Amino Acid Metabolism
67,RpoE,False,-0.0029629197395732,RpoE,Heat shock response; response to high temperature and/or misfolded membrane/periplasmic proteins,Temperature Shock
193,cyoB/ndh/nuoB KO-2,False,0.0029047140754745,,cyoB/ndh/nuoB KOs,Energy Metabolism
175,Hot TALE 16,False,0.0027794123549822,,Regulatory changes under high temperature,Unknown
52,lsrB KO,False,-0.0026114241309111,,lsrB KO and compensatory regulatory changes,Quorum Sensing
65,NRZ,False,-0.0026018304598156,OmpR,Nitrate reduction under microaerobic condition; aerobic to anaerobic transition,Energy Metabolism
11,Histidine,False,-0.0025667984333159,His-tRNA+DksA,Histidine biosynthesis,Amino Acid Metabolism
28,ldrA,False,-0.0025360781733845,,Unknown,Unknown
153,arcA/luxS KO,False,0.0024984711171841,,arcA KO,Energy Metabolism
26,baeR KO,False,0.0024944883112044,,baeR KO,Envelope Stress
29,Quorum Sensing,False,0.0023422792487536,Crp+LsrR,"Quorum sensing via autoinducer 2, biofilm architecture, foreign DNA stress response; lsrR KO",Quorum Sensing
128,FliA,False,0.0023337314133817,FliA,"Sigma 28; flagellum biosynthesis and export, motility",Extracellular Structures
161,PAL Amp,False,-0.0023159682816353,,Unknown,Unknown
50,Sulfoquinovose,False,-0.0022080658901529,CsqR,Sulfoquinovose transport and catabolism,Carbon Metabolism
131,efeU Activation,False,-0.0021968609523787,,efeU re-activation and associated efeU ALE-related expression changes,Metal Homeostasis
19,Sorbitol,False,-0.002153318354014,SrlR+GutM+Crp+H-NS,Sorbitol transport and catabolism,Carbon Metabolism
114,GlcNAc,False,0.0021474311547883,NagC+Crp,"Amino sugar transport, biosynthesis and catabolism",Carbon Metabolism
73,trxC Del,False,0.002067840503024,,Unknown,Unknown
170,Purine,False,0.001956906405623,PurR+ppGpp,Purine transport and biosynthesis,Nucleotide Metabolism
95,Ribose,False,0.00195330412747,dsrA+Crp+RbsR,Ribose transport and catabolism,Carbon Metabolism
9,ROS TALE Amp,False,0.0017863698534679,,Amplification of DLP12/IS3,Unknown
98,ymiB,False,-0.0017381948582874,,Unknown,Unknown
125,Membrane,False,0.0015159927602598,,"Membrane-related stress response regulators, transporters, multidrug resistance",Envelope Stress
126,Thiamine-1,False,-0.0015089818353484,Thiamine diphosphate,Thiamine uptake and biosynthesis,Cofactor Metabolism
74,ArcA,False,0.001459875672299,ArcA,Anaerobiosis; repression of aerobic growth genes during anaerobic growth,Energy Metabolism
122,UC-9,False,0.0014515627322099,,Unknown,Unknown
8,yqhI,False,-0.0014392734723512,,Unknown,Unknown
154,sdh KO,False,-0.0014135987220929,,sdh KO,Carbon Metabolism
104,FHL,False,-0.0013749891428006,RpoN+NsrR+ModE+IHF+FhlA,Formate hydrogenlyase: hydrogen production during glucose fermentation via formate oxidation/proton reduction,Energy Metabolism
181,GadX,False,-0.0013489099160564,RpoS+GadX,Glutamate-dependent acid resistance system; multidrug efflux,Envelope Stress
150,Nickel/Cobalt,False,-0.0012995891301363,RcnR,Nickel and cobalt resistance via efflux,Metal Homeostasis
10,Nucleotide Stress,False,0.0012773801523587,,DNA repair; stringent response signaling via ppGpp; ribosomal biogenesis and stability,DNA Damage
47,Biofilm,False,-0.0012582116749048,RpoS+ppGpp+BluR+MarA,"Biofilm formation, acid resistance, cold shock response",Extracellular Structures
38,EvgA,False,-0.0011902223638341,EvgA,"Glutamate-dependent acid response, drug resistance, alkali metals response",Envelope Stress
102,Thr/Ser-1,False,0.0011394582055217,TdcA+TdcR+IHF+Fnr+Crp,Threonine/serine transport and catabolism during anaerobiosis,Amino Acid Metabolism
107,ypjJ,False,-0.0011223871177037,,Unknown,Unknown
148,LPS,False,0.0010753794491508,,Lipopolysaccharide biosynthesis and export,Extracellular Structures
96,Dipeptide,False,-0.0010390369387932,gcvB+IHF+Fnr,Dipeptide transport; flagellar biosynthesis,Amino Acid Metabolism
136,Pyruvate-2,False,-0.0010210112804753,PyrR,Pyruvate sensing and transport,Carbon Metabolism
39,Xylose,False,0.0009773682976761,Crp+XylR,d-Xylose transport and catabolism,Carbon Metabolism
106,BW25113,False,0.0009658667947068,,Accounts for genomic differences between BW25113 and MG1655 substrains,Strain Difference
165,GadXW,False,0.0009186326194505,GadX+GadW,Glutamate-dependent acid resistance system; multidrug efflux,Envelope Stress
187,entC/ubiC KO-2,False,-0.0009017067500369,,entC/ubiC KO and compensatory sad up-regulation,Energy Metabolism
99,yjjZ,False,-0.0007401798904862,,Unknown,Unknown
94,NtrC-1,False,-0.0006881170087082,RpoN+RpoS+NtrC,"Nitrogen assimilation, ammonium transport",Nitrogen Metabolism
69,Phosphate-1,False,-0.0006237322568299,PhoB,"Inorganic phosphate sensing, transport, and production",Phosphate Metabolism
158,Cysteine-2,False,0.0006133322667278,CysB,"Cysteine biosynthesis, sulfate assimilation",Amino Acid Metabolism
7,Sialic Acid,False,-0.0005401738989128,Crp+NanR,N-acetyl-neuraminic acid (or sialic acid) transport and metabolism,Carbon Metabolism
63,Pyrimidine,False,0.0005149805131462,PurR/UTP,Pyrimidine transport and biosynthesis,Nucleotide Metabolism
123,Copper,False,-0.0004560241192208,CusR/CueR/HprR,Copper/silver sensing and export,Metal Homeostasis
139,Capsule,False,0.0004286479118414,RcsAB,Colanic acid capsule synthesis and transport; periplasmic proteins; envelope stress response,Extracellular Structures
174,Cra,False,0.000403672330914,Cra,Central carbon metabolism; glycolytic flux-dependent regulation via fructose sensing,Carbon Metabolism
167,UC-2,False,0.0003939077754812,,Unknown,Unknown
17,Zinc-1,False,0.0003562473095385,Zur/ZntR/CueR,Zinc sensing and uptake; copper sensing and export,Metal Homeostasis
82,SSW SNPs,False,-0.0003150383063443,,Unknown,ALE Effects
186,Glutarate,False,0.0003100049422663,RpoS+H-NS+Crp+Lrp+GlaR+ppGpp,Glutarate/aminobutyrate transport and catabolism,Carbon Metabolism
5,Osmoprotectant,False,-0.0003098032225219,RpoS+ppGpp+IHF+H-NS,Transport of osmoprotectant glycine betaine,Envelope Stress
70,Salicylic Acid,False,0.0002963662396397,,Salicylic acid efflux,Redox Stress
86,UC-3,False,0.0002881597993282,,Unknown,Unknown
51,RpoS,False,0.0002826391502264,RpoS,Master regulator of global stress response,Global Stress
118,ythA,False,0.0002582377735729,,Unknown,Unknown
110,SCFA,False,0.0002129979647838,RpoN+AtoC+IHF,Short-chain fatty acid (acetoacetate) transport and catabolism,Carbon Metabolism
101,e14 Del,False,-0.0001760460603294,,Unknown,Unknown
30,IS Elements-2,False,-8.255104926321535e-05,,Unknown,Unknown
27,ydaG,False,8.072535043992641e-05,,Unknown,Unknown
115,YgbI,False,6.614008355589037e-05,YgbI,Tartrate transport and catabolism,Carbon Metabolism
