k,name,in_iM,gene_weight,regulator,function,category
189,UC-7,True,-0.0801672502757531,,Unknown,Unknown
51,RpoS,True,0.0773400921536186,RpoS,Master regulator of global stress response,Global Stress
89,UC-6,False,0.072333931520952,,Unknown,Unknown
181,GadX,False,0.0340052785223399,RpoS+GadX,Glutamate-dependent acid resistance system; multidrug efflux,Envelope Stress
109,Flagella,False,0.030255947809672,,Flagellar biosynthesis,Extracellular Structures
66,nquinone ALE 3,False,-0.0257776100564548,,ubiC KO and associated adaptive regulatory changes,Energy Metabolism
176,Suf System,False,0.0227178673262233,NsrR+IHF+IscR+OxyR+Fur+ppGpp,Iron-sulfur cluster biosynthesis and insertion,Metal Homeostasis
192,crp KO-2,False,-0.0223871157186753,,crp KO and associated glycerol-3-phosphate (GlpR) regulatory changes,Carbon Metabolism
92,Crp-1,False,-0.0217733782669393,Crp,Miscellaneous carbon source metabolism,Carbon Metabolism
47,Biofilm,False,0.0208490864812135,RpoS+ppGpp+BluR+MarA,"Biofilm formation, acid resistance, cold shock response",Extracellular Structures
6,Glutamine,False,-0.0205655906922468,NtrC,Glutamine transport and synthesis,Nitrogen Metabolism
41,pgi KO,False,0.0202552386125957,,pgi KO,Carbon Metabolism
164,minicoli KOs,False,0.0198680446271278,,Deletions from minicoli strain,Genome Reduction
132,rcsB KO,False,-0.0188590712949738,,rcsB KO and associated regulatory changes,Envelope Stress
8,yqhI,False,0.0188298143687522,,Unknown,Unknown
199,Ile/Val,False,-0.0188166683992746,,Isoleucine and valine biosynthesis,Amino Acid Metabolism
102,Thr/Ser-1,False,-0.0177914329439187,TdcA+TdcR+IHF+Fnr+Crp,Threonine/serine transport and catabolism during anaerobiosis,Amino Acid Metabolism
53,UC-1,False,0.0167141060024629,,Unknown,Unknown
81,crp KO-1,False,-0.0165011881507647,,crp KO and compensatory regulatory changes,Carbon Metabolism
169,NrdR,False,0.0163789018663964,NrdR,Ribonucleoside reduction,Nucleotide Metabolism
10,Nucleotide Stress,False,0.0159463077982324,,DNA repair; stringent response signaling via ppGpp; ribosomal biogenesis and stability,DNA Damage
24,YjfJ,False,0.0158173511521462,YjfJ,Putative heat responsive regulon,Temperature Shock
12,UC-4,False,-0.01536143839467,,Unknown,Unknown
32,CpxR,False,0.0152106824098689,CpxR,"Inner membrane damage sensing and repair via protein folding/degradation, chemotaxis, drug efflux, DNA repair, motility",Envelope Stress
190,Efflux Pump,False,0.0147555282962976,,Multidrug/spermidine efflux pump,Resistance
3,OxyR,False,-0.0143484931885935,OxyR,"Oxidative stress response, especially peroxide",Redox Stress
84,NtrC-2,False,0.0141739872237487,NtrC+RpoN,"Nitrogen assimilation, ammonium transport",Nitrogen Metabolism
197,CCK-PGI Del,False,0.0141192207227557,,Unknown,Unknown
178,NO Stress,False,0.0132981200316518,NsrR/NarP,"Nitric oxide sensing and detoxification, iron-sulfur cluster repair, anaerobic growth",Redox Stress
49,BasR,False,-0.013267583129995,BasR,Lipid A modification and polymixin resistance in the presence of excess iron,Extracellular Structures
196,Glyoxylate,False,-0.0132400213017777,Crp+ArcA+ppGpp+Cra+IclR+IHF,Glyxoylate cycle; alternate to TCA cycle,Energy Metabolism
200,UC-8,False,-0.0131572301429798,,Unknown,Unknown
136,Pyruvate-2,False,0.0131064989431867,PyrR,Pyruvate sensing and transport,Carbon Metabolism
36,cydB/appC KO,False,-0.0130792865845563,,cydB/appC KO and compensatory regulatory changes,Energy Metabolism
151,IS5,False,0.0128690275551051,,IS5 transcripts,Unknown
175,Hot TALE 16,False,0.0123964372717582,,Regulatory changes under high temperature,Unknown
96,Dipeptide,False,-0.0123858992371571,gcvB+IHF+Fnr,Dipeptide transport; flagellar biosynthesis,Amino Acid Metabolism
104,FHL,False,-0.0121147234906277,RpoN+NsrR+ModE+IHF+FhlA,Formate hydrogenlyase: hydrogen production during glucose fermentation via formate oxidation/proton reduction,Energy Metabolism
156,Fnr-2,False,-0.011850075055824,Fnr,Transition from aerobic to anaerobic growth; global control of anaerobiosis,Energy Metabolism
97,Curli-1,False,0.0115962521970203,RpoS+FliZ+CpxR+CsgD+BtsR,Curli secretion and assembly,Extracellular Structures
73,trxC Del,False,0.0112504934265119,,Unknown,Unknown
131,efeU Activation,False,-0.0109812315758643,,efeU re-activation and associated efeU ALE-related expression changes,Metal Homeostasis
28,ldrA,False,0.0107660948105725,,Unknown,Unknown
141,ROS TALE Del-2,False,0.0107457561515277,,Unknown,Unknown
170,Purine,False,-0.0107141329374031,PurR+ppGpp,Purine transport and biosynthesis,Nucleotide Metabolism
173,IS Elements-1,False,-0.0105941065422181,,Unknown,Unknown
115,YgbI,False,0.0105690189185808,YgbI,Tartrate transport and catabolism,Carbon Metabolism
167,UC-2,False,-0.0105477350533177,,Unknown,Unknown
121,Gluconate,False,0.0103232319319213,GntR+Crp,Gluconate transport and catabolism (Entner-Doudoroff),Carbon Metabolism
85,DNA Damage,False,0.0100459903993528,LexA,SOS response to DNA damage or inhibition of DNA replication,DNA Damage
63,Pyrimidine,False,0.0099443926041649,PurR/UTP,Pyrimidine transport and biosynthesis,Nucleotide Metabolism
98,ymiB,False,0.0098024984426324,,Unknown,Unknown
168,ydfB,False,0.0097791051742174,,Unknown,Unknown
90,Leu/Val/Ile,False,-0.0097123107493053,Lrp+IHF+Ile-tRNA+Leu-tRNA+Val-tRNA+ppGpp,Branched-chain amino acid biosynthesis,Amino Acid Metabolism
75,yceO,False,-0.0097002249341723,,Unknown,Unknown
64,Zinc-2,False,0.0096917295380977,ZraR,Tolerance to high zinc concentration,Metal Homeostasis
100,Molybdenum,False,-0.0092846711917255,Crp+FliA+ModE,Molybdenum transport and molybdoenzyme synthesis,Metal Homeostasis
135,Cysteine-1,False,0.0092117859343234,CysB,"Cysteine biosynthesis, sulfate assimilation",Amino Acid Metabolism
111,YgeV,False,0.0091663323935562,YgeV,Nucleoside degradation activated by ethanol treatment,Carbon Metabolism
45,Resistance,False,0.0090243273456734,,Multidrug resistance; stress response to harmful compounds/antibiotics,Envelope Stress
88,Nitrogen,False,-0.0088200497174916,Nac,Nitrogen metabolism under nitrogen limitation,Nitrogen Metabolism
56,Sulfate,False,-0.0087992985307442,Cbl+CysB,Cysteine transport and biosynthesis; aliphatic sulfonate utilization and homeostatic response to sulfate starvation,Amino Acid Metabolism
194,tpiA KO,False,-0.0086715493975248,,tpiA KO and compensatory evolved regulatory changes,Carbon Metabolism
26,baeR KO,False,0.008417392430184,,baeR KO,Envelope Stress
7,Sialic Acid,False,0.0083580928654964,Crp+NanR,N-acetyl-neuraminic acid (or sialic acid) transport and metabolism,Carbon Metabolism
130,ldrD,False,-0.0083197751164034,,Unknown,Unknown
113,FDH-O,False,-0.0079303359211881,sdhX,Formate dehydrogenase O; formate to carbon dioxide oxidation; formate-nitrate electron transport during aerobic/anerobic shift,Energy Metabolism
145,ppGpp,False,-0.007914227995879,ppGpp,Stringent response,Global Stress
83,yafF,False,0.0077824409775329,,Unknown,Unknown
116,Lysine/T2SS,False,0.0076590049815493,ArgP,Lysine transport and biosynthesis; type II secretion system,Amino Acid Metabolism
58,Fur-2,False,-0.0076248626939839,Fur,"Iron sensing and uptake, enterobactin biosynthesis, iron-sulfur cluster activation, iron sequestration",Metal Homeostasis
80,Thiamine-2,False,-0.0075478561811737,,Thiamine uptake and biosynthesis,Cofactor Metabolism
114,GlcNAc,False,-0.0073405767396213,NagC+Crp,"Amino sugar transport, biosynthesis and catabolism",Carbon Metabolism
184,pts KO,False,0.0072437687062204,,ptsHI/crr KO and compensatory regulatory changes,Carbon Metabolism
137,Phosphate-2,False,-0.0071690989033591,PhoB,"Inorganic phosphate sensing, transport, and production",Phosphate Metabolism
31,Nickel,False,-0.0070529468125613,RpoN+NarL+NikR+Fnr,Nickel sensing and uptake,Metal Homeostasis
180,Tyr/Trp/Phe,False,-0.0069064837809701,TyrR/TrpR/Trp-tRNA,Aromatic amino acid biosynthesis and transport,Amino Acid Metabolism
191,Tryptophanase,False,0.0068430290573676,Crp+TorR+Nac+L-tryptophan,Tryptophan import and catabolism via tryptophanase; indole/pyruvate biosynthesis,Amino Acid Metabolism
162,Propionate,False,0.0068120570306488,PrpR+RpoN+Cra+Crp,Propionate catabolism; 2-methylcitric acid cycle,Carbon Metabolism
23,thrA KO,False,-0.006769538781981,,thrA KO and compensatory transcriptional changes,Amino Acid Metabolism
182,Fatty Acid,False,-0.0067556583873483,FadR,Fatty acid degradation and biosynthesis,Carbon Metabolism
40,IS1,False,0.0067100485248952,,IS1 transcripts,Unknown
195,Phage Shock,False,-0.0066445878366752,RpoN+IHF+PspF,Phage shock response; response to filamentous phage infection and/or extracytoplasmic shock,Phage Shock
34,Acid Shock RNA,False,0.0066047238402149,,Very low pH-responsive acid shock polypeptide,Acid Stress
163,CP4-44,False,0.0065425231647256,,CP4-44 prophage expression variation,Prophage
149,Arginine,False,-0.0062674457312009,ArgR,Arginine transport and biosynthesis,Amino Acid Metabolism
118,ythA,False,-0.0062358885337952,,Unknown,Unknown
43,N Reduction,False,0.0061914572478353,FlhDC+ModE+NarP+NarL+Fnr,"Electron transfer via nitrate reductases (periplasmic and A), cytochrome c",Energy Metabolism
157,Microaerobic,False,0.0061855268676877,RpoS+Fis+NarP+NarL+AppY+YdeO+ArcA+IscR,Hydrogenase 1 and cytochrome bd-II ubiquinol oxidase: microaerobic respiratory chain between hydrogen and oxygen,Energy Metabolism
65,NRZ,False,0.0060512114139254,OmpR,Nitrate reduction under microaerobic condition; aerobic to anaerobic transition,Energy Metabolism
122,UC-9,False,-0.0060438015282196,,Unknown,Unknown
160,YcjW,False,-0.0059833637568255,YcjW,Carbohydrate transport and catabolism,Carbon Metabolism
155,YmfT,False,-0.0059083270149351,YmfT,e14 prophage regulator activated by DNA damage,DNA Damage
74,ArcA,False,-0.0059034458913302,ArcA,Anaerobiosis; repression of aerobic growth genes during anaerobic growth,Energy Metabolism
187,entC/ubiC KO-2,False,-0.0057552770690479,,entC/ubiC KO and compensatory sad up-regulation,Energy Metabolism
79,Isc System,False,0.0055479572902619,ryhB/IscR,Iron-sulfur cluster biogenesis and insertion,Cofactor Metabolism
35,FucR/ExuR,False,0.005413704414771,FucR/ExuR,Fucose/galacturonate/glucuronate transport and catabolism,Carbon Metabolism
112,pts ALE,False,0.0053078963112987,,ptsHIcrr KO and associated adaptive regulatory changes,Energy Metabolism
188,Oxidoreductase,False,-0.0052721619809608,,Putative oxidoreductase components,Redox Stress
179,Maltose,False,0.0052639661388901,MalT,Maltose transport and catabolism,Carbon Metabolism
55,ykgR,False,-0.0051800401519695,,Unknown,Unknown
171,cyoB/ndh/nuoB KO-1,False,0.0050433132226797,,NDH-1 (nuoB) KO and compensatory NDH-2 (ndh) up-regulation,Energy Metabolism
172,Fimbriae,False,-0.0048211524023526,QseB+IHF+Lrp+H-NS,Type 1 (mannose-sensitive) pili/fimbriae biosynthesis and secretion,Extracellular Structures
165,GadXW,False,-0.004686786653599,GadX+GadW,Glutamate-dependent acid resistance system; multidrug efflux,Envelope Stress
42,Biotin,False,0.0046501443898747,BirA,Biotin biosynthesis,Cofactor Metabolism
128,FliA,False,-0.0046204585547547,FliA,"Sigma 28; flagellum biosynthesis and export, motility",Extracellular Structures
133,malE OE,False,-0.0045699898477072,,Accounts for malE plasmid overexpression,Carbon Metabolism
193,cyoB/ndh/nuoB KO-2,False,-0.0045574730799443,,cyoB/ndh/nuoB KOs,Energy Metabolism
46,PAL 10 Del,False,-0.0045377051737232,,Unknown,Unknown
52,lsrB KO,False,0.0044194319220738,,lsrB KO and compensatory regulatory changes,Quorum Sensing
22,SoxS,False,-0.0043659621960245,SoxS,"Superoxide/nitric oxide sensing and removal, protection from organic solvents and antibiotics",Redox Stress
19,Sorbitol,False,0.0043593868362045,SrlR+GutM+Crp+H-NS,Sorbitol transport and catabolism,Carbon Metabolism
11,Histidine,False,-0.0043321604089432,His-tRNA+DksA,Histidine biosynthesis,Amino Acid Metabolism
142,UC-5,False,-0.004320738489765,,Unknown,Unknown
110,SCFA,False,-0.0042963987276977,RpoN+AtoC+IHF,Short-chain fatty acid (acetoacetate) transport and catabolism,Carbon Metabolism
29,Quorum Sensing,False,0.0041613149897491,Crp+LsrR,"Quorum sensing via autoinducer 2, biofilm architecture, foreign DNA stress response; lsrR KO",Quorum Sensing
159,ydfW,False,-0.004129488113286,,Unknown,Unknown
120,yoaI,False,0.0040313723586908,,Unknown,Unknown
144,Putrescine,False,0.0040291774770052,RpoS+ArcA+PuuR,Putrescine transport and catabolism,Nitrogen Metabolism
27,ydaG,False,-0.0040198307459481,,Unknown,Unknown
48,Cytochrome c,False,0.003981063333771,FlhDC+IHF+NsrR+NarL+NarP+Fis+Fnr,Cytochrome c-552 and putative cytochrome c-related proteins,Energy Metabolism
105,Glycine,False,-0.0039779237382406,PurR+Fnr+ppGpp+Crp+Lrp+GcvA,Glycine cleavage system,Amino Acid Metabolism
185,gcvB,False,-0.0039514960575737,gcvB,Amino acid transport,Amino Acid Metabolism
91,NDH-1,False,0.0039365360860666,NarL+ArcA+IHF+Fnr+Fis+ryhB,"NADH:ubiquinone oxidoreductase I: electron transfer from NADH to quinone pool, proton electrochemical gradient generation for aerobic and anaerobic respiration",Energy Metabolism
77,ROS TALE Del-1,False,0.0037567477007069,,Unknown,Unknown
99,yjjZ,False,-0.0037339003614383,,Unknown,Unknown
152,NtrC-3,False,-0.0035633133040514,NtrC+RpoN,"Nitrogen assimilation, pyrimidine transport and catabolism",Nitrogen Metabolism
5,Osmoprotectant,False,0.0034489159978228,RpoS+ppGpp+IHF+H-NS,Transport of osmoprotectant glycine betaine,Envelope Stress
87,YieP,False,-0.0033264927689885,YieP,"Cellular membrane synthesis and stress response, 3-hydroxypropanoate tolerance",Envelope Stress
21,Nucleoside,False,0.0033108475153159,Crp+CytR,Transport and utilization of ribonucleosides and deoxyribonucleosides,Nucleotide Metabolism
94,NtrC-1,False,-0.0032291342382575,RpoN+RpoS+NtrC,"Nitrogen assimilation, ammonium transport",Nitrogen Metabolism
15,ldrC,False,0.0032138974855073,,Unknown,Unknown
68,Cellulose,False,-0.0031790111327461,,Cellulose biosynthesis; biofilm formation; membrane/periplasmic proteins,Extracellular Structures
138,Leucine,False,0.0030737963019928,LeuO+Leu-tRNA+ppGpp,Leucine biosynthesis,Amino Acid Metabolism
103,Tryptophan,False,-0.0030195929231944,TrpR+Trp-tRNA,Tryptophan transport and biosynthesis,Amino Acid Metabolism
143,FlhDC-1,False,0.0029572708153544,FlhDC,Flagellum biosynthesis and export,Extracellular Structures
153,arcA/luxS KO,False,0.0029567961434638,,arcA KO,Energy Metabolism
146,Glycolate,False,-0.0029415727907341,IHF+ArcA+PdhR+GlcC,Glycolate/glyoxylate tranport and catabolism,Carbon Metabolism
183,DhaR,False,-0.0028730487953025,DhaR,Dihydroxyacetone transport and catabolism; phosphotransferase activity for DhaM phosphorylation,Carbon Metabolism
127,Cold Shock,False,-0.0027156623032744,,Cold shock proteins,Temperature Shock
150,Nickel/Cobalt,False,-0.0025710741896469,RcnR,Nickel and cobalt resistance via efflux,Metal Homeostasis
44,FDH-N/NRA,False,-0.0025141387729716,NarL+Fnr,Anaerobic growth on nitrate; formate-to-nitrate electron transfer via formate dehydrogenase N and nitrate reductase A,Energy Metabolism
33,Curli-2,False,-0.0025010714393827,RpoS+FliZ+CpxR+CsgD+BtsR,Curli secretion and assembly,Extracellular Structures
54,Fur-1,False,0.0024544929612483,Fur,"Iron sensing and uptake, enterobactin biosynthesis, iron-sulfur cluster activation, iron sequestration",Metal Homeostasis
17,Zinc-1,False,-0.0022930396145458,Zur/ZntR/CueR,Zinc sensing and uptake; copper sensing and export,Metal Homeostasis
108,PaaX,False,0.0022859412412342,Crp+IHF+PaaX+SlyA,Phenylacetic acid transport and catabolism,Carbon Metabolism
148,LPS,False,0.0022721637080083,,Lipopolysaccharide biosynthesis and export,Extracellular Structures
25,Lrp,False,-0.0022372872621019,Lrp,"Global regulation of amino acid biosynthesis/catabolism, stationary phase, nutrient transport, pili synthesis, 1-carbon metabolism",Amino Acid Metabolism
177,PlaR,False,-0.0022240754215774,PlaR+RpoE+Crp+IHF,Plant-derived sugars transport and catabolism,Carbon Metabolism
106,BW25113,False,0.002218552719783,,Accounts for genomic differences between BW25113 and MG1655 substrains,Strain Difference
60,Nitrate/Nitrite,False,-0.0021836550025836,NarL+Fnr,Nitrate/nitrite transport and reduction,Nitrogen Metabolism
117,Fnr-3,False,0.0021166927172645,Fnr,Anaerobic growth,Energy Metabolism
76,Potassium,False,0.0020959170385964,KdpE,Potassium sensing and transport,Metal Homeostasis
147,PAL 26 Del,False,-0.0020874634330808,,Unknown,Unknown
0,Sugar Diacid,False,-0.0019625072809384,CdaR,Transport and catabolism of carbohydrate diacids (galacatarate and glucarate),Carbon Metabolism
78,cyoB/kdpE/qseB KO,False,0.0019469378662252,,cyoB/kdpE/qseF KO,Energy Metabolism
129,Pyruvate-1,False,0.0019360423872929,BtsR,"Pyruvate sensing, transport, and catabolism under nutrient limitation",Carbon Metabolism
101,e14 Del,False,0.0018753196020032,,Unknown,Unknown
13,RpoH,False,-0.0018038053215101,RpoH,Global heat shock response during log-phase; response to high temperature and/or misfolded proteins,Temperature Shock
2,ygdT,False,-0.0017182863887804,,Unknown,Unknown
161,PAL Amp,False,-0.0016882279784354,,Unknown,Unknown
107,ypjJ,False,0.0016666923560462,,Unknown,Unknown
124,Thr/Ser-2,False,-0.001644745926844,Fnr+Crp+IHF+TdcA+TdcR,Threonine/serine transport and catabolism,Amino Acid Metabolism
59,Magnesium,False,0.0015298460113696,PhoP,Magnesium sensing and transport; magnesium-limitation response,Metal Homeostasis
57,ypaB,False,0.0015201773930666,,Unknown,Unknown
18,Methionine,False,-0.0015072685523631,MetJ,Methionine transport and biosynthesis,Amino Acid Metabolism
123,Copper,False,-0.0014676427139395,CusR/CueR/HprR,Copper/silver sensing and export,Metal Homeostasis
126,Thiamine-1,False,-0.0014563217110549,Thiamine diphosphate,Thiamine uptake and biosynthesis,Cofactor Metabolism
1,Translation,False,-0.0014480060073906,DksA,Ribosome biogenesis,Translation
62,Fnr-1,False,-0.0014322741924016,Fnr,Transition from aerobic to anaerobic growth; anaerobic reductase and hydrogenase activity,Energy Metabolism
30,IS Elements-2,False,0.0013480727524229,,Unknown,Unknown
140,ytiC,False,-0.0012666734572519,,Unknown,Unknown
69,Phosphate-1,False,0.0012317725307723,PhoB,"Inorganic phosphate sensing, transport, and production",Phosphate Metabolism
14,FucR/AllR/AraC,False,-0.0012162766669473,FucR/AllR/AraC,Allantoin/glycolate/glyoxylate/arabinose/fucose transport and catabolism,Nitrogen Metabolism
93,yneP,False,0.0011692340612591,,Unknown,Unknown
9,ROS TALE Amp,False,-0.0011638358023116,,Amplification of DLP12/IS3,Unknown
37,ymdG,False,0.001144484087904,,Unknown,Unknown
95,Ribose,False,0.0011017239475436,dsrA+Crp+RbsR,Ribose transport and catabolism,Carbon Metabolism
71,ymgI,False,-0.0010942078814175,,Unknown,Unknown
16,Ferric Citrate,False,0.0010522253754804,PdhR+HypT+Nac+Crp+Fur+FecI,Ferric citrate transporter; iron uptake under intracellular limitation,Metal Homeostasis
82,SSW SNPs,False,0.0010178066044166,,Unknown,ALE Effects
154,sdh KO,False,-0.0010161667290065,,sdh KO,Carbon Metabolism
61,glrR KO,False,-0.0009477431141761,,glrR (aka qseF) KO; xylose transport and catabolism,Envelope Stress
67,RpoE,False,-0.0009316698258409,RpoE,Heat shock response; response to high temperature and/or misfolded membrane/periplasmic proteins,Temperature Shock
38,EvgA,False,-0.0008721511828207,EvgA,"Glutamate-dependent acid response, drug resistance, alkali metals response",Envelope Stress
166,Rhamnose,False,-0.0008315645539391,Crp+RhaS,Rhamnose transport and catabolism,Carbon Metabolism
4,FlhDC-2,False,-0.0008002333066147,FlhDC,Flagellum biosynthesis and export,Extracellular Structures
186,Glutarate,False,-0.0007876064610097,RpoS+H-NS+Crp+Lrp+GlaR+ppGpp,Glutarate/aminobutyrate transport and catabolism,Carbon Metabolism
86,UC-3,False,-0.0006332184908555,,Unknown,Unknown
119,entC/ubiC KO-1,False,0.0006046021565831,,entC/ubiC KO and compensatory sad up-regulation,Energy Metabolism
70,Salicylic Acid,False,-0.0005817245669286,,Salicylic acid efflux,Redox Stress
50,Sulfoquinovose,False,-0.0005339635504854,CsqR,Sulfoquinovose transport and catabolism,Carbon Metabolism
39,Xylose,False,-0.0004770687562194,Crp+XylR,d-Xylose transport and catabolism,Carbon Metabolism
72,Galactose,False,0.0004266648129009,RpoS+GalR+GalS+Crp,Galactose transport and catabolism,Carbon Metabolism
125,Membrane,False,-0.0003407139306777,,"Membrane-related stress response regulators, transporters, multidrug resistance",Envelope Stress
139,Capsule,False,0.0002478265539882,RcsAB,Colanic acid capsule synthesis and transport; periplasmic proteins; envelope stress response,Extracellular Structures
174,Cra,False,0.0002334938779538,Cra,Central carbon metabolism; glycolytic flux-dependent regulation via fructose sensing,Carbon Metabolism
198,Acetate,False,-0.0001678179430254,,Acetate uptake and catabolism; aldehyde catabolism; acetate/ethanol detoxification at stationary phase,Carbon Metabolism
20,Glycerol,False,-0.0001047043461957,Crp+GlpR,Glycerol/glycerol-3-phosphate transport and catabolism,Carbon Metabolism
158,Cysteine-2,False,-3.739948764996387e-05,CysB,"Cysteine biosynthesis, sulfate assimilation",Amino Acid Metabolism
134,Crp-2,False,-1.3131502600353668e-05,Crp,Carbohydrate transport and catabolism,Carbon Metabolism
