k,name,in_iM,gene_weight,regulator,function,category
74,ArcA,True,0.0820282684155413,ArcA,Anaerobiosis; repression of aerobic growth genes during anaerobic growth,Energy Metabolism
167,UC-2,True,0.0477033001702425,,Unknown,Unknown
66,nquinone ALE 3,False,0.0347145381321526,,ubiC KO and associated adaptive regulatory changes,Energy Metabolism
198,Acetate,False,-0.0276904131050553,,Acetate uptake and catabolism; aldehyde catabolism; acetate/ethanol detoxification at stationary phase,Carbon Metabolism
86,UC-3,False,-0.0255033071994086,,Unknown,Unknown
73,trxC Del,False,0.0248831728186853,,Unknown,Unknown
111,YgeV,False,-0.0244846595161913,YgeV,Nucleoside degradation activated by ethanol treatment,Carbon Metabolism
89,UC-6,False,0.0243171803978415,,Unknown,Unknown
112,pts ALE,False,0.0234074172602677,,ptsHIcrr KO and associated adaptive regulatory changes,Energy Metabolism
181,GadX,False,0.0224343914570078,RpoS+GadX,Glutamate-dependent acid resistance system; multidrug efflux,Envelope Stress
168,ydfB,False,-0.0214488612386547,,Unknown,Unknown
76,Potassium,False,0.0212042832313674,KdpE,Potassium sensing and transport,Metal Homeostasis
156,Fnr-2,False,-0.0208777333310467,Fnr,Transition from aerobic to anaerobic growth; global control of anaerobiosis,Energy Metabolism
59,Magnesium,False,0.0203435289500991,PhoP,Magnesium sensing and transport; magnesium-limitation response,Metal Homeostasis
8,yqhI,False,-0.0199164503842717,,Unknown,Unknown
53,UC-1,False,-0.0196090055627231,,Unknown,Unknown
186,Glutarate,False,-0.0186236576005425,RpoS+H-NS+Crp+Lrp+GlaR+ppGpp,Glutarate/aminobutyrate transport and catabolism,Carbon Metabolism
36,cydB/appC KO,False,-0.0179619620483134,,cydB/appC KO and compensatory regulatory changes,Energy Metabolism
164,minicoli KOs,False,-0.0167296926720343,,Deletions from minicoli strain,Genome Reduction
1,Translation,False,-0.0166292148270539,DksA,Ribosome biogenesis,Translation
75,yceO,False,-0.0164191584339593,,Unknown,Unknown
154,sdh KO,False,0.0159528658116611,,sdh KO,Carbon Metabolism
113,FDH-O,False,0.015647397683032,sdhX,Formate dehydrogenase O; formate to carbon dioxide oxidation; formate-nitrate electron transport during aerobic/anerobic shift,Energy Metabolism
80,Thiamine-2,False,0.0153996378612947,,Thiamine uptake and biosynthesis,Cofactor Metabolism
79,Isc System,False,0.0146095214386371,ryhB/IscR,Iron-sulfur cluster biogenesis and insertion,Cofactor Metabolism
151,IS5,False,-0.0144169720059664,,IS5 transcripts,Unknown
191,Tryptophanase,False,0.0140069517586423,Crp+TorR+Nac+L-tryptophan,Tryptophan import and catabolism via tryptophanase; indole/pyruvate biosynthesis,Amino Acid Metabolism
116,Lysine/T2SS,False,-0.0131090236594868,ArgP,Lysine transport and biosynthesis; type II secretion system,Amino Acid Metabolism
10,Nucleotide Stress,False,0.0130466185164982,,DNA repair; stringent response signaling via ppGpp; ribosomal biogenesis and stability,DNA Damage
40,IS1,False,-0.0130174694209594,,IS1 transcripts,Unknown
142,UC-5,False,-0.0128196071525122,,Unknown,Unknown
155,YmfT,False,-0.012806650430829,YmfT,e14 prophage regulator activated by DNA damage,DNA Damage
132,rcsB KO,False,0.0125254129143593,,rcsB KO and associated regulatory changes,Envelope Stress
122,UC-9,False,-0.0123618534556541,,Unknown,Unknown
34,Acid Shock RNA,False,0.0120423990453016,,Very low pH-responsive acid shock polypeptide,Acid Stress
184,pts KO,False,-0.0119653803744797,,ptsHI/crr KO and compensatory regulatory changes,Carbon Metabolism
5,Osmoprotectant,False,0.0119484688708589,RpoS+ppGpp+IHF+H-NS,Transport of osmoprotectant glycine betaine,Envelope Stress
27,ydaG,False,0.0118252983812623,,Unknown,Unknown
100,Molybdenum,False,-0.0118191751865582,Crp+FliA+ModE,Molybdenum transport and molybdoenzyme synthesis,Metal Homeostasis
188,Oxidoreductase,False,0.0118081329521241,,Putative oxidoreductase components,Redox Stress
143,FlhDC-1,False,0.0116265160257066,FlhDC,Flagellum biosynthesis and export,Extracellular Structures
166,Rhamnose,False,-0.011569626849326,Crp+RhaS,Rhamnose transport and catabolism,Carbon Metabolism
94,NtrC-1,False,0.0113694352781432,RpoN+RpoS+NtrC,"Nitrogen assimilation, ammonium transport",Nitrogen Metabolism
99,yjjZ,False,0.0110747848978511,,Unknown,Unknown
171,cyoB/ndh/nuoB KO-1,False,-0.0107578944189076,,NDH-1 (nuoB) KO and compensatory NDH-2 (ndh) up-regulation,Energy Metabolism
83,yafF,False,0.0105603948133102,,Unknown,Unknown
93,yneP,False,0.0104127273447373,,Unknown,Unknown
161,PAL Amp,False,-0.0104012808851606,,Unknown,Unknown
71,ymgI,False,0.0103178136087972,,Unknown,Unknown
153,arcA/luxS KO,False,-0.0102651019982295,,arcA KO,Energy Metabolism
49,BasR,False,-0.0102415209850489,BasR,Lipid A modification and polymixin resistance in the presence of excess iron,Extracellular Structures
60,Nitrate/Nitrite,False,-0.0102181866505676,NarL+Fnr,Nitrate/nitrite transport and reduction,Nitrogen Metabolism
187,entC/ubiC KO-2,False,-0.0099707606842223,,entC/ubiC KO and compensatory sad up-regulation,Energy Metabolism
81,crp KO-1,False,-0.0098820494185202,,crp KO and compensatory regulatory changes,Carbon Metabolism
77,ROS TALE Del-1,False,0.0092032878005897,,Unknown,Unknown
196,Glyoxylate,False,-0.0088484102315971,Crp+ArcA+ppGpp+Cra+IclR+IHF,Glyxoylate cycle; alternate to TCA cycle,Energy Metabolism
30,IS Elements-2,False,-0.0087816099834664,,Unknown,Unknown
197,CCK-PGI Del,False,0.0085186600624195,,Unknown,Unknown
108,PaaX,False,-0.0084479456060106,Crp+IHF+PaaX+SlyA,Phenylacetic acid transport and catabolism,Carbon Metabolism
98,ymiB,False,-0.0084046951583831,,Unknown,Unknown
70,Salicylic Acid,False,0.0083416794533064,,Salicylic acid efflux,Redox Stress
29,Quorum Sensing,False,-0.0081701307184719,Crp+LsrR,"Quorum sensing via autoinducer 2, biofilm architecture, foreign DNA stress response; lsrR KO",Quorum Sensing
33,Curli-2,False,-0.0081291583529385,RpoS+FliZ+CpxR+CsgD+BtsR,Curli secretion and assembly,Extracellular Structures
118,ythA,False,-0.0079701218798521,,Unknown,Unknown
67,RpoE,False,-0.0078858045028053,RpoE,Heat shock response; response to high temperature and/or misfolded membrane/periplasmic proteins,Temperature Shock
37,ymdG,False,0.0078551967416724,,Unknown,Unknown
146,Glycolate,False,-0.0077984782354718,IHF+ArcA+PdhR+GlcC,Glycolate/glyoxylate tranport and catabolism,Carbon Metabolism
39,Xylose,False,0.0076576592050132,Crp+XylR,d-Xylose transport and catabolism,Carbon Metabolism
109,Flagella,False,0.0076472491891391,,Flagellar biosynthesis,Extracellular Structures
159,ydfW,False,-0.0076213644234305,,Unknown,Unknown
106,BW25113,False,0.0075940436413772,,Accounts for genomic differences between BW25113 and MG1655 substrains,Strain Difference
176,Suf System,False,-0.0075421421488035,NsrR+IHF+IscR+OxyR+Fur+ppGpp,Iron-sulfur cluster biosynthesis and insertion,Metal Homeostasis
103,Tryptophan,False,0.0073219663565128,TrpR+Trp-tRNA,Tryptophan transport and biosynthesis,Amino Acid Metabolism
180,Tyr/Trp/Phe,False,0.007077668985015,TyrR/TrpR/Trp-tRNA,Aromatic amino acid biosynthesis and transport,Amino Acid Metabolism
195,Phage Shock,False,-0.0069552658337329,RpoN+IHF+PspF,Phage shock response; response to filamentous phage infection and/or extracytoplasmic shock,Phage Shock
147,PAL 26 Del,False,-0.0067534933271695,,Unknown,Unknown
23,thrA KO,False,-0.0067158132487277,,thrA KO and compensatory transcriptional changes,Amino Acid Metabolism
101,e14 Del,False,-0.0066808049113332,,Unknown,Unknown
165,GadXW,False,-0.0066155694843854,GadX+GadW,Glutamate-dependent acid resistance system; multidrug efflux,Envelope Stress
72,Galactose,False,0.0064500391927813,RpoS+GalR+GalS+Crp,Galactose transport and catabolism,Carbon Metabolism
131,efeU Activation,False,-0.0064393806149077,,efeU re-activation and associated efeU ALE-related expression changes,Metal Homeostasis
152,NtrC-3,False,-0.0063927518374724,NtrC+RpoN,"Nitrogen assimilation, pyrimidine transport and catabolism",Nitrogen Metabolism
14,FucR/AllR/AraC,False,0.0062840009915247,FucR/AllR/AraC,Allantoin/glycolate/glyoxylate/arabinose/fucose transport and catabolism,Nitrogen Metabolism
124,Thr/Ser-2,False,-0.0061184203290534,Fnr+Crp+IHF+TdcA+TdcR,Threonine/serine transport and catabolism,Amino Acid Metabolism
148,LPS,False,-0.0060848034842293,,Lipopolysaccharide biosynthesis and export,Extracellular Structures
46,PAL 10 Del,False,-0.0060308670863132,,Unknown,Unknown
110,SCFA,False,-0.0059810436815988,RpoN+AtoC+IHF,Short-chain fatty acid (acetoacetate) transport and catabolism,Carbon Metabolism
58,Fur-2,False,0.0059657549250299,Fur,"Iron sensing and uptake, enterobactin biosynthesis, iron-sulfur cluster activation, iron sequestration",Metal Homeostasis
183,DhaR,False,0.0058045462081319,DhaR,Dihydroxyacetone transport and catabolism; phosphotransferase activity for DhaM phosphorylation,Carbon Metabolism
126,Thiamine-1,False,-0.0057945325487704,Thiamine diphosphate,Thiamine uptake and biosynthesis,Cofactor Metabolism
41,pgi KO,False,0.0057593504180635,,pgi KO,Carbon Metabolism
88,Nitrogen,False,0.0057472368966114,Nac,Nitrogen metabolism under nitrogen limitation,Nitrogen Metabolism
150,Nickel/Cobalt,False,-0.0057017646731513,RcnR,Nickel and cobalt resistance via efflux,Metal Homeostasis
21,Nucleoside,False,-0.0056129862016817,Crp+CytR,Transport and utilization of ribonucleosides and deoxyribonucleosides,Nucleotide Metabolism
140,ytiC,False,-0.0054611563487599,,Unknown,Unknown
42,Biotin,False,0.0053531079567259,BirA,Biotin biosynthesis,Cofactor Metabolism
123,Copper,False,-0.0053064955910906,CusR/CueR/HprR,Copper/silver sensing and export,Metal Homeostasis
121,Gluconate,False,-0.0052873221853247,GntR+Crp,Gluconate transport and catabolism (Entner-Doudoroff),Carbon Metabolism
43,N Reduction,False,-0.0052191401394514,FlhDC+ModE+NarP+NarL+Fnr,"Electron transfer via nitrate reductases (periplasmic and A), cytochrome c",Energy Metabolism
50,Sulfoquinovose,False,-0.005186366341401,CsqR,Sulfoquinovose transport and catabolism,Carbon Metabolism
16,Ferric Citrate,False,-0.0051713248588403,PdhR+HypT+Nac+Crp+Fur+FecI,Ferric citrate transporter; iron uptake under intracellular limitation,Metal Homeostasis
114,GlcNAc,False,-0.005087906252428,NagC+Crp,"Amino sugar transport, biosynthesis and catabolism",Carbon Metabolism
51,RpoS,False,-0.0050214977721568,RpoS,Master regulator of global stress response,Global Stress
55,ykgR,False,0.0050101762210737,,Unknown,Unknown
200,UC-8,False,-0.0049677952344128,,Unknown,Unknown
129,Pyruvate-1,False,-0.0048207078179148,BtsR,"Pyruvate sensing, transport, and catabolism under nutrient limitation",Carbon Metabolism
192,crp KO-2,False,-0.0048013206052085,,crp KO and associated glycerol-3-phosphate (GlpR) regulatory changes,Carbon Metabolism
45,Resistance,False,0.0046542337575817,,Multidrug resistance; stress response to harmful compounds/antibiotics,Envelope Stress
85,DNA Damage,False,-0.0046132498587417,LexA,SOS response to DNA damage or inhibition of DNA replication,DNA Damage
90,Leu/Val/Ile,False,0.004545291384954,Lrp+IHF+Ile-tRNA+Leu-tRNA+Val-tRNA+ppGpp,Branched-chain amino acid biosynthesis,Amino Acid Metabolism
96,Dipeptide,False,0.0045430428662471,gcvB+IHF+Fnr,Dipeptide transport; flagellar biosynthesis,Amino Acid Metabolism
127,Cold Shock,False,0.004528816182136,,Cold shock proteins,Temperature Shock
177,PlaR,False,-0.0044981180349667,PlaR+RpoE+Crp+IHF,Plant-derived sugars transport and catabolism,Carbon Metabolism
97,Curli-1,False,0.0044246127831461,RpoS+FliZ+CpxR+CsgD+BtsR,Curli secretion and assembly,Extracellular Structures
24,YjfJ,False,0.0044165580095426,YjfJ,Putative heat responsive regulon,Temperature Shock
160,YcjW,False,-0.0043971487421931,YcjW,Carbohydrate transport and catabolism,Carbon Metabolism
141,ROS TALE Del-2,False,-0.0043485224525233,,Unknown,Unknown
6,Glutamine,False,-0.0042923383104647,NtrC,Glutamine transport and synthesis,Nitrogen Metabolism
158,Cysteine-2,False,-0.0041341184518402,CysB,"Cysteine biosynthesis, sulfate assimilation",Amino Acid Metabolism
163,CP4-44,False,-0.0040075718907735,,CP4-44 prophage expression variation,Prophage
104,FHL,False,-0.0039929465376815,RpoN+NsrR+ModE+IHF+FhlA,Formate hydrogenlyase: hydrogen production during glucose fermentation via formate oxidation/proton reduction,Energy Metabolism
144,Putrescine,False,0.0039761486275393,RpoS+ArcA+PuuR,Putrescine transport and catabolism,Nitrogen Metabolism
139,Capsule,False,-0.0039224458282458,RcsAB,Colanic acid capsule synthesis and transport; periplasmic proteins; envelope stress response,Extracellular Structures
18,Methionine,False,-0.0039053427643423,MetJ,Methionine transport and biosynthesis,Amino Acid Metabolism
22,SoxS,False,-0.0038532304021562,SoxS,"Superoxide/nitric oxide sensing and removal, protection from organic solvents and antibiotics",Redox Stress
48,Cytochrome c,False,0.0038487262409784,FlhDC+IHF+NsrR+NarL+NarP+Fis+Fnr,Cytochrome c-552 and putative cytochrome c-related proteins,Energy Metabolism
68,Cellulose,False,-0.0038092639721463,,Cellulose biosynthesis; biofilm formation; membrane/periplasmic proteins,Extracellular Structures
95,Ribose,False,-0.0038072144922263,dsrA+Crp+RbsR,Ribose transport and catabolism,Carbon Metabolism
84,NtrC-2,False,0.0037943561726596,NtrC+RpoN,"Nitrogen assimilation, ammonium transport",Nitrogen Metabolism
69,Phosphate-1,False,-0.0036565151977494,PhoB,"Inorganic phosphate sensing, transport, and production",Phosphate Metabolism
136,Pyruvate-2,False,-0.0035249610052989,PyrR,Pyruvate sensing and transport,Carbon Metabolism
175,Hot TALE 16,False,0.0035173571332695,,Regulatory changes under high temperature,Unknown
128,FliA,False,-0.0034035888191094,FliA,"Sigma 28; flagellum biosynthesis and export, motility",Extracellular Structures
133,malE OE,False,-0.0033676513497437,,Accounts for malE plasmid overexpression,Carbon Metabolism
62,Fnr-1,False,-0.0033321868774981,Fnr,Transition from aerobic to anaerobic growth; anaerobic reductase and hydrogenase activity,Energy Metabolism
2,ygdT,False,-0.0032244050131542,,Unknown,Unknown
11,Histidine,False,0.003158328345724,His-tRNA+DksA,Histidine biosynthesis,Amino Acid Metabolism
149,Arginine,False,-0.0030923378582462,ArgR,Arginine transport and biosynthesis,Amino Acid Metabolism
162,Propionate,False,-0.0030035019881263,PrpR+RpoN+Cra+Crp,Propionate catabolism; 2-methylcitric acid cycle,Carbon Metabolism
20,Glycerol,False,0.0029200793422504,Crp+GlpR,Glycerol/glycerol-3-phosphate transport and catabolism,Carbon Metabolism
0,Sugar Diacid,False,-0.0029181659197044,CdaR,Transport and catabolism of carbohydrate diacids (galacatarate and glucarate),Carbon Metabolism
63,Pyrimidine,False,0.0028973713017533,PurR/UTP,Pyrimidine transport and biosynthesis,Nucleotide Metabolism
17,Zinc-1,False,0.0028880306707067,Zur/ZntR/CueR,Zinc sensing and uptake; copper sensing and export,Metal Homeostasis
169,NrdR,False,-0.00286396519287,NrdR,Ribonucleoside reduction,Nucleotide Metabolism
31,Nickel,False,0.0028341464260119,RpoN+NarL+NikR+Fnr,Nickel sensing and uptake,Metal Homeostasis
115,YgbI,False,-0.0028122142023531,YgbI,Tartrate transport and catabolism,Carbon Metabolism
172,Fimbriae,False,0.0028089081757613,QseB+IHF+Lrp+H-NS,Type 1 (mannose-sensitive) pili/fimbriae biosynthesis and secretion,Extracellular Structures
179,Maltose,False,-0.0027690986392438,MalT,Maltose transport and catabolism,Carbon Metabolism
189,UC-7,False,-0.0027044594401791,,Unknown,Unknown
178,NO Stress,False,-0.0026916889466474,NsrR/NarP,"Nitric oxide sensing and detoxification, iron-sulfur cluster repair, anaerobic growth",Redox Stress
87,YieP,False,0.0026879601815983,YieP,"Cellular membrane synthesis and stress response, 3-hydroxypropanoate tolerance",Envelope Stress
157,Microaerobic,False,0.0024169102395488,RpoS+Fis+NarP+NarL+AppY+YdeO+ArcA+IscR,Hydrogenase 1 and cytochrome bd-II ubiquinol oxidase: microaerobic respiratory chain between hydrogen and oxygen,Energy Metabolism
120,yoaI,False,0.002392762069962,,Unknown,Unknown
190,Efflux Pump,False,-0.0023760693480555,,Multidrug/spermidine efflux pump,Resistance
174,Cra,False,0.0023266678216322,Cra,Central carbon metabolism; glycolytic flux-dependent regulation via fructose sensing,Carbon Metabolism
12,UC-4,False,0.0022564567966561,,Unknown,Unknown
38,EvgA,False,-0.0022047623749681,EvgA,"Glutamate-dependent acid response, drug resistance, alkali metals response",Envelope Stress
185,gcvB,False,-0.002127559972271,gcvB,Amino acid transport,Amino Acid Metabolism
119,entC/ubiC KO-1,False,-0.0020609457859116,,entC/ubiC KO and compensatory sad up-regulation,Energy Metabolism
193,cyoB/ndh/nuoB KO-2,False,0.002058699301569,,cyoB/ndh/nuoB KOs,Energy Metabolism
199,Ile/Val,False,0.0020284133752767,,Isoleucine and valine biosynthesis,Amino Acid Metabolism
56,Sulfate,False,-0.0018098755489754,Cbl+CysB,Cysteine transport and biosynthesis; aliphatic sulfonate utilization and homeostatic response to sulfate starvation,Amino Acid Metabolism
134,Crp-2,False,-0.0017857904161823,Crp,Carbohydrate transport and catabolism,Carbon Metabolism
64,Zinc-2,False,0.0017659668856277,ZraR,Tolerance to high zinc concentration,Metal Homeostasis
7,Sialic Acid,False,0.001763559274095,Crp+NanR,N-acetyl-neuraminic acid (or sialic acid) transport and metabolism,Carbon Metabolism
4,FlhDC-2,False,-0.0016462652562918,FlhDC,Flagellum biosynthesis and export,Extracellular Structures
182,Fatty Acid,False,-0.0015385772966424,FadR,Fatty acid degradation and biosynthesis,Carbon Metabolism
54,Fur-1,False,0.001442866717261,Fur,"Iron sensing and uptake, enterobactin biosynthesis, iron-sulfur cluster activation, iron sequestration",Metal Homeostasis
173,IS Elements-1,False,0.0013375730874597,,Unknown,Unknown
135,Cysteine-1,False,0.001280179368192,CysB,"Cysteine biosynthesis, sulfate assimilation",Amino Acid Metabolism
130,ldrD,False,0.0011966518399935,,Unknown,Unknown
32,CpxR,False,0.0011899232820088,CpxR,"Inner membrane damage sensing and repair via protein folding/degradation, chemotaxis, drug efflux, DNA repair, motility",Envelope Stress
78,cyoB/kdpE/qseB KO,False,-0.0011472558891869,,cyoB/kdpE/qseF KO,Energy Metabolism
61,glrR KO,False,-0.0011213938636089,,glrR (aka qseF) KO; xylose transport and catabolism,Envelope Stress
35,FucR/ExuR,False,-0.0010444909320105,FucR/ExuR,Fucose/galacturonate/glucuronate transport and catabolism,Carbon Metabolism
9,ROS TALE Amp,False,0.0009821230594414,,Amplification of DLP12/IS3,Unknown
102,Thr/Ser-1,False,-0.0009532513592682,TdcA+TdcR+IHF+Fnr+Crp,Threonine/serine transport and catabolism during anaerobiosis,Amino Acid Metabolism
92,Crp-1,False,-0.0009509256856002,Crp,Miscellaneous carbon source metabolism,Carbon Metabolism
65,NRZ,False,0.0009328362561379,OmpR,Nitrate reduction under microaerobic condition; aerobic to anaerobic transition,Energy Metabolism
44,FDH-N/NRA,False,0.0009261633601531,NarL+Fnr,Anaerobic growth on nitrate; formate-to-nitrate electron transfer via formate dehydrogenase N and nitrate reductase A,Energy Metabolism
15,ldrC,False,-0.0009083982890951,,Unknown,Unknown
194,tpiA KO,False,0.0009077857625415,,tpiA KO and compensatory evolved regulatory changes,Carbon Metabolism
25,Lrp,False,0.0009016898403407,Lrp,"Global regulation of amino acid biosynthesis/catabolism, stationary phase, nutrient transport, pili synthesis, 1-carbon metabolism",Amino Acid Metabolism
107,ypjJ,False,0.0008474255784366,,Unknown,Unknown
170,Purine,False,0.0008204070223001,PurR+ppGpp,Purine transport and biosynthesis,Nucleotide Metabolism
125,Membrane,False,0.0007812902610228,,"Membrane-related stress response regulators, transporters, multidrug resistance",Envelope Stress
28,ldrA,False,-0.0007658795485014,,Unknown,Unknown
26,baeR KO,False,-0.0007013289351308,,baeR KO,Envelope Stress
3,OxyR,False,-0.0006802405333254,OxyR,"Oxidative stress response, especially peroxide",Redox Stress
105,Glycine,False,-0.000605015204044,PurR+Fnr+ppGpp+Crp+Lrp+GcvA,Glycine cleavage system,Amino Acid Metabolism
137,Phosphate-2,False,0.0005958793485499,PhoB,"Inorganic phosphate sensing, transport, and production",Phosphate Metabolism
19,Sorbitol,False,0.000459262390075,SrlR+GutM+Crp+H-NS,Sorbitol transport and catabolism,Carbon Metabolism
57,ypaB,False,-0.0004385762299216,,Unknown,Unknown
91,NDH-1,False,0.0003882462011691,NarL+ArcA+IHF+Fnr+Fis+ryhB,"NADH:ubiquinone oxidoreductase I: electron transfer from NADH to quinone pool, proton electrochemical gradient generation for aerobic and anaerobic respiration",Energy Metabolism
117,Fnr-3,False,0.0003765138945221,Fnr,Anaerobic growth,Energy Metabolism
47,Biofilm,False,-0.0003726025108103,RpoS+ppGpp+BluR+MarA,"Biofilm formation, acid resistance, cold shock response",Extracellular Structures
145,ppGpp,False,0.0002211496140177,ppGpp,Stringent response,Global Stress
138,Leucine,False,0.0001781605901535,LeuO+Leu-tRNA+ppGpp,Leucine biosynthesis,Amino Acid Metabolism
13,RpoH,False,-0.000109096980578,RpoH,Global heat shock response during log-phase; response to high temperature and/or misfolded proteins,Temperature Shock
52,lsrB KO,False,8.661276038997445e-05,,lsrB KO and compensatory regulatory changes,Quorum Sensing
82,SSW SNPs,False,3.3104074348942625e-05,,Unknown,ALE Effects
