k,name,in_iM,gene_weight,regulator,function,category
199,Ile/Val,False,0.0617090909215182,,Isoleucine and valine biosynthesis,Amino Acid Metabolism
142,UC-5,False,0.0377815428237074,,Unknown,Unknown
89,UC-6,False,0.0325994641063355,,Unknown,Unknown
68,Cellulose,False,-0.0251378277448643,,Cellulose biosynthesis; biofilm formation; membrane/periplasmic proteins,Extracellular Structures
80,Thiamine-2,False,0.0249555474074532,,Thiamine uptake and biosynthesis,Cofactor Metabolism
107,ypjJ,False,0.0242247316589787,,Unknown,Unknown
161,PAL Amp,False,0.0225415768545114,,Unknown,Unknown
5,Osmoprotectant,False,0.0222491571965492,RpoS+ppGpp+IHF+H-NS,Transport of osmoprotectant glycine betaine,Envelope Stress
184,pts KO,False,-0.0214158772759187,,ptsHI/crr KO and compensatory regulatory changes,Carbon Metabolism
186,Glutarate,False,0.0193096100450676,RpoS+H-NS+Crp+Lrp+GlaR+ppGpp,Glutarate/aminobutyrate transport and catabolism,Carbon Metabolism
60,Nitrate/Nitrite,False,-0.0188657279923893,NarL+Fnr,Nitrate/nitrite transport and reduction,Nitrogen Metabolism
110,SCFA,False,0.0188003605635361,RpoN+AtoC+IHF,Short-chain fatty acid (acetoacetate) transport and catabolism,Carbon Metabolism
180,Tyr/Trp/Phe,False,-0.0187412414739641,TyrR/TrpR/Trp-tRNA,Aromatic amino acid biosynthesis and transport,Amino Acid Metabolism
9,ROS TALE Amp,False,0.0184909614415289,,Amplification of DLP12/IS3,Unknown
131,efeU Activation,False,0.0184774135807549,,efeU re-activation and associated efeU ALE-related expression changes,Metal Homeostasis
138,Leucine,False,0.0178594401864045,LeuO+Leu-tRNA+ppGpp,Leucine biosynthesis,Amino Acid Metabolism
88,Nitrogen,False,-0.0177980753650619,Nac,Nitrogen metabolism under nitrogen limitation,Nitrogen Metabolism
14,FucR/AllR/AraC,False,0.016952225327462,FucR/AllR/AraC,Allantoin/glycolate/glyoxylate/arabinose/fucose transport and catabolism,Nitrogen Metabolism
83,yafF,False,0.0166377281810435,,Unknown,Unknown
162,Propionate,False,0.0165556547145043,PrpR+RpoN+Cra+Crp,Propionate catabolism; 2-methylcitric acid cycle,Carbon Metabolism
77,ROS TALE Del-1,False,-0.0164003675457385,,Unknown,Unknown
153,arcA/luxS KO,False,0.0161512298112616,,arcA KO,Energy Metabolism
21,Nucleoside,False,0.0159363741891625,Crp+CytR,Transport and utilization of ribonucleosides and deoxyribonucleosides,Nucleotide Metabolism
52,lsrB KO,False,0.0158144624119881,,lsrB KO and compensatory regulatory changes,Quorum Sensing
113,FDH-O,False,-0.0156997134376971,sdhX,Formate dehydrogenase O; formate to carbon dioxide oxidation; formate-nitrate electron transport during aerobic/anerobic shift,Energy Metabolism
15,ldrC,False,-0.015622033875865,,Unknown,Unknown
140,ytiC,False,-0.0155659481545582,,Unknown,Unknown
82,SSW SNPs,False,-0.0155569703527831,,Unknown,ALE Effects
23,thrA KO,False,0.0147094682854637,,thrA KO and compensatory transcriptional changes,Amino Acid Metabolism
150,Nickel/Cobalt,False,-0.0146209382377321,RcnR,Nickel and cobalt resistance via efflux,Metal Homeostasis
105,Glycine,False,-0.0146048934460648,PurR+Fnr+ppGpp+Crp+Lrp+GcvA,Glycine cleavage system,Amino Acid Metabolism
1,Translation,False,-0.0142762989999546,DksA,Ribosome biogenesis,Translation
100,Molybdenum,False,-0.0140049527899477,Crp+FliA+ModE,Molybdenum transport and molybdoenzyme synthesis,Metal Homeostasis
96,Dipeptide,False,-0.0138715438463782,gcvB+IHF+Fnr,Dipeptide transport; flagellar biosynthesis,Amino Acid Metabolism
90,Leu/Val/Ile,False,0.0135910982955207,Lrp+IHF+Ile-tRNA+Leu-tRNA+Val-tRNA+ppGpp,Branched-chain amino acid biosynthesis,Amino Acid Metabolism
151,IS5,False,0.0134769001360922,,IS5 transcripts,Unknown
144,Putrescine,False,-0.0130086631736572,RpoS+ArcA+PuuR,Putrescine transport and catabolism,Nitrogen Metabolism
74,ArcA,False,-0.0129782284629643,ArcA,Anaerobiosis; repression of aerobic growth genes during anaerobic growth,Energy Metabolism
28,ldrA,False,0.0128191779347105,,Unknown,Unknown
6,Glutamine,False,-0.0126257142381031,NtrC,Glutamine transport and synthesis,Nitrogen Metabolism
38,EvgA,False,-0.0122057336969162,EvgA,"Glutamate-dependent acid response, drug resistance, alkali metals response",Envelope Stress
104,FHL,False,-0.0120801920583167,RpoN+NsrR+ModE+IHF+FhlA,Formate hydrogenlyase: hydrogen production during glucose fermentation via formate oxidation/proton reduction,Energy Metabolism
143,FlhDC-1,False,0.0119205111789719,FlhDC,Flagellum biosynthesis and export,Extracellular Structures
62,Fnr-1,False,-0.011844466280277,Fnr,Transition from aerobic to anaerobic growth; anaerobic reductase and hydrogenase activity,Energy Metabolism
121,Gluconate,False,-0.0116088065780906,GntR+Crp,Gluconate transport and catabolism (Entner-Doudoroff),Carbon Metabolism
182,Fatty Acid,False,0.0115587438867452,FadR,Fatty acid degradation and biosynthesis,Carbon Metabolism
39,Xylose,False,-0.0115102776919006,Crp+XylR,d-Xylose transport and catabolism,Carbon Metabolism
149,Arginine,False,0.0113477540944934,ArgR,Arginine transport and biosynthesis,Amino Acid Metabolism
106,BW25113,False,-0.0113451327655596,,Accounts for genomic differences between BW25113 and MG1655 substrains,Strain Difference
154,sdh KO,False,0.0112560209890775,,sdh KO,Carbon Metabolism
86,UC-3,False,0.0112423669345806,,Unknown,Unknown
156,Fnr-2,False,0.0110148973924069,Fnr,Transition from aerobic to anaerobic growth; global control of anaerobiosis,Energy Metabolism
164,minicoli KOs,False,-0.0109272251632787,,Deletions from minicoli strain,Genome Reduction
81,crp KO-1,False,-0.0108935763703952,,crp KO and compensatory regulatory changes,Carbon Metabolism
85,DNA Damage,False,0.0108431428656949,LexA,SOS response to DNA damage or inhibition of DNA replication,DNA Damage
148,LPS,False,-0.0107928269626836,,Lipopolysaccharide biosynthesis and export,Extracellular Structures
197,CCK-PGI Del,False,0.0106595459340051,,Unknown,Unknown
174,Cra,False,-0.0106494726527383,Cra,Central carbon metabolism; glycolytic flux-dependent regulation via fructose sensing,Carbon Metabolism
43,N Reduction,False,-0.0102096831075718,FlhDC+ModE+NarP+NarL+Fnr,"Electron transfer via nitrate reductases (periplasmic and A), cytochrome c",Energy Metabolism
115,YgbI,False,0.0099691043009866,YgbI,Tartrate transport and catabolism,Carbon Metabolism
173,IS Elements-1,False,-0.0099669924012814,,Unknown,Unknown
55,ykgR,False,-0.0099257197997208,,Unknown,Unknown
187,entC/ubiC KO-2,False,0.009665440846643,,entC/ubiC KO and compensatory sad up-regulation,Energy Metabolism
194,tpiA KO,False,-0.0095726987728631,,tpiA KO and compensatory evolved regulatory changes,Carbon Metabolism
146,Glycolate,False,-0.0095631248359164,IHF+ArcA+PdhR+GlcC,Glycolate/glyoxylate tranport and catabolism,Carbon Metabolism
152,NtrC-3,False,-0.0095164749028999,NtrC+RpoN,"Nitrogen assimilation, pyrimidine transport and catabolism",Nitrogen Metabolism
195,Phage Shock,False,0.0093873463117507,RpoN+IHF+PspF,Phage shock response; response to filamentous phage infection and/or extracytoplasmic shock,Phage Shock
87,YieP,False,-0.0092838272944742,YieP,"Cellular membrane synthesis and stress response, 3-hydroxypropanoate tolerance",Envelope Stress
50,Sulfoquinovose,False,-0.0092328822205666,CsqR,Sulfoquinovose transport and catabolism,Carbon Metabolism
29,Quorum Sensing,False,-0.0091197428818298,Crp+LsrR,"Quorum sensing via autoinducer 2, biofilm architecture, foreign DNA stress response; lsrR KO",Quorum Sensing
188,Oxidoreductase,False,-0.0090077074810967,,Putative oxidoreductase components,Redox Stress
158,Cysteine-2,False,-0.0090026655813737,CysB,"Cysteine biosynthesis, sulfate assimilation",Amino Acid Metabolism
132,rcsB KO,False,-0.008759827347821,,rcsB KO and associated regulatory changes,Envelope Stress
45,Resistance,False,-0.0085016488736425,,Multidrug resistance; stress response to harmful compounds/antibiotics,Envelope Stress
13,RpoH,False,-0.0083825936808959,RpoH,Global heat shock response during log-phase; response to high temperature and/or misfolded proteins,Temperature Shock
2,ygdT,False,-0.0081682086877004,,Unknown,Unknown
66,nquinone ALE 3,False,0.0080291265176317,,ubiC KO and associated adaptive regulatory changes,Energy Metabolism
33,Curli-2,False,0.0078552561344051,RpoS+FliZ+CpxR+CsgD+BtsR,Curli secretion and assembly,Extracellular Structures
155,YmfT,False,-0.0078449360831695,YmfT,e14 prophage regulator activated by DNA damage,DNA Damage
75,yceO,False,-0.0077522629054555,,Unknown,Unknown
18,Methionine,False,0.007729616312564,MetJ,Methionine transport and biosynthesis,Amino Acid Metabolism
57,ypaB,False,0.007634279210381,,Unknown,Unknown
35,FucR/ExuR,False,-0.0076205487569731,FucR/ExuR,Fucose/galacturonate/glucuronate transport and catabolism,Carbon Metabolism
64,Zinc-2,False,0.0073809297176637,ZraR,Tolerance to high zinc concentration,Metal Homeostasis
137,Phosphate-2,False,0.0072760506692346,PhoB,"Inorganic phosphate sensing, transport, and production",Phosphate Metabolism
26,baeR KO,False,0.0071419695476681,,baeR KO,Envelope Stress
98,ymiB,False,0.0070970902373937,,Unknown,Unknown
47,Biofilm,False,-0.0070919899501857,RpoS+ppGpp+BluR+MarA,"Biofilm formation, acid resistance, cold shock response",Extracellular Structures
185,gcvB,False,0.0070405450338745,gcvB,Amino acid transport,Amino Acid Metabolism
172,Fimbriae,False,0.0069587577183797,QseB+IHF+Lrp+H-NS,Type 1 (mannose-sensitive) pili/fimbriae biosynthesis and secretion,Extracellular Structures
46,PAL 10 Del,False,0.0068942453383311,,Unknown,Unknown
181,GadX,False,-0.0068830895401396,RpoS+GadX,Glutamate-dependent acid resistance system; multidrug efflux,Envelope Stress
69,Phosphate-1,False,-0.0068042010638855,PhoB,"Inorganic phosphate sensing, transport, and production",Phosphate Metabolism
70,Salicylic Acid,False,0.006776960671908,,Salicylic acid efflux,Redox Stress
193,cyoB/ndh/nuoB KO-2,False,-0.00654618241268,,cyoB/ndh/nuoB KOs,Energy Metabolism
4,FlhDC-2,False,-0.0065370862258808,FlhDC,Flagellum biosynthesis and export,Extracellular Structures
176,Suf System,False,0.0064587267501059,NsrR+IHF+IscR+OxyR+Fur+ppGpp,Iron-sulfur cluster biosynthesis and insertion,Metal Homeostasis
126,Thiamine-1,False,-0.0064550164181798,Thiamine diphosphate,Thiamine uptake and biosynthesis,Cofactor Metabolism
73,trxC Del,False,0.0062244794383092,,Unknown,Unknown
63,Pyrimidine,False,-0.0061447352168721,PurR/UTP,Pyrimidine transport and biosynthesis,Nucleotide Metabolism
37,ymdG,False,0.0061271237194421,,Unknown,Unknown
114,GlcNAc,False,0.0059325942036696,NagC+Crp,"Amino sugar transport, biosynthesis and catabolism",Carbon Metabolism
157,Microaerobic,False,-0.0058889266760959,RpoS+Fis+NarP+NarL+AppY+YdeO+ArcA+IscR,Hydrogenase 1 and cytochrome bd-II ubiquinol oxidase: microaerobic respiratory chain between hydrogen and oxygen,Energy Metabolism
198,Acetate,False,-0.0057338273678469,,Acetate uptake and catabolism; aldehyde catabolism; acetate/ethanol detoxification at stationary phase,Carbon Metabolism
19,Sorbitol,False,-0.0056414824355616,SrlR+GutM+Crp+H-NS,Sorbitol transport and catabolism,Carbon Metabolism
58,Fur-2,False,-0.005622463872978,Fur,"Iron sensing and uptake, enterobactin biosynthesis, iron-sulfur cluster activation, iron sequestration",Metal Homeostasis
79,Isc System,False,-0.0055237745557803,ryhB/IscR,Iron-sulfur cluster biogenesis and insertion,Cofactor Metabolism
139,Capsule,False,0.0054844724566884,RcsAB,Colanic acid capsule synthesis and transport; periplasmic proteins; envelope stress response,Extracellular Structures
178,NO Stress,False,0.0054526454491641,NsrR/NarP,"Nitric oxide sensing and detoxification, iron-sulfur cluster repair, anaerobic growth",Redox Stress
120,yoaI,False,-0.0054145766151155,,Unknown,Unknown
117,Fnr-3,False,-0.0053193570923718,Fnr,Anaerobic growth,Energy Metabolism
124,Thr/Ser-2,False,0.0052910567342847,Fnr+Crp+IHF+TdcA+TdcR,Threonine/serine transport and catabolism,Amino Acid Metabolism
20,Glycerol,False,-0.0051422336412097,Crp+GlpR,Glycerol/glycerol-3-phosphate transport and catabolism,Carbon Metabolism
136,Pyruvate-2,False,-0.005131691397757,PyrR,Pyruvate sensing and transport,Carbon Metabolism
54,Fur-1,False,-0.0050262331642383,Fur,"Iron sensing and uptake, enterobactin biosynthesis, iron-sulfur cluster activation, iron sequestration",Metal Homeostasis
112,pts ALE,False,0.0050076255593289,,ptsHIcrr KO and associated adaptive regulatory changes,Energy Metabolism
145,ppGpp,False,0.005000339730399,ppGpp,Stringent response,Global Stress
130,ldrD,False,-0.0049869987257478,,Unknown,Unknown
51,RpoS,False,-0.0049808311718095,RpoS,Master regulator of global stress response,Global Stress
92,Crp-1,False,0.0048706585800383,Crp,Miscellaneous carbon source metabolism,Carbon Metabolism
189,UC-7,False,-0.0048122810241531,,Unknown,Unknown
34,Acid Shock RNA,False,-0.0047849638992388,,Very low pH-responsive acid shock polypeptide,Acid Stress
196,Glyoxylate,False,0.0047543377387501,Crp+ArcA+ppGpp+Cra+IclR+IHF,Glyxoylate cycle; alternate to TCA cycle,Energy Metabolism
103,Tryptophan,False,0.004754202131031,TrpR+Trp-tRNA,Tryptophan transport and biosynthesis,Amino Acid Metabolism
159,ydfW,False,-0.004694222889944,,Unknown,Unknown
101,e14 Del,False,-0.0046830444789582,,Unknown,Unknown
53,UC-1,False,-0.0046820411702578,,Unknown,Unknown
183,DhaR,False,-0.0045358906857768,DhaR,Dihydroxyacetone transport and catabolism; phosphotransferase activity for DhaM phosphorylation,Carbon Metabolism
170,Purine,False,0.0044869920521457,PurR+ppGpp,Purine transport and biosynthesis,Nucleotide Metabolism
118,ythA,False,-0.004402300799576,,Unknown,Unknown
166,Rhamnose,False,-0.0043342603549536,Crp+RhaS,Rhamnose transport and catabolism,Carbon Metabolism
119,entC/ubiC KO-1,False,-0.0043093917605985,,entC/ubiC KO and compensatory sad up-regulation,Energy Metabolism
109,Flagella,False,0.004119128378022,,Flagellar biosynthesis,Extracellular Structures
84,NtrC-2,False,0.0040053058673564,NtrC+RpoN,"Nitrogen assimilation, ammonium transport",Nitrogen Metabolism
147,PAL 26 Del,False,0.0039685304958123,,Unknown,Unknown
17,Zinc-1,False,-0.0037919168077632,Zur/ZntR/CueR,Zinc sensing and uptake; copper sensing and export,Metal Homeostasis
40,IS1,False,0.0037453721333838,,IS1 transcripts,Unknown
125,Membrane,False,0.0036073989110222,,"Membrane-related stress response regulators, transporters, multidrug resistance",Envelope Stress
27,ydaG,False,0.0035673558595835,,Unknown,Unknown
122,UC-9,False,0.0035429876023687,,Unknown,Unknown
22,SoxS,False,-0.0034738286111528,SoxS,"Superoxide/nitric oxide sensing and removal, protection from organic solvents and antibiotics",Redox Stress
129,Pyruvate-1,False,0.0033661727074451,BtsR,"Pyruvate sensing, transport, and catabolism under nutrient limitation",Carbon Metabolism
177,PlaR,False,0.0033291094296832,PlaR+RpoE+Crp+IHF,Plant-derived sugars transport and catabolism,Carbon Metabolism
16,Ferric Citrate,False,-0.0032909075124647,PdhR+HypT+Nac+Crp+Fur+FecI,Ferric citrate transporter; iron uptake under intracellular limitation,Metal Homeostasis
48,Cytochrome c,False,-0.0032840669626374,FlhDC+IHF+NsrR+NarL+NarP+Fis+Fnr,Cytochrome c-552 and putative cytochrome c-related proteins,Energy Metabolism
0,Sugar Diacid,False,-0.0032248709704161,CdaR,Transport and catabolism of carbohydrate diacids (galacatarate and glucarate),Carbon Metabolism
116,Lysine/T2SS,False,0.0032229540831249,ArgP,Lysine transport and biosynthesis; type II secretion system,Amino Acid Metabolism
36,cydB/appC KO,False,0.0032202350133053,,cydB/appC KO and compensatory regulatory changes,Energy Metabolism
171,cyoB/ndh/nuoB KO-1,False,0.0032153314573685,,NDH-1 (nuoB) KO and compensatory NDH-2 (ndh) up-regulation,Energy Metabolism
10,Nucleotide Stress,False,-0.0029273002895869,,DNA repair; stringent response signaling via ppGpp; ribosomal biogenesis and stability,DNA Damage
127,Cold Shock,False,0.0028972842728313,,Cold shock proteins,Temperature Shock
44,FDH-N/NRA,False,0.0027319908362433,NarL+Fnr,Anaerobic growth on nitrate; formate-to-nitrate electron transfer via formate dehydrogenase N and nitrate reductase A,Energy Metabolism
11,Histidine,False,-0.0027159780846756,His-tRNA+DksA,Histidine biosynthesis,Amino Acid Metabolism
168,ydfB,False,-0.0024912211973084,,Unknown,Unknown
190,Efflux Pump,False,0.0024879346874871,,Multidrug/spermidine efflux pump,Resistance
61,glrR KO,False,0.0024763470367768,,glrR (aka qseF) KO; xylose transport and catabolism,Envelope Stress
30,IS Elements-2,False,-0.0024391893114331,,Unknown,Unknown
56,Sulfate,False,-0.0024175323360811,Cbl+CysB,Cysteine transport and biosynthesis; aliphatic sulfonate utilization and homeostatic response to sulfate starvation,Amino Acid Metabolism
71,ymgI,False,0.0023869943127331,,Unknown,Unknown
78,cyoB/kdpE/qseB KO,False,0.0022942188798576,,cyoB/kdpE/qseF KO,Energy Metabolism
135,Cysteine-1,False,0.0021304822027977,CysB,"Cysteine biosynthesis, sulfate assimilation",Amino Acid Metabolism
72,Galactose,False,-0.0019896934624365,RpoS+GalR+GalS+Crp,Galactose transport and catabolism,Carbon Metabolism
200,UC-8,False,0.0019287038012669,,Unknown,Unknown
49,BasR,False,-0.0019078612336708,BasR,Lipid A modification and polymixin resistance in the presence of excess iron,Extracellular Structures
167,UC-2,False,-0.0017794626886383,,Unknown,Unknown
42,Biotin,False,0.0017187581372988,BirA,Biotin biosynthesis,Cofactor Metabolism
97,Curli-1,False,-0.0017091305956481,RpoS+FliZ+CpxR+CsgD+BtsR,Curli secretion and assembly,Extracellular Structures
8,yqhI,False,-0.0016883561024128,,Unknown,Unknown
163,CP4-44,False,-0.0016529615882045,,CP4-44 prophage expression variation,Prophage
128,FliA,False,0.0016106174629698,FliA,"Sigma 28; flagellum biosynthesis and export, motility",Extracellular Structures
99,yjjZ,False,-0.0015944981448383,,Unknown,Unknown
95,Ribose,False,0.0015348041843663,dsrA+Crp+RbsR,Ribose transport and catabolism,Carbon Metabolism
59,Magnesium,False,0.0015316087355888,PhoP,Magnesium sensing and transport; magnesium-limitation response,Metal Homeostasis
32,CpxR,False,-0.0014978864728605,CpxR,"Inner membrane damage sensing and repair via protein folding/degradation, chemotaxis, drug efflux, DNA repair, motility",Envelope Stress
141,ROS TALE Del-2,False,-0.0014725137201188,,Unknown,Unknown
102,Thr/Ser-1,False,-0.0012685957879832,TdcA+TdcR+IHF+Fnr+Crp,Threonine/serine transport and catabolism during anaerobiosis,Amino Acid Metabolism
192,crp KO-2,False,-0.001168849338431,,crp KO and associated glycerol-3-phosphate (GlpR) regulatory changes,Carbon Metabolism
93,yneP,False,0.0010984736908185,,Unknown,Unknown
179,Maltose,False,-0.001075539666514,MalT,Maltose transport and catabolism,Carbon Metabolism
111,YgeV,False,-0.0010232244276695,YgeV,Nucleoside degradation activated by ethanol treatment,Carbon Metabolism
91,NDH-1,False,-0.0010187067688389,NarL+ArcA+IHF+Fnr+Fis+ryhB,"NADH:ubiquinone oxidoreductase I: electron transfer from NADH to quinone pool, proton electrochemical gradient generation for aerobic and anaerobic respiration",Energy Metabolism
175,Hot TALE 16,False,0.0009645021494814,,Regulatory changes under high temperature,Unknown
134,Crp-2,False,0.0009625145197356,Crp,Carbohydrate transport and catabolism,Carbon Metabolism
123,Copper,False,0.0009353756181532,CusR/CueR/HprR,Copper/silver sensing and export,Metal Homeostasis
133,malE OE,False,0.0008782906313921,,Accounts for malE plasmid overexpression,Carbon Metabolism
94,NtrC-1,False,0.0008084675036204,RpoN+RpoS+NtrC,"Nitrogen assimilation, ammonium transport",Nitrogen Metabolism
31,Nickel,False,0.0007804670550364,RpoN+NarL+NikR+Fnr,Nickel sensing and uptake,Metal Homeostasis
169,NrdR,False,-0.0007345632368531,NrdR,Ribonucleoside reduction,Nucleotide Metabolism
160,YcjW,False,0.0007073711754203,YcjW,Carbohydrate transport and catabolism,Carbon Metabolism
41,pgi KO,False,-0.0004681957341368,,pgi KO,Carbon Metabolism
65,NRZ,False,0.0003886498364269,OmpR,Nitrate reduction under microaerobic condition; aerobic to anaerobic transition,Energy Metabolism
76,Potassium,False,0.0003841494026553,KdpE,Potassium sensing and transport,Metal Homeostasis
191,Tryptophanase,False,0.0003539941435162,Crp+TorR+Nac+L-tryptophan,Tryptophan import and catabolism via tryptophanase; indole/pyruvate biosynthesis,Amino Acid Metabolism
25,Lrp,False,-0.0002999713765328,Lrp,"Global regulation of amino acid biosynthesis/catabolism, stationary phase, nutrient transport, pili synthesis, 1-carbon metabolism",Amino Acid Metabolism
165,GadXW,False,0.000213428115811,GadX+GadW,Glutamate-dependent acid resistance system; multidrug efflux,Envelope Stress
3,OxyR,False,-0.0002106110531248,OxyR,"Oxidative stress response, especially peroxide",Redox Stress
67,RpoE,False,0.0001952468750943,RpoE,Heat shock response; response to high temperature and/or misfolded membrane/periplasmic proteins,Temperature Shock
12,UC-4,False,-0.0001835424786096,,Unknown,Unknown
24,YjfJ,False,-0.0001042777422538,YjfJ,Putative heat responsive regulon,Temperature Shock
7,Sialic Acid,False,8.846165076470141e-05,Crp+NanR,N-acetyl-neuraminic acid (or sialic acid) transport and metabolism,Carbon Metabolism
108,PaaX,False,-2.738406176225664e-07,Crp+IHF+PaaX+SlyA,Phenylacetic acid transport and catabolism,Carbon Metabolism
