k,name,in_iM,gene_weight,regulator,function,category
128,FliA,True,0.1062858137539865,FliA,"Sigma 28; flagellum biosynthesis and export, motility",Extracellular Structures
143,FlhDC-1,True,0.0831461754711202,FlhDC,Flagellum biosynthesis and export,Extracellular Structures
4,FlhDC-2,True,0.053145375654521,FlhDC,Flagellum biosynthesis and export,Extracellular Structures
109,Flagella,False,-0.0541845511669449,,Flagellar biosynthesis,Extracellular Structures
113,FDH-O,False,0.0257470286057845,sdhX,Formate dehydrogenase O; formate to carbon dioxide oxidation; formate-nitrate electron transport during aerobic/anerobic shift,Energy Metabolism
158,Cysteine-2,False,-0.0223396352496028,CysB,"Cysteine biosynthesis, sulfate assimilation",Amino Acid Metabolism
8,yqhI,False,0.0222010399065344,,Unknown,Unknown
96,Dipeptide,False,-0.0221178434150522,gcvB+IHF+Fnr,Dipeptide transport; flagellar biosynthesis,Amino Acid Metabolism
60,Nitrate/Nitrite,False,-0.0183630145338338,NarL+Fnr,Nitrate/nitrite transport and reduction,Nitrogen Metabolism
141,ROS TALE Del-2,False,0.0172996010586314,,Unknown,Unknown
16,Ferric Citrate,False,0.016998413629093,PdhR+HypT+Nac+Crp+Fur+FecI,Ferric citrate transporter; iron uptake under intracellular limitation,Metal Homeostasis
142,UC-5,False,0.0169542184190552,,Unknown,Unknown
102,Thr/Ser-1,False,-0.0168080571231572,TdcA+TdcR+IHF+Fnr+Crp,Threonine/serine transport and catabolism during anaerobiosis,Amino Acid Metabolism
189,UC-7,False,-0.0157743601082676,,Unknown,Unknown
168,ydfB,False,-0.0153966580110883,,Unknown,Unknown
93,yneP,False,-0.0153456633515555,,Unknown,Unknown
76,Potassium,False,-0.0152073736900563,KdpE,Potassium sensing and transport,Metal Homeostasis
111,YgeV,False,-0.01509010893352,YgeV,Nucleoside degradation activated by ethanol treatment,Carbon Metabolism
19,Sorbitol,False,0.0149589902227206,SrlR+GutM+Crp+H-NS,Sorbitol transport and catabolism,Carbon Metabolism
199,Ile/Val,False,-0.0144351936149728,,Isoleucine and valine biosynthesis,Amino Acid Metabolism
108,PaaX,False,-0.0139029231646666,Crp+IHF+PaaX+SlyA,Phenylacetic acid transport and catabolism,Carbon Metabolism
133,malE OE,False,0.0138103233125013,,Accounts for malE plasmid overexpression,Carbon Metabolism
53,UC-1,False,-0.0136439776327148,,Unknown,Unknown
164,minicoli KOs,False,0.0133919000326922,,Deletions from minicoli strain,Genome Reduction
105,Glycine,False,0.0133724055778454,PurR+Fnr+ppGpp+Crp+Lrp+GcvA,Glycine cleavage system,Amino Acid Metabolism
163,CP4-44,False,-0.0133674204845321,,CP4-44 prophage expression variation,Prophage
197,CCK-PGI Del,False,-0.0131463163911122,,Unknown,Unknown
26,baeR KO,False,0.0130870894559838,,baeR KO,Envelope Stress
24,YjfJ,False,0.0130225366563994,YjfJ,Putative heat responsive regulon,Temperature Shock
79,Isc System,False,-0.0129973902022279,ryhB/IscR,Iron-sulfur cluster biogenesis and insertion,Cofactor Metabolism
73,trxC Del,False,-0.0128680523705013,,Unknown,Unknown
194,tpiA KO,False,0.0126310125579808,,tpiA KO and compensatory evolved regulatory changes,Carbon Metabolism
106,BW25113,False,-0.0123478430366769,,Accounts for genomic differences between BW25113 and MG1655 substrains,Strain Difference
95,Ribose,False,-0.0123060818735416,dsrA+Crp+RbsR,Ribose transport and catabolism,Carbon Metabolism
174,Cra,False,-0.0120107290312902,Cra,Central carbon metabolism; glycolytic flux-dependent regulation via fructose sensing,Carbon Metabolism
154,sdh KO,False,-0.0118988829685437,,sdh KO,Carbon Metabolism
120,yoaI,False,0.011894449287467,,Unknown,Unknown
171,cyoB/ndh/nuoB KO-1,False,0.0118443697767249,,NDH-1 (nuoB) KO and compensatory NDH-2 (ndh) up-regulation,Energy Metabolism
7,Sialic Acid,False,0.0115785021128322,Crp+NanR,N-acetyl-neuraminic acid (or sialic acid) transport and metabolism,Carbon Metabolism
175,Hot TALE 16,False,0.011516813251868,,Regulatory changes under high temperature,Unknown
66,nquinone ALE 3,False,-0.0113152075738345,,ubiC KO and associated adaptive regulatory changes,Energy Metabolism
122,UC-9,False,0.0105691662739451,,Unknown,Unknown
184,pts KO,False,-0.0105178809843921,,ptsHI/crr KO and compensatory regulatory changes,Carbon Metabolism
40,IS1,False,0.0104889547404625,,IS1 transcripts,Unknown
173,IS Elements-1,False,-0.0104270907139369,,Unknown,Unknown
43,N Reduction,False,-0.0102920125445653,FlhDC+ModE+NarP+NarL+Fnr,"Electron transfer via nitrate reductases (periplasmic and A), cytochrome c",Energy Metabolism
67,RpoE,False,0.0100176777492591,RpoE,Heat shock response; response to high temperature and/or misfolded membrane/periplasmic proteins,Temperature Shock
48,Cytochrome c,False,0.0098327270492661,FlhDC+IHF+NsrR+NarL+NarP+Fis+Fnr,Cytochrome c-552 and putative cytochrome c-related proteins,Energy Metabolism
151,IS5,False,-0.0097876766950697,,IS5 transcripts,Unknown
3,OxyR,False,-0.0095993155789727,OxyR,"Oxidative stress response, especially peroxide",Redox Stress
124,Thr/Ser-2,False,-0.0095780647307862,Fnr+Crp+IHF+TdcA+TdcR,Threonine/serine transport and catabolism,Amino Acid Metabolism
75,yceO,False,0.0093378294921173,,Unknown,Unknown
80,Thiamine-2,False,-0.0092302270741327,,Thiamine uptake and biosynthesis,Cofactor Metabolism
83,yafF,False,0.0089929118571724,,Unknown,Unknown
182,Fatty Acid,False,-0.0088127113263164,FadR,Fatty acid degradation and biosynthesis,Carbon Metabolism
33,Curli-2,False,-0.0087740049823444,RpoS+FliZ+CpxR+CsgD+BtsR,Curli secretion and assembly,Extracellular Structures
161,PAL Amp,False,-0.008659067623133,,Unknown,Unknown
15,ldrC,False,-0.0086063413040352,,Unknown,Unknown
190,Efflux Pump,False,-0.0085822698276737,,Multidrug/spermidine efflux pump,Resistance
100,Molybdenum,False,-0.0084903984958128,Crp+FliA+ModE,Molybdenum transport and molybdoenzyme synthesis,Metal Homeostasis
56,Sulfate,False,-0.0083647978203159,Cbl+CysB,Cysteine transport and biosynthesis; aliphatic sulfonate utilization and homeostatic response to sulfate starvation,Amino Acid Metabolism
103,Tryptophan,False,-0.0083531423741886,TrpR+Trp-tRNA,Tryptophan transport and biosynthesis,Amino Acid Metabolism
112,pts ALE,False,0.0082622137964807,,ptsHIcrr KO and associated adaptive regulatory changes,Energy Metabolism
138,Leucine,False,0.0082065310818478,LeuO+Leu-tRNA+ppGpp,Leucine biosynthesis,Amino Acid Metabolism
104,FHL,False,-0.0081219218019535,RpoN+NsrR+ModE+IHF+FhlA,Formate hydrogenlyase: hydrogen production during glucose fermentation via formate oxidation/proton reduction,Energy Metabolism
64,Zinc-2,False,-0.0081128259886854,ZraR,Tolerance to high zinc concentration,Metal Homeostasis
41,pgi KO,False,0.0081032071532262,,pgi KO,Carbon Metabolism
136,Pyruvate-2,False,0.0079931881779193,PyrR,Pyruvate sensing and transport,Carbon Metabolism
145,ppGpp,False,-0.007976754144984,ppGpp,Stringent response,Global Stress
126,Thiamine-1,False,0.0079131685158716,Thiamine diphosphate,Thiamine uptake and biosynthesis,Cofactor Metabolism
157,Microaerobic,False,0.007798850621971,RpoS+Fis+NarP+NarL+AppY+YdeO+ArcA+IscR,Hydrogenase 1 and cytochrome bd-II ubiquinol oxidase: microaerobic respiratory chain between hydrogen and oxygen,Energy Metabolism
28,ldrA,False,0.0077886229173882,,Unknown,Unknown
23,thrA KO,False,0.0076930470584793,,thrA KO and compensatory transcriptional changes,Amino Acid Metabolism
61,glrR KO,False,0.0075747606997619,,glrR (aka qseF) KO; xylose transport and catabolism,Envelope Stress
50,Sulfoquinovose,False,-0.0075001118986111,CsqR,Sulfoquinovose transport and catabolism,Carbon Metabolism
13,RpoH,False,0.0074396485646603,RpoH,Global heat shock response during log-phase; response to high temperature and/or misfolded proteins,Temperature Shock
115,YgbI,False,-0.0074039600507109,YgbI,Tartrate transport and catabolism,Carbon Metabolism
195,Phage Shock,False,0.0072102569250506,RpoN+IHF+PspF,Phage shock response; response to filamentous phage infection and/or extracytoplasmic shock,Phage Shock
97,Curli-1,False,-0.0071547353246502,RpoS+FliZ+CpxR+CsgD+BtsR,Curli secretion and assembly,Extracellular Structures
165,GadXW,False,-0.0070374949418568,GadX+GadW,Glutamate-dependent acid resistance system; multidrug efflux,Envelope Stress
178,NO Stress,False,-0.0068044813726652,NsrR/NarP,"Nitric oxide sensing and detoxification, iron-sulfur cluster repair, anaerobic growth",Redox Stress
6,Glutamine,False,0.0065830589080749,NtrC,Glutamine transport and synthesis,Nitrogen Metabolism
1,Translation,False,-0.0065690066000769,DksA,Ribosome biogenesis,Translation
18,Methionine,False,-0.0064505629332059,MetJ,Methionine transport and biosynthesis,Amino Acid Metabolism
116,Lysine/T2SS,False,-0.0063336190965463,ArgP,Lysine transport and biosynthesis; type II secretion system,Amino Acid Metabolism
101,e14 Del,False,0.0060548771919351,,Unknown,Unknown
32,CpxR,False,-0.0060297297964252,CpxR,"Inner membrane damage sensing and repair via protein folding/degradation, chemotaxis, drug efflux, DNA repair, motility",Envelope Stress
82,SSW SNPs,False,-0.0059819498316109,,Unknown,ALE Effects
69,Phosphate-1,False,0.0058763678577088,PhoB,"Inorganic phosphate sensing, transport, and production",Phosphate Metabolism
127,Cold Shock,False,-0.0056973959724299,,Cold shock proteins,Temperature Shock
25,Lrp,False,0.0055628553287156,Lrp,"Global regulation of amino acid biosynthesis/catabolism, stationary phase, nutrient transport, pili synthesis, 1-carbon metabolism",Amino Acid Metabolism
84,NtrC-2,False,-0.0055219998767314,NtrC+RpoN,"Nitrogen assimilation, ammonium transport",Nitrogen Metabolism
9,ROS TALE Amp,False,-0.0055131530585086,,Amplification of DLP12/IS3,Unknown
27,ydaG,False,-0.0053956724339427,,Unknown,Unknown
200,UC-8,False,-0.0052750626532976,,Unknown,Unknown
94,NtrC-1,False,0.0051988055396153,RpoN+RpoS+NtrC,"Nitrogen assimilation, ammonium transport",Nitrogen Metabolism
185,gcvB,False,-0.0051755598488485,gcvB,Amino acid transport,Amino Acid Metabolism
20,Glycerol,False,-0.0051721837598995,Crp+GlpR,Glycerol/glycerol-3-phosphate transport and catabolism,Carbon Metabolism
42,Biotin,False,0.0051456284550195,BirA,Biotin biosynthesis,Cofactor Metabolism
107,ypjJ,False,-0.0051377902320404,,Unknown,Unknown
188,Oxidoreductase,False,0.0051290636421603,,Putative oxidoreductase components,Redox Stress
177,PlaR,False,0.0049747550296713,PlaR+RpoE+Crp+IHF,Plant-derived sugars transport and catabolism,Carbon Metabolism
156,Fnr-2,False,0.0048924124762852,Fnr,Transition from aerobic to anaerobic growth; global control of anaerobiosis,Energy Metabolism
45,Resistance,False,-0.0048890826740066,,Multidrug resistance; stress response to harmful compounds/antibiotics,Envelope Stress
192,crp KO-2,False,-0.0048549019862627,,crp KO and associated glycerol-3-phosphate (GlpR) regulatory changes,Carbon Metabolism
49,BasR,False,-0.0047894949185689,BasR,Lipid A modification and polymixin resistance in the presence of excess iron,Extracellular Structures
148,LPS,False,0.0046842310387242,,Lipopolysaccharide biosynthesis and export,Extracellular Structures
31,Nickel,False,0.004682811253701,RpoN+NarL+NikR+Fnr,Nickel sensing and uptake,Metal Homeostasis
57,ypaB,False,0.0045415987296613,,Unknown,Unknown
180,Tyr/Trp/Phe,False,0.0045377683250901,TyrR/TrpR/Trp-tRNA,Aromatic amino acid biosynthesis and transport,Amino Acid Metabolism
89,UC-6,False,0.0044824115719137,,Unknown,Unknown
34,Acid Shock RNA,False,0.0044741446965575,,Very low pH-responsive acid shock polypeptide,Acid Stress
88,Nitrogen,False,-0.0044527757653109,Nac,Nitrogen metabolism under nitrogen limitation,Nitrogen Metabolism
65,NRZ,False,0.0044520817330701,OmpR,Nitrate reduction under microaerobic condition; aerobic to anaerobic transition,Energy Metabolism
159,ydfW,False,0.0044420222961529,,Unknown,Unknown
47,Biofilm,False,0.0044267463847782,RpoS+ppGpp+BluR+MarA,"Biofilm formation, acid resistance, cold shock response",Extracellular Structures
144,Putrescine,False,0.0042734461533486,RpoS+ArcA+PuuR,Putrescine transport and catabolism,Nitrogen Metabolism
169,NrdR,False,-0.0042209521022518,NrdR,Ribonucleoside reduction,Nucleotide Metabolism
72,Galactose,False,0.0041932493359759,RpoS+GalR+GalS+Crp,Galactose transport and catabolism,Carbon Metabolism
90,Leu/Val/Ile,False,0.0040824298615842,Lrp+IHF+Ile-tRNA+Leu-tRNA+Val-tRNA+ppGpp,Branched-chain amino acid biosynthesis,Amino Acid Metabolism
130,ldrD,False,-0.00398696829264,,Unknown,Unknown
198,Acetate,False,0.0039722253029489,,Acetate uptake and catabolism; aldehyde catabolism; acetate/ethanol detoxification at stationary phase,Carbon Metabolism
36,cydB/appC KO,False,0.0039641928306975,,cydB/appC KO and compensatory regulatory changes,Energy Metabolism
91,NDH-1,False,-0.003938247636889,NarL+ArcA+IHF+Fnr+Fis+ryhB,"NADH:ubiquinone oxidoreductase I: electron transfer from NADH to quinone pool, proton electrochemical gradient generation for aerobic and anaerobic respiration",Energy Metabolism
51,RpoS,False,-0.0039152949853066,RpoS,Master regulator of global stress response,Global Stress
29,Quorum Sensing,False,-0.0038921906425652,Crp+LsrR,"Quorum sensing via autoinducer 2, biofilm architecture, foreign DNA stress response; lsrR KO",Quorum Sensing
183,DhaR,False,0.0038458023318226,DhaR,Dihydroxyacetone transport and catabolism; phosphotransferase activity for DhaM phosphorylation,Carbon Metabolism
38,EvgA,False,-0.003780075924508,EvgA,"Glutamate-dependent acid response, drug resistance, alkali metals response",Envelope Stress
179,Maltose,False,-0.0037749496259223,MalT,Maltose transport and catabolism,Carbon Metabolism
117,Fnr-3,False,0.0037690969422052,Fnr,Anaerobic growth,Energy Metabolism
118,ythA,False,0.0036389721382646,,Unknown,Unknown
44,FDH-N/NRA,False,-0.0036005776396411,NarL+Fnr,Anaerobic growth on nitrate; formate-to-nitrate electron transfer via formate dehydrogenase N and nitrate reductase A,Energy Metabolism
162,Propionate,False,0.0034680631642832,PrpR+RpoN+Cra+Crp,Propionate catabolism; 2-methylcitric acid cycle,Carbon Metabolism
52,lsrB KO,False,0.0034621112184619,,lsrB KO and compensatory regulatory changes,Quorum Sensing
98,ymiB,False,-0.0034435594654545,,Unknown,Unknown
170,Purine,False,-0.0033786740288829,PurR+ppGpp,Purine transport and biosynthesis,Nucleotide Metabolism
134,Crp-2,False,-0.0032419287919352,Crp,Carbohydrate transport and catabolism,Carbon Metabolism
119,entC/ubiC KO-1,False,-0.0030975625229995,,entC/ubiC KO and compensatory sad up-regulation,Energy Metabolism
135,Cysteine-1,False,0.0030954737426974,CysB,"Cysteine biosynthesis, sulfate assimilation",Amino Acid Metabolism
92,Crp-1,False,-0.0030518234325647,Crp,Miscellaneous carbon source metabolism,Carbon Metabolism
70,Salicylic Acid,False,-0.0030491299684534,,Salicylic acid efflux,Redox Stress
74,ArcA,False,-0.0030153422947677,ArcA,Anaerobiosis; repression of aerobic growth genes during anaerobic growth,Energy Metabolism
35,FucR/ExuR,False,0.0029309426640019,FucR/ExuR,Fucose/galacturonate/glucuronate transport and catabolism,Carbon Metabolism
5,Osmoprotectant,False,0.0028477077448541,RpoS+ppGpp+IHF+H-NS,Transport of osmoprotectant glycine betaine,Envelope Stress
153,arcA/luxS KO,False,0.0027682783889963,,arcA KO,Energy Metabolism
123,Copper,False,-0.0027011842005775,CusR/CueR/HprR,Copper/silver sensing and export,Metal Homeostasis
167,UC-2,False,0.0026929236810389,,Unknown,Unknown
140,ytiC,False,0.0026533622800933,,Unknown,Unknown
152,NtrC-3,False,-0.0026526514863921,NtrC+RpoN,"Nitrogen assimilation, pyrimidine transport and catabolism",Nitrogen Metabolism
125,Membrane,False,-0.0026289639800305,,"Membrane-related stress response regulators, transporters, multidrug resistance",Envelope Stress
58,Fur-2,False,-0.0025978685527541,Fur,"Iron sensing and uptake, enterobactin biosynthesis, iron-sulfur cluster activation, iron sequestration",Metal Homeostasis
39,Xylose,False,0.002580400653427,Crp+XylR,d-Xylose transport and catabolism,Carbon Metabolism
186,Glutarate,False,-0.0023920603543231,RpoS+H-NS+Crp+Lrp+GlaR+ppGpp,Glutarate/aminobutyrate transport and catabolism,Carbon Metabolism
131,efeU Activation,False,0.0023877302777401,,efeU re-activation and associated efeU ALE-related expression changes,Metal Homeostasis
147,PAL 26 Del,False,-0.0023837867984251,,Unknown,Unknown
137,Phosphate-2,False,-0.0023625491739272,PhoB,"Inorganic phosphate sensing, transport, and production",Phosphate Metabolism
121,Gluconate,False,0.0022930680304719,GntR+Crp,Gluconate transport and catabolism (Entner-Doudoroff),Carbon Metabolism
81,crp KO-1,False,0.0022871536202646,,crp KO and compensatory regulatory changes,Carbon Metabolism
132,rcsB KO,False,-0.0021327818978554,,rcsB KO and associated regulatory changes,Envelope Stress
166,Rhamnose,False,0.0021283536456179,Crp+RhaS,Rhamnose transport and catabolism,Carbon Metabolism
11,Histidine,False,0.0020454042497515,His-tRNA+DksA,Histidine biosynthesis,Amino Acid Metabolism
71,ymgI,False,-0.0019282212579066,,Unknown,Unknown
146,Glycolate,False,-0.0019232254687094,IHF+ArcA+PdhR+GlcC,Glycolate/glyoxylate tranport and catabolism,Carbon Metabolism
99,yjjZ,False,-0.0018839275143792,,Unknown,Unknown
46,PAL 10 Del,False,-0.0017914228162827,,Unknown,Unknown
55,ykgR,False,-0.0017877818890749,,Unknown,Unknown
181,GadX,False,0.0017846716652179,RpoS+GadX,Glutamate-dependent acid resistance system; multidrug efflux,Envelope Stress
155,YmfT,False,-0.001639274463154,YmfT,e14 prophage regulator activated by DNA damage,DNA Damage
139,Capsule,False,0.0014946863824997,RcsAB,Colanic acid capsule synthesis and transport; periplasmic proteins; envelope stress response,Extracellular Structures
176,Suf System,False,0.0014328583371692,NsrR+IHF+IscR+OxyR+Fur+ppGpp,Iron-sulfur cluster biosynthesis and insertion,Metal Homeostasis
21,Nucleoside,False,0.0014263387882744,Crp+CytR,Transport and utilization of ribonucleosides and deoxyribonucleosides,Nucleotide Metabolism
0,Sugar Diacid,False,0.001351318305877,CdaR,Transport and catabolism of carbohydrate diacids (galacatarate and glucarate),Carbon Metabolism
54,Fur-1,False,0.0013209189201238,Fur,"Iron sensing and uptake, enterobactin biosynthesis, iron-sulfur cluster activation, iron sequestration",Metal Homeostasis
68,Cellulose,False,-0.0012927955510625,,Cellulose biosynthesis; biofilm formation; membrane/periplasmic proteins,Extracellular Structures
12,UC-4,False,-0.0012419538306926,,Unknown,Unknown
14,FucR/AllR/AraC,False,0.0012261096442202,FucR/AllR/AraC,Allantoin/glycolate/glyoxylate/arabinose/fucose transport and catabolism,Nitrogen Metabolism
59,Magnesium,False,0.0011716332368206,PhoP,Magnesium sensing and transport; magnesium-limitation response,Metal Homeostasis
129,Pyruvate-1,False,0.0011324508129954,BtsR,"Pyruvate sensing, transport, and catabolism under nutrient limitation",Carbon Metabolism
78,cyoB/kdpE/qseB KO,False,-0.0010921348648702,,cyoB/kdpE/qseF KO,Energy Metabolism
191,Tryptophanase,False,0.0010849847257904,Crp+TorR+Nac+L-tryptophan,Tryptophan import and catabolism via tryptophanase; indole/pyruvate biosynthesis,Amino Acid Metabolism
114,GlcNAc,False,-0.001068917369084,NagC+Crp,"Amino sugar transport, biosynthesis and catabolism",Carbon Metabolism
187,entC/ubiC KO-2,False,-0.0010538705006398,,entC/ubiC KO and compensatory sad up-regulation,Energy Metabolism
63,Pyrimidine,False,-0.0009283596812345,PurR/UTP,Pyrimidine transport and biosynthesis,Nucleotide Metabolism
17,Zinc-1,False,0.0009250580242023,Zur/ZntR/CueR,Zinc sensing and uptake; copper sensing and export,Metal Homeostasis
87,YieP,False,0.0008339282433025,YieP,"Cellular membrane synthesis and stress response, 3-hydroxypropanoate tolerance",Envelope Stress
196,Glyoxylate,False,-0.0008322180393967,Crp+ArcA+ppGpp+Cra+IclR+IHF,Glyxoylate cycle; alternate to TCA cycle,Energy Metabolism
30,IS Elements-2,False,-0.0007858004274764,,Unknown,Unknown
86,UC-3,False,-0.0007185845316587,,Unknown,Unknown
110,SCFA,False,0.0006970886395796,RpoN+AtoC+IHF,Short-chain fatty acid (acetoacetate) transport and catabolism,Carbon Metabolism
77,ROS TALE Del-1,False,-0.0006715718275487,,Unknown,Unknown
62,Fnr-1,False,-0.0006236702934908,Fnr,Transition from aerobic to anaerobic growth; anaerobic reductase and hydrogenase activity,Energy Metabolism
37,ymdG,False,0.0006013578239286,,Unknown,Unknown
22,SoxS,False,0.0005713009145702,SoxS,"Superoxide/nitric oxide sensing and removal, protection from organic solvents and antibiotics",Redox Stress
193,cyoB/ndh/nuoB KO-2,False,0.0005450292776213,,cyoB/ndh/nuoB KOs,Energy Metabolism
85,DNA Damage,False,-0.0005267261588522,LexA,SOS response to DNA damage or inhibition of DNA replication,DNA Damage
10,Nucleotide Stress,False,0.0004641505906133,,DNA repair; stringent response signaling via ppGpp; ribosomal biogenesis and stability,DNA Damage
150,Nickel/Cobalt,False,0.0004132292210712,RcnR,Nickel and cobalt resistance via efflux,Metal Homeostasis
2,ygdT,False,0.0003871357823616,,Unknown,Unknown
160,YcjW,False,-0.0002989240407544,YcjW,Carbohydrate transport and catabolism,Carbon Metabolism
172,Fimbriae,False,-0.0002952345340948,QseB+IHF+Lrp+H-NS,Type 1 (mannose-sensitive) pili/fimbriae biosynthesis and secretion,Extracellular Structures
149,Arginine,False,-0.0002925848087275,ArgR,Arginine transport and biosynthesis,Amino Acid Metabolism
