k,name,in_iM,gene_weight,regulator,function,category
33,Pyoverdine,True,0.1042677899,PvdS,"Biosynthesis and transport of pyoverdine, metal transporters",Exometabolites
44,Fe-S/Oxidative Stress,False,-0.0396808239,,"Fe-S cluster assembly, oxidative stress resistance: sodA, fumC, katB, catalase ",Stress Response
21,Fe/Protein Transport,False,0.032185593000000005,,"Iron starvation response: PvdS,  FoxR (ortholog), other sigma factors associated with iron starvation response, bacterioferritin, bacterioferritin-associated ferredoxin, energy transduction (exbBD), TonB-dependent siderophore receptors ",Metal Uptake
19,single_gene_1,False,0.0259570915,,"baeR, exdb, unknown genes",Noise
29,Fatty Acid,False,-0.0239134391,PsrA,"psrA, fadAB, etfAB, genes with multiple drug resistance domains",Metabolism
40,Unchar-5,False,-0.0195603003,,"several unknown genes, type III effectors, cold shock domain-containing proteins, RNA-directed DNA polymerase, integrase, cysteine synthase familiy proteins",Uncharacterized
34,Unchar-7,False,0.0184586144,,"lipid-A-disaccharide synthase, TolC family protein, dihydrolipoyllysine-residue acetyltransferase",Uncharacterized
31,Carbon Starvation-1,False,-0.018286326500000002,,"Carbon starvation response: carbon starvation protein A, acetate utilization; pilin assembly: tadABCZ (homologs), rcpAC (homologs), flp family type IVb pilin",Metabolism
24,Protocatechuate,False,0.01737203,,Benzoate degradation: pcaBCGHK,Metabolism
9,Resistance-1,False,-0.016370455000000003,,"MarR transcriptional regulator, efflux transporter subunits (RND, MFS, etc.), sulforaphane/aliphatic isothiocyanate, resistance proteins (saxAF)",Stress Response
28,Osmotic Stress,False,0.015435338600000001,,"Osmotic/water stress resistance: osmoprotectants, compatible solute production; oxidative stress resistance ",Stress Response
5,Unchar-4,False,-0.0153588682,,"Zinc transporters, cadA, rpme-1, iron transporters and receptors",Uncharacterized
15,Coronatine,False,-0.0151602755,,Coronatine biosynthesis: coronamic acid and coronafacic acid; alginate biosynthesis; type III effectors,Exometabolites
27,Yersiniabactin,False,0.0147000548,,Biosynthesis and transport of yersiniabactin,Exometabolites
22,Carbon Starvation-2,False,-0.0144388034,,Inositol phosphate and galactose metabolism,Metabolism
30,Unchar-3,False,0.0139206691,,"phoP/phoQ two component system, phosphate ABC transporter, pyruvate dehydrogenase, pbpG",Uncharacterized
20,single_gene_2,False,-0.0134899962,,"helix-turn-helix domain-containing protein, IS element, holin, kdpF, genes of unknown function",Noise
7,Unchar-9,False,-0.0133058846,PSPTO_3698,"molybdenum cofactor-associated genes: moaA, fdhD, oxidoreductase (molydopterin binding protein); xanyhine dehydrogenase subunits (xdhAB) and xanthine dehydrogenase accessory protein (xdhC)",Uncharacterized
43,single_gene_5,False,-0.0130672845,,"holin, genes of unknown function",Noise
17,Unchar-2,False,0.013047121200000001,,"oxidative stress response: pqq, kdpf, organic hydroperoxide resistance protein, pirin (ortholog); nusA",Uncharacterized
23,Phage,False,-0.0112954199,,"prtN, ptrB, prophage genes associated with pyocin production in Pseudomonas aeruginosa",Genomic
10,Sulfur-2,False,-0.0112032607,,"Sulfur starvation response protein (oscA), alkane sulfonate transporters, sulfate transporters, amino acid transporters",Metabolism
25,Flagella-2,False,-0.0109104618,,"Glycosyltransferase, flagellar biosynthesis and assembly: hook, P-ring, export ATPase, chaperone, type III secretion system; cheZ",Motility
26,Zur,False,-0.010073743900000001,PSPTO_5267,"Zinc transporters, cadA, rpme-1, iron transporters, and receptors",Metal Uptake
14,Chaperone,False,0.009207369,,"Chaperones, heat shock proteins, proteins involved in repair processes other than in response to heat shock, ATP-dependent protease ATPase subunits",Stress Response
2,Chemotaxis,False,0.0091749715,,"crp, csrA, flgM, chemotaxis proteins, membrane components, fliC, methyl accepting chemotaxis proteins, glycosyltransferase, several genes involved in signal transduction, flagellar genes: hook-associated proteins, filament capping protein, motor protein, motor stator protein",Motility
0,Nitrogen,False,-0.0089928872,NtrC,"Nitrogen stress response: ntrB/ntrC two component system, glnK, amtB, utilization of alternate nitrogen sources: urea (conversion of urea to ammonia), amino acids (transporters), pyrimidines (rutABCD), allantoin (allantoin permease), GABA (GABA permease)",Metabolism
1,Unchar-1,False,-0.0088633096,,"colR/colS two component system, pyruvate metabolism, insecticidal toxins, groES, glycerol uptake, etc.",Uncharacterized
42,single_gene_4,False,-0.007880138200000001,,"helix-turn-helix domain-containing protein, genes of unknown function",Noise
36,Translation-1,False,0.0075242713000000004,,"Ribosomal proteins, atpCG, secY, rpoA",Translation
37,T3SS,False,-0.007336735400000001,,"hrpR, hrpS, hrpL, coronatine biosynthesis activation: corP, corR/corS two component system, type III effectors, type III secretion system chaperones, type III secretion system components, type III secretion proteins, type III helper protein, type III restriction system endonuclease,ribosome modulation factor, HPr kinase, pectate lyase, flagellar hook length control protein",Exometabolites
3,Sulfur-1,False,0.0070450344000000005,,"Taurine, alkane sulfonate, cysteine, and methionine transport",Metabolism
41,single_gene_3,False,-0.0060741726,,genes of unknown function,Noise
32,Folate,False,0.0059607987000000005,,"Tetrahydrofolate production: soxGADB, folD, purU",Metabolism
8,Alginate,False,0.0053212805,,"Alginate biosynthesis, phenol degradation protein, benzaldehyde dehydrogenase, dimethylglycine demethylation, genes involved in amino acid transport and metabolism",Exometabolites
11,Unchar-6,False,-0.004542084,,uncharacterized,Uncharacterized
38,AlgU,False,0.0045317906,AlgU,"algU (rpoE),  hrpR, alginate biosynthesis, stress resistance: oxidative, osmotic, heat, UV, and metal ion stress",Stress Response
6,IS-elements,False,0.0038199287,,"transposases, ptrB",Genomic
13,Transport,False,0.0034729347000000002,,"Transport of inorganic ions, amino acids, carbohydrates, and lipids; membrane proteins; carbon starvation protein A; tryptophan synthesis; syringafactin synthesis",Metabolism
39,Resistance-2,False,0.0033189536,CueR,"Syringafactin production and efflux, cueR, copper transport, chemotaxis, uric acid production, virulence factor srfB, virulence effector srfC, bacterioferritin, Flp type IV pilin",Stress Response
16,Unchar-8,False,0.0025465180000000002,,"fur, ribosomal proteins (rpsT, rplS, rpmE), ribosomal modulation factor, cold shock proteins, bacterioferritin, bacterioferritin-associated ferredoxin, transposases",Uncharacterized
35,Flagella-1,False,0.0018090289000000002,,"fleS/fleR two component system, flagellar biosynthesis and assembly: rod; hook; L; M, and P ring; hook and basal body complex; motor switch; flagellar type III secretion system",Motility
12,Plasmid,False,-0.0017191083000000001,,"Plasmid genes: conjugal transfer proteins, DNA primase, glycoside hydrolase, mobilization proteins, type III effectors, integrase, UV resistance protein A, replication initiation protein; efflux transporters, glycine metabolism, sarcosine oxidase subunits ( likely due to plasmid manipulation)",Genomic
18,Translation-2,False,0.0011473226,,"Ribosome maturation factor, rho, rpsU, rpiU",Translation
4,Recombination,False,0.0004734774,,"Recombinases family proteins, several genes of unknown function",Stress Response
