k,name,in_iM,gene_weight,regulator,function,category
10,CcpA-2 – Low Glucose 2,False,0.031336715,[CcpA + SigA] / [CcpN],"Uptake, utilization, and regulation of alternative carbon sources: TCA intermediates, ribose, maltodextrin, galacto-oligosaccharides, acetoin, gluconate, etc. Suppression of glucose pathways. Stationary phase.",Carbon
1,FadR – Fatty Acids,False,0.027697129,FadR,Fatty acid degradation,Carbon
82,CcpA-1 – Low Glucose 1,False,0.021729284,CcpA + SigA,"Uptake and utilization of alternative carbon sources: ribose, sucrose, salicin, beta-glucosides, lichenan,  glucomannon, trehalose, G3P, etc. High expression in exponential phase on LB media",Carbon
37,Noise – Diamide 15,False,-0.016960115,,Likely accounting for noise in the diamide after 15 minutes and LBG exponential conditions,Uncharacterized
77,PhoP-1 – Phosphate Limitation 1,False,-0.016010592,PhoP + SigA,"High-affinity phosphate uptake, teichuronic acid production pseudogene.",Elements
26,Uncharacterized 6,False,-0.015814905,,5’ ends of tRNAs and independent transcripts,Uncharacterized
16,Ybc – Uncharacterized Operon,False,0.014431468000000001,,Contains one subunit of NADH dehydrogenase with several unknown genes. Categorized as prophage. Responds to heat shock.,Stress
72,LevR – Levan and Fructose,False,-0.014426555,LevR,"Fuctose uptake and phosphorylation, degradation of the exopolysaccharide levan into fructose",Carbon
60,RocR / PutR – Arginine and Proline Utilization,False,-0.014379057,[SigL + AhrC + RocR] / [Spo0A + SigA + CodY + PutR],"Utilization of arginine, ornithine, citrulline and proline as carbon and energy sources",Amino Acids
31,Noise – S1210,False,-0.01390856,,Noisy independent transcript S1210,Uncharacterized
79,Alb – Antilisterial Bacteriocin,False,-0.013182013000000001,Rok + ResD + AbrB + SigA,"Produces and exports subtilosin, which kills anaerobic listeria bacteria",Lifestyles
45,Zur – Zinc Limitation,False,0.013059541000000001,Zur,"Zinc uptake, zinc metallochaperones, alternatives to zinc-containing proteins",Elements
76,Empty 2,False,-0.01198549,,Contains no genes,Uncharacterized
38,GlpP – Glycerol,False,-0.011357657,GlpP,Glycerol uptake and utilization,Carbon
41,S-Box – Methionine,False,-0.011249646,S-box,Methionine salvage and biosynthesis,Amino Acids
47,SigM – Membrane Stress,False,0.011239513000000001,SigM,"General stress proteins, alarmones, lipid carriers and flippases, DNA repair, inhibition of septation. Contains many UTRs and some unknown proteins.",Stress
81,"MtlR / AnsR – Mannitol, Asparagine, and Aspartate",False,0.011016142000000001,[MtlR] / [AnsR + SigA],"Uptake and utilization of mannitol, degradation of asparagine and aspartate",Multi-Purpose
19,Empty 1,False,-0.010409572,,Contains no genes,Uncharacterized
0,PchR – Pulcherrimin,False,0.010194577,PchR,Extracellular synthesis and import of pulcherrimin for iron acquisition,Elements
42,Noise – Carbon Source Transition 1,False,-0.009564498000000001,,Likely accounting for noise in the carbon source transition experiments,Uncharacterized
22,Spβ-1 – SP-β Prophage 1,False,-0.009080991,,Temperature-responsive SP-beta prophage. Response to stressors such as cold and ethanol. Subset of  SPbeta Prophage 2.,Mobile Genes
50,PyrR – Pyrimidines,False,0.008992581000000001,PyrR,Synthesis of pyrimidines,Other Organics
18,ImmR – ICEBs1,False,-0.00898296,ImmR,Mobile genetic element that participates in horizontal gene transfer,Mobile Genes
73,TnrA / PucR – Nitrogen Limitation,False,0.008917059,[SigA + TnrA] / [SigA + PucR],"Ammonium uptake, utilization of nitrate and xanthine. Suggests nitrate limitation in the BT condition",Multi-Purpose
68,SigE / G – Sporulation 3,False,-0.008790613000000001,[SigE] / [SigG],"Spore coat production, transcription factor and regulator expression, spore DNA protection, spore stress resistance",Sporulation
65,Xpf – PBSX Prophage,False,0.008720304,Xpf,Prophage element that induces production of bacteriocin and cell lysis in response to DNA-damaging agents,Mobile Genes
7,SigB-1 – General Stress 1,False,-0.008706551,SigB,"Survival of general stressors including ethanol, salt, paraquat, heat, and freeze-thaw",Stress
71,"TnrA + CodY – Leucine, Methionine, and Threonine",False,-0.008455983,[TnrA + CodY + ThrR] / [TnrA + CodY + T-box + CcpA + SigA],"Synthesis and salvage of leucine, methionine, threonine",Amino Acids
36,AbrB – Transition State,False,0.008180093000000001,AbrB,"Various transition state roles: spore killing, antibiotic resistance, toxin production, metabolism, protein modification, and unknown proteins.",Lifestyles
40,NadR / BirA – NAD and Biotin,False,0.007868013,[NadR] / [BirA],"Biosynthesis of NAD and biotin, plus safA & coxA sporulation proteins and repression of manganese uptake",Multi-Purpose
8,Fnr – Nitrate Respiration,False,-0.007775312,Fnr + SigA,Nitrate respiration and nitrite extrusion,Oxygen Limitation
57,Fur – Iron Limitation,False,-0.007685842000000001,Fur,"Production and transport of siderophores for iron chelation, replacement of ferredoxins in the ETC with flavodoxins, RNA chaperones for iron-limited conditions, heme degradation",Elements
39,MtrB – Tryptophan,False,0.007339773000000001,MtrB,Biosynthesis of tryptophan,Amino Acids
52,His – Histidine Synthesis,False,0.00733189,YlxR,Synthesis of histidine,Amino Acids
20,"IolR / MelR – Inositol, Melibiose, and Acetoin",False,0.00727121,[IolR] / [MelR] / [AcoR],"Uptake and utilization of inositol, melibiose/raffinose, and acetoin",Multi-Purpose
17,Uncharacterized 1,False,-0.007163601,,"Contains a SigE/SigG inhibitor, spore coat proteins, translational proteins, oxidative stress response, many RNAs",Uncharacterized
2,CodY – BCAA Limitation,False,-0.0071624850000000006,CodY,"Uptake of di-/oligopeptides, uptake of guanosine, cell wall metabolism",Amino Acids
61,FrlR – Amino Sugars,False,0.0070198610000000005,FrlR,Amino sugar uptake and metabolism,Carbon
48,SigE – Sporulation 2,False,-0.006910002,SigE,"Spore maturation through core dehydration, nutrient transport and utilization, septum degradation, inner cortex synthesis, and regulator activation",Sporulation
25,SigK-2 – Sporulation 6,False,-0.006730735000000001,SigK,"Production of outermost spore coat and crust proteins, mother cell lysis",Sporulation
5,Eps – Exopolymeric Substances,False,-0.006723164,SigA + AbrB + RemA + SinR,"Biosynthesis of tasA and extracellular polysaccharides, the major components of the biofilm",Lifestyles
54,DegU – Toxins and Colony Establishment,False,-0.006704293,DegU,"Response to arrested flagellar motor. Secretion of yukE, a homolog of virulence factor EsxA. Production of antitoxins and putative toxin y-genes. Production of hydrophobic biofilm layer and lipoproteins for motility. Many unknown proteins.",Lifestyles
11,ArsR+ – Diamide Stress,False,-0.006697784,[ArsR] / [YodB] / [SigA + CtsR] / [SigA + CsoR],"Detoxification in response to: oxidative protein damage, arsenic, catechol, copper, toxic quinones",Multi-Purpose
12,Yrk – Putative Sulfur Carriers,False,-0.006624782,,Putative sulfur carriers. High activity under diamide stress,Elements
69,CymR – Sulfur,False,-0.006615375000000001,CymR,"Sulfur metabolism in response to oxidative stress. Utilization and detoxification of S-(2-succino)cysteine, methionine-cysteine conversion, siroheme biosynthesis",Elements
51,ComK – Competence,False,-0.006093969,ComK,"DNA transport, pseudopilus, recombination machinery, and regulatory proteins for competence",Lifestyles
43,Uncharacterized 2,False,-0.00606452,,"Contains cold shock, sporulation onset, toxin, amino acid homeostasis, translataional, other proteins, many RNAs",Uncharacterized
75,HutP – Histidine Utilization,False,0.0058631460000000005,HutP,Histidine uptake and utilization,Amino Acids
59,FruR – Fructose,False,0.005679501,FruR,Fructose uptake and utilization,Carbon
53,ComA – Surfactants,False,0.005623579,[ComA + CcpA + TnrA] / [Abh + SigA + ComA + Spx + PhoP + CodY + PerR],"Activated during transition to stationary phase (quorum sensing), production of surfactant and exoenzymes to improve nutrient delivery in the biofilm, ComS for activation of competence ",Lifestyles
6,MalR – Malate,False,0.005344842000000001,MalR,Malate uptake and utilization,Carbon
30,ManR – Mannose,False,0.0053109030000000005,ManR,Utilization of mannose for cell wall synthesis. Needed for exponential growth in LB media (absent glucose) or in the presence of fructose,Carbon
74,PhoP-2 – Phosphate Limitation 2,False,0.005295493,PhoP + SigA,"Degradation of wall teichoic acid to salvage phosphate, synthesis of teichuronic acid to replace wall, high-affinity phosphate uptake.",Elements
34,Uncharacterized 4,False,0.004972684000000001,,Contains many poorly characterized RNAs with noisy activity ,Uncharacterized
23,SigD – Motility,False,-0.004750203000000001,SigD,"Production of flagella components and export machinery, chemotaxis receptors, use of extracellular energy (polyglutamic acid), regulation of swarming, sporulation inhibitors, cell wall turnover",Lifestyles
13,SigK-1 – Sporulation 5,False,0.004411971000000001,SigK,"Production of spore coat and crust proteins, L-sulfolactate production, spore coat cross-linking, stress resistance, many unknown proteins",Sporulation
15,GerE / GerR – Mid-late Spore Coat,False,0.0042734520000000005,[SigK + GerE] / [SigK + GerR],"Production of spore coat and crust proteins. Omitted from sporulation analysis because all genes are contained by SigK1 & 2, and activity levels are very noisy in non-sporulating conditions.",Sporulation
27,SknR – Skin Element,False,-0.004236031,SknR,Prophage element that disrupts the SigK gene but also plays roles in preventing early germination and regulating proliferation. Unknown and toxin resistance genes.,Mobile Genes
49,LexA – DNA Repair,False,0.004231297,LexA,SOS response for DNA protection and repair,Stress
3,AcoR – Acetoin,False,-0.003974704,AcoR,"Utilization of acetoin, extracellular energy storage",Carbon
4,SigW – Cell Wall Stress,False,-0.003960043,SigW,"Adaptation to membrane active agents such as cefuroxime, antimicrobials from B. amyloliquefaciens, sdpC, and nisin. Control of membrane fluidity. Contains many unknown proteins.",Stress
55,Noise – LBGexp_1,False,0.0038977350000000003,,Likely accounting for noise in the first sample of LBG_exp. Top few RNAs are 5' UTRs of glucose metabolism genes,Uncharacterized
58,PurR – Purines,False,-0.0035966490000000004,PurR,"Synthesis of purine, xanthine and guanine uptake and conversion into purines",Other Organics
67,CymR / NsrR – Sulfur and Nitrate Respiration,False,0.003456784,[SigA + CymR] / [ResD + SigA + NsrR],Import and utilization of sulfonate and cystine for cysteine production. Nitrite reduction,Multi-Purpose
32,CzrA – Toxic Cation Export,False,-0.0030340170000000004,CzrA,"Resistance to Zn, Cu, Co, Ni, and Cd",Elements
29,Noise – S1235,False,-0.002984608,,"Independent transcript S1235, behaves similar to late sporulation I-modulons",Uncharacterized
46,SigB-2 – General Stress 2,False,-0.0028277690000000004,SigB,Likely accounting for microarray saturation in the ethanol condition of I-modulon SigB 1 by negatively weighting highly expressed ethanol genes,Stress
80,LicR – Lichenan,False,0.002298244,LicR,"Uptake, phosphorylation, and utilization of lechenin, a glucan found in soil",Carbon
33,Uncharacterized 3,False,-0.002160281,,"Contains many poorly characterized RNAs with noisy activity but clear time correlations, especially in sporulation. May be indicative of overall decreased translational activity ",Uncharacterized
28,Noise – S415,False,0.002064381,,Noisy independent transcript S415,Uncharacterized
9,ResD – Oxygen Limitation,False,-0.001751291,ResD,"Anaerobic nitrate respiration, bacteriocin production, heme, cytochrome, and ATP synthesis, copper homeostasis",Oxygen Limitation
24,Uncharacterized 5,False,0.001710516,,Contains many poorly characterized RNAs with noisy activity ,Uncharacterized
44,Rex – Overflow Metabolism,False,-0.0012344930000000001,Rex,Overflow metabolism (LDH) and cytochrome BD oxidation  for respiration in anaerobic conditions,Oxygen Limitation
62,Noise – S144,False,0.0011930480000000002,,"Likely accounting for noisey RNA S144, an independent transcript",Uncharacterized
21,StrRes – Translation,False,-0.001179486,[stringent response] / [RplJ],"Production of ribosomes, translation initiation factors, ADP formation, protein processing and secretory machinery, DNA replication, RNA polymerase",Lifestyles
56,AhrC – Arginine,False,0.001115125,AhrC + YlxR,Uptake and biosynthesis of arginine,Amino Acids
14,WapA – Intercellular Competition,False,0.0005364570000000001,SigA + YvrHb + DegU + WalR,Activation of WapA and its operon of unknown genes for interspecies toxin delivery,Lifestyles
64,Spβ-2 – SP-β Prophage 2,False,0.0005134860000000001,CsoR + SigA + SigK + SigE,"Temperature-responsive SP-beta prophage. Prophage, unknown, and putative metabolic genes. Response to mitomycin.",Mobile Genes
63,Noise – Carbon Source Transition 2,False,-0.00033879200000000003,,Likely accounting for noise in carbon source transition and gluconnate experiments,Uncharacterized
70,Thi-Box – Thiamine,False,-0.000167207,Thi-box,Synthesis and uptake of thiamine,Other Organics
35,Spo0A – Sporulation 1,False,0.00015235500000000001,[Spo0A] / [DnaA],"Initiation of sporulation through sigma factor, transcription factor, and regulatory protein expression, as well as septum formation and chromosome anchoring",Sporulation
78,Empty 3,False,9.81e-05,,Contains no genes,Uncharacterized
66,SigG – Sporulation 4,False,-3.28e-05,SigG,"Calcium and nutrient delivery to the spore, endospore cortex maturation, lipoproteins, forespore-specific metabolic proteins, many unknown sporulation proteins, stress resistance, proteins required for germination",Sporulation
