locus,gene_weight,gene_name,gene_product,cog,regulator,link
b2103,0.289990407801394,thiD,bifunctional hydroxymethylpyrimidine kinase/phosphomethylpyrimidine kinase,Coenzyme transport and metabolism,"YeiE,Thiamine diphosphate",https://ecocyc.org/gene?orgid=ECOLI&id=G7135
b2104,0.2442064613610384,thiM,hydroxyethylthiazole kinase,Nucleotide transport and metabolism,Thiamine diphosphate,https://ecocyc.org/gene?orgid=ECOLI&id=M007
b0068,0.1445079366733579,thiB,thiamine ABC transporter periplasmic binding protein,Inorganic ion transport and metabolism,"RpoD,SgrR,ppGpp,DksA",https://ecocyc.org/gene?orgid=ECOLI&id=EG11574
b0067,0.1304259458928487,thiP,thiamine ABC transporter membrane subunit,Inorganic ion transport and metabolism,"RpoD,YcjW,ppGpp,SgrR,DksA",https://ecocyc.org/gene?orgid=ECOLI&id=EG11573
b2102,0.1252591332039665,yegX,putative hydrolase,Cell wall/membrane/envelope biogenesis,,https://ecocyc.org/gene?orgid=ECOLI&id=G7134
b1112,-0.1471772012250986,bhsA,DUF1471 domain-containing multiple stress resistance outer membrane protein BhsA,Cell wall/membrane/envelope biogenesis,"RpoD,RpoE,Crp,ComR",https://ecocyc.org/gene?orgid=ECOLI&id=G6570
