k,Name,in_iM,gene_weight,Regulator,Function,Category
72,LevR – Levan and Fructose,True,0.264009276,LevR,"Fuctose uptake and phosphorylation, degradation of the exopolysaccharide levan into fructose",Carbon
30,ManR – Mannose,False,0.048434019,ManR,Utilization of mannose for cell wall synthesis. Needed for exponential growth in LB media (absent glucose) or in the presence of fructose,Carbon
38,GlpP – Glycerol,False,-0.027431734000000003,GlpP,Glycerol uptake and utilization,Carbon
50,PyrR – Pyrimidines,False,0.017203569000000002,PyrR,Synthesis of pyrimidines,Other Organics
56,AhrC – Arginine,False,-0.016723999,AhrC + YlxR,Uptake and biosynthesis of arginine,Amino Acids
33,Uncharacterized 3,False,0.016238698,,"Contains many poorly characterized RNAs with noisy activity but clear time correlations, especially in sporulation. May be indicative of overall decreased translational activity ",Uncharacterized
8,Fnr – Nitrate Respiration,False,0.015495124,Fnr + SigA,Nitrate respiration and nitrite extrusion,Oxygen Limitation
43,Uncharacterized 2,False,-0.014167801,,"Contains cold shock, sporulation onset, toxin, amino acid homeostasis, translataional, other proteins, many RNAs",Uncharacterized
40,NadR / BirA – NAD and Biotin,False,0.013028487,[NadR] / [BirA],"Biosynthesis of NAD and biotin, plus safA & coxA sporulation proteins and repression of manganese uptake",Multi-Purpose
46,SigB-2 – General Stress 2,False,-0.012365225,SigB,Likely accounting for microarray saturation in the ethanol condition of I-modulon SigB 1 by negatively weighting highly expressed ethanol genes,Stress
14,WapA – Intercellular Competition,False,0.011304771,SigA + YvrHb + DegU + WalR,Activation of WapA and its operon of unknown genes for interspecies toxin delivery,Lifestyles
1,FadR – Fatty Acids,False,0.011265553000000001,FadR,Fatty acid degradation,Carbon
36,AbrB – Transition State,False,-0.011200749000000001,AbrB,"Various transition state roles: spore killing, antibiotic resistance, toxin production, metabolism, protein modification, and unknown proteins.",Lifestyles
69,CymR – Sulfur,False,0.009119605000000001,CymR,"Sulfur metabolism in response to oxidative stress. Utilization and detoxification of S-(2-succino)cysteine, methionine-cysteine conversion, siroheme biosynthesis",Elements
25,SigK-2 – Sporulation 6,False,-0.008528907,SigK,"Production of outermost spore coat and crust proteins, mother cell lysis",Sporulation
41,S-Box – Methionine,False,-0.008392783000000001,S-box,Methionine salvage and biosynthesis,Amino Acids
53,ComA – Surfactants,False,0.008248849,[ComA + CcpA + TnrA] / [Abh + SigA + ComA + Spx + PhoP + CodY + PerR],"Activated during transition to stationary phase (quorum sensing), production of surfactant and exoenzymes to improve nutrient delivery in the biofilm, ComS for activation of competence ",Lifestyles
24,Uncharacterized 5,False,-0.008165751,,Contains many poorly characterized RNAs with noisy activity ,Uncharacterized
23,SigD – Motility,False,-0.007779914000000001,SigD,"Production of flagella components and export machinery, chemotaxis receptors, use of extracellular energy (polyglutamic acid), regulation of swarming, sporulation inhibitors, cell wall turnover",Lifestyles
48,SigE – Sporulation 2,False,-0.007475406,SigE,"Spore maturation through core dehydration, nutrient transport and utilization, septum degradation, inner cortex synthesis, and regulator activation",Sporulation
6,MalR – Malate,False,-0.0074680860000000005,MalR,Malate uptake and utilization,Carbon
57,Fur – Iron Limitation,False,0.007074644000000001,Fur,"Production and transport of siderophores for iron chelation, replacement of ferredoxins in the ETC with flavodoxins, RNA chaperones for iron-limited conditions, heme degradation",Elements
34,Uncharacterized 4,False,-0.006914222,,Contains many poorly characterized RNAs with noisy activity ,Uncharacterized
51,ComK – Competence,False,0.006797753,ComK,"DNA transport, pseudopilus, recombination machinery, and regulatory proteins for competence",Lifestyles
21,StrRes – Translation,False,-0.006773746000000001,[stringent response] / [RplJ],"Production of ribosomes, translation initiation factors, ADP formation, protein processing and secretory machinery, DNA replication, RNA polymerase",Lifestyles
67,CymR / NsrR – Sulfur and Nitrate Respiration,False,-0.006644706,[SigA + CymR] / [ResD + SigA + NsrR],Import and utilization of sulfonate and cystine for cysteine production. Nitrite reduction,Multi-Purpose
42,Noise – Carbon Source Transition 1,False,0.00636528,,Likely accounting for noise in the carbon source transition experiments,Uncharacterized
65,Xpf – PBSX Prophage,False,-0.006288748,Xpf,Prophage element that induces production of bacteriocin and cell lysis in response to DNA-damaging agents,Mobile Genes
68,SigE / G – Sporulation 3,False,-0.0061088570000000005,[SigE] / [SigG],"Spore coat production, transcription factor and regulator expression, spore DNA protection, spore stress resistance",Sporulation
4,SigW – Cell Wall Stress,False,-0.0059577,SigW,"Adaptation to membrane active agents such as cefuroxime, antimicrobials from B. amyloliquefaciens, sdpC, and nisin. Control of membrane fluidity. Contains many unknown proteins.",Stress
59,FruR – Fructose,False,0.005758433,FruR,Fructose uptake and utilization,Carbon
61,FrlR – Amino Sugars,False,0.0051826630000000005,FrlR,Amino sugar uptake and metabolism,Carbon
54,DegU – Toxins and Colony Establishment,False,0.00512634,DegU,"Response to arrested flagellar motor. Secretion of yukE, a homolog of virulence factor EsxA. Production of antitoxins and putative toxin y-genes. Production of hydrophobic biofilm layer and lipoproteins for motility. Many unknown proteins.",Lifestyles
3,AcoR – Acetoin,False,0.004855883,AcoR,"Utilization of acetoin, extracellular energy storage",Carbon
28,Noise – S415,False,0.004705985,,Noisy independent transcript S415,Uncharacterized
26,Uncharacterized 6,False,0.004543573,,5’ ends of tRNAs and independent transcripts,Uncharacterized
80,LicR – Lichenan,False,-0.0045021340000000005,LicR,"Uptake, phosphorylation, and utilization of lechenin, a glucan found in soil",Carbon
47,SigM – Membrane Stress,False,-0.004300501,SigM,"General stress proteins, alarmones, lipid carriers and flippases, DNA repair, inhibition of septation. Contains many UTRs and some unknown proteins.",Stress
75,HutP – Histidine Utilization,False,-0.004253207,HutP,Histidine uptake and utilization,Amino Acids
7,SigB-1 – General Stress 1,False,-0.004094478,SigB,"Survival of general stressors including ethanol, salt, paraquat, heat, and freeze-thaw",Stress
17,Uncharacterized 1,False,-0.004022348,,"Contains a SigE/SigG inhibitor, spore coat proteins, translational proteins, oxidative stress response, many RNAs",Uncharacterized
39,MtrB – Tryptophan,False,0.0037684990000000002,MtrB,Biosynthesis of tryptophan,Amino Acids
44,Rex – Overflow Metabolism,False,0.0037003760000000004,Rex,Overflow metabolism (LDH) and cytochrome BD oxidation  for respiration in anaerobic conditions,Oxygen Limitation
60,RocR / PutR – Arginine and Proline Utilization,False,-0.0035051770000000004,[SigL + AhrC + RocR] / [Spo0A + SigA + CodY + PutR],"Utilization of arginine, ornithine, citrulline and proline as carbon and energy sources",Amino Acids
71,"TnrA + CodY – Leucine, Methionine, and Threonine",False,-0.003482031,[TnrA + CodY + ThrR] / [TnrA + CodY + T-box + CcpA + SigA],"Synthesis and salvage of leucine, methionine, threonine",Amino Acids
10,CcpA-2 – Low Glucose 2,False,0.00328227,[CcpA + SigA] / [CcpN],"Uptake, utilization, and regulation of alternative carbon sources: TCA intermediates, ribose, maltodextrin, galacto-oligosaccharides, acetoin, gluconate, etc. Suppression of glucose pathways. Stationary phase.",Carbon
27,SknR – Skin Element,False,0.00305573,SknR,Prophage element that disrupts the SigK gene but also plays roles in preventing early germination and regulating proliferation. Unknown and toxin resistance genes.,Mobile Genes
16,Ybc – Uncharacterized Operon,False,0.002984205,,Contains one subunit of NADH dehydrogenase with several unknown genes. Categorized as prophage. Responds to heat shock.,Stress
29,Noise – S1235,False,0.002846471,,"Independent transcript S1235, behaves similar to late sporulation I-modulons",Uncharacterized
35,Spo0A – Sporulation 1,False,-0.00280457,[Spo0A] / [DnaA],"Initiation of sporulation through sigma factor, transcription factor, and regulatory protein expression, as well as septum formation and chromosome anchoring",Sporulation
18,ImmR – ICEBs1,False,-0.002668146,ImmR,Mobile genetic element that participates in horizontal gene transfer,Mobile Genes
79,Alb – Antilisterial Bacteriocin,False,0.002602881,Rok + ResD + AbrB + SigA,"Produces and exports subtilosin, which kills anaerobic listeria bacteria",Lifestyles
70,Thi-Box – Thiamine,False,0.002564104,Thi-box,Synthesis and uptake of thiamine,Other Organics
0,PchR – Pulcherrimin,False,-0.002549467,PchR,Extracellular synthesis and import of pulcherrimin for iron acquisition,Elements
12,Yrk – Putative Sulfur Carriers,False,-0.0025476550000000002,,Putative sulfur carriers. High activity under diamide stress,Elements
32,CzrA – Toxic Cation Export,False,-0.00250672,CzrA,"Resistance to Zn, Cu, Co, Ni, and Cd",Elements
64,Spβ-2 – SP-β Prophage 2,False,0.002479448,CsoR + SigA + SigK + SigE,"Temperature-responsive SP-beta prophage. Prophage, unknown, and putative metabolic genes. Response to mitomycin.",Mobile Genes
74,PhoP-2 – Phosphate Limitation 2,False,0.002426881,PhoP + SigA,"Degradation of wall teichoic acid to salvage phosphate, synthesis of teichuronic acid to replace wall, high-affinity phosphate uptake.",Elements
37,Noise – Diamide 15,False,-0.002323519,,Likely accounting for noise in the diamide after 15 minutes and LBG exponential conditions,Uncharacterized
77,PhoP-1 – Phosphate Limitation 1,False,0.002294983,PhoP + SigA,"High-affinity phosphate uptake, teichuronic acid production pseudogene.",Elements
22,Spβ-1 – SP-β Prophage 1,False,-0.002052452,,Temperature-responsive SP-beta prophage. Response to stressors such as cold and ethanol. Subset of  SPbeta Prophage 2.,Mobile Genes
63,Noise – Carbon Source Transition 2,False,-0.002007716,,Likely accounting for noise in carbon source transition and gluconnate experiments,Uncharacterized
58,PurR – Purines,False,-0.0017919180000000002,PurR,"Synthesis of purine, xanthine and guanine uptake and conversion into purines",Other Organics
9,ResD – Oxygen Limitation,False,-0.0017526710000000001,ResD,"Anaerobic nitrate respiration, bacteriocin production, heme, cytochrome, and ATP synthesis, copper homeostasis",Oxygen Limitation
76,Empty 2,False,0.0015915290000000002,,Contains no genes,Uncharacterized
81,"MtlR / AnsR – Mannitol, Asparagine, and Aspartate",False,-0.0015841520000000001,[MtlR] / [AnsR + SigA],"Uptake and utilization of mannitol, degradation of asparagine and aspartate",Multi-Purpose
78,Empty 3,False,-0.001580627,,Contains no genes,Uncharacterized
2,CodY – BCAA Limitation,False,0.001546599,CodY,"Uptake of di-/oligopeptides, uptake of guanosine, cell wall metabolism",Amino Acids
45,Zur – Zinc Limitation,False,-0.001496364,Zur,"Zinc uptake, zinc metallochaperones, alternatives to zinc-containing proteins",Elements
73,TnrA / PucR – Nitrogen Limitation,False,0.00130843,[SigA + TnrA] / [SigA + PucR],"Ammonium uptake, utilization of nitrate and xanthine. Suggests nitrate limitation in the BT condition",Multi-Purpose
15,GerE / GerR – Mid-late Spore Coat,False,-0.001217423,[SigK + GerE] / [SigK + GerR],"Production of spore coat and crust proteins. Omitted from sporulation analysis because all genes are contained by SigK1 & 2, and activity levels are very noisy in non-sporulating conditions.",Sporulation
20,"IolR / MelR – Inositol, Melibiose, and Acetoin",False,-0.00108133,[IolR] / [MelR] / [AcoR],"Uptake and utilization of inositol, melibiose/raffinose, and acetoin",Multi-Purpose
49,LexA – DNA Repair,False,0.000998912,LexA,SOS response for DNA protection and repair,Stress
11,ArsR+ – Diamide Stress,False,0.0009705750000000001,[ArsR] / [YodB] / [SigA + CtsR] / [SigA + CsoR],"Detoxification in response to: oxidative protein damage, arsenic, catechol, copper, toxic quinones",Multi-Purpose
66,SigG – Sporulation 4,False,-0.0009058810000000001,SigG,"Calcium and nutrient delivery to the spore, endospore cortex maturation, lipoproteins, forespore-specific metabolic proteins, many unknown sporulation proteins, stress resistance, proteins required for germination",Sporulation
19,Empty 1,False,-0.0008347640000000001,,Contains no genes,Uncharacterized
55,Noise – LBGexp_1,False,-0.000689893,,Likely accounting for noise in the first sample of LBG_exp. Top few RNAs are 5' UTRs of glucose metabolism genes,Uncharacterized
62,Noise – S144,False,-0.00067837,,"Likely accounting for noisey RNA S144, an independent transcript",Uncharacterized
52,His – Histidine Synthesis,False,0.000600975,YlxR,Synthesis of histidine,Amino Acids
82,CcpA-1 – Low Glucose 1,False,0.000596685,CcpA + SigA,"Uptake and utilization of alternative carbon sources: ribose, sucrose, salicin, beta-glucosides, lichenan,  glucomannon, trehalose, G3P, etc. High expression in exponential phase on LB media",Carbon
31,Noise – S1210,False,-0.00056757,,Noisy independent transcript S1210,Uncharacterized
5,Eps – Exopolymeric Substances,False,-0.00028732400000000004,SigA + AbrB + RemA + SinR,"Biosynthesis of tasA and extracellular polysaccharides, the major components of the biofilm",Lifestyles
13,SigK-1 – Sporulation 5,False,-2.81e-05,SigK,"Production of spore coat and crust proteins, L-sulfolactate production, spore coat cross-linking, stress resistance, many unknown proteins",Sporulation
