k,name,in_iM,gene_weight,regulator,function,category
24,Protocatechuate,False,0.0339648646,,Benzoate degradation: pcaBCGHK,Metabolism
16,Unchar-8,False,0.028474894,,"fur, ribosomal proteins (rpsT, rplS, rpmE), ribosomal modulation factor, cold shock proteins, bacterioferritin, bacterioferritin-associated ferredoxin, transposases",Uncharacterized
19,single_gene_1,False,-0.0207184116,,"baeR, exdb, unknown genes",Noise
8,Alginate,False,0.019273867,,"Alginate biosynthesis, phenol degradation protein, benzaldehyde dehydrogenase, dimethylglycine demethylation, genes involved in amino acid transport and metabolism",Exometabolites
7,Unchar-9,False,0.0167448127,PSPTO_3698,"molybdenum cofactor-associated genes: moaA, fdhD, oxidoreductase (molydopterin binding protein); xanyhine dehydrogenase subunits (xdhAB) and xanthine dehydrogenase accessory protein (xdhC)",Uncharacterized
17,Unchar-2,False,-0.0165608037,,"oxidative stress response: pqq, kdpf, organic hydroperoxide resistance protein, pirin (ortholog); nusA",Uncharacterized
33,Pyoverdine,False,0.0162600744,PvdS,"Biosynthesis and transport of pyoverdine, metal transporters",Exometabolites
2,Chemotaxis,False,-0.0137489525,,"crp, csrA, flgM, chemotaxis proteins, membrane components, fliC, methyl accepting chemotaxis proteins, glycosyltransferase, several genes involved in signal transduction, flagellar genes: hook-associated proteins, filament capping protein, motor protein, motor stator protein",Motility
1,Unchar-1,False,-0.012749343500000001,,"colR/colS two component system, pyruvate metabolism, insecticidal toxins, groES, glycerol uptake, etc.",Uncharacterized
32,Folate,False,0.0126734606,,"Tetrahydrofolate production: soxGADB, folD, purU",Metabolism
18,Translation-2,False,-0.0116389525,,"Ribosome maturation factor, rho, rpsU, rpiU",Translation
10,Sulfur-2,False,0.011080461000000002,,"Sulfur starvation response protein (oscA), alkane sulfonate transporters, sulfate transporters, amino acid transporters",Metabolism
14,Chaperone,False,-0.01078048,,"Chaperones, heat shock proteins, proteins involved in repair processes other than in response to heat shock, ATP-dependent protease ATPase subunits",Stress Response
22,Carbon Starvation-2,False,0.0106316799,,Inositol phosphate and galactose metabolism,Metabolism
40,Unchar-5,False,-0.0106264101,,"several unknown genes, type III effectors, cold shock domain-containing proteins, RNA-directed DNA polymerase, integrase, cysteine synthase familiy proteins",Uncharacterized
28,Osmotic Stress,False,0.0103248791,,"Osmotic/water stress resistance: osmoprotectants, compatible solute production; oxidative stress resistance ",Stress Response
21,Fe/Protein Transport,False,-0.010061325000000001,,"Iron starvation response: PvdS,  FoxR (ortholog), other sigma factors associated with iron starvation response, bacterioferritin, bacterioferritin-associated ferredoxin, energy transduction (exbBD), TonB-dependent siderophore receptors ",Metal Uptake
39,Resistance-2,False,-0.0099236522,CueR,"Syringafactin production and efflux, cueR, copper transport, chemotaxis, uric acid production, virulence factor srfB, virulence effector srfC, bacterioferritin, Flp type IV pilin",Stress Response
27,Yersiniabactin,False,-0.0098124419,,Biosynthesis and transport of yersiniabactin,Exometabolites
3,Sulfur-1,False,-0.009353846,,"Taurine, alkane sulfonate, cysteine, and methionine transport",Metabolism
13,Transport,False,-0.0085180798,,"Transport of inorganic ions, amino acids, carbohydrates, and lipids; membrane proteins; carbon starvation protein A; tryptophan synthesis; syringafactin synthesis",Metabolism
4,Recombination,False,-0.008329175900000001,,"Recombinases family proteins, several genes of unknown function",Stress Response
38,AlgU,False,-0.0077816938,AlgU,"algU (rpoE),  hrpR, alginate biosynthesis, stress resistance: oxidative, osmotic, heat, UV, and metal ion stress",Stress Response
29,Fatty Acid,False,-0.0071630642,PsrA,"psrA, fadAB, etfAB, genes with multiple drug resistance domains",Metabolism
11,Unchar-6,False,-0.0069360091,,uncharacterized,Uncharacterized
0,Nitrogen,False,-0.0065930482,NtrC,"Nitrogen stress response: ntrB/ntrC two component system, glnK, amtB, utilization of alternate nitrogen sources: urea (conversion of urea to ammonia), amino acids (transporters), pyrimidines (rutABCD), allantoin (allantoin permease), GABA (GABA permease)",Metabolism
37,T3SS,False,-0.0065884634,,"hrpR, hrpS, hrpL, coronatine biosynthesis activation: corP, corR/corS two component system, type III effectors, type III secretion system chaperones, type III secretion system components, type III secretion proteins, type III helper protein, type III restriction system endonuclease,ribosome modulation factor, HPr kinase, pectate lyase, flagellar hook length control protein",Exometabolites
30,Unchar-3,False,0.0060209814,,"phoP/phoQ two component system, phosphate ABC transporter, pyruvate dehydrogenase, pbpG",Uncharacterized
26,Zur,False,0.0054947833,PSPTO_5267,"Zinc transporters, cadA, rpme-1, iron transporters, and receptors",Metal Uptake
12,Plasmid,False,-0.0049863901,,"Plasmid genes: conjugal transfer proteins, DNA primase, glycoside hydrolase, mobilization proteins, type III effectors, integrase, UV resistance protein A, replication initiation protein; efflux transporters, glycine metabolism, sarcosine oxidase subunits ( likely due to plasmid manipulation)",Genomic
44,Fe-S/Oxidative Stress,False,0.004983056400000001,,"Fe-S cluster assembly, oxidative stress resistance: sodA, fumC, katB, catalase ",Stress Response
42,single_gene_4,False,-0.0042994887,,"helix-turn-helix domain-containing protein, genes of unknown function",Noise
9,Resistance-1,False,0.0041923088,,"MarR transcriptional regulator, efflux transporter subunits (RND, MFS, etc.), sulforaphane/aliphatic isothiocyanate, resistance proteins (saxAF)",Stress Response
34,Unchar-7,False,-0.0041145677,,"lipid-A-disaccharide synthase, TolC family protein, dihydrolipoyllysine-residue acetyltransferase",Uncharacterized
31,Carbon Starvation-1,False,0.00404698,,"Carbon starvation response: carbon starvation protein A, acetate utilization; pilin assembly: tadABCZ (homologs), rcpAC (homologs), flp family type IVb pilin",Metabolism
15,Coronatine,False,-0.0039657362,,Coronatine biosynthesis: coronamic acid and coronafacic acid; alginate biosynthesis; type III effectors,Exometabolites
36,Translation-1,False,0.0037226496,,"Ribosomal proteins, atpCG, secY, rpoA",Translation
6,IS-elements,False,-0.0033628886000000003,,"transposases, ptrB",Genomic
25,Flagella-2,False,0.0031887505,,"Glycosyltransferase, flagellar biosynthesis and assembly: hook, P-ring, export ATPase, chaperone, type III secretion system; cheZ",Motility
20,single_gene_2,False,0.0029356837,,"helix-turn-helix domain-containing protein, IS element, holin, kdpF, genes of unknown function",Noise
5,Unchar-4,False,-0.0025298313000000003,,"Zinc transporters, cadA, rpme-1, iron transporters and receptors",Uncharacterized
41,single_gene_3,False,0.0022927349,,genes of unknown function,Noise
35,Flagella-1,False,-0.0019147592,,"fleS/fleR two component system, flagellar biosynthesis and assembly: rod; hook; L; M, and P ring; hook and basal body complex; motor switch; flagellar type III secretion system",Motility
23,Phage,False,0.0017214475,,"prtN, ptrB, prophage genes associated with pyocin production in Pseudomonas aeruginosa",Genomic
43,single_gene_5,False,0.0006582155,,"holin, genes of unknown function",Noise
