k,Name,in_iM,gene_weight,Regulator,Function,Category
54,DegU – Toxins and Colony Establishment,False,0.047300626,DegU,"Response to arrested flagellar motor. Secretion of yukE, a homolog of virulence factor EsxA. Production of antitoxins and putative toxin y-genes. Production of hydrophobic biofilm layer and lipoproteins for motility. Many unknown proteins.",Lifestyles
36,AbrB – Transition State,False,-0.038922224,AbrB,"Various transition state roles: spore killing, antibiotic resistance, toxin production, metabolism, protein modification, and unknown proteins.",Lifestyles
37,Noise – Diamide 15,False,0.038711255,,Likely accounting for noise in the diamide after 15 minutes and LBG exponential conditions,Uncharacterized
81,"MtlR / AnsR – Mannitol, Asparagine, and Aspartate",False,-0.027127511,[MtlR] / [AnsR + SigA],"Uptake and utilization of mannitol, degradation of asparagine and aspartate",Multi-Purpose
31,Noise – S1210,False,-0.026484942999999997,,Noisy independent transcript S1210,Uncharacterized
79,Alb – Antilisterial Bacteriocin,False,0.02495692,Rok + ResD + AbrB + SigA,"Produces and exports subtilosin, which kills anaerobic listeria bacteria",Lifestyles
27,SknR – Skin Element,False,-0.021976597,SknR,Prophage element that disrupts the SigK gene but also plays roles in preventing early germination and regulating proliferation. Unknown and toxin resistance genes.,Mobile Genes
35,Spo0A – Sporulation 1,False,-0.021800926,[Spo0A] / [DnaA],"Initiation of sporulation through sigma factor, transcription factor, and regulatory protein expression, as well as septum formation and chromosome anchoring",Sporulation
17,Uncharacterized 1,False,0.021693702999999998,,"Contains a SigE/SigG inhibitor, spore coat proteins, translational proteins, oxidative stress response, many RNAs",Uncharacterized
23,SigD – Motility,False,-0.018976615,SigD,"Production of flagella components and export machinery, chemotaxis receptors, use of extracellular energy (polyglutamic acid), regulation of swarming, sporulation inhibitors, cell wall turnover",Lifestyles
71,"TnrA + CodY – Leucine, Methionine, and Threonine",False,0.016902703999999998,[TnrA + CodY + ThrR] / [TnrA + CodY + T-box + CcpA + SigA],"Synthesis and salvage of leucine, methionine, threonine",Amino Acids
72,LevR – Levan and Fructose,False,0.016112695,LevR,"Fuctose uptake and phosphorylation, degradation of the exopolysaccharide levan into fructose",Carbon
47,SigM – Membrane Stress,False,-0.015197463999999999,SigM,"General stress proteins, alarmones, lipid carriers and flippases, DNA repair, inhibition of septation. Contains many UTRs and some unknown proteins.",Stress
61,FrlR – Amino Sugars,False,-0.014343412,FrlR,Amino sugar uptake and metabolism,Carbon
50,PyrR – Pyrimidines,False,-0.013352635,PyrR,Synthesis of pyrimidines,Other Organics
66,SigG – Sporulation 4,False,-0.013233068999999998,SigG,"Calcium and nutrient delivery to the spore, endospore cortex maturation, lipoproteins, forespore-specific metabolic proteins, many unknown sporulation proteins, stress resistance, proteins required for germination",Sporulation
62,Noise – S144,False,0.013100311000000002,,"Likely accounting for noisey RNA S144, an independent transcript",Uncharacterized
39,MtrB – Tryptophan,False,-0.013068136000000001,MtrB,Biosynthesis of tryptophan,Amino Acids
43,Uncharacterized 2,False,-0.012882069,,"Contains cold shock, sporulation onset, toxin, amino acid homeostasis, translataional, other proteins, many RNAs",Uncharacterized
15,GerE / GerR – Mid-late Spore Coat,False,0.012773932,[SigK + GerE] / [SigK + GerR],"Production of spore coat and crust proteins. Omitted from sporulation analysis because all genes are contained by SigK1 & 2, and activity levels are very noisy in non-sporulating conditions.",Sporulation
73,TnrA / PucR – Nitrogen Limitation,False,-0.011287771,[SigA + TnrA] / [SigA + PucR],"Ammonium uptake, utilization of nitrate and xanthine. Suggests nitrate limitation in the BT condition",Multi-Purpose
0,PchR – Pulcherrimin,False,0.010612005,PchR,Extracellular synthesis and import of pulcherrimin for iron acquisition,Elements
44,Rex – Overflow Metabolism,False,-0.010600018999999999,Rex,Overflow metabolism (LDH) and cytochrome BD oxidation  for respiration in anaerobic conditions,Oxygen Limitation
5,Eps – Exopolymeric Substances,False,0.010496803,SigA + AbrB + RemA + SinR,"Biosynthesis of tasA and extracellular polysaccharides, the major components of the biofilm",Lifestyles
63,Noise – Carbon Source Transition 2,False,-0.01045012,,Likely accounting for noise in carbon source transition and gluconnate experiments,Uncharacterized
46,SigB-2 – General Stress 2,False,0.01016741,SigB,Likely accounting for microarray saturation in the ethanol condition of I-modulon SigB 1 by negatively weighting highly expressed ethanol genes,Stress
70,Thi-Box – Thiamine,False,0.010088294,Thi-box,Synthesis and uptake of thiamine,Other Organics
55,Noise – LBGexp_1,False,-0.009971374,,Likely accounting for noise in the first sample of LBG_exp. Top few RNAs are 5' UTRs of glucose metabolism genes,Uncharacterized
26,Uncharacterized 6,False,0.009891111,,5’ ends of tRNAs and independent transcripts,Uncharacterized
76,Empty 2,False,0.009564186,,Contains no genes,Uncharacterized
16,Ybc – Uncharacterized Operon,False,0.009499229,,Contains one subunit of NADH dehydrogenase with several unknown genes. Categorized as prophage. Responds to heat shock.,Stress
18,ImmR – ICEBs1,False,0.009458691,ImmR,Mobile genetic element that participates in horizontal gene transfer,Mobile Genes
74,PhoP-2 – Phosphate Limitation 2,False,-0.00922254,PhoP + SigA,"Degradation of wall teichoic acid to salvage phosphate, synthesis of teichuronic acid to replace wall, high-affinity phosphate uptake.",Elements
52,His – Histidine Synthesis,False,-0.009009495,YlxR,Synthesis of histidine,Amino Acids
21,StrRes – Translation,False,-0.009005408000000001,[stringent response] / [RplJ],"Production of ribosomes, translation initiation factors, ADP formation, protein processing and secretory machinery, DNA replication, RNA polymerase",Lifestyles
42,Noise – Carbon Source Transition 1,False,0.008871327,,Likely accounting for noise in the carbon source transition experiments,Uncharacterized
58,PurR – Purines,False,0.00846414,PurR,"Synthesis of purine, xanthine and guanine uptake and conversion into purines",Other Organics
11,ArsR+ – Diamide Stress,False,-0.008315811,[ArsR] / [YodB] / [SigA + CtsR] / [SigA + CsoR],"Detoxification in response to: oxidative protein damage, arsenic, catechol, copper, toxic quinones",Multi-Purpose
30,ManR – Mannose,False,-0.008217927,ManR,Utilization of mannose for cell wall synthesis. Needed for exponential growth in LB media (absent glucose) or in the presence of fructose,Carbon
1,FadR – Fatty Acids,False,-0.007662188,FadR,Fatty acid degradation,Carbon
25,SigK-2 – Sporulation 6,False,-0.007294238000000001,SigK,"Production of outermost spore coat and crust proteins, mother cell lysis",Sporulation
64,Spβ-2 – SP-β Prophage 2,False,-0.006919965,CsoR + SigA + SigK + SigE,"Temperature-responsive SP-beta prophage. Prophage, unknown, and putative metabolic genes. Response to mitomycin.",Mobile Genes
20,"IolR / MelR – Inositol, Melibiose, and Acetoin",False,-0.0063965409999999995,[IolR] / [MelR] / [AcoR],"Uptake and utilization of inositol, melibiose/raffinose, and acetoin",Multi-Purpose
19,Empty 1,False,-0.006389242,,Contains no genes,Uncharacterized
6,MalR – Malate,False,0.006243456,MalR,Malate uptake and utilization,Carbon
48,SigE – Sporulation 2,False,-0.006203869,SigE,"Spore maturation through core dehydration, nutrient transport and utilization, septum degradation, inner cortex synthesis, and regulator activation",Sporulation
68,SigE / G – Sporulation 3,False,0.006129246999999999,[SigE] / [SigG],"Spore coat production, transcription factor and regulator expression, spore DNA protection, spore stress resistance",Sporulation
49,LexA – DNA Repair,False,0.005995677,LexA,SOS response for DNA protection and repair,Stress
40,NadR / BirA – NAD and Biotin,False,0.005657285,[NadR] / [BirA],"Biosynthesis of NAD and biotin, plus safA & coxA sporulation proteins and repression of manganese uptake",Multi-Purpose
53,ComA – Surfactants,False,-0.0055240969999999995,[ComA + CcpA + TnrA] / [Abh + SigA + ComA + Spx + PhoP + CodY + PerR],"Activated during transition to stationary phase (quorum sensing), production of surfactant and exoenzymes to improve nutrient delivery in the biofilm, ComS for activation of competence ",Lifestyles
69,CymR – Sulfur,False,-0.005056926,CymR,"Sulfur metabolism in response to oxidative stress. Utilization and detoxification of S-(2-succino)cysteine, methionine-cysteine conversion, siroheme biosynthesis",Elements
80,LicR – Lichenan,False,0.004930992,LicR,"Uptake, phosphorylation, and utilization of lechenin, a glucan found in soil",Carbon
9,ResD – Oxygen Limitation,False,-0.004670936,ResD,"Anaerobic nitrate respiration, bacteriocin production, heme, cytochrome, and ATP synthesis, copper homeostasis",Oxygen Limitation
22,Spβ-1 – SP-β Prophage 1,False,0.0043336040000000004,,Temperature-responsive SP-beta prophage. Response to stressors such as cold and ethanol. Subset of  SPbeta Prophage 2.,Mobile Genes
24,Uncharacterized 5,False,-0.00432722,,Contains many poorly characterized RNAs with noisy activity ,Uncharacterized
60,RocR / PutR – Arginine and Proline Utilization,False,-0.004158266,[SigL + AhrC + RocR] / [Spo0A + SigA + CodY + PutR],"Utilization of arginine, ornithine, citrulline and proline as carbon and energy sources",Amino Acids
14,WapA – Intercellular Competition,False,0.0038493620000000003,SigA + YvrHb + DegU + WalR,Activation of WapA and its operon of unknown genes for interspecies toxin delivery,Lifestyles
77,PhoP-1 – Phosphate Limitation 1,False,-0.00379018,PhoP + SigA,"High-affinity phosphate uptake, teichuronic acid production pseudogene.",Elements
3,AcoR – Acetoin,False,0.003214464,AcoR,"Utilization of acetoin, extracellular energy storage",Carbon
33,Uncharacterized 3,False,-0.0028968040000000002,,"Contains many poorly characterized RNAs with noisy activity but clear time correlations, especially in sporulation. May be indicative of overall decreased translational activity ",Uncharacterized
13,SigK-1 – Sporulation 5,False,-0.0028367059999999996,SigK,"Production of spore coat and crust proteins, L-sulfolactate production, spore coat cross-linking, stress resistance, many unknown proteins",Sporulation
38,GlpP – Glycerol,False,0.002825281,GlpP,Glycerol uptake and utilization,Carbon
57,Fur – Iron Limitation,False,0.0027241920000000003,Fur,"Production and transport of siderophores for iron chelation, replacement of ferredoxins in the ETC with flavodoxins, RNA chaperones for iron-limited conditions, heme degradation",Elements
28,Noise – S415,False,0.00271108,,Noisy independent transcript S415,Uncharacterized
41,S-Box – Methionine,False,-0.0024845329999999997,S-box,Methionine salvage and biosynthesis,Amino Acids
12,Yrk – Putative Sulfur Carriers,False,0.002383057,,Putative sulfur carriers. High activity under diamide stress,Elements
67,CymR / NsrR – Sulfur and Nitrate Respiration,False,-0.002252526,[SigA + CymR] / [ResD + SigA + NsrR],Import and utilization of sulfonate and cystine for cysteine production. Nitrite reduction,Multi-Purpose
29,Noise – S1235,False,0.0016703010000000001,,"Independent transcript S1235, behaves similar to late sporulation I-modulons",Uncharacterized
7,SigB-1 – General Stress 1,False,-0.001607006,SigB,"Survival of general stressors including ethanol, salt, paraquat, heat, and freeze-thaw",Stress
75,HutP – Histidine Utilization,False,0.001520616,HutP,Histidine uptake and utilization,Amino Acids
65,Xpf – PBSX Prophage,False,-0.001279657,Xpf,Prophage element that induces production of bacteriocin and cell lysis in response to DNA-damaging agents,Mobile Genes
82,CcpA-1 – Low Glucose 1,False,0.001086782,CcpA + SigA,"Uptake and utilization of alternative carbon sources: ribose, sucrose, salicin, beta-glucosides, lichenan,  glucomannon, trehalose, G3P, etc. High expression in exponential phase on LB media",Carbon
10,CcpA-2 – Low Glucose 2,False,0.00095676,[CcpA + SigA] / [CcpN],"Uptake, utilization, and regulation of alternative carbon sources: TCA intermediates, ribose, maltodextrin, galacto-oligosaccharides, acetoin, gluconate, etc. Suppression of glucose pathways. Stationary phase.",Carbon
34,Uncharacterized 4,False,0.0009086410000000001,,Contains many poorly characterized RNAs with noisy activity ,Uncharacterized
78,Empty 3,False,-0.000648447,,Contains no genes,Uncharacterized
59,FruR – Fructose,False,-0.000576494,FruR,Fructose uptake and utilization,Carbon
56,AhrC – Arginine,False,-0.000572375,AhrC + YlxR,Uptake and biosynthesis of arginine,Amino Acids
32,CzrA – Toxic Cation Export,False,-0.0005210719999999999,CzrA,"Resistance to Zn, Cu, Co, Ni, and Cd",Elements
2,CodY – BCAA Limitation,False,0.00041008,CodY,"Uptake of di-/oligopeptides, uptake of guanosine, cell wall metabolism",Amino Acids
51,ComK – Competence,False,-0.000343184,ComK,"DNA transport, pseudopilus, recombination machinery, and regulatory proteins for competence",Lifestyles
4,SigW – Cell Wall Stress,False,-0.00030732400000000004,SigW,"Adaptation to membrane active agents such as cefuroxime, antimicrobials from B. amyloliquefaciens, sdpC, and nisin. Control of membrane fluidity. Contains many unknown proteins.",Stress
8,Fnr – Nitrate Respiration,False,0.000286738,Fnr + SigA,Nitrate respiration and nitrite extrusion,Oxygen Limitation
45,Zur – Zinc Limitation,False,-0.00025152400000000004,Zur,"Zinc uptake, zinc metallochaperones, alternatives to zinc-containing proteins",Elements
