k,name,in_iM,gene_weight,regulator,function,category
41,single_gene_3,False,-0.009391457800000001,,genes of unknown function,Noise
35,Flagella-1,False,-0.0087856053,,"fleS/fleR two component system, flagellar biosynthesis and assembly: rod; hook; L; M, and P ring; hook and basal body complex; motor switch; flagellar type III secretion system",Motility
29,Fatty Acid,False,0.0087697034,PsrA,"psrA, fadAB, etfAB, genes with multiple drug resistance domains",Metabolism
39,Resistance-2,False,0.0084608969,CueR,"Syringafactin production and efflux, cueR, copper transport, chemotaxis, uric acid production, virulence factor srfB, virulence effector srfC, bacterioferritin, Flp type IV pilin",Stress Response
32,Folate,False,0.0082079191,,"Tetrahydrofolate production: soxGADB, folD, purU",Metabolism
8,Alginate,False,0.0080363239,,"Alginate biosynthesis, phenol degradation protein, benzaldehyde dehydrogenase, dimethylglycine demethylation, genes involved in amino acid transport and metabolism",Exometabolites
9,Resistance-1,False,-0.0072973915,,"MarR transcriptional regulator, efflux transporter subunits (RND, MFS, etc.), sulforaphane/aliphatic isothiocyanate, resistance proteins (saxAF)",Stress Response
0,Nitrogen,False,-0.006596295,NtrC,"Nitrogen stress response: ntrB/ntrC two component system, glnK, amtB, utilization of alternate nitrogen sources: urea (conversion of urea to ammonia), amino acids (transporters), pyrimidines (rutABCD), allantoin (allantoin permease), GABA (GABA permease)",Metabolism
20,single_gene_2,False,0.0061186289,,"helix-turn-helix domain-containing protein, IS element, holin, kdpF, genes of unknown function",Noise
6,IS-elements,False,-0.0060736132,,"transposases, ptrB",Genomic
25,Flagella-2,False,0.0058712466,,"Glycosyltransferase, flagellar biosynthesis and assembly: hook, P-ring, export ATPase, chaperone, type III secretion system; cheZ",Motility
27,Yersiniabactin,False,-0.0058283548,,Biosynthesis and transport of yersiniabactin,Exometabolites
2,Chemotaxis,False,0.0056182755000000004,,"crp, csrA, flgM, chemotaxis proteins, membrane components, fliC, methyl accepting chemotaxis proteins, glycosyltransferase, several genes involved in signal transduction, flagellar genes: hook-associated proteins, filament capping protein, motor protein, motor stator protein",Motility
13,Transport,False,-0.0053851474,,"Transport of inorganic ions, amino acids, carbohydrates, and lipids; membrane proteins; carbon starvation protein A; tryptophan synthesis; syringafactin synthesis",Metabolism
24,Protocatechuate,False,-0.0050148482,,Benzoate degradation: pcaBCGHK,Metabolism
26,Zur,False,0.0049142273,PSPTO_5267,"Zinc transporters, cadA, rpme-1, iron transporters, and receptors",Metal Uptake
22,Carbon Starvation-2,False,-0.0048011489,,Inositol phosphate and galactose metabolism,Metabolism
38,AlgU,False,-0.0046880075,AlgU,"algU (rpoE),  hrpR, alginate biosynthesis, stress resistance: oxidative, osmotic, heat, UV, and metal ion stress",Stress Response
16,Unchar-8,False,-0.0045615662000000005,,"fur, ribosomal proteins (rpsT, rplS, rpmE), ribosomal modulation factor, cold shock proteins, bacterioferritin, bacterioferritin-associated ferredoxin, transposases",Uncharacterized
30,Unchar-3,False,0.004363433,,"phoP/phoQ two component system, phosphate ABC transporter, pyruvate dehydrogenase, pbpG",Uncharacterized
28,Osmotic Stress,False,0.0040953884,,"Osmotic/water stress resistance: osmoprotectants, compatible solute production; oxidative stress resistance ",Stress Response
4,Recombination,False,-0.0038852717000000003,,"Recombinases family proteins, several genes of unknown function",Stress Response
11,Unchar-6,False,-0.0037678336,,uncharacterized,Uncharacterized
21,Fe/Protein Transport,False,-0.003248435,,"Iron starvation response: PvdS,  FoxR (ortholog), other sigma factors associated with iron starvation response, bacterioferritin, bacterioferritin-associated ferredoxin, energy transduction (exbBD), TonB-dependent siderophore receptors ",Metal Uptake
36,Translation-1,False,-0.0032120580000000003,,"Ribosomal proteins, atpCG, secY, rpoA",Translation
14,Chaperone,False,-0.0031201561000000003,,"Chaperones, heat shock proteins, proteins involved in repair processes other than in response to heat shock, ATP-dependent protease ATPase subunits",Stress Response
1,Unchar-1,False,0.0029907156,,"colR/colS two component system, pyruvate metabolism, insecticidal toxins, groES, glycerol uptake, etc.",Uncharacterized
44,Fe-S/Oxidative Stress,False,-0.0028518798,,"Fe-S cluster assembly, oxidative stress resistance: sodA, fumC, katB, catalase ",Stress Response
40,Unchar-5,False,-0.0028270749,,"several unknown genes, type III effectors, cold shock domain-containing proteins, RNA-directed DNA polymerase, integrase, cysteine synthase familiy proteins",Uncharacterized
10,Sulfur-2,False,-0.0028196395000000003,,"Sulfur starvation response protein (oscA), alkane sulfonate transporters, sulfate transporters, amino acid transporters",Metabolism
18,Translation-2,False,-0.0026279789000000003,,"Ribosome maturation factor, rho, rpsU, rpiU",Translation
3,Sulfur-1,False,0.0026242818000000003,,"Taurine, alkane sulfonate, cysteine, and methionine transport",Metabolism
5,Unchar-4,False,-0.0025083548000000002,,"Zinc transporters, cadA, rpme-1, iron transporters and receptors",Uncharacterized
42,single_gene_4,False,0.0021518932000000003,,"helix-turn-helix domain-containing protein, genes of unknown function",Noise
19,single_gene_1,False,0.0021000208,,"baeR, exdb, unknown genes",Noise
37,T3SS,False,0.0020589044,,"hrpR, hrpS, hrpL, coronatine biosynthesis activation: corP, corR/corS two component system, type III effectors, type III secretion system chaperones, type III secretion system components, type III secretion proteins, type III helper protein, type III restriction system endonuclease,ribosome modulation factor, HPr kinase, pectate lyase, flagellar hook length control protein",Exometabolites
7,Unchar-9,False,-0.0014019049000000001,PSPTO_3698,"molybdenum cofactor-associated genes: moaA, fdhD, oxidoreductase (molydopterin binding protein); xanyhine dehydrogenase subunits (xdhAB) and xanthine dehydrogenase accessory protein (xdhC)",Uncharacterized
23,Phage,False,0.0011598271,,"prtN, ptrB, prophage genes associated with pyocin production in Pseudomonas aeruginosa",Genomic
15,Coronatine,False,0.0008194349,,Coronatine biosynthesis: coronamic acid and coronafacic acid; alginate biosynthesis; type III effectors,Exometabolites
31,Carbon Starvation-1,False,-0.0005329659,,"Carbon starvation response: carbon starvation protein A, acetate utilization; pilin assembly: tadABCZ (homologs), rcpAC (homologs), flp family type IVb pilin",Metabolism
12,Plasmid,False,-0.0004364386,,"Plasmid genes: conjugal transfer proteins, DNA primase, glycoside hydrolase, mobilization proteins, type III effectors, integrase, UV resistance protein A, replication initiation protein; efflux transporters, glycine metabolism, sarcosine oxidase subunits ( likely due to plasmid manipulation)",Genomic
34,Unchar-7,False,-0.0002678013,,"lipid-A-disaccharide synthase, TolC family protein, dihydrolipoyllysine-residue acetyltransferase",Uncharacterized
43,single_gene_5,False,0.00023168790000000001,,"holin, genes of unknown function",Noise
17,Unchar-2,False,-0.0002068273,,"oxidative stress response: pqq, kdpf, organic hydroperoxide resistance protein, pirin (ortholog); nusA",Uncharacterized
33,Pyoverdine,False,-0.0001080757,PvdS,"Biosynthesis and transport of pyoverdine, metal transporters",Exometabolites
