k,name,in_iM,gene_weight,regulator,function,category
51,RpoS,True,0.0576996196230586,RpoS,Master regulator of global stress response,Global Stress
24,YjfJ,False,0.0313871002050571,YjfJ,Putative heat responsive regulon,Temperature Shock
200,UC-8,False,0.0307036228735149,,Unknown,Unknown
112,pts ALE,False,-0.0297217055927241,,ptsHIcrr KO and associated adaptive regulatory changes,Energy Metabolism
170,Purine,False,-0.0211667223668105,PurR+ppGpp,Purine transport and biosynthesis,Nucleotide Metabolism
142,UC-5,False,0.0210237597866226,,Unknown,Unknown
169,NrdR,False,0.0195657870654955,NrdR,Ribonucleoside reduction,Nucleotide Metabolism
80,Thiamine-2,False,-0.0191666225540225,,Thiamine uptake and biosynthesis,Cofactor Metabolism
92,Crp-1,False,-0.0184282672352597,Crp,Miscellaneous carbon source metabolism,Carbon Metabolism
140,ytiC,False,-0.01839900978765,,Unknown,Unknown
158,Cysteine-2,False,-0.0174164610189315,CysB,"Cysteine biosynthesis, sulfate assimilation",Amino Acid Metabolism
116,Lysine/T2SS,False,-0.0171967639922084,ArgP,Lysine transport and biosynthesis; type II secretion system,Amino Acid Metabolism
56,Sulfate,False,-0.0165979893878333,Cbl+CysB,Cysteine transport and biosynthesis; aliphatic sulfonate utilization and homeostatic response to sulfate starvation,Amino Acid Metabolism
192,crp KO-2,False,-0.0162121796524265,,crp KO and associated glycerol-3-phosphate (GlpR) regulatory changes,Carbon Metabolism
199,Ile/Val,False,0.0161086101363366,,Isoleucine and valine biosynthesis,Amino Acid Metabolism
59,Magnesium,False,-0.0160920869361016,PhoP,Magnesium sensing and transport; magnesium-limitation response,Metal Homeostasis
145,ppGpp,False,-0.0159704461475173,ppGpp,Stringent response,Global Stress
61,glrR KO,False,-0.0152932386993427,,glrR (aka qseF) KO; xylose transport and catabolism,Envelope Stress
105,Glycine,False,0.0148424597309542,PurR+Fnr+ppGpp+Crp+Lrp+GcvA,Glycine cleavage system,Amino Acid Metabolism
45,Resistance,False,0.0148313581457419,,Multidrug resistance; stress response to harmful compounds/antibiotics,Envelope Stress
195,Phage Shock,False,0.0147578126247477,RpoN+IHF+PspF,Phage shock response; response to filamentous phage infection and/or extracytoplasmic shock,Phage Shock
23,thrA KO,False,0.0143569213080541,,thrA KO and compensatory transcriptional changes,Amino Acid Metabolism
113,FDH-O,False,-0.0139775318006185,sdhX,Formate dehydrogenase O; formate to carbon dioxide oxidation; formate-nitrate electron transport during aerobic/anerobic shift,Energy Metabolism
15,ldrC,False,-0.0137308927569378,,Unknown,Unknown
183,DhaR,False,0.0133859735304773,DhaR,Dihydroxyacetone transport and catabolism; phosphotransferase activity for DhaM phosphorylation,Carbon Metabolism
41,pgi KO,False,0.013316793355432,,pgi KO,Carbon Metabolism
136,Pyruvate-2,False,0.0124624419808543,PyrR,Pyruvate sensing and transport,Carbon Metabolism
119,entC/ubiC KO-1,False,-0.0124590412236134,,entC/ubiC KO and compensatory sad up-regulation,Energy Metabolism
14,FucR/AllR/AraC,False,-0.0122917009589167,FucR/AllR/AraC,Allantoin/glycolate/glyoxylate/arabinose/fucose transport and catabolism,Nitrogen Metabolism
94,NtrC-1,False,0.0122578031665057,RpoN+RpoS+NtrC,"Nitrogen assimilation, ammonium transport",Nitrogen Metabolism
179,Maltose,False,-0.0120731431442795,MalT,Maltose transport and catabolism,Carbon Metabolism
60,Nitrate/Nitrite,False,-0.0120537032489076,NarL+Fnr,Nitrate/nitrite transport and reduction,Nitrogen Metabolism
138,Leucine,False,-0.0117201660229227,LeuO+Leu-tRNA+ppGpp,Leucine biosynthesis,Amino Acid Metabolism
151,IS5,False,0.0115738443253231,,IS5 transcripts,Unknown
187,entC/ubiC KO-2,False,0.011129251642959,,entC/ubiC KO and compensatory sad up-regulation,Energy Metabolism
109,Flagella,False,-0.0110244426846311,,Flagellar biosynthesis,Extracellular Structures
110,SCFA,False,-0.0109019687013782,RpoN+AtoC+IHF,Short-chain fatty acid (acetoacetate) transport and catabolism,Carbon Metabolism
22,SoxS,False,-0.0108877951813879,SoxS,"Superoxide/nitric oxide sensing and removal, protection from organic solvents and antibiotics",Redox Stress
32,CpxR,False,0.0107062903034514,CpxR,"Inner membrane damage sensing and repair via protein folding/degradation, chemotaxis, drug efflux, DNA repair, motility",Envelope Stress
7,Sialic Acid,False,-0.0106803123189188,Crp+NanR,N-acetyl-neuraminic acid (or sialic acid) transport and metabolism,Carbon Metabolism
132,rcsB KO,False,-0.0105846216098893,,rcsB KO and associated regulatory changes,Envelope Stress
27,ydaG,False,-0.0103355800159824,,Unknown,Unknown
137,Phosphate-2,False,-0.0102930741776014,PhoB,"Inorganic phosphate sensing, transport, and production",Phosphate Metabolism
134,Crp-2,False,-0.0102044978884103,Crp,Carbohydrate transport and catabolism,Carbon Metabolism
31,Nickel,False,0.0098867882702858,RpoN+NarL+NikR+Fnr,Nickel sensing and uptake,Metal Homeostasis
100,Molybdenum,False,-0.0097699967120477,Crp+FliA+ModE,Molybdenum transport and molybdoenzyme synthesis,Metal Homeostasis
118,ythA,False,-0.0097437873944095,,Unknown,Unknown
152,NtrC-3,False,-0.0096947803761669,NtrC+RpoN,"Nitrogen assimilation, pyrimidine transport and catabolism",Nitrogen Metabolism
125,Membrane,False,0.0096601783058452,,"Membrane-related stress response regulators, transporters, multidrug resistance",Envelope Stress
40,IS1,False,0.0094913730135166,,IS1 transcripts,Unknown
36,cydB/appC KO,False,-0.0092091090086899,,cydB/appC KO and compensatory regulatory changes,Energy Metabolism
46,PAL 10 Del,False,-0.0092011794466474,,Unknown,Unknown
167,UC-2,False,-0.0090393064495112,,Unknown,Unknown
97,Curli-1,False,-0.0087928493041691,RpoS+FliZ+CpxR+CsgD+BtsR,Curli secretion and assembly,Extracellular Structures
198,Acetate,False,-0.0087318384046342,,Acetate uptake and catabolism; aldehyde catabolism; acetate/ethanol detoxification at stationary phase,Carbon Metabolism
85,DNA Damage,False,-0.0086336487807707,LexA,SOS response to DNA damage or inhibition of DNA replication,DNA Damage
124,Thr/Ser-2,False,0.0085518973523703,Fnr+Crp+IHF+TdcA+TdcR,Threonine/serine transport and catabolism,Amino Acid Metabolism
53,UC-1,False,-0.0083112300209796,,Unknown,Unknown
197,CCK-PGI Del,False,0.0082786086967513,,Unknown,Unknown
25,Lrp,False,0.0082493252338363,Lrp,"Global regulation of amino acid biosynthesis/catabolism, stationary phase, nutrient transport, pili synthesis, 1-carbon metabolism",Amino Acid Metabolism
174,Cra,False,-0.0082136645300465,Cra,Central carbon metabolism; glycolytic flux-dependent regulation via fructose sensing,Carbon Metabolism
86,UC-3,False,-0.0077849041634331,,Unknown,Unknown
42,Biotin,False,-0.0077414023283455,BirA,Biotin biosynthesis,Cofactor Metabolism
58,Fur-2,False,-0.0077107484417532,Fur,"Iron sensing and uptake, enterobactin biosynthesis, iron-sulfur cluster activation, iron sequestration",Metal Homeostasis
185,gcvB,False,0.0076698978934546,gcvB,Amino acid transport,Amino Acid Metabolism
177,PlaR,False,0.0076690322511118,PlaR+RpoE+Crp+IHF,Plant-derived sugars transport and catabolism,Carbon Metabolism
173,IS Elements-1,False,0.0075214025130647,,Unknown,Unknown
75,yceO,False,0.0072667365301502,,Unknown,Unknown
159,ydfW,False,-0.0071945228628699,,Unknown,Unknown
90,Leu/Val/Ile,False,0.0071351987413806,Lrp+IHF+Ile-tRNA+Leu-tRNA+Val-tRNA+ppGpp,Branched-chain amino acid biosynthesis,Amino Acid Metabolism
9,ROS TALE Amp,False,-0.00707699613571,,Amplification of DLP12/IS3,Unknown
107,ypjJ,False,-0.007061532967649,,Unknown,Unknown
122,UC-9,False,-0.0070466313115459,,Unknown,Unknown
104,FHL,False,0.0070019045420688,RpoN+NsrR+ModE+IHF+FhlA,Formate hydrogenlyase: hydrogen production during glucose fermentation via formate oxidation/proton reduction,Energy Metabolism
57,ypaB,False,-0.0069321693253158,,Unknown,Unknown
181,GadX,False,0.0068159158098127,RpoS+GadX,Glutamate-dependent acid resistance system; multidrug efflux,Envelope Stress
64,Zinc-2,False,-0.0067401422302074,ZraR,Tolerance to high zinc concentration,Metal Homeostasis
69,Phosphate-1,False,-0.006714555902559,PhoB,"Inorganic phosphate sensing, transport, and production",Phosphate Metabolism
120,yoaI,False,-0.0065993284091405,,Unknown,Unknown
149,Arginine,False,0.0064642055014532,ArgR,Arginine transport and biosynthesis,Amino Acid Metabolism
139,Capsule,False,-0.0064221951962531,RcsAB,Colanic acid capsule synthesis and transport; periplasmic proteins; envelope stress response,Extracellular Structures
3,OxyR,False,-0.0064100591550015,OxyR,"Oxidative stress response, especially peroxide",Redox Stress
190,Efflux Pump,False,-0.0064035604701469,,Multidrug/spermidine efflux pump,Resistance
35,FucR/ExuR,False,0.0060176200235659,FucR/ExuR,Fucose/galacturonate/glucuronate transport and catabolism,Carbon Metabolism
47,Biofilm,False,0.0060017275698008,RpoS+ppGpp+BluR+MarA,"Biofilm formation, acid resistance, cold shock response",Extracellular Structures
106,BW25113,False,-0.005983827263014,,Accounts for genomic differences between BW25113 and MG1655 substrains,Strain Difference
162,Propionate,False,-0.0056902898545643,PrpR+RpoN+Cra+Crp,Propionate catabolism; 2-methylcitric acid cycle,Carbon Metabolism
154,sdh KO,False,0.0056885748089312,,sdh KO,Carbon Metabolism
176,Suf System,False,-0.005666555132614,NsrR+IHF+IscR+OxyR+Fur+ppGpp,Iron-sulfur cluster biosynthesis and insertion,Metal Homeostasis
157,Microaerobic,False,0.0055637657942116,RpoS+Fis+NarP+NarL+AppY+YdeO+ArcA+IscR,Hydrogenase 1 and cytochrome bd-II ubiquinol oxidase: microaerobic respiratory chain between hydrogen and oxygen,Energy Metabolism
98,ymiB,False,-0.0055346004858847,,Unknown,Unknown
193,cyoB/ndh/nuoB KO-2,False,-0.0051886757426041,,cyoB/ndh/nuoB KOs,Energy Metabolism
126,Thiamine-1,False,0.0051849990979902,Thiamine diphosphate,Thiamine uptake and biosynthesis,Cofactor Metabolism
39,Xylose,False,-0.0051626978025196,Crp+XylR,d-Xylose transport and catabolism,Carbon Metabolism
43,N Reduction,False,0.0051475851299823,FlhDC+ModE+NarP+NarL+Fnr,"Electron transfer via nitrate reductases (periplasmic and A), cytochrome c",Energy Metabolism
161,PAL Amp,False,0.0051237567291195,,Unknown,Unknown
5,Osmoprotectant,False,0.0051054173675771,RpoS+ppGpp+IHF+H-NS,Transport of osmoprotectant glycine betaine,Envelope Stress
48,Cytochrome c,False,-0.005016346703593,FlhDC+IHF+NsrR+NarL+NarP+Fis+Fnr,Cytochrome c-552 and putative cytochrome c-related proteins,Energy Metabolism
194,tpiA KO,False,-0.0050066402901406,,tpiA KO and compensatory evolved regulatory changes,Carbon Metabolism
84,NtrC-2,False,-0.0049711961318962,NtrC+RpoN,"Nitrogen assimilation, ammonium transport",Nitrogen Metabolism
155,YmfT,False,0.0049449228362387,YmfT,e14 prophage regulator activated by DNA damage,DNA Damage
102,Thr/Ser-1,False,-0.0049169201100779,TdcA+TdcR+IHF+Fnr+Crp,Threonine/serine transport and catabolism during anaerobiosis,Amino Acid Metabolism
101,e14 Del,False,0.0048767388963694,,Unknown,Unknown
89,UC-6,False,-0.0048593478363001,,Unknown,Unknown
76,Potassium,False,-0.0048492226317147,KdpE,Potassium sensing and transport,Metal Homeostasis
111,YgeV,False,0.0046334139991182,YgeV,Nucleoside degradation activated by ethanol treatment,Carbon Metabolism
148,LPS,False,-0.004522056942589,,Lipopolysaccharide biosynthesis and export,Extracellular Structures
160,YcjW,False,0.0044859755419382,YcjW,Carbohydrate transport and catabolism,Carbon Metabolism
11,Histidine,False,-0.0044074480057549,His-tRNA+DksA,Histidine biosynthesis,Amino Acid Metabolism
121,Gluconate,False,0.0043985599012522,GntR+Crp,Gluconate transport and catabolism (Entner-Doudoroff),Carbon Metabolism
196,Glyoxylate,False,-0.004376394744672,Crp+ArcA+ppGpp+Cra+IclR+IHF,Glyxoylate cycle; alternate to TCA cycle,Energy Metabolism
129,Pyruvate-1,False,-0.0043694971099849,BtsR,"Pyruvate sensing, transport, and catabolism under nutrient limitation",Carbon Metabolism
166,Rhamnose,False,-0.0042812201291582,Crp+RhaS,Rhamnose transport and catabolism,Carbon Metabolism
70,Salicylic Acid,False,0.0042672855581369,,Salicylic acid efflux,Redox Stress
16,Ferric Citrate,False,-0.0042136739456626,PdhR+HypT+Nac+Crp+Fur+FecI,Ferric citrate transporter; iron uptake under intracellular limitation,Metal Homeostasis
79,Isc System,False,-0.0041825288892262,ryhB/IscR,Iron-sulfur cluster biogenesis and insertion,Cofactor Metabolism
153,arcA/luxS KO,False,0.0041410976103342,,arcA KO,Energy Metabolism
67,RpoE,False,0.0041375934622296,RpoE,Heat shock response; response to high temperature and/or misfolded membrane/periplasmic proteins,Temperature Shock
108,PaaX,False,-0.0040533068300605,Crp+IHF+PaaX+SlyA,Phenylacetic acid transport and catabolism,Carbon Metabolism
49,BasR,False,-0.0038389387288486,BasR,Lipid A modification and polymixin resistance in the presence of excess iron,Extracellular Structures
144,Putrescine,False,-0.0037566032829973,RpoS+ArcA+PuuR,Putrescine transport and catabolism,Nitrogen Metabolism
147,PAL 26 Del,False,0.003695014495463,,Unknown,Unknown
117,Fnr-3,False,-0.0036094147286613,Fnr,Anaerobic growth,Energy Metabolism
81,crp KO-1,False,-0.0035658766534966,,crp KO and compensatory regulatory changes,Carbon Metabolism
20,Glycerol,False,-0.0034961014258847,Crp+GlpR,Glycerol/glycerol-3-phosphate transport and catabolism,Carbon Metabolism
12,UC-4,False,0.0034888283238689,,Unknown,Unknown
87,YieP,False,-0.0034324415769939,YieP,"Cellular membrane synthesis and stress response, 3-hydroxypropanoate tolerance",Envelope Stress
123,Copper,False,0.0033773320624794,CusR/CueR/HprR,Copper/silver sensing and export,Metal Homeostasis
63,Pyrimidine,False,0.0033086909328648,PurR/UTP,Pyrimidine transport and biosynthesis,Nucleotide Metabolism
77,ROS TALE Del-1,False,0.0032686245671761,,Unknown,Unknown
62,Fnr-1,False,-0.0032091809199866,Fnr,Transition from aerobic to anaerobic growth; anaerobic reductase and hydrogenase activity,Energy Metabolism
133,malE OE,False,-0.0031335207897847,,Accounts for malE plasmid overexpression,Carbon Metabolism
146,Glycolate,False,0.003104007172421,IHF+ArcA+PdhR+GlcC,Glycolate/glyoxylate tranport and catabolism,Carbon Metabolism
38,EvgA,False,-0.0030642199949085,EvgA,"Glutamate-dependent acid response, drug resistance, alkali metals response",Envelope Stress
95,Ribose,False,0.0030389495954524,dsrA+Crp+RbsR,Ribose transport and catabolism,Carbon Metabolism
191,Tryptophanase,False,0.0030251651080132,Crp+TorR+Nac+L-tryptophan,Tryptophan import and catabolism via tryptophanase; indole/pyruvate biosynthesis,Amino Acid Metabolism
150,Nickel/Cobalt,False,0.0030233214693853,RcnR,Nickel and cobalt resistance via efflux,Metal Homeostasis
130,ldrD,False,0.0029797057961583,,Unknown,Unknown
52,lsrB KO,False,0.0029716459089759,,lsrB KO and compensatory regulatory changes,Quorum Sensing
33,Curli-2,False,0.0028634012141674,RpoS+FliZ+CpxR+CsgD+BtsR,Curli secretion and assembly,Extracellular Structures
143,FlhDC-1,False,-0.0028346088198977,FlhDC,Flagellum biosynthesis and export,Extracellular Structures
10,Nucleotide Stress,False,-0.002824889047478,,DNA repair; stringent response signaling via ppGpp; ribosomal biogenesis and stability,DNA Damage
71,ymgI,False,0.002816901365857,,Unknown,Unknown
13,RpoH,False,-0.0027239581874985,RpoH,Global heat shock response during log-phase; response to high temperature and/or misfolded proteins,Temperature Shock
175,Hot TALE 16,False,0.0025237389562718,,Regulatory changes under high temperature,Unknown
141,ROS TALE Del-2,False,0.002504565148564,,Unknown,Unknown
127,Cold Shock,False,0.0024533386264598,,Cold shock proteins,Temperature Shock
128,FliA,False,-0.0024156474812325,FliA,"Sigma 28; flagellum biosynthesis and export, motility",Extracellular Structures
18,Methionine,False,0.0023882699572779,MetJ,Methionine transport and biosynthesis,Amino Acid Metabolism
17,Zinc-1,False,0.0023735372628879,Zur/ZntR/CueR,Zinc sensing and uptake; copper sensing and export,Metal Homeostasis
103,Tryptophan,False,-0.0023078834858437,TrpR+Trp-tRNA,Tryptophan transport and biosynthesis,Amino Acid Metabolism
66,nquinone ALE 3,False,-0.002306348738627,,ubiC KO and associated adaptive regulatory changes,Energy Metabolism
74,ArcA,False,0.0022572026702871,ArcA,Anaerobiosis; repression of aerobic growth genes during anaerobic growth,Energy Metabolism
114,GlcNAc,False,0.0022258940785353,NagC+Crp,"Amino sugar transport, biosynthesis and catabolism",Carbon Metabolism
34,Acid Shock RNA,False,0.0021688176585042,,Very low pH-responsive acid shock polypeptide,Acid Stress
135,Cysteine-1,False,0.0021532737141391,CysB,"Cysteine biosynthesis, sulfate assimilation",Amino Acid Metabolism
54,Fur-1,False,0.0021361296166072,Fur,"Iron sensing and uptake, enterobactin biosynthesis, iron-sulfur cluster activation, iron sequestration",Metal Homeostasis
50,Sulfoquinovose,False,-0.0018390086376334,CsqR,Sulfoquinovose transport and catabolism,Carbon Metabolism
184,pts KO,False,0.0017652892663292,,ptsHI/crr KO and compensatory regulatory changes,Carbon Metabolism
44,FDH-N/NRA,False,0.0016584119934364,NarL+Fnr,Anaerobic growth on nitrate; formate-to-nitrate electron transfer via formate dehydrogenase N and nitrate reductase A,Energy Metabolism
83,yafF,False,0.0016073824034666,,Unknown,Unknown
182,Fatty Acid,False,0.0015976759601042,FadR,Fatty acid degradation and biosynthesis,Carbon Metabolism
55,ykgR,False,-0.0015700964333822,,Unknown,Unknown
30,IS Elements-2,False,0.0015471886089492,,Unknown,Unknown
93,yneP,False,0.0014673315763086,,Unknown,Unknown
131,efeU Activation,False,-0.0014351311117179,,efeU re-activation and associated efeU ALE-related expression changes,Metal Homeostasis
180,Tyr/Trp/Phe,False,-0.001412512666076,TyrR/TrpR/Trp-tRNA,Aromatic amino acid biosynthesis and transport,Amino Acid Metabolism
21,Nucleoside,False,-0.0013886514345874,Crp+CytR,Transport and utilization of ribonucleosides and deoxyribonucleosides,Nucleotide Metabolism
4,FlhDC-2,False,0.0013856770418102,FlhDC,Flagellum biosynthesis and export,Extracellular Structures
88,Nitrogen,False,0.0013567092231095,Nac,Nitrogen metabolism under nitrogen limitation,Nitrogen Metabolism
37,ymdG,False,-0.0013000915677856,,Unknown,Unknown
1,Translation,False,-0.0012028472033301,DksA,Ribosome biogenesis,Translation
168,ydfB,False,-0.0011593608060902,,Unknown,Unknown
78,cyoB/kdpE/qseB KO,False,-0.0011527661180671,,cyoB/kdpE/qseF KO,Energy Metabolism
29,Quorum Sensing,False,-0.0010452169535676,Crp+LsrR,"Quorum sensing via autoinducer 2, biofilm architecture, foreign DNA stress response; lsrR KO",Quorum Sensing
188,Oxidoreductase,False,-0.0010070244735794,,Putative oxidoreductase components,Redox Stress
19,Sorbitol,False,-0.0010004597205845,SrlR+GutM+Crp+H-NS,Sorbitol transport and catabolism,Carbon Metabolism
163,CP4-44,False,-0.0009651993193293,,CP4-44 prophage expression variation,Prophage
172,Fimbriae,False,-0.000948765437132,QseB+IHF+Lrp+H-NS,Type 1 (mannose-sensitive) pili/fimbriae biosynthesis and secretion,Extracellular Structures
8,yqhI,False,-0.0008792821605593,,Unknown,Unknown
178,NO Stress,False,-0.0008759540104882,NsrR/NarP,"Nitric oxide sensing and detoxification, iron-sulfur cluster repair, anaerobic growth",Redox Stress
165,GadXW,False,-0.0008430525425575,GadX+GadW,Glutamate-dependent acid resistance system; multidrug efflux,Envelope Stress
171,cyoB/ndh/nuoB KO-1,False,-0.000816775298816,,NDH-1 (nuoB) KO and compensatory NDH-2 (ndh) up-regulation,Energy Metabolism
189,UC-7,False,0.0007779810104451,,Unknown,Unknown
186,Glutarate,False,0.0007779052633051,RpoS+H-NS+Crp+Lrp+GlaR+ppGpp,Glutarate/aminobutyrate transport and catabolism,Carbon Metabolism
91,NDH-1,False,0.0007569676954976,NarL+ArcA+IHF+Fnr+Fis+ryhB,"NADH:ubiquinone oxidoreductase I: electron transfer from NADH to quinone pool, proton electrochemical gradient generation for aerobic and anaerobic respiration",Energy Metabolism
99,yjjZ,False,0.0006954142859797,,Unknown,Unknown
96,Dipeptide,False,0.0006124747288851,gcvB+IHF+Fnr,Dipeptide transport; flagellar biosynthesis,Amino Acid Metabolism
82,SSW SNPs,False,-0.0005966918857852,,Unknown,ALE Effects
2,ygdT,False,0.0005292637097299,,Unknown,Unknown
28,ldrA,False,0.0005134384277348,,Unknown,Unknown
156,Fnr-2,False,-0.0004665309031354,Fnr,Transition from aerobic to anaerobic growth; global control of anaerobiosis,Energy Metabolism
26,baeR KO,False,0.000462346426653,,baeR KO,Envelope Stress
6,Glutamine,False,0.0003723939678741,NtrC,Glutamine transport and synthesis,Nitrogen Metabolism
73,trxC Del,False,-0.0003289999233129,,Unknown,Unknown
164,minicoli KOs,False,0.0002458595994652,,Deletions from minicoli strain,Genome Reduction
115,YgbI,False,0.000227728517359,YgbI,Tartrate transport and catabolism,Carbon Metabolism
72,Galactose,False,-0.0001374924880692,RpoS+GalR+GalS+Crp,Galactose transport and catabolism,Carbon Metabolism
68,Cellulose,False,0.0001140024069292,,Cellulose biosynthesis; biofilm formation; membrane/periplasmic proteins,Extracellular Structures
65,NRZ,False,-0.0001077023358141,OmpR,Nitrate reduction under microaerobic condition; aerobic to anaerobic transition,Energy Metabolism
0,Sugar Diacid,False,8.876437863294202e-05,CdaR,Transport and catabolism of carbohydrate diacids (galacatarate and glucarate),Carbon Metabolism
