k,name,in_iM,gene_weight,regulator,function,category
11,Unchar-6,False,0.0313114288,,uncharacterized,Uncharacterized
3,Sulfur-1,False,0.025943853200000002,,"Taurine, alkane sulfonate, cysteine, and methionine transport",Metabolism
37,T3SS,False,0.0238505148,,"hrpR, hrpS, hrpL, coronatine biosynthesis activation: corP, corR/corS two component system, type III effectors, type III secretion system chaperones, type III secretion system components, type III secretion proteins, type III helper protein, type III restriction system endonuclease,ribosome modulation factor, HPr kinase, pectate lyase, flagellar hook length control protein",Exometabolites
19,single_gene_1,False,-0.0224729387,,"baeR, exdb, unknown genes",Noise
2,Chemotaxis,False,0.0168555499,,"crp, csrA, flgM, chemotaxis proteins, membrane components, fliC, methyl accepting chemotaxis proteins, glycosyltransferase, several genes involved in signal transduction, flagellar genes: hook-associated proteins, filament capping protein, motor protein, motor stator protein",Motility
8,Alginate,False,-0.0159850674,,"Alginate biosynthesis, phenol degradation protein, benzaldehyde dehydrogenase, dimethylglycine demethylation, genes involved in amino acid transport and metabolism",Exometabolites
10,Sulfur-2,False,0.0157470212,,"Sulfur starvation response protein (oscA), alkane sulfonate transporters, sulfate transporters, amino acid transporters",Metabolism
13,Transport,False,-0.0139101072,,"Transport of inorganic ions, amino acids, carbohydrates, and lipids; membrane proteins; carbon starvation protein A; tryptophan synthesis; syringafactin synthesis",Metabolism
23,Phage,False,-0.0137283323,,"prtN, ptrB, prophage genes associated with pyocin production in Pseudomonas aeruginosa",Genomic
29,Fatty Acid,False,0.0135654784,PsrA,"psrA, fadAB, etfAB, genes with multiple drug resistance domains",Metabolism
22,Carbon Starvation-2,False,-0.0131857899,,Inositol phosphate and galactose metabolism,Metabolism
24,Protocatechuate,False,-0.0128403418,,Benzoate degradation: pcaBCGHK,Metabolism
5,Unchar-4,False,-0.0123727651,,"Zinc transporters, cadA, rpme-1, iron transporters and receptors",Uncharacterized
21,Fe/Protein Transport,False,0.0116027214,,"Iron starvation response: PvdS,  FoxR (ortholog), other sigma factors associated with iron starvation response, bacterioferritin, bacterioferritin-associated ferredoxin, energy transduction (exbBD), TonB-dependent siderophore receptors ",Metal Uptake
7,Unchar-9,False,0.0103891508,PSPTO_3698,"molybdenum cofactor-associated genes: moaA, fdhD, oxidoreductase (molydopterin binding protein); xanyhine dehydrogenase subunits (xdhAB) and xanthine dehydrogenase accessory protein (xdhC)",Uncharacterized
9,Resistance-1,False,-0.00978153,,"MarR transcriptional regulator, efflux transporter subunits (RND, MFS, etc.), sulforaphane/aliphatic isothiocyanate, resistance proteins (saxAF)",Stress Response
14,Chaperone,False,0.008907258500000001,,"Chaperones, heat shock proteins, proteins involved in repair processes other than in response to heat shock, ATP-dependent protease ATPase subunits",Stress Response
31,Carbon Starvation-1,False,0.0087118191,,"Carbon starvation response: carbon starvation protein A, acetate utilization; pilin assembly: tadABCZ (homologs), rcpAC (homologs), flp family type IVb pilin",Metabolism
32,Folate,False,-0.0085258429,,"Tetrahydrofolate production: soxGADB, folD, purU",Metabolism
1,Unchar-1,False,0.008410202,,"colR/colS two component system, pyruvate metabolism, insecticidal toxins, groES, glycerol uptake, etc.",Uncharacterized
12,Plasmid,False,-0.0080963956,,"Plasmid genes: conjugal transfer proteins, DNA primase, glycoside hydrolase, mobilization proteins, type III effectors, integrase, UV resistance protein A, replication initiation protein; efflux transporters, glycine metabolism, sarcosine oxidase subunits ( likely due to plasmid manipulation)",Genomic
20,single_gene_2,False,0.0078908077,,"helix-turn-helix domain-containing protein, IS element, holin, kdpF, genes of unknown function",Noise
33,Pyoverdine,False,-0.0070266392,PvdS,"Biosynthesis and transport of pyoverdine, metal transporters",Exometabolites
25,Flagella-2,False,0.0066021775000000005,,"Glycosyltransferase, flagellar biosynthesis and assembly: hook, P-ring, export ATPase, chaperone, type III secretion system; cheZ",Motility
17,Unchar-2,False,-0.0062876396000000005,,"oxidative stress response: pqq, kdpf, organic hydroperoxide resistance protein, pirin (ortholog); nusA",Uncharacterized
44,Fe-S/Oxidative Stress,False,0.0062640656,,"Fe-S cluster assembly, oxidative stress resistance: sodA, fumC, katB, catalase ",Stress Response
36,Translation-1,False,0.0059861257,,"Ribosomal proteins, atpCG, secY, rpoA",Translation
41,single_gene_3,False,0.0052647703,,genes of unknown function,Noise
27,Yersiniabactin,False,0.0052222881,,Biosynthesis and transport of yersiniabactin,Exometabolites
26,Zur,False,0.0037615692000000003,PSPTO_5267,"Zinc transporters, cadA, rpme-1, iron transporters, and receptors",Metal Uptake
30,Unchar-3,False,0.0036284182,,"phoP/phoQ two component system, phosphate ABC transporter, pyruvate dehydrogenase, pbpG",Uncharacterized
4,Recombination,False,0.0034373206,,"Recombinases family proteins, several genes of unknown function",Stress Response
6,IS-elements,False,-0.0031963614,,"transposases, ptrB",Genomic
40,Unchar-5,False,-0.0030393112,,"several unknown genes, type III effectors, cold shock domain-containing proteins, RNA-directed DNA polymerase, integrase, cysteine synthase familiy proteins",Uncharacterized
39,Resistance-2,False,-0.0019742958,CueR,"Syringafactin production and efflux, cueR, copper transport, chemotaxis, uric acid production, virulence factor srfB, virulence effector srfC, bacterioferritin, Flp type IV pilin",Stress Response
42,single_gene_4,False,-0.0018497769000000001,,"helix-turn-helix domain-containing protein, genes of unknown function",Noise
0,Nitrogen,False,-0.0017947305,NtrC,"Nitrogen stress response: ntrB/ntrC two component system, glnK, amtB, utilization of alternate nitrogen sources: urea (conversion of urea to ammonia), amino acids (transporters), pyrimidines (rutABCD), allantoin (allantoin permease), GABA (GABA permease)",Metabolism
35,Flagella-1,False,0.0016355959,,"fleS/fleR two component system, flagellar biosynthesis and assembly: rod; hook; L; M, and P ring; hook and basal body complex; motor switch; flagellar type III secretion system",Motility
28,Osmotic Stress,False,-0.0013568814,,"Osmotic/water stress resistance: osmoprotectants, compatible solute production; oxidative stress resistance ",Stress Response
15,Coronatine,False,0.0012998016,,Coronatine biosynthesis: coronamic acid and coronafacic acid; alginate biosynthesis; type III effectors,Exometabolites
16,Unchar-8,False,-0.0011232706,,"fur, ribosomal proteins (rpsT, rplS, rpmE), ribosomal modulation factor, cold shock proteins, bacterioferritin, bacterioferritin-associated ferredoxin, transposases",Uncharacterized
18,Translation-2,False,-0.0010113992000000001,,"Ribosome maturation factor, rho, rpsU, rpiU",Translation
43,single_gene_5,False,0.0007451316,,"holin, genes of unknown function",Noise
38,AlgU,False,0.0004179098,AlgU,"algU (rpoE),  hrpR, alginate biosynthesis, stress resistance: oxidative, osmotic, heat, UV, and metal ion stress",Stress Response
34,Unchar-7,False,0.00033758700000000003,,"lipid-A-disaccharide synthase, TolC family protein, dihydrolipoyllysine-residue acetyltransferase",Uncharacterized
