k,name,in_iM,gene_weight,regulator,function,category
167,UC-2,True,0.1261933886726552,,Unknown,Unknown
165,GadXW,True,0.0464333716688825,GadX+GadW,Glutamate-dependent acid resistance system; multidrug efflux,Envelope Stress
181,GadX,False,0.0528159457967435,RpoS+GadX,Glutamate-dependent acid resistance system; multidrug efflux,Envelope Stress
125,Membrane,False,-0.0490138489261646,,"Membrane-related stress response regulators, transporters, multidrug resistance",Envelope Stress
173,IS Elements-1,False,-0.029344538055284,,Unknown,Unknown
26,baeR KO,False,-0.0271420900134745,,baeR KO,Envelope Stress
86,UC-3,False,-0.0235759002516971,,Unknown,Unknown
111,YgeV,False,-0.0229543612343052,YgeV,Nucleoside degradation activated by ethanol treatment,Carbon Metabolism
190,Efflux Pump,False,-0.020884357701995,,Multidrug/spermidine efflux pump,Resistance
108,PaaX,False,-0.0207087339472481,Crp+IHF+PaaX+SlyA,Phenylacetic acid transport and catabolism,Carbon Metabolism
51,RpoS,False,-0.019773787499133,RpoS,Master regulator of global stress response,Global Stress
53,UC-1,False,-0.0193240060437537,,Unknown,Unknown
106,BW25113,False,0.0185196681407332,,Accounts for genomic differences between BW25113 and MG1655 substrains,Strain Difference
6,Glutamine,False,0.0180631667529798,NtrC,Glutamine transport and synthesis,Nitrogen Metabolism
157,Microaerobic,False,0.0177089833491019,RpoS+Fis+NarP+NarL+AppY+YdeO+ArcA+IscR,Hydrogenase 1 and cytochrome bd-II ubiquinol oxidase: microaerobic respiratory chain between hydrogen and oxygen,Energy Metabolism
67,RpoE,False,0.0171307738061684,RpoE,Heat shock response; response to high temperature and/or misfolded membrane/periplasmic proteins,Temperature Shock
24,YjfJ,False,-0.0171061618626019,YjfJ,Putative heat responsive regulon,Temperature Shock
118,ythA,False,-0.0170714923420209,,Unknown,Unknown
11,Histidine,False,-0.0169892791023646,His-tRNA+DksA,Histidine biosynthesis,Amino Acid Metabolism
7,Sialic Acid,False,0.0165491640427826,Crp+NanR,N-acetyl-neuraminic acid (or sialic acid) transport and metabolism,Carbon Metabolism
2,ygdT,False,-0.0152367073653359,,Unknown,Unknown
124,Thr/Ser-2,False,-0.0144950624473711,Fnr+Crp+IHF+TdcA+TdcR,Threonine/serine transport and catabolism,Amino Acid Metabolism
48,Cytochrome c,False,0.014295342742613,FlhDC+IHF+NsrR+NarL+NarP+Fis+Fnr,Cytochrome c-552 and putative cytochrome c-related proteins,Energy Metabolism
97,Curli-1,False,-0.0140767200096285,RpoS+FliZ+CpxR+CsgD+BtsR,Curli secretion and assembly,Extracellular Structures
197,CCK-PGI Del,False,0.0132305000518202,,Unknown,Unknown
156,Fnr-2,False,-0.0131487263208408,Fnr,Transition from aerobic to anaerobic growth; global control of anaerobiosis,Energy Metabolism
30,IS Elements-2,False,-0.0130294495544434,,Unknown,Unknown
34,Acid Shock RNA,False,0.0125428470207346,,Very low pH-responsive acid shock polypeptide,Acid Stress
136,Pyruvate-2,False,0.0124651652563165,PyrR,Pyruvate sensing and transport,Carbon Metabolism
132,rcsB KO,False,-0.0124437328657337,,rcsB KO and associated regulatory changes,Envelope Stress
137,Phosphate-2,False,0.0121612993674751,PhoB,"Inorganic phosphate sensing, transport, and production",Phosphate Metabolism
188,Oxidoreductase,False,0.0117696444184609,,Putative oxidoreductase components,Redox Stress
122,UC-9,False,-0.0113902068523982,,Unknown,Unknown
44,FDH-N/NRA,False,0.010901218831011,NarL+Fnr,Anaerobic growth on nitrate; formate-to-nitrate electron transfer via formate dehydrogenase N and nitrate reductase A,Energy Metabolism
36,cydB/appC KO,False,-0.0103439156194095,,cydB/appC KO and compensatory regulatory changes,Energy Metabolism
150,Nickel/Cobalt,False,0.0103373154026417,RcnR,Nickel and cobalt resistance via efflux,Metal Homeostasis
116,Lysine/T2SS,False,-0.0102425295227673,ArgP,Lysine transport and biosynthesis; type II secretion system,Amino Acid Metabolism
25,Lrp,False,-0.0102164801692119,Lrp,"Global regulation of amino acid biosynthesis/catabolism, stationary phase, nutrient transport, pili synthesis, 1-carbon metabolism",Amino Acid Metabolism
187,entC/ubiC KO-2,False,0.010054813743738,,entC/ubiC KO and compensatory sad up-regulation,Energy Metabolism
149,Arginine,False,-0.010024849206812,ArgR,Arginine transport and biosynthesis,Amino Acid Metabolism
39,Xylose,False,-0.0097518560186592,Crp+XylR,d-Xylose transport and catabolism,Carbon Metabolism
63,Pyrimidine,False,-0.0095750923609682,PurR/UTP,Pyrimidine transport and biosynthesis,Nucleotide Metabolism
68,Cellulose,False,0.0093903778000105,,Cellulose biosynthesis; biofilm formation; membrane/periplasmic proteins,Extracellular Structures
73,trxC Del,False,-0.0092838443612029,,Unknown,Unknown
186,Glutarate,False,-0.0091760669841709,RpoS+H-NS+Crp+Lrp+GlaR+ppGpp,Glutarate/aminobutyrate transport and catabolism,Carbon Metabolism
89,UC-6,False,0.0089244194286949,,Unknown,Unknown
31,Nickel,False,-0.0088663871570139,RpoN+NarL+NikR+Fnr,Nickel sensing and uptake,Metal Homeostasis
182,Fatty Acid,False,0.0088299469281727,FadR,Fatty acid degradation and biosynthesis,Carbon Metabolism
172,Fimbriae,False,-0.0087425081974112,QseB+IHF+Lrp+H-NS,Type 1 (mannose-sensitive) pili/fimbriae biosynthesis and secretion,Extracellular Structures
74,ArcA,False,-0.0086473800448456,ArcA,Anaerobiosis; repression of aerobic growth genes during anaerobic growth,Energy Metabolism
144,Putrescine,False,0.0085761302657537,RpoS+ArcA+PuuR,Putrescine transport and catabolism,Nitrogen Metabolism
142,UC-5,False,0.0083362960900926,,Unknown,Unknown
0,Sugar Diacid,False,-0.0083022249815131,CdaR,Transport and catabolism of carbohydrate diacids (galacatarate and glucarate),Carbon Metabolism
151,IS5,False,0.0082375175195708,,IS5 transcripts,Unknown
16,Ferric Citrate,False,0.0080998060099299,PdhR+HypT+Nac+Crp+Fur+FecI,Ferric citrate transporter; iron uptake under intracellular limitation,Metal Homeostasis
200,UC-8,False,-0.0080093002480022,,Unknown,Unknown
195,Phage Shock,False,-0.0078809285416688,RpoN+IHF+PspF,Phage shock response; response to filamentous phage infection and/or extracytoplasmic shock,Phage Shock
102,Thr/Ser-1,False,-0.0077802202498676,TdcA+TdcR+IHF+Fnr+Crp,Threonine/serine transport and catabolism during anaerobiosis,Amino Acid Metabolism
61,glrR KO,False,0.0077416162048243,,glrR (aka qseF) KO; xylose transport and catabolism,Envelope Stress
20,Glycerol,False,0.007685059768565,Crp+GlpR,Glycerol/glycerol-3-phosphate transport and catabolism,Carbon Metabolism
189,UC-7,False,-0.0075310030213199,,Unknown,Unknown
109,Flagella,False,-0.007504864695779,,Flagellar biosynthesis,Extracellular Structures
69,Phosphate-1,False,-0.0073695583661546,PhoB,"Inorganic phosphate sensing, transport, and production",Phosphate Metabolism
100,Molybdenum,False,-0.0071525571574776,Crp+FliA+ModE,Molybdenum transport and molybdoenzyme synthesis,Metal Homeostasis
177,PlaR,False,0.0071235723913627,PlaR+RpoE+Crp+IHF,Plant-derived sugars transport and catabolism,Carbon Metabolism
135,Cysteine-1,False,-0.0070615404537736,CysB,"Cysteine biosynthesis, sulfate assimilation",Amino Acid Metabolism
72,Galactose,False,-0.0070316850536202,RpoS+GalR+GalS+Crp,Galactose transport and catabolism,Carbon Metabolism
12,UC-4,False,-0.0068510351310401,,Unknown,Unknown
57,ypaB,False,0.0067620934401505,,Unknown,Unknown
64,Zinc-2,False,-0.0065237181908031,ZraR,Tolerance to high zinc concentration,Metal Homeostasis
120,yoaI,False,0.0064618474808286,,Unknown,Unknown
14,FucR/AllR/AraC,False,0.0061330980966983,FucR/AllR/AraC,Allantoin/glycolate/glyoxylate/arabinose/fucose transport and catabolism,Nitrogen Metabolism
155,YmfT,False,0.0061116443610786,YmfT,e14 prophage regulator activated by DNA damage,DNA Damage
162,Propionate,False,0.006073834346712,PrpR+RpoN+Cra+Crp,Propionate catabolism; 2-methylcitric acid cycle,Carbon Metabolism
27,ydaG,False,0.0060577496329671,,Unknown,Unknown
183,DhaR,False,-0.0060369323126403,DhaR,Dihydroxyacetone transport and catabolism; phosphotransferase activity for DhaM phosphorylation,Carbon Metabolism
134,Crp-2,False,0.0060226553166767,Crp,Carbohydrate transport and catabolism,Carbon Metabolism
45,Resistance,False,-0.0059740781905871,,Multidrug resistance; stress response to harmful compounds/antibiotics,Envelope Stress
166,Rhamnose,False,0.0059591722876637,Crp+RhaS,Rhamnose transport and catabolism,Carbon Metabolism
75,yceO,False,0.0055921321245764,,Unknown,Unknown
169,NrdR,False,0.0055880415619439,NrdR,Ribonucleoside reduction,Nucleotide Metabolism
71,ymgI,False,-0.0055845173647106,,Unknown,Unknown
107,ypjJ,False,0.0055172377187458,,Unknown,Unknown
168,ydfB,False,0.0054977023290954,,Unknown,Unknown
115,YgbI,False,0.0054756911216469,YgbI,Tartrate transport and catabolism,Carbon Metabolism
185,gcvB,False,-0.0054513541610638,gcvB,Amino acid transport,Amino Acid Metabolism
98,ymiB,False,0.0054201404730885,,Unknown,Unknown
121,Gluconate,False,0.0053721402393382,GntR+Crp,Gluconate transport and catabolism (Entner-Doudoroff),Carbon Metabolism
90,Leu/Val/Ile,False,-0.0053161525548429,Lrp+IHF+Ile-tRNA+Leu-tRNA+Val-tRNA+ppGpp,Branched-chain amino acid biosynthesis,Amino Acid Metabolism
32,CpxR,False,-0.0052637689566428,CpxR,"Inner membrane damage sensing and repair via protein folding/degradation, chemotaxis, drug efflux, DNA repair, motility",Envelope Stress
38,EvgA,False,-0.0052038511173474,EvgA,"Glutamate-dependent acid response, drug resistance, alkali metals response",Envelope Stress
21,Nucleoside,False,-0.005157984690528,Crp+CytR,Transport and utilization of ribonucleosides and deoxyribonucleosides,Nucleotide Metabolism
128,FliA,False,-0.0050861592689653,FliA,"Sigma 28; flagellum biosynthesis and export, motility",Extracellular Structures
85,DNA Damage,False,-0.0050611328135045,LexA,SOS response to DNA damage or inhibition of DNA replication,DNA Damage
40,IS1,False,0.0050524713681767,,IS1 transcripts,Unknown
43,N Reduction,False,0.00495216605466,FlhDC+ModE+NarP+NarL+Fnr,"Electron transfer via nitrate reductases (periplasmic and A), cytochrome c",Energy Metabolism
194,tpiA KO,False,-0.0048765703765787,,tpiA KO and compensatory evolved regulatory changes,Carbon Metabolism
153,arcA/luxS KO,False,0.0048204386622501,,arcA KO,Energy Metabolism
143,FlhDC-1,False,0.0047239165075678,FlhDC,Flagellum biosynthesis and export,Extracellular Structures
145,ppGpp,False,0.0045999720306254,ppGpp,Stringent response,Global Stress
114,GlcNAc,False,-0.0043077881177468,NagC+Crp,"Amino sugar transport, biosynthesis and catabolism",Carbon Metabolism
110,SCFA,False,0.0042833859605483,RpoN+AtoC+IHF,Short-chain fatty acid (acetoacetate) transport and catabolism,Carbon Metabolism
70,Salicylic Acid,False,-0.0042533716884695,,Salicylic acid efflux,Redox Stress
158,Cysteine-2,False,-0.0041563126987927,CysB,"Cysteine biosynthesis, sulfate assimilation",Amino Acid Metabolism
55,ykgR,False,-0.00409554965484,,Unknown,Unknown
180,Tyr/Trp/Phe,False,-0.0040937273503503,TyrR/TrpR/Trp-tRNA,Aromatic amino acid biosynthesis and transport,Amino Acid Metabolism
50,Sulfoquinovose,False,-0.0040001023405886,CsqR,Sulfoquinovose transport and catabolism,Carbon Metabolism
22,SoxS,False,-0.0039850285818198,SoxS,"Superoxide/nitric oxide sensing and removal, protection from organic solvents and antibiotics",Redox Stress
9,ROS TALE Amp,False,0.0038198361648228,,Amplification of DLP12/IS3,Unknown
1,Translation,False,-0.0037957280521156,DksA,Ribosome biogenesis,Translation
117,Fnr-3,False,-0.0037317340100852,Fnr,Anaerobic growth,Energy Metabolism
8,yqhI,False,0.0037249256981266,,Unknown,Unknown
18,Methionine,False,0.0036849815438761,MetJ,Methionine transport and biosynthesis,Amino Acid Metabolism
47,Biofilm,False,0.0033684215195721,RpoS+ppGpp+BluR+MarA,"Biofilm formation, acid resistance, cold shock response",Extracellular Structures
179,Maltose,False,-0.0033631199990903,MalT,Maltose transport and catabolism,Carbon Metabolism
199,Ile/Val,False,-0.0033381733039003,,Isoleucine and valine biosynthesis,Amino Acid Metabolism
94,NtrC-1,False,-0.0033211276349202,RpoN+RpoS+NtrC,"Nitrogen assimilation, ammonium transport",Nitrogen Metabolism
91,NDH-1,False,0.0033179924311419,NarL+ArcA+IHF+Fnr+Fis+ryhB,"NADH:ubiquinone oxidoreductase I: electron transfer from NADH to quinone pool, proton electrochemical gradient generation for aerobic and anaerobic respiration",Energy Metabolism
163,CP4-44,False,-0.0032765866218555,,CP4-44 prophage expression variation,Prophage
13,RpoH,False,-0.0032158317878798,RpoH,Global heat shock response during log-phase; response to high temperature and/or misfolded proteins,Temperature Shock
139,Capsule,False,0.0031968818706669,RcsAB,Colanic acid capsule synthesis and transport; periplasmic proteins; envelope stress response,Extracellular Structures
23,thrA KO,False,0.0031898001239521,,thrA KO and compensatory transcriptional changes,Amino Acid Metabolism
123,Copper,False,-0.0031784436645393,CusR/CueR/HprR,Copper/silver sensing and export,Metal Homeostasis
198,Acetate,False,0.0029906431280802,,Acetate uptake and catabolism; aldehyde catabolism; acetate/ethanol detoxification at stationary phase,Carbon Metabolism
193,cyoB/ndh/nuoB KO-2,False,-0.0029770039471083,,cyoB/ndh/nuoB KOs,Energy Metabolism
131,efeU Activation,False,-0.0029483076450962,,efeU re-activation and associated efeU ALE-related expression changes,Metal Homeostasis
112,pts ALE,False,-0.0029452891235861,,ptsHIcrr KO and associated adaptive regulatory changes,Energy Metabolism
148,LPS,False,0.0029108607537427,,Lipopolysaccharide biosynthesis and export,Extracellular Structures
103,Tryptophan,False,-0.0028899989610087,TrpR+Trp-tRNA,Tryptophan transport and biosynthesis,Amino Acid Metabolism
79,Isc System,False,-0.002866746338586,ryhB/IscR,Iron-sulfur cluster biogenesis and insertion,Cofactor Metabolism
33,Curli-2,False,-0.0028580193766543,RpoS+FliZ+CpxR+CsgD+BtsR,Curli secretion and assembly,Extracellular Structures
80,Thiamine-2,False,0.0028232794845098,,Thiamine uptake and biosynthesis,Cofactor Metabolism
84,NtrC-2,False,0.0027895743916864,NtrC+RpoN,"Nitrogen assimilation, ammonium transport",Nitrogen Metabolism
178,NO Stress,False,-0.0027593336169647,NsrR/NarP,"Nitric oxide sensing and detoxification, iron-sulfur cluster repair, anaerobic growth",Redox Stress
146,Glycolate,False,-0.002709716757014,IHF+ArcA+PdhR+GlcC,Glycolate/glyoxylate tranport and catabolism,Carbon Metabolism
92,Crp-1,False,0.0026070707061029,Crp,Miscellaneous carbon source metabolism,Carbon Metabolism
127,Cold Shock,False,-0.0025764067591965,,Cold shock proteins,Temperature Shock
105,Glycine,False,0.0024822030424977,PurR+Fnr+ppGpp+Crp+Lrp+GcvA,Glycine cleavage system,Amino Acid Metabolism
113,FDH-O,False,-0.0023934066286489,sdhX,Formate dehydrogenase O; formate to carbon dioxide oxidation; formate-nitrate electron transport during aerobic/anerobic shift,Energy Metabolism
58,Fur-2,False,0.0023625768846454,Fur,"Iron sensing and uptake, enterobactin biosynthesis, iron-sulfur cluster activation, iron sequestration",Metal Homeostasis
46,PAL 10 Del,False,-0.0023223381232615,,Unknown,Unknown
130,ldrD,False,0.0023214385141606,,Unknown,Unknown
52,lsrB KO,False,-0.0022928105149664,,lsrB KO and compensatory regulatory changes,Quorum Sensing
78,cyoB/kdpE/qseB KO,False,-0.0022772728550022,,cyoB/kdpE/qseF KO,Energy Metabolism
19,Sorbitol,False,0.0022512663367473,SrlR+GutM+Crp+H-NS,Sorbitol transport and catabolism,Carbon Metabolism
191,Tryptophanase,False,0.0022396738028932,Crp+TorR+Nac+L-tryptophan,Tryptophan import and catabolism via tryptophanase; indole/pyruvate biosynthesis,Amino Acid Metabolism
81,crp KO-1,False,0.0022215145073741,,crp KO and compensatory regulatory changes,Carbon Metabolism
154,sdh KO,False,0.0022005174919118,,sdh KO,Carbon Metabolism
87,YieP,False,0.0021887584376838,YieP,"Cellular membrane synthesis and stress response, 3-hydroxypropanoate tolerance",Envelope Stress
62,Fnr-1,False,0.0021812938126609,Fnr,Transition from aerobic to anaerobic growth; anaerobic reductase and hydrogenase activity,Energy Metabolism
164,minicoli KOs,False,-0.0021508800687694,,Deletions from minicoli strain,Genome Reduction
159,ydfW,False,-0.0021495962434553,,Unknown,Unknown
76,Potassium,False,-0.0021006317404183,KdpE,Potassium sensing and transport,Metal Homeostasis
93,yneP,False,-0.0020750076246903,,Unknown,Unknown
17,Zinc-1,False,-0.0020683540755466,Zur/ZntR/CueR,Zinc sensing and uptake; copper sensing and export,Metal Homeostasis
176,Suf System,False,0.0020634923172938,NsrR+IHF+IscR+OxyR+Fur+ppGpp,Iron-sulfur cluster biosynthesis and insertion,Metal Homeostasis
160,YcjW,False,0.0019988209477042,YcjW,Carbohydrate transport and catabolism,Carbon Metabolism
35,FucR/ExuR,False,-0.0019950951592991,FucR/ExuR,Fucose/galacturonate/glucuronate transport and catabolism,Carbon Metabolism
37,ymdG,False,-0.0019891761261998,,Unknown,Unknown
161,PAL Amp,False,-0.001928218249761,,Unknown,Unknown
174,Cra,False,0.0019092095416262,Cra,Central carbon metabolism; glycolytic flux-dependent regulation via fructose sensing,Carbon Metabolism
95,Ribose,False,-0.0018661321505956,dsrA+Crp+RbsR,Ribose transport and catabolism,Carbon Metabolism
196,Glyoxylate,False,0.0017777351164661,Crp+ArcA+ppGpp+Cra+IclR+IHF,Glyxoylate cycle; alternate to TCA cycle,Energy Metabolism
192,crp KO-2,False,0.0017480571633209,,crp KO and associated glycerol-3-phosphate (GlpR) regulatory changes,Carbon Metabolism
3,OxyR,False,-0.0017380745957123,OxyR,"Oxidative stress response, especially peroxide",Redox Stress
60,Nitrate/Nitrite,False,-0.0016434364281291,NarL+Fnr,Nitrate/nitrite transport and reduction,Nitrogen Metabolism
10,Nucleotide Stress,False,-0.0015459671665587,,DNA repair; stringent response signaling via ppGpp; ribosomal biogenesis and stability,DNA Damage
49,BasR,False,0.0014707277953854,BasR,Lipid A modification and polymixin resistance in the presence of excess iron,Extracellular Structures
171,cyoB/ndh/nuoB KO-1,False,-0.0013843094256143,,NDH-1 (nuoB) KO and compensatory NDH-2 (ndh) up-regulation,Energy Metabolism
104,FHL,False,0.0013456366849542,RpoN+NsrR+ModE+IHF+FhlA,Formate hydrogenlyase: hydrogen production during glucose fermentation via formate oxidation/proton reduction,Energy Metabolism
184,pts KO,False,0.0012817857512981,,ptsHI/crr KO and compensatory regulatory changes,Carbon Metabolism
101,e14 Del,False,-0.0012435132605718,,Unknown,Unknown
99,yjjZ,False,-0.0012348671631551,,Unknown,Unknown
65,NRZ,False,-0.0011385161107059,OmpR,Nitrate reduction under microaerobic condition; aerobic to anaerobic transition,Energy Metabolism
140,ytiC,False,0.0010909553214027,,Unknown,Unknown
66,nquinone ALE 3,False,0.0010630771757569,,ubiC KO and associated adaptive regulatory changes,Energy Metabolism
82,SSW SNPs,False,-0.0010256927333918,,Unknown,ALE Effects
29,Quorum Sensing,False,0.0009342509118471,Crp+LsrR,"Quorum sensing via autoinducer 2, biofilm architecture, foreign DNA stress response; lsrR KO",Quorum Sensing
5,Osmoprotectant,False,0.0009159444756007,RpoS+ppGpp+IHF+H-NS,Transport of osmoprotectant glycine betaine,Envelope Stress
77,ROS TALE Del-1,False,-0.000856069408744,,Unknown,Unknown
4,FlhDC-2,False,0.0006992770064943,FlhDC,Flagellum biosynthesis and export,Extracellular Structures
170,Purine,False,-0.0006402955630115,PurR+ppGpp,Purine transport and biosynthesis,Nucleotide Metabolism
175,Hot TALE 16,False,-0.0006360617845955,,Regulatory changes under high temperature,Unknown
96,Dipeptide,False,0.000506257248537,gcvB+IHF+Fnr,Dipeptide transport; flagellar biosynthesis,Amino Acid Metabolism
129,Pyruvate-1,False,0.0004464637343468,BtsR,"Pyruvate sensing, transport, and catabolism under nutrient limitation",Carbon Metabolism
42,Biotin,False,-0.0004397002725136,BirA,Biotin biosynthesis,Cofactor Metabolism
54,Fur-1,False,0.0004367730039329,Fur,"Iron sensing and uptake, enterobactin biosynthesis, iron-sulfur cluster activation, iron sequestration",Metal Homeostasis
152,NtrC-3,False,0.0004334315823982,NtrC+RpoN,"Nitrogen assimilation, pyrimidine transport and catabolism",Nitrogen Metabolism
126,Thiamine-1,False,0.0004310992933302,Thiamine diphosphate,Thiamine uptake and biosynthesis,Cofactor Metabolism
138,Leucine,False,-0.0003609410278345,LeuO+Leu-tRNA+ppGpp,Leucine biosynthesis,Amino Acid Metabolism
147,PAL 26 Del,False,0.0003444807715619,,Unknown,Unknown
15,ldrC,False,-0.000331167355949,,Unknown,Unknown
141,ROS TALE Del-2,False,-0.0001996106265046,,Unknown,Unknown
41,pgi KO,False,-0.0001413064342684,,pgi KO,Carbon Metabolism
88,Nitrogen,False,-0.0001381433452556,Nac,Nitrogen metabolism under nitrogen limitation,Nitrogen Metabolism
59,Magnesium,False,0.0001345902746299,PhoP,Magnesium sensing and transport; magnesium-limitation response,Metal Homeostasis
83,yafF,False,-0.0001192688598135,,Unknown,Unknown
56,Sulfate,False,0.0001158693511618,Cbl+CysB,Cysteine transport and biosynthesis; aliphatic sulfonate utilization and homeostatic response to sulfate starvation,Amino Acid Metabolism
133,malE OE,False,-7.415482566764039e-05,,Accounts for malE plasmid overexpression,Carbon Metabolism
28,ldrA,False,6.138099198758756e-05,,Unknown,Unknown
119,entC/ubiC KO-1,False,-3.021791114620922e-06,,entC/ubiC KO and compensatory sad up-regulation,Energy Metabolism
