k,name,in_iM,gene_weight,regulator,function,category
164,minicoli KOs,False,0.0363811998831459,,Deletions from minicoli strain,Genome Reduction
176,Suf System,False,-0.0295582588771508,NsrR+IHF+IscR+OxyR+Fur+ppGpp,Iron-sulfur cluster biosynthesis and insertion,Metal Homeostasis
47,Biofilm,False,-0.0290149988709164,RpoS+ppGpp+BluR+MarA,"Biofilm formation, acid resistance, cold shock response",Extracellular Structures
161,PAL Amp,False,-0.0258247189467509,,Unknown,Unknown
132,rcsB KO,False,-0.0217541982263107,,rcsB KO and associated regulatory changes,Envelope Stress
57,ypaB,False,0.0208439342515412,,Unknown,Unknown
171,cyoB/ndh/nuoB KO-1,False,-0.0207553764272592,,NDH-1 (nuoB) KO and compensatory NDH-2 (ndh) up-regulation,Energy Metabolism
113,FDH-O,False,-0.019326280749776,sdhX,Formate dehydrogenase O; formate to carbon dioxide oxidation; formate-nitrate electron transport during aerobic/anerobic shift,Energy Metabolism
151,IS5,False,-0.0192781860185557,,IS5 transcripts,Unknown
71,ymgI,False,-0.0188920667479248,,Unknown,Unknown
181,GadX,False,0.0184320020188045,RpoS+GadX,Glutamate-dependent acid resistance system; multidrug efflux,Envelope Stress
91,NDH-1,False,-0.0181072070422341,NarL+ArcA+IHF+Fnr+Fis+ryhB,"NADH:ubiquinone oxidoreductase I: electron transfer from NADH to quinone pool, proton electrochemical gradient generation for aerobic and anaerobic respiration",Energy Metabolism
13,RpoH,False,-0.0176893740142425,RpoH,Global heat shock response during log-phase; response to high temperature and/or misfolded proteins,Temperature Shock
131,efeU Activation,False,0.0171598520404958,,efeU re-activation and associated efeU ALE-related expression changes,Metal Homeostasis
74,ArcA,False,0.0163530183851305,ArcA,Anaerobiosis; repression of aerobic growth genes during anaerobic growth,Energy Metabolism
116,Lysine/T2SS,False,-0.0150849204150443,ArgP,Lysine transport and biosynthesis; type II secretion system,Amino Acid Metabolism
64,Zinc-2,False,0.0148596774854326,ZraR,Tolerance to high zinc concentration,Metal Homeostasis
170,Purine,False,-0.0143286021856845,PurR+ppGpp,Purine transport and biosynthesis,Nucleotide Metabolism
37,ymdG,False,-0.0142181542303202,,Unknown,Unknown
158,Cysteine-2,False,0.0139323591244314,CysB,"Cysteine biosynthesis, sulfate assimilation",Amino Acid Metabolism
119,entC/ubiC KO-1,False,0.0135551105311106,,entC/ubiC KO and compensatory sad up-regulation,Energy Metabolism
27,ydaG,False,0.0133580147907889,,Unknown,Unknown
196,Glyoxylate,False,-0.0133427972501108,Crp+ArcA+ppGpp+Cra+IclR+IHF,Glyxoylate cycle; alternate to TCA cycle,Energy Metabolism
34,Acid Shock RNA,False,-0.0131081129254338,,Very low pH-responsive acid shock polypeptide,Acid Stress
133,malE OE,False,0.0129640151496814,,Accounts for malE plasmid overexpression,Carbon Metabolism
40,IS1,False,0.0128969051032858,,IS1 transcripts,Unknown
183,DhaR,False,-0.0127970487845692,DhaR,Dihydroxyacetone transport and catabolism; phosphotransferase activity for DhaM phosphorylation,Carbon Metabolism
99,yjjZ,False,0.0125135500450309,,Unknown,Unknown
79,Isc System,False,0.0124930345754406,ryhB/IscR,Iron-sulfur cluster biogenesis and insertion,Cofactor Metabolism
146,Glycolate,False,-0.0124646063135063,IHF+ArcA+PdhR+GlcC,Glycolate/glyoxylate tranport and catabolism,Carbon Metabolism
109,Flagella,False,0.0122973739160208,,Flagellar biosynthesis,Extracellular Structures
24,YjfJ,False,-0.0122694052477043,YjfJ,Putative heat responsive regulon,Temperature Shock
46,PAL 10 Del,False,-0.0122087546480883,,Unknown,Unknown
140,ytiC,False,0.0119917977366744,,Unknown,Unknown
23,thrA KO,False,0.0117737884488793,,thrA KO and compensatory transcriptional changes,Amino Acid Metabolism
104,FHL,False,-0.0114338372900197,RpoN+NsrR+ModE+IHF+FhlA,Formate hydrogenlyase: hydrogen production during glucose fermentation via formate oxidation/proton reduction,Energy Metabolism
127,Cold Shock,False,0.0111549918512769,,Cold shock proteins,Temperature Shock
130,ldrD,False,-0.0111298436313035,,Unknown,Unknown
83,yafF,False,0.0107821111724164,,Unknown,Unknown
31,Nickel,False,0.010755979354937,RpoN+NarL+NikR+Fnr,Nickel sensing and uptake,Metal Homeostasis
189,UC-7,False,0.0106180088419469,,Unknown,Unknown
80,Thiamine-2,False,0.0105591229636504,,Thiamine uptake and biosynthesis,Cofactor Metabolism
81,crp KO-1,False,-0.0104477450436306,,crp KO and compensatory regulatory changes,Carbon Metabolism
199,Ile/Val,False,0.0103026370164903,,Isoleucine and valine biosynthesis,Amino Acid Metabolism
92,Crp-1,False,-0.0100782828316703,Crp,Miscellaneous carbon source metabolism,Carbon Metabolism
90,Leu/Val/Ile,False,-0.0099874736744745,Lrp+IHF+Ile-tRNA+Leu-tRNA+Val-tRNA+ppGpp,Branched-chain amino acid biosynthesis,Amino Acid Metabolism
159,ydfW,False,-0.0097555667819291,,Unknown,Unknown
2,ygdT,False,-0.0097314998004461,,Unknown,Unknown
124,Thr/Ser-2,False,-0.0097024524504262,Fnr+Crp+IHF+TdcA+TdcR,Threonine/serine transport and catabolism,Amino Acid Metabolism
192,crp KO-2,False,-0.0096674849154975,,crp KO and associated glycerol-3-phosphate (GlpR) regulatory changes,Carbon Metabolism
182,Fatty Acid,False,0.0095718926789505,FadR,Fatty acid degradation and biosynthesis,Carbon Metabolism
150,Nickel/Cobalt,False,-0.009256496059187,RcnR,Nickel and cobalt resistance via efflux,Metal Homeostasis
195,Phage Shock,False,-0.009183668411278,RpoN+IHF+PspF,Phage shock response; response to filamentous phage infection and/or extracytoplasmic shock,Phage Shock
68,Cellulose,False,0.0090702842126881,,Cellulose biosynthesis; biofilm formation; membrane/periplasmic proteins,Extracellular Structures
3,OxyR,False,0.0090028938206588,OxyR,"Oxidative stress response, especially peroxide",Redox Stress
128,FliA,False,-0.0087002760851562,FliA,"Sigma 28; flagellum biosynthesis and export, motility",Extracellular Structures
76,Potassium,False,-0.0086833632660181,KdpE,Potassium sensing and transport,Metal Homeostasis
102,Thr/Ser-1,False,-0.008573357403897,TdcA+TdcR+IHF+Fnr+Crp,Threonine/serine transport and catabolism during anaerobiosis,Amino Acid Metabolism
78,cyoB/kdpE/qseB KO,False,-0.0085027265022419,,cyoB/kdpE/qseF KO,Energy Metabolism
200,UC-8,False,-0.0083911995568181,,Unknown,Unknown
45,Resistance,False,0.0083827051817899,,Multidrug resistance; stress response to harmful compounds/antibiotics,Envelope Stress
51,RpoS,False,0.0083609265395901,RpoS,Master regulator of global stress response,Global Stress
162,Propionate,False,-0.0083204383554963,PrpR+RpoN+Cra+Crp,Propionate catabolism; 2-methylcitric acid cycle,Carbon Metabolism
48,Cytochrome c,False,0.0082856154171392,FlhDC+IHF+NsrR+NarL+NarP+Fis+Fnr,Cytochrome c-552 and putative cytochrome c-related proteins,Energy Metabolism
9,ROS TALE Amp,False,-0.0080468387158676,,Amplification of DLP12/IS3,Unknown
122,UC-9,False,-0.0078619430551358,,Unknown,Unknown
75,yceO,False,0.0078372473119808,,Unknown,Unknown
53,UC-1,False,0.0078267617732067,,Unknown,Unknown
129,Pyruvate-1,False,0.007811795394937,BtsR,"Pyruvate sensing, transport, and catabolism under nutrient limitation",Carbon Metabolism
10,Nucleotide Stress,False,0.0077950567734833,,DNA repair; stringent response signaling via ppGpp; ribosomal biogenesis and stability,DNA Damage
86,UC-3,False,0.0076906142432371,,Unknown,Unknown
178,NO Stress,False,0.0076777090946336,NsrR/NarP,"Nitric oxide sensing and detoxification, iron-sulfur cluster repair, anaerobic growth",Redox Stress
50,Sulfoquinovose,False,-0.0074879598151668,CsqR,Sulfoquinovose transport and catabolism,Carbon Metabolism
35,FucR/ExuR,False,-0.0074434817115007,FucR/ExuR,Fucose/galacturonate/glucuronate transport and catabolism,Carbon Metabolism
18,Methionine,False,0.007440647339186,MetJ,Methionine transport and biosynthesis,Amino Acid Metabolism
101,e14 Del,False,-0.0074048499082471,,Unknown,Unknown
191,Tryptophanase,False,-0.0073857057645386,Crp+TorR+Nac+L-tryptophan,Tryptophan import and catabolism via tryptophanase; indole/pyruvate biosynthesis,Amino Acid Metabolism
77,ROS TALE Del-1,False,0.0073615678733468,,Unknown,Unknown
63,Pyrimidine,False,0.0072193158091888,PurR/UTP,Pyrimidine transport and biosynthesis,Nucleotide Metabolism
184,pts KO,False,0.0071796083471327,,ptsHI/crr KO and compensatory regulatory changes,Carbon Metabolism
106,BW25113,False,0.0071510182007489,,Accounts for genomic differences between BW25113 and MG1655 substrains,Strain Difference
5,Osmoprotectant,False,-0.0068552734162592,RpoS+ppGpp+IHF+H-NS,Transport of osmoprotectant glycine betaine,Envelope Stress
60,Nitrate/Nitrite,False,0.0066331766187759,NarL+Fnr,Nitrate/nitrite transport and reduction,Nitrogen Metabolism
167,UC-2,False,-0.006628554493646,,Unknown,Unknown
168,ydfB,False,0.0065799907741688,,Unknown,Unknown
54,Fur-1,False,-0.0064691417077474,Fur,"Iron sensing and uptake, enterobactin biosynthesis, iron-sulfur cluster activation, iron sequestration",Metal Homeostasis
62,Fnr-1,False,-0.006351392632911,Fnr,Transition from aerobic to anaerobic growth; anaerobic reductase and hydrogenase activity,Energy Metabolism
187,entC/ubiC KO-2,False,0.0062485243512339,,entC/ubiC KO and compensatory sad up-regulation,Energy Metabolism
115,YgbI,False,-0.0061107945578381,YgbI,Tartrate transport and catabolism,Carbon Metabolism
157,Microaerobic,False,-0.0060974151014704,RpoS+Fis+NarP+NarL+AppY+YdeO+ArcA+IscR,Hydrogenase 1 and cytochrome bd-II ubiquinol oxidase: microaerobic respiratory chain between hydrogen and oxygen,Energy Metabolism
44,FDH-N/NRA,False,0.0060807417906135,NarL+Fnr,Anaerobic growth on nitrate; formate-to-nitrate electron transfer via formate dehydrogenase N and nitrate reductase A,Energy Metabolism
49,BasR,False,-0.0060805141109672,BasR,Lipid A modification and polymixin resistance in the presence of excess iron,Extracellular Structures
153,arcA/luxS KO,False,-0.0060360139761925,,arcA KO,Energy Metabolism
143,FlhDC-1,False,0.006032595547957,FlhDC,Flagellum biosynthesis and export,Extracellular Structures
15,ldrC,False,0.0059823602326195,,Unknown,Unknown
141,ROS TALE Del-2,False,0.0059748972784407,,Unknown,Unknown
12,UC-4,False,-0.0058967180789632,,Unknown,Unknown
14,FucR/AllR/AraC,False,0.005635603754516,FucR/AllR/AraC,Allantoin/glycolate/glyoxylate/arabinose/fucose transport and catabolism,Nitrogen Metabolism
96,Dipeptide,False,-0.0055980025350534,gcvB+IHF+Fnr,Dipeptide transport; flagellar biosynthesis,Amino Acid Metabolism
198,Acetate,False,0.0055216076785897,,Acetate uptake and catabolism; aldehyde catabolism; acetate/ethanol detoxification at stationary phase,Carbon Metabolism
16,Ferric Citrate,False,0.0055170327094863,PdhR+HypT+Nac+Crp+Fur+FecI,Ferric citrate transporter; iron uptake under intracellular limitation,Metal Homeostasis
103,Tryptophan,False,-0.0053703886087127,TrpR+Trp-tRNA,Tryptophan transport and biosynthesis,Amino Acid Metabolism
197,CCK-PGI Del,False,0.0053251237840442,,Unknown,Unknown
112,pts ALE,False,0.0053208315762306,,ptsHIcrr KO and associated adaptive regulatory changes,Energy Metabolism
166,Rhamnose,False,0.0051292751870059,Crp+RhaS,Rhamnose transport and catabolism,Carbon Metabolism
87,YieP,False,0.0050666177453376,YieP,"Cellular membrane synthesis and stress response, 3-hydroxypropanoate tolerance",Envelope Stress
142,UC-5,False,0.005052535689261,,Unknown,Unknown
125,Membrane,False,-0.0049651379706632,,"Membrane-related stress response regulators, transporters, multidrug resistance",Envelope Stress
26,baeR KO,False,0.0049167939471484,,baeR KO,Envelope Stress
174,Cra,False,-0.0048576500199706,Cra,Central carbon metabolism; glycolytic flux-dependent regulation via fructose sensing,Carbon Metabolism
188,Oxidoreductase,False,0.0047719937638242,,Putative oxidoreductase components,Redox Stress
138,Leucine,False,0.004697975641913,LeuO+Leu-tRNA+ppGpp,Leucine biosynthesis,Amino Acid Metabolism
70,Salicylic Acid,False,0.0044967736682473,,Salicylic acid efflux,Redox Stress
0,Sugar Diacid,False,0.0044815708225083,CdaR,Transport and catabolism of carbohydrate diacids (galacatarate and glucarate),Carbon Metabolism
180,Tyr/Trp/Phe,False,-0.004461783974167,TyrR/TrpR/Trp-tRNA,Aromatic amino acid biosynthesis and transport,Amino Acid Metabolism
59,Magnesium,False,0.0044027191338076,PhoP,Magnesium sensing and transport; magnesium-limitation response,Metal Homeostasis
111,YgeV,False,0.0043698386230342,YgeV,Nucleoside degradation activated by ethanol treatment,Carbon Metabolism
6,Glutamine,False,0.0043025380613592,NtrC,Glutamine transport and synthesis,Nitrogen Metabolism
42,Biotin,False,-0.0042788792654293,BirA,Biotin biosynthesis,Cofactor Metabolism
61,glrR KO,False,-0.0042757636315573,,glrR (aka qseF) KO; xylose transport and catabolism,Envelope Stress
22,SoxS,False,0.0041654157181781,SoxS,"Superoxide/nitric oxide sensing and removal, protection from organic solvents and antibiotics",Redox Stress
41,pgi KO,False,-0.0041300498401252,,pgi KO,Carbon Metabolism
156,Fnr-2,False,0.0039874321468481,Fnr,Transition from aerobic to anaerobic growth; global control of anaerobiosis,Energy Metabolism
152,NtrC-3,False,0.0039787228535321,NtrC+RpoN,"Nitrogen assimilation, pyrimidine transport and catabolism",Nitrogen Metabolism
39,Xylose,False,0.0039644757012012,Crp+XylR,d-Xylose transport and catabolism,Carbon Metabolism
7,Sialic Acid,False,0.0039198918136167,Crp+NanR,N-acetyl-neuraminic acid (or sialic acid) transport and metabolism,Carbon Metabolism
134,Crp-2,False,0.0038789106202649,Crp,Carbohydrate transport and catabolism,Carbon Metabolism
32,CpxR,False,-0.0038614865474264,CpxR,"Inner membrane damage sensing and repair via protein folding/degradation, chemotaxis, drug efflux, DNA repair, motility",Envelope Stress
98,ymiB,False,-0.0038450244225913,,Unknown,Unknown
108,PaaX,False,-0.0037611226537962,Crp+IHF+PaaX+SlyA,Phenylacetic acid transport and catabolism,Carbon Metabolism
8,yqhI,False,0.0036909803190849,,Unknown,Unknown
145,ppGpp,False,-0.0036856591198912,ppGpp,Stringent response,Global Stress
66,nquinone ALE 3,False,-0.0036166720071664,,ubiC KO and associated adaptive regulatory changes,Energy Metabolism
177,PlaR,False,-0.0035937395583239,PlaR+RpoE+Crp+IHF,Plant-derived sugars transport and catabolism,Carbon Metabolism
114,GlcNAc,False,0.0035812589618177,NagC+Crp,"Amino sugar transport, biosynthesis and catabolism",Carbon Metabolism
107,ypjJ,False,-0.003573619242454,,Unknown,Unknown
20,Glycerol,False,-0.0035199324110757,Crp+GlpR,Glycerol/glycerol-3-phosphate transport and catabolism,Carbon Metabolism
55,ykgR,False,0.003355305579614,,Unknown,Unknown
69,Phosphate-1,False,-0.0032777389504732,PhoB,"Inorganic phosphate sensing, transport, and production",Phosphate Metabolism
88,Nitrogen,False,0.0032527155665453,Nac,Nitrogen metabolism under nitrogen limitation,Nitrogen Metabolism
21,Nucleoside,False,-0.0032505688409063,Crp+CytR,Transport and utilization of ribonucleosides and deoxyribonucleosides,Nucleotide Metabolism
193,cyoB/ndh/nuoB KO-2,False,0.0032398871579277,,cyoB/ndh/nuoB KOs,Energy Metabolism
149,Arginine,False,-0.0031384889128285,ArgR,Arginine transport and biosynthesis,Amino Acid Metabolism
94,NtrC-1,False,-0.0029802078341986,RpoN+RpoS+NtrC,"Nitrogen assimilation, ammonium transport",Nitrogen Metabolism
173,IS Elements-1,False,-0.0027503409202625,,Unknown,Unknown
100,Molybdenum,False,-0.0026848047656142,Crp+FliA+ModE,Molybdenum transport and molybdoenzyme synthesis,Metal Homeostasis
163,CP4-44,False,0.0026744312578758,,CP4-44 prophage expression variation,Prophage
95,Ribose,False,0.0026652959518238,dsrA+Crp+RbsR,Ribose transport and catabolism,Carbon Metabolism
38,EvgA,False,0.00262292282247,EvgA,"Glutamate-dependent acid response, drug resistance, alkali metals response",Envelope Stress
25,Lrp,False,-0.0026045992974114,Lrp,"Global regulation of amino acid biosynthesis/catabolism, stationary phase, nutrient transport, pili synthesis, 1-carbon metabolism",Amino Acid Metabolism
194,tpiA KO,False,-0.0025011093091866,,tpiA KO and compensatory evolved regulatory changes,Carbon Metabolism
65,NRZ,False,0.002500395452138,OmpR,Nitrate reduction under microaerobic condition; aerobic to anaerobic transition,Energy Metabolism
72,Galactose,False,0.0024970965319529,RpoS+GalR+GalS+Crp,Galactose transport and catabolism,Carbon Metabolism
4,FlhDC-2,False,0.0024939232553711,FlhDC,Flagellum biosynthesis and export,Extracellular Structures
118,ythA,False,-0.0024868402650987,,Unknown,Unknown
82,SSW SNPs,False,0.0024282808885764,,Unknown,ALE Effects
56,Sulfate,False,0.0023691543228925,Cbl+CysB,Cysteine transport and biosynthesis; aliphatic sulfonate utilization and homeostatic response to sulfate starvation,Amino Acid Metabolism
30,IS Elements-2,False,-0.0023326509719862,,Unknown,Unknown
58,Fur-2,False,0.0023026998447502,Fur,"Iron sensing and uptake, enterobactin biosynthesis, iron-sulfur cluster activation, iron sequestration",Metal Homeostasis
135,Cysteine-1,False,-0.002250738963526,CysB,"Cysteine biosynthesis, sulfate assimilation",Amino Acid Metabolism
19,Sorbitol,False,-0.0022482449889617,SrlR+GutM+Crp+H-NS,Sorbitol transport and catabolism,Carbon Metabolism
126,Thiamine-1,False,-0.0022165058569131,Thiamine diphosphate,Thiamine uptake and biosynthesis,Cofactor Metabolism
148,LPS,False,-0.0021952382450257,,Lipopolysaccharide biosynthesis and export,Extracellular Structures
155,YmfT,False,0.0021173442230483,YmfT,e14 prophage regulator activated by DNA damage,DNA Damage
43,N Reduction,False,-0.0020895506121531,FlhDC+ModE+NarP+NarL+Fnr,"Electron transfer via nitrate reductases (periplasmic and A), cytochrome c",Energy Metabolism
110,SCFA,False,-0.0020883676000759,RpoN+AtoC+IHF,Short-chain fatty acid (acetoacetate) transport and catabolism,Carbon Metabolism
175,Hot TALE 16,False,-0.0020533543328878,,Regulatory changes under high temperature,Unknown
28,ldrA,False,-0.0020502237370526,,Unknown,Unknown
137,Phosphate-2,False,-0.0020450780973113,PhoB,"Inorganic phosphate sensing, transport, and production",Phosphate Metabolism
169,NrdR,False,-0.0019097518427424,NrdR,Ribonucleoside reduction,Nucleotide Metabolism
84,NtrC-2,False,-0.0019080952061054,NtrC+RpoN,"Nitrogen assimilation, ammonium transport",Nitrogen Metabolism
121,Gluconate,False,0.001867714983587,GntR+Crp,Gluconate transport and catabolism (Entner-Doudoroff),Carbon Metabolism
11,Histidine,False,0.0017922715522961,His-tRNA+DksA,Histidine biosynthesis,Amino Acid Metabolism
97,Curli-1,False,-0.0017755093415251,RpoS+FliZ+CpxR+CsgD+BtsR,Curli secretion and assembly,Extracellular Structures
120,yoaI,False,0.0017502267612419,,Unknown,Unknown
123,Copper,False,-0.0017157863318754,CusR/CueR/HprR,Copper/silver sensing and export,Metal Homeostasis
33,Curli-2,False,0.0016929437236497,RpoS+FliZ+CpxR+CsgD+BtsR,Curli secretion and assembly,Extracellular Structures
93,yneP,False,0.001657614244282,,Unknown,Unknown
36,cydB/appC KO,False,0.0015291399549767,,cydB/appC KO and compensatory regulatory changes,Energy Metabolism
52,lsrB KO,False,-0.0015099701341604,,lsrB KO and compensatory regulatory changes,Quorum Sensing
73,trxC Del,False,0.0014984188227391,,Unknown,Unknown
172,Fimbriae,False,0.0014483117840074,QseB+IHF+Lrp+H-NS,Type 1 (mannose-sensitive) pili/fimbriae biosynthesis and secretion,Extracellular Structures
136,Pyruvate-2,False,0.0014348638828659,PyrR,Pyruvate sensing and transport,Carbon Metabolism
154,sdh KO,False,0.001322219397436,,sdh KO,Carbon Metabolism
89,UC-6,False,0.0013152461844699,,Unknown,Unknown
147,PAL 26 Del,False,0.0012580144501867,,Unknown,Unknown
85,DNA Damage,False,-0.0012363458931016,LexA,SOS response to DNA damage or inhibition of DNA replication,DNA Damage
179,Maltose,False,-0.0011094334515567,MalT,Maltose transport and catabolism,Carbon Metabolism
67,RpoE,False,-0.0010999374578794,RpoE,Heat shock response; response to high temperature and/or misfolded membrane/periplasmic proteins,Temperature Shock
29,Quorum Sensing,False,0.001024239987031,Crp+LsrR,"Quorum sensing via autoinducer 2, biofilm architecture, foreign DNA stress response; lsrR KO",Quorum Sensing
139,Capsule,False,-0.0009298052615384,RcsAB,Colanic acid capsule synthesis and transport; periplasmic proteins; envelope stress response,Extracellular Structures
17,Zinc-1,False,-0.0009033810058067,Zur/ZntR/CueR,Zinc sensing and uptake; copper sensing and export,Metal Homeostasis
160,YcjW,False,-0.0008550947111856,YcjW,Carbohydrate transport and catabolism,Carbon Metabolism
165,GadXW,False,-0.0007743164233324,GadX+GadW,Glutamate-dependent acid resistance system; multidrug efflux,Envelope Stress
190,Efflux Pump,False,-0.0007627783323982,,Multidrug/spermidine efflux pump,Resistance
105,Glycine,False,0.0006040068396637,PurR+Fnr+ppGpp+Crp+Lrp+GcvA,Glycine cleavage system,Amino Acid Metabolism
1,Translation,False,-0.0004778215359098,DksA,Ribosome biogenesis,Translation
117,Fnr-3,False,0.0004248475819474,Fnr,Anaerobic growth,Energy Metabolism
144,Putrescine,False,0.0004190382165806,RpoS+ArcA+PuuR,Putrescine transport and catabolism,Nitrogen Metabolism
186,Glutarate,False,8.887109271982456e-05,RpoS+H-NS+Crp+Lrp+GlaR+ppGpp,Glutarate/aminobutyrate transport and catabolism,Carbon Metabolism
185,gcvB,False,2.530117749976488e-05,gcvB,Amino acid transport,Amino Acid Metabolism
