k,name,in_iM,gene_weight,regulator,function,category
0,Nitrogen,True,0.1092734965,NtrC,"Nitrogen stress response: ntrB/ntrC two component system, glnK, amtB, utilization of alternate nitrogen sources: urea (conversion of urea to ammonia), amino acids (transporters), pyrimidines (rutABCD), allantoin (allantoin permease), GABA (GABA permease)",Metabolism
35,Flagella-1,False,0.0163651221,,"fleS/fleR two component system, flagellar biosynthesis and assembly: rod; hook; L; M, and P ring; hook and basal body complex; motor switch; flagellar type III secretion system",Motility
7,Unchar-9,False,-0.0142963379,PSPTO_3698,"molybdenum cofactor-associated genes: moaA, fdhD, oxidoreductase (molydopterin binding protein); xanyhine dehydrogenase subunits (xdhAB) and xanthine dehydrogenase accessory protein (xdhC)",Uncharacterized
42,single_gene_4,False,0.013047800200000001,,"helix-turn-helix domain-containing protein, genes of unknown function",Noise
22,Carbon Starvation-2,False,0.013038211400000001,,Inositol phosphate and galactose metabolism,Metabolism
40,Unchar-5,False,0.0112020716,,"several unknown genes, type III effectors, cold shock domain-containing proteins, RNA-directed DNA polymerase, integrase, cysteine synthase familiy proteins",Uncharacterized
38,AlgU,False,0.0102672224,AlgU,"algU (rpoE),  hrpR, alginate biosynthesis, stress resistance: oxidative, osmotic, heat, UV, and metal ion stress",Stress Response
26,Zur,False,0.010238460900000001,PSPTO_5267,"Zinc transporters, cadA, rpme-1, iron transporters, and receptors",Metal Uptake
39,Resistance-2,False,-0.010044950300000001,CueR,"Syringafactin production and efflux, cueR, copper transport, chemotaxis, uric acid production, virulence factor srfB, virulence effector srfC, bacterioferritin, Flp type IV pilin",Stress Response
13,Transport,False,-0.009827216500000001,,"Transport of inorganic ions, amino acids, carbohydrates, and lipids; membrane proteins; carbon starvation protein A; tryptophan synthesis; syringafactin synthesis",Metabolism
15,Coronatine,False,-0.0097578418,,Coronatine biosynthesis: coronamic acid and coronafacic acid; alginate biosynthesis; type III effectors,Exometabolites
9,Resistance-1,False,-0.0097019011,,"MarR transcriptional regulator, efflux transporter subunits (RND, MFS, etc.), sulforaphane/aliphatic isothiocyanate, resistance proteins (saxAF)",Stress Response
14,Chaperone,False,-0.0095064506,,"Chaperones, heat shock proteins, proteins involved in repair processes other than in response to heat shock, ATP-dependent protease ATPase subunits",Stress Response
24,Protocatechuate,False,-0.0094308858,,Benzoate degradation: pcaBCGHK,Metabolism
6,IS-elements,False,0.008638538000000001,,"transposases, ptrB",Genomic
43,single_gene_5,False,0.0084997311,,"holin, genes of unknown function",Noise
11,Unchar-6,False,0.0083837066,,uncharacterized,Uncharacterized
1,Unchar-1,False,0.0077854953000000005,,"colR/colS two component system, pyruvate metabolism, insecticidal toxins, groES, glycerol uptake, etc.",Uncharacterized
21,Fe/Protein Transport,False,-0.0077771889,,"Iron starvation response: PvdS,  FoxR (ortholog), other sigma factors associated with iron starvation response, bacterioferritin, bacterioferritin-associated ferredoxin, energy transduction (exbBD), TonB-dependent siderophore receptors ",Metal Uptake
23,Phage,False,-0.0077126828000000005,,"prtN, ptrB, prophage genes associated with pyocin production in Pseudomonas aeruginosa",Genomic
16,Unchar-8,False,0.0076261322,,"fur, ribosomal proteins (rpsT, rplS, rpmE), ribosomal modulation factor, cold shock proteins, bacterioferritin, bacterioferritin-associated ferredoxin, transposases",Uncharacterized
18,Translation-2,False,0.0075758715,,"Ribosome maturation factor, rho, rpsU, rpiU",Translation
27,Yersiniabactin,False,-0.0070326550000000005,,Biosynthesis and transport of yersiniabactin,Exometabolites
34,Unchar-7,False,-0.0068908233000000004,,"lipid-A-disaccharide synthase, TolC family protein, dihydrolipoyllysine-residue acetyltransferase",Uncharacterized
29,Fatty Acid,False,0.0067389351,PsrA,"psrA, fadAB, etfAB, genes with multiple drug resistance domains",Metabolism
19,single_gene_1,False,0.006217539,,"baeR, exdb, unknown genes",Noise
44,Fe-S/Oxidative Stress,False,0.0049119735,,"Fe-S cluster assembly, oxidative stress resistance: sodA, fumC, katB, catalase ",Stress Response
12,Plasmid,False,-0.0043932958000000005,,"Plasmid genes: conjugal transfer proteins, DNA primase, glycoside hydrolase, mobilization proteins, type III effectors, integrase, UV resistance protein A, replication initiation protein; efflux transporters, glycine metabolism, sarcosine oxidase subunits ( likely due to plasmid manipulation)",Genomic
28,Osmotic Stress,False,0.0037371577000000003,,"Osmotic/water stress resistance: osmoprotectants, compatible solute production; oxidative stress resistance ",Stress Response
25,Flagella-2,False,-0.0034273724000000003,,"Glycosyltransferase, flagellar biosynthesis and assembly: hook, P-ring, export ATPase, chaperone, type III secretion system; cheZ",Motility
31,Carbon Starvation-1,False,-0.0031815566,,"Carbon starvation response: carbon starvation protein A, acetate utilization; pilin assembly: tadABCZ (homologs), rcpAC (homologs), flp family type IVb pilin",Metabolism
36,Translation-1,False,0.0031043068,,"Ribosomal proteins, atpCG, secY, rpoA",Translation
5,Unchar-4,False,-0.0027288524,,"Zinc transporters, cadA, rpme-1, iron transporters and receptors",Uncharacterized
20,single_gene_2,False,0.0021062439,,"helix-turn-helix domain-containing protein, IS element, holin, kdpF, genes of unknown function",Noise
33,Pyoverdine,False,-0.0017664215,PvdS,"Biosynthesis and transport of pyoverdine, metal transporters",Exometabolites
17,Unchar-2,False,-0.00150897,,"oxidative stress response: pqq, kdpf, organic hydroperoxide resistance protein, pirin (ortholog); nusA",Uncharacterized
32,Folate,False,0.0014347827000000001,,"Tetrahydrofolate production: soxGADB, folD, purU",Metabolism
3,Sulfur-1,False,-0.0013384072,,"Taurine, alkane sulfonate, cysteine, and methionine transport",Metabolism
41,single_gene_3,False,-0.0012668071,,genes of unknown function,Noise
8,Alginate,False,0.0012572534,,"Alginate biosynthesis, phenol degradation protein, benzaldehyde dehydrogenase, dimethylglycine demethylation, genes involved in amino acid transport and metabolism",Exometabolites
2,Chemotaxis,False,-0.0010706842,,"crp, csrA, flgM, chemotaxis proteins, membrane components, fliC, methyl accepting chemotaxis proteins, glycosyltransferase, several genes involved in signal transduction, flagellar genes: hook-associated proteins, filament capping protein, motor protein, motor stator protein",Motility
30,Unchar-3,False,0.0006280356,,"phoP/phoQ two component system, phosphate ABC transporter, pyruvate dehydrogenase, pbpG",Uncharacterized
37,T3SS,False,0.0005817193000000001,,"hrpR, hrpS, hrpL, coronatine biosynthesis activation: corP, corR/corS two component system, type III effectors, type III secretion system chaperones, type III secretion system components, type III secretion proteins, type III helper protein, type III restriction system endonuclease,ribosome modulation factor, HPr kinase, pectate lyase, flagellar hook length control protein",Exometabolites
10,Sulfur-2,False,-0.00016158360000000002,,"Sulfur starvation response protein (oscA), alkane sulfonate transporters, sulfate transporters, amino acid transporters",Metabolism
4,Recombination,False,-5.1858200000000004e-05,,"Recombinases family proteins, several genes of unknown function",Stress Response
