k,name,in_iM,gene_weight,regulator,function,category
104,FHL,False,0.0537087779473327,RpoN+NsrR+ModE+IHF+FhlA,Formate hydrogenlyase: hydrogen production during glucose fermentation via formate oxidation/proton reduction,Energy Metabolism
159,ydfW,False,-0.036885863801052,,Unknown,Unknown
113,FDH-O,False,0.0321426441834367,sdhX,Formate dehydrogenase O; formate to carbon dioxide oxidation; formate-nitrate electron transport during aerobic/anerobic shift,Energy Metabolism
71,ymgI,False,0.0317477617881328,,Unknown,Unknown
61,glrR KO,False,0.0278650030800061,,glrR (aka qseF) KO; xylose transport and catabolism,Envelope Stress
52,lsrB KO,False,-0.0268821078036932,,lsrB KO and compensatory regulatory changes,Quorum Sensing
127,Cold Shock,False,-0.0259538268571418,,Cold shock proteins,Temperature Shock
178,NO Stress,False,0.0247366877207444,NsrR/NarP,"Nitric oxide sensing and detoxification, iron-sulfur cluster repair, anaerobic growth",Redox Stress
36,cydB/appC KO,False,-0.0244470289357671,,cydB/appC KO and compensatory regulatory changes,Energy Metabolism
93,yneP,False,0.0243191590502276,,Unknown,Unknown
91,NDH-1,False,-0.0239662618086156,NarL+ArcA+IHF+Fnr+Fis+ryhB,"NADH:ubiquinone oxidoreductase I: electron transfer from NADH to quinone pool, proton electrochemical gradient generation for aerobic and anaerobic respiration",Energy Metabolism
189,UC-7,False,-0.0233253555662083,,Unknown,Unknown
109,Flagella,False,-0.0232274534203841,,Flagellar biosynthesis,Extracellular Structures
130,ldrD,False,-0.0213120518480509,,Unknown,Unknown
60,Nitrate/Nitrite,False,0.0207879288014379,NarL+Fnr,Nitrate/nitrite transport and reduction,Nitrogen Metabolism
55,ykgR,False,-0.0205885545426778,,Unknown,Unknown
29,Quorum Sensing,False,0.0203065034335057,Crp+LsrR,"Quorum sensing via autoinducer 2, biofilm architecture, foreign DNA stress response; lsrR KO",Quorum Sensing
43,N Reduction,False,0.0200070278427739,FlhDC+ModE+NarP+NarL+Fnr,"Electron transfer via nitrate reductases (periplasmic and A), cytochrome c",Energy Metabolism
183,DhaR,False,0.019844078517678,DhaR,Dihydroxyacetone transport and catabolism; phosphotransferase activity for DhaM phosphorylation,Carbon Metabolism
79,Isc System,False,0.019305819829735,ryhB/IscR,Iron-sulfur cluster biogenesis and insertion,Cofactor Metabolism
164,minicoli KOs,False,0.0191228933716493,,Deletions from minicoli strain,Genome Reduction
156,Fnr-2,False,-0.0184040641224485,Fnr,Transition from aerobic to anaerobic growth; global control of anaerobiosis,Energy Metabolism
132,rcsB KO,False,0.018187805115633,,rcsB KO and associated regulatory changes,Envelope Stress
106,BW25113,False,0.0181563005479083,,Accounts for genomic differences between BW25113 and MG1655 substrains,Strain Difference
62,Fnr-1,False,-0.0181445721504278,Fnr,Transition from aerobic to anaerobic growth; anaerobic reductase and hydrogenase activity,Energy Metabolism
68,Cellulose,False,-0.0181210966113169,,Cellulose biosynthesis; biofilm formation; membrane/periplasmic proteins,Extracellular Structures
190,Efflux Pump,False,-0.01781031514927,,Multidrug/spermidine efflux pump,Resistance
44,FDH-N/NRA,False,-0.0160948126584433,NarL+Fnr,Anaerobic growth on nitrate; formate-to-nitrate electron transfer via formate dehydrogenase N and nitrate reductase A,Energy Metabolism
119,entC/ubiC KO-1,False,-0.0158478331637303,,entC/ubiC KO and compensatory sad up-regulation,Energy Metabolism
37,ymdG,False,0.0158289618691077,,Unknown,Unknown
57,ypaB,False,0.0157124322390179,,Unknown,Unknown
41,pgi KO,False,-0.015711702930053,,pgi KO,Carbon Metabolism
175,Hot TALE 16,False,-0.015018399041992,,Regulatory changes under high temperature,Unknown
157,Microaerobic,False,0.014960119199753,RpoS+Fis+NarP+NarL+AppY+YdeO+ArcA+IscR,Hydrogenase 1 and cytochrome bd-II ubiquinol oxidase: microaerobic respiratory chain between hydrogen and oxygen,Energy Metabolism
111,YgeV,False,-0.0142657019980017,YgeV,Nucleoside degradation activated by ethanol treatment,Carbon Metabolism
39,Xylose,False,0.0142010217226953,Crp+XylR,d-Xylose transport and catabolism,Carbon Metabolism
199,Ile/Val,False,-0.0139438960615754,,Isoleucine and valine biosynthesis,Amino Acid Metabolism
59,Magnesium,False,-0.0136382799819346,PhoP,Magnesium sensing and transport; magnesium-limitation response,Metal Homeostasis
21,Nucleoside,False,-0.0133114926404314,Crp+CytR,Transport and utilization of ribonucleosides and deoxyribonucleosides,Nucleotide Metabolism
167,UC-2,False,-0.0132136680033484,,Unknown,Unknown
47,Biofilm,False,-0.0131923741096355,RpoS+ppGpp+BluR+MarA,"Biofilm formation, acid resistance, cold shock response",Extracellular Structures
120,yoaI,False,-0.01299762214344,,Unknown,Unknown
19,Sorbitol,False,-0.0128426098550106,SrlR+GutM+Crp+H-NS,Sorbitol transport and catabolism,Carbon Metabolism
162,Propionate,False,-0.0126119539054471,PrpR+RpoN+Cra+Crp,Propionate catabolism; 2-methylcitric acid cycle,Carbon Metabolism
155,YmfT,False,0.0126072498554625,YmfT,e14 prophage regulator activated by DNA damage,DNA Damage
75,yceO,False,0.0125777569691399,,Unknown,Unknown
168,ydfB,False,-0.0122450935499985,,Unknown,Unknown
193,cyoB/ndh/nuoB KO-2,False,0.012156358225436,,cyoB/ndh/nuoB KOs,Energy Metabolism
63,Pyrimidine,False,-0.0121289916258179,PurR/UTP,Pyrimidine transport and biosynthesis,Nucleotide Metabolism
148,LPS,False,0.0118729946273689,,Lipopolysaccharide biosynthesis and export,Extracellular Structures
101,e14 Del,False,-0.0118703017513462,,Unknown,Unknown
116,Lysine/T2SS,False,-0.011813776509503,ArgP,Lysine transport and biosynthesis; type II secretion system,Amino Acid Metabolism
172,Fimbriae,False,-0.0115505232512284,QseB+IHF+Lrp+H-NS,Type 1 (mannose-sensitive) pili/fimbriae biosynthesis and secretion,Extracellular Structures
12,UC-4,False,-0.011477798979031,,Unknown,Unknown
192,crp KO-2,False,-0.0114056205119999,,crp KO and associated glycerol-3-phosphate (GlpR) regulatory changes,Carbon Metabolism
134,Crp-2,False,0.0108988366046898,Crp,Carbohydrate transport and catabolism,Carbon Metabolism
160,YcjW,False,0.0106997560954891,YcjW,Carbohydrate transport and catabolism,Carbon Metabolism
35,FucR/ExuR,False,0.0103782617986979,FucR/ExuR,Fucose/galacturonate/glucuronate transport and catabolism,Carbon Metabolism
117,Fnr-3,False,0.0103577321506491,Fnr,Anaerobic growth,Energy Metabolism
6,Glutamine,False,-0.0102864015067521,NtrC,Glutamine transport and synthesis,Nitrogen Metabolism
126,Thiamine-1,False,0.0101567936701319,Thiamine diphosphate,Thiamine uptake and biosynthesis,Cofactor Metabolism
46,PAL 10 Del,False,-0.0100778780464968,,Unknown,Unknown
88,Nitrogen,False,0.0098331102677165,Nac,Nitrogen metabolism under nitrogen limitation,Nitrogen Metabolism
50,Sulfoquinovose,False,-0.0098212613744038,CsqR,Sulfoquinovose transport and catabolism,Carbon Metabolism
1,Translation,False,-0.0096592104403124,DksA,Ribosome biogenesis,Translation
173,IS Elements-1,False,0.0096553092082287,,Unknown,Unknown
122,UC-9,False,0.009628530995953,,Unknown,Unknown
105,Glycine,False,-0.0096177040439218,PurR+Fnr+ppGpp+Crp+Lrp+GcvA,Glycine cleavage system,Amino Acid Metabolism
112,pts ALE,False,-0.0095707648542601,,ptsHIcrr KO and associated adaptive regulatory changes,Energy Metabolism
107,ypjJ,False,0.0094458956808633,,Unknown,Unknown
200,UC-8,False,-0.0094447754850581,,Unknown,Unknown
72,Galactose,False,-0.0093866949143925,RpoS+GalR+GalS+Crp,Galactose transport and catabolism,Carbon Metabolism
182,Fatty Acid,False,0.0091635629372151,FadR,Fatty acid degradation and biosynthesis,Carbon Metabolism
191,Tryptophanase,False,0.0090570281362373,Crp+TorR+Nac+L-tryptophan,Tryptophan import and catabolism via tryptophanase; indole/pyruvate biosynthesis,Amino Acid Metabolism
84,NtrC-2,False,-0.0090108195875652,NtrC+RpoN,"Nitrogen assimilation, ammonium transport",Nitrogen Metabolism
108,PaaX,False,-0.0088976260028516,Crp+IHF+PaaX+SlyA,Phenylacetic acid transport and catabolism,Carbon Metabolism
146,Glycolate,False,-0.0086762927856777,IHF+ArcA+PdhR+GlcC,Glycolate/glyoxylate tranport and catabolism,Carbon Metabolism
94,NtrC-1,False,0.0085080144522265,RpoN+RpoS+NtrC,"Nitrogen assimilation, ammonium transport",Nitrogen Metabolism
137,Phosphate-2,False,0.0084467272910741,PhoB,"Inorganic phosphate sensing, transport, and production",Phosphate Metabolism
73,trxC Del,False,-0.0083676189029648,,Unknown,Unknown
125,Membrane,False,0.0083585847376583,,"Membrane-related stress response regulators, transporters, multidrug resistance",Envelope Stress
194,tpiA KO,False,-0.008266625749348,,tpiA KO and compensatory evolved regulatory changes,Carbon Metabolism
152,NtrC-3,False,0.0081577068328197,NtrC+RpoN,"Nitrogen assimilation, pyrimidine transport and catabolism",Nitrogen Metabolism
140,ytiC,False,0.0081497913813021,,Unknown,Unknown
23,thrA KO,False,0.0079867113480657,,thrA KO and compensatory transcriptional changes,Amino Acid Metabolism
158,Cysteine-2,False,0.0079562821887345,CysB,"Cysteine biosynthesis, sulfate assimilation",Amino Acid Metabolism
17,Zinc-1,False,-0.007879016012748,Zur/ZntR/CueR,Zinc sensing and uptake; copper sensing and export,Metal Homeostasis
28,ldrA,False,-0.0078604664964018,,Unknown,Unknown
147,PAL 26 Del,False,-0.0077990260951411,,Unknown,Unknown
95,Ribose,False,0.0077832151188157,dsrA+Crp+RbsR,Ribose transport and catabolism,Carbon Metabolism
2,ygdT,False,0.0076457229552479,,Unknown,Unknown
177,PlaR,False,-0.0074794900317671,PlaR+RpoE+Crp+IHF,Plant-derived sugars transport and catabolism,Carbon Metabolism
18,Methionine,False,0.0074515232953864,MetJ,Methionine transport and biosynthesis,Amino Acid Metabolism
69,Phosphate-1,False,-0.0073776688042816,PhoB,"Inorganic phosphate sensing, transport, and production",Phosphate Metabolism
27,ydaG,False,-0.0073085567676932,,Unknown,Unknown
64,Zinc-2,False,-0.0072216108439514,ZraR,Tolerance to high zinc concentration,Metal Homeostasis
38,EvgA,False,0.0071440575928221,EvgA,"Glutamate-dependent acid response, drug resistance, alkali metals response",Envelope Stress
30,IS Elements-2,False,0.0070793754663824,,Unknown,Unknown
145,ppGpp,False,0.007078533069242,ppGpp,Stringent response,Global Stress
187,entC/ubiC KO-2,False,0.0070114569343694,,entC/ubiC KO and compensatory sad up-regulation,Energy Metabolism
56,Sulfate,False,-0.0069355401585412,Cbl+CysB,Cysteine transport and biosynthesis; aliphatic sulfonate utilization and homeostatic response to sulfate starvation,Amino Acid Metabolism
179,Maltose,False,-0.0069083882776329,MalT,Maltose transport and catabolism,Carbon Metabolism
142,UC-5,False,0.0068552481875054,,Unknown,Unknown
66,nquinone ALE 3,False,-0.0066892178033748,,ubiC KO and associated adaptive regulatory changes,Energy Metabolism
131,efeU Activation,False,-0.0066144943418493,,efeU re-activation and associated efeU ALE-related expression changes,Metal Homeostasis
149,Arginine,False,0.0065808321089492,ArgR,Arginine transport and biosynthesis,Amino Acid Metabolism
82,SSW SNPs,False,-0.0064601281364963,,Unknown,ALE Effects
151,IS5,False,-0.0064594552350537,,IS5 transcripts,Unknown
7,Sialic Acid,False,0.0064366204314423,Crp+NanR,N-acetyl-neuraminic acid (or sialic acid) transport and metabolism,Carbon Metabolism
99,yjjZ,False,-0.0063613665293351,,Unknown,Unknown
5,Osmoprotectant,False,0.0062069553432194,RpoS+ppGpp+IHF+H-NS,Transport of osmoprotectant glycine betaine,Envelope Stress
166,Rhamnose,False,-0.0062054591092926,Crp+RhaS,Rhamnose transport and catabolism,Carbon Metabolism
65,NRZ,False,-0.006162110338756,OmpR,Nitrate reduction under microaerobic condition; aerobic to anaerobic transition,Energy Metabolism
34,Acid Shock RNA,False,0.0061399504197646,,Very low pH-responsive acid shock polypeptide,Acid Stress
133,malE OE,False,-0.006096906949654,,Accounts for malE plasmid overexpression,Carbon Metabolism
121,Gluconate,False,-0.0059115852968609,GntR+Crp,Gluconate transport and catabolism (Entner-Doudoroff),Carbon Metabolism
188,Oxidoreductase,False,-0.0058676328745057,,Putative oxidoreductase components,Redox Stress
180,Tyr/Trp/Phe,False,-0.005784609049381,TyrR/TrpR/Trp-tRNA,Aromatic amino acid biosynthesis and transport,Amino Acid Metabolism
87,YieP,False,-0.0057504921069197,YieP,"Cellular membrane synthesis and stress response, 3-hydroxypropanoate tolerance",Envelope Stress
110,SCFA,False,-0.005529988754457,RpoN+AtoC+IHF,Short-chain fatty acid (acetoacetate) transport and catabolism,Carbon Metabolism
31,Nickel,False,-0.0054767074161126,RpoN+NarL+NikR+Fnr,Nickel sensing and uptake,Metal Homeostasis
114,GlcNAc,False,0.0053669264297083,NagC+Crp,"Amino sugar transport, biosynthesis and catabolism",Carbon Metabolism
195,Phage Shock,False,0.0052979424016447,RpoN+IHF+PspF,Phage shock response; response to filamentous phage infection and/or extracytoplasmic shock,Phage Shock
196,Glyoxylate,False,0.0052357110068243,Crp+ArcA+ppGpp+Cra+IclR+IHF,Glyxoylate cycle; alternate to TCA cycle,Energy Metabolism
49,BasR,False,-0.0051763457736062,BasR,Lipid A modification and polymixin resistance in the presence of excess iron,Extracellular Structures
171,cyoB/ndh/nuoB KO-1,False,0.0051172182093105,,NDH-1 (nuoB) KO and compensatory NDH-2 (ndh) up-regulation,Energy Metabolism
48,Cytochrome c,False,-0.0050877624804503,FlhDC+IHF+NsrR+NarL+NarP+Fis+Fnr,Cytochrome c-552 and putative cytochrome c-related proteins,Energy Metabolism
10,Nucleotide Stress,False,0.0050261398849354,,DNA repair; stringent response signaling via ppGpp; ribosomal biogenesis and stability,DNA Damage
22,SoxS,False,-0.0046401699248943,SoxS,"Superoxide/nitric oxide sensing and removal, protection from organic solvents and antibiotics",Redox Stress
185,gcvB,False,0.0045997877508837,gcvB,Amino acid transport,Amino Acid Metabolism
74,ArcA,False,-0.0045991546149447,ArcA,Anaerobiosis; repression of aerobic growth genes during anaerobic growth,Energy Metabolism
92,Crp-1,False,-0.0044190904300202,Crp,Miscellaneous carbon source metabolism,Carbon Metabolism
118,ythA,False,-0.0043593594716533,,Unknown,Unknown
80,Thiamine-2,False,0.0043533704236395,,Thiamine uptake and biosynthesis,Cofactor Metabolism
181,GadX,False,-0.0042383499631974,RpoS+GadX,Glutamate-dependent acid resistance system; multidrug efflux,Envelope Stress
115,YgbI,False,0.0042027448811767,YgbI,Tartrate transport and catabolism,Carbon Metabolism
9,ROS TALE Amp,False,-0.0041819718669977,,Amplification of DLP12/IS3,Unknown
78,cyoB/kdpE/qseB KO,False,-0.0041737961083829,,cyoB/kdpE/qseF KO,Energy Metabolism
89,UC-6,False,-0.0041470338150457,,Unknown,Unknown
86,UC-3,False,-0.0040457198915256,,Unknown,Unknown
33,Curli-2,False,-0.0040183332007683,RpoS+FliZ+CpxR+CsgD+BtsR,Curli secretion and assembly,Extracellular Structures
32,CpxR,False,0.0039468491194257,CpxR,"Inner membrane damage sensing and repair via protein folding/degradation, chemotaxis, drug efflux, DNA repair, motility",Envelope Stress
85,DNA Damage,False,-0.0039124618714068,LexA,SOS response to DNA damage or inhibition of DNA replication,DNA Damage
103,Tryptophan,False,0.0037963258185134,TrpR+Trp-tRNA,Tryptophan transport and biosynthesis,Amino Acid Metabolism
144,Putrescine,False,-0.0037843476738778,RpoS+ArcA+PuuR,Putrescine transport and catabolism,Nitrogen Metabolism
3,OxyR,False,-0.0034116350528272,OxyR,"Oxidative stress response, especially peroxide",Redox Stress
198,Acetate,False,0.003349014719279,,Acetate uptake and catabolism; aldehyde catabolism; acetate/ethanol detoxification at stationary phase,Carbon Metabolism
129,Pyruvate-1,False,0.0031629734891845,BtsR,"Pyruvate sensing, transport, and catabolism under nutrient limitation",Carbon Metabolism
163,CP4-44,False,0.0031586444142073,,CP4-44 prophage expression variation,Prophage
25,Lrp,False,-0.003085856542387,Lrp,"Global regulation of amino acid biosynthesis/catabolism, stationary phase, nutrient transport, pili synthesis, 1-carbon metabolism",Amino Acid Metabolism
20,Glycerol,False,0.0029410425956191,Crp+GlpR,Glycerol/glycerol-3-phosphate transport and catabolism,Carbon Metabolism
138,Leucine,False,-0.0029356603319649,LeuO+Leu-tRNA+ppGpp,Leucine biosynthesis,Amino Acid Metabolism
153,arcA/luxS KO,False,0.0028803119335662,,arcA KO,Energy Metabolism
0,Sugar Diacid,False,0.0028525137582476,CdaR,Transport and catabolism of carbohydrate diacids (galacatarate and glucarate),Carbon Metabolism
13,RpoH,False,0.0028418861975936,RpoH,Global heat shock response during log-phase; response to high temperature and/or misfolded proteins,Temperature Shock
197,CCK-PGI Del,False,0.0028372179580187,,Unknown,Unknown
77,ROS TALE Del-1,False,0.0028368740200033,,Unknown,Unknown
40,IS1,False,-0.0028355689570995,,IS1 transcripts,Unknown
16,Ferric Citrate,False,-0.002799489219032,PdhR+HypT+Nac+Crp+Fur+FecI,Ferric citrate transporter; iron uptake under intracellular limitation,Metal Homeostasis
54,Fur-1,False,0.0027367796903883,Fur,"Iron sensing and uptake, enterobactin biosynthesis, iron-sulfur cluster activation, iron sequestration",Metal Homeostasis
150,Nickel/Cobalt,False,-0.0026329729627436,RcnR,Nickel and cobalt resistance via efflux,Metal Homeostasis
124,Thr/Ser-2,False,0.0026039757058741,Fnr+Crp+IHF+TdcA+TdcR,Threonine/serine transport and catabolism,Amino Acid Metabolism
135,Cysteine-1,False,0.0025666409685879,CysB,"Cysteine biosynthesis, sulfate assimilation",Amino Acid Metabolism
98,ymiB,False,0.0025393652728772,,Unknown,Unknown
51,RpoS,False,-0.0024597253106844,RpoS,Master regulator of global stress response,Global Stress
169,NrdR,False,0.0024251183683026,NrdR,Ribonucleoside reduction,Nucleotide Metabolism
4,FlhDC-2,False,-0.0022865023626712,FlhDC,Flagellum biosynthesis and export,Extracellular Structures
136,Pyruvate-2,False,-0.0022678821366881,PyrR,Pyruvate sensing and transport,Carbon Metabolism
26,baeR KO,False,0.0021450082856911,,baeR KO,Envelope Stress
139,Capsule,False,-0.0021417730333044,RcsAB,Colanic acid capsule synthesis and transport; periplasmic proteins; envelope stress response,Extracellular Structures
53,UC-1,False,0.0021252320258582,,Unknown,Unknown
161,PAL Amp,False,-0.0019954357088526,,Unknown,Unknown
11,Histidine,False,-0.0019002605219516,His-tRNA+DksA,Histidine biosynthesis,Amino Acid Metabolism
81,crp KO-1,False,-0.0018634281078349,,crp KO and compensatory regulatory changes,Carbon Metabolism
90,Leu/Val/Ile,False,-0.0016890697817049,Lrp+IHF+Ile-tRNA+Leu-tRNA+Val-tRNA+ppGpp,Branched-chain amino acid biosynthesis,Amino Acid Metabolism
102,Thr/Ser-1,False,0.0016219592343008,TdcA+TdcR+IHF+Fnr+Crp,Threonine/serine transport and catabolism during anaerobiosis,Amino Acid Metabolism
170,Purine,False,-0.0015945019289298,PurR+ppGpp,Purine transport and biosynthesis,Nucleotide Metabolism
15,ldrC,False,-0.0014877774283471,,Unknown,Unknown
67,RpoE,False,0.0014042873434729,RpoE,Heat shock response; response to high temperature and/or misfolded membrane/periplasmic proteins,Temperature Shock
14,FucR/AllR/AraC,False,-0.0012715063688056,FucR/AllR/AraC,Allantoin/glycolate/glyoxylate/arabinose/fucose transport and catabolism,Nitrogen Metabolism
45,Resistance,False,0.0012271381069711,,Multidrug resistance; stress response to harmful compounds/antibiotics,Envelope Stress
143,FlhDC-1,False,0.0010700802017898,FlhDC,Flagellum biosynthesis and export,Extracellular Structures
184,pts KO,False,-0.0010292908698029,,ptsHI/crr KO and compensatory regulatory changes,Carbon Metabolism
42,Biotin,False,-0.0009580274297849,BirA,Biotin biosynthesis,Cofactor Metabolism
186,Glutarate,False,0.0009426804959894,RpoS+H-NS+Crp+Lrp+GlaR+ppGpp,Glutarate/aminobutyrate transport and catabolism,Carbon Metabolism
128,FliA,False,0.0008801817226924,FliA,"Sigma 28; flagellum biosynthesis and export, motility",Extracellular Structures
100,Molybdenum,False,-0.0008082512303431,Crp+FliA+ModE,Molybdenum transport and molybdoenzyme synthesis,Metal Homeostasis
174,Cra,False,0.0007269421209264,Cra,Central carbon metabolism; glycolytic flux-dependent regulation via fructose sensing,Carbon Metabolism
123,Copper,False,0.0006088523726673,CusR/CueR/HprR,Copper/silver sensing and export,Metal Homeostasis
96,Dipeptide,False,0.0005932840617168,gcvB+IHF+Fnr,Dipeptide transport; flagellar biosynthesis,Amino Acid Metabolism
83,yafF,False,-0.0005929138178693,,Unknown,Unknown
8,yqhI,False,0.0005817028805369,,Unknown,Unknown
141,ROS TALE Del-2,False,0.0005710002872302,,Unknown,Unknown
154,sdh KO,False,0.000563512449648,,sdh KO,Carbon Metabolism
24,YjfJ,False,-0.0004895602709364,YjfJ,Putative heat responsive regulon,Temperature Shock
58,Fur-2,False,-0.000270996637538,Fur,"Iron sensing and uptake, enterobactin biosynthesis, iron-sulfur cluster activation, iron sequestration",Metal Homeostasis
97,Curli-1,False,-0.0002229177236437,RpoS+FliZ+CpxR+CsgD+BtsR,Curli secretion and assembly,Extracellular Structures
70,Salicylic Acid,False,-0.0002048587645291,,Salicylic acid efflux,Redox Stress
165,GadXW,False,-0.0001374127663363,GadX+GadW,Glutamate-dependent acid resistance system; multidrug efflux,Envelope Stress
76,Potassium,False,1.5643920324883162e-05,KdpE,Potassium sensing and transport,Metal Homeostasis
176,Suf System,False,6.872280014786147e-06,NsrR+IHF+IscR+OxyR+Fur+ppGpp,Iron-sulfur cluster biosynthesis and insertion,Metal Homeostasis
